ticker,company_name,sector,category,exchange,price_usd,change_1d,change_1w,change_1m,change_ytd,return_1yr,market_cap_gbp_b,beta,pe_ratio,avg_volume_m,vol_1d,vol_1w,vol_1m,div_yield_pct,short_pct,analyst,analyst_score,pct_1d,val_100_1d,profit_100_1d,val_1000_1d,profit_1000_1d,val_10000_1d,profit_10000_1d,pct_1w,val_100_1w,profit_100_1w,val_1000_1w,profit_1000_1w,val_10000_1w,profit_10000_1w,pct_1m,val_100_1m,profit_100_1m,val_1000_1m,profit_1000_1m,val_10000_1m,profit_10000_1m,pct_ytd,val_100_ytd,profit_100_ytd,val_1000_ytd,profit_1000_ytd,val_10000_ytd,profit_10000_ytd,pct_1y,val_100_1y,profit_100_1y,val_1000_1y,profit_1000_1y,val_10000_1y,profit_10000_1y,news1_title,news1_publisher,news1_date,news1_sentiment,news2_title,news2_publisher,news2_date,news2_sentiment,news3_title,news3_publisher,news3_date,news3_sentiment,signal_rank,signal,signal_confidence,signal_rationale,signal_drivers,portfolio_held,portfolio_quantity,portfolio_avg_price,portfolio_ppl,portfolio_total_value
DRS,Leonardo DRS,Defence,weapons,NYSE,46.08,-2.37%,-7.27%,+7.64%,+33.02%,+5%,9.286,0.121,43.07,1.0,1440000,5619000,20929100,79.0,1.31,none,,-2.37,97.63,-2.37,976.3,-23.7,9763.0,-237.0,-7.27,92.73,-7.27,927.3,-72.7,9273.0,-727.0,7.64,107.64,7.64,1076.4,76.4,10764.0,764.0,33.02,133.02,33.02,1330.2,330.2,13302.0,3302.0,5.0,105.0,5.0,1050.0,50.0,10500.0,500.0,Leonardo DRS (DRS) Stock Valuation Check After Strong Multi Year Returns,Simply Wall St.,2026-06-12,0.511,Leonardo DRS (DRS) Gained from the E-Drive and Golden Dome Initiative,Insider Monkey,2026-06-12,0.382,Leonardo DRS vs. Firefly Aerospace: Which Industrials Stock Is a Better Buy in 2026?,Motley Fool,2026-06-11,0.44,10,buy,0.6,"DRS has strong YTD performance (+33.02%) and positive news sentiment (0.343), with a P/E of 43.07 reflecting growth expectations in defence electronics. The recent momentum and backlog strength support the case, though analyst coverage is lacking.",+33.02% YTD; P/E 43.07; positive news sentiment 0.343; defence electronics backlog,,,,,
XOM,ExxonMobil,Energy,oil-majors,NYSE,137.81,-2.26%,-6.00%,-15.22%,+13.88%,+20%,431.524,0.149,23.2,20.07,48063400,124996500,399370900,290.0,1.14,buy,2.28,-2.26,97.74,-2.26,977.4,-22.6,9774.0,-226.0,-6.0,94.0,-6.0,940.0,-60.0,9400.0,-600.0,-15.22,84.78,-15.22,847.8,-152.2,8478.0,-1522.0,13.88,113.88,13.88,1138.8,138.8,11388.0,1388.0,20.0,120.0,20.0,1200.0,200.0,12000.0,2000.0,Expert Warns: California Taxes Harming “Big Wealth Driver in the State” as Billionaires Flee,24/7 Wall St.,2026-06-19,-0.202,Darren Woods’ Game Plan at Exxon Mobil: Produce More Oil for Less Money,Barrons.com,2026-06-19,0.0,Exxon Mobil (XOM) Stock Could Be 18.9% Undervalued Despite Recent Pullback,Simply Wall St.,2026-06-18,0.0,,,,,,,,,,
CVX,Chevron,Energy,oil-majors,NYSE,173.63,-2.44%,-6.56%,-11.97%,+13.49%,+16%,261.235,0.472,30.2,11.03,19146100,53127900,210849000,395.0,1.16,buy,1.84,-2.44,97.56,-2.44,975.6,-24.4,9756.0,-244.0,-6.56,93.44,-6.56,934.4,-65.6,9344.0,-656.0,-11.97,88.03,-11.97,880.3,-119.7,8803.0,-1197.0,13.49,113.49,13.49,1134.9,134.9,11349.0,1349.0,16.0,116.0,16.0,1160.0,160.0,11600.0,1600.0,Expert Warns: California Taxes Harming “Big Wealth Driver in the State” as Billionaires Flee,24/7 Wall St.,2026-06-19,-0.202,"The SLB Paradox: Short-Term Friction, Long-Cycle Fuel",Trefis,2026-06-18,-0.103,Stocks Supported as Geopolitical Risks Recede,Barchart,2026-06-18,0.052,,,,,,,,,,
SHEL,Shell,Energy,oil-majors,NYSE,78.81,-1.75%,-8.20%,-10.10%,+6.40%,+9%,165.037,-0.248,12.28,7.85,8159204,35089378,154234069,380.0,1.89,buy,2.13,-1.75,98.25,-1.75,982.5,-17.5,9825.0,-175.0,-8.2,91.8,-8.2,918.0,-82.0,9180.0,-820.0,-10.1,89.9,-10.1,899.0,-101.0,8990.0,-1010.0,6.4,106.4,6.4,1064.0,64.0,10640.0,640.0,9.0,109.0,9.0,1090.0,90.0,10900.0,900.0,Equinor to Boost Troll Gas Output with $412 Million Subsea Development,Oilprice.com,2026-06-19,0.402,ConocoPhillips vs. Viper Energy: Which Energy Stock Is a Better Buy in 2026?,Motley Fool,2026-06-19,0.727,European Equities Traded in the US as American Depositary Receipts Rise in Wednesday Trading,MT Newswires,2026-06-17,0.0,9,buy,0.4,"P/E 12.3 is cheap, dividend yield 3.8%, but 1W -8.2% and buyback pause until July 14 weigh; news shows slip under £30 on Iran deal.",P/E 12.3; Dividend yield 3.8%; Buy rating; 1W -8.2% correction,,,,,
BP,BP p.l.c.,Energy,oil-majors,NYSE,39.1,-2.75%,-8.39%,-15.26%,+11.80%,+25%,76.062,-0.239,31.79,11.96,14304700,45917600,199896000,,0.4,buy,2.5,-2.75,97.25,-2.75,972.5,-27.5,9725.0,-275.0,-8.39,91.61,-8.39,916.1,-83.9,9161.0,-839.0,-15.26,84.74,-15.26,847.4,-152.6,8474.0,-1526.0,11.8,111.8,11.8,1118.0,118.0,11180.0,1180.0,25.0,125.0,25.0,1250.0,250.0,12500.0,2500.0,BP taps DeepOcean for Foinaven subsea recycling project,Offshore Technology,2026-06-19,0.0,Investors Heavily Search BP p.l.c. (BP): Here is What You Need to Know,Zacks,2026-06-18,0.0,How the Oil Sands Became the Lowest-Cost North American Producer,Oilprice.com,2026-06-17,0.0,,,,,,,,,,
TTE,TotalEnergies,Energy,oil-majors,NYSE,80.43,-2.84%,-8.31%,-13.42%,+22.23%,+29%,135.186,0.045,11.93,1.72,3341369,10018169,31312669,501.0,0.2,none,,-2.84,97.16,-2.84,971.6,-28.4,9716.0,-284.0,-8.31,91.69,-8.31,916.9,-83.1,9169.0,-831.0,-13.42,86.58,-13.42,865.8,-134.2,8658.0,-1342.0,22.23,122.23,22.23,1222.3,222.3,12223.0,2223.0,29.0,129.0,29.0,1290.0,290.0,12900.0,2900.0,Equinor to Boost Troll Gas Output with $412 Million Subsea Development,Oilprice.com,2026-06-19,0.402,Hormuz Reopening to Spark Oil Field Restart Visible From Space,Bloomberg,2026-06-19,0.226,How the Oil Sands Became the Lowest-Cost North American Producer,Oilprice.com,2026-06-17,0.0,,,,,,,,,,
EQNR,Equinor,Energy,oil-majors,NYSE,32.38,-3.86%,-11.89%,-20.62%,+35.02%,+17%,60.916,-0.752,14.65,5.64,5808800,25943700,88509800,,2.85,hold,3.33,-3.86,96.14,-3.86,961.4,-38.6,9614.0,-386.0,-11.89,88.11,-11.89,881.1,-118.9,8811.0,-1189.0,-20.62,79.38,-20.62,793.8,-206.2,7938.0,-2062.0,35.02,135.02,35.02,1350.2,350.2,13502.0,3502.0,17.0,117.0,17.0,1170.0,170.0,11700.0,1700.0,Equinor to Boost Troll Gas Output with $412 Million Subsea Development,Oilprice.com,2026-06-19,0.402,Equinor Unveils Production Growth & Buyback Strategy Through 2030,Zacks,2026-06-19,0.382,Equinor and partners agree Ringvei Vest subsea development plan,Offshore Technology,2026-06-19,0.361,,,,,,,,,,
COP,ConocoPhillips,Energy,ep-refining,NYSE,107.74,-2.51%,-6.61%,-13.88%,+13.12%,+14%,99.16,0.106,18.26,8.69,22893000,55569500,167298800,302.0,1.83,buy,1.85,-2.51,97.49,-2.51,974.9,-25.1,9749.0,-251.0,-6.61,93.39,-6.61,933.9,-66.1,9339.0,-661.0,-13.88,86.12,-13.88,861.2,-138.8,8612.0,-1388.0,13.12,113.12,13.12,1131.2,131.2,11312.0,1312.0,14.0,114.0,14.0,1140.0,140.0,11400.0,1400.0,Equinor to Boost Troll Gas Output with $412 Million Subsea Development,Oilprice.com,2026-06-19,0.402,ConocoPhillips vs. Viper Energy: Which Energy Stock Is a Better Buy in 2026?,Motley Fool,2026-06-19,0.727,ConocoPhillips (COP) Stock Slides as Market Rises: Facts to Know Before You Trade,Zacks,2026-06-18,0.0,,,,,,,,,,
OXY,Occidental Petroleum,Energy,ep-refining,NYSE,51.82,-2.32%,-6.58%,-14.24%,+23.42%,+14%,38.937,0.124,70.03,13.86,13871800,52996000,235659900,194.0,0.02,hold,2.56,-2.32,97.68,-2.32,976.8,-23.2,9768.0,-232.0,-6.58,93.42,-6.58,934.2,-65.8,9342.0,-658.0,-14.24,85.76,-14.24,857.6,-142.4,8576.0,-1424.0,23.42,123.42,23.42,1234.2,234.2,12342.0,2342.0,14.0,114.0,14.0,1140.0,140.0,11400.0,1400.0,"ExxonMobil and Occidental Petroleum Stocks Trade Down, What You Need To Know",StockStory,2026-06-18,0.0,Can Devon's Multi-Basin Assets Sustain Growth for Years to Come?,Zacks,2026-06-18,0.511,SEDG Rides on Growing Demand for Integrated Solar & Storage Solutions,Zacks,2026-06-18,0.226,,,,,,,,,,
EOG,EOG Resources,Energy,ep-refining,NYSE,129.98,-1.89%,-4.80%,-9.92%,+23.28%,+4%,52.301,0.256,12.78,4.17,12213400,30556100,85387300,309.0,4.11,buy,2.19,-1.89,98.11,-1.89,981.1,-18.9,9811.0,-189.0,-4.8,95.2,-4.8,952.0,-48.0,9520.0,-480.0,-9.92,90.08,-9.92,900.8,-99.2,9008.0,-992.0,23.28,123.28,23.28,1232.8,232.8,12328.0,2328.0,4.0,104.0,4.0,1040.0,40.0,10400.0,400.0,Can Devon's Multi-Basin Assets Sustain Growth for Years to Come?,Zacks,2026-06-18,0.511,"The Zacks Analyst Blog Highlights Exxon Mobil, ConocoPhillips and EOG Resources",Zacks,2026-06-18,0.0,Oil Prices Slide on US-Iran Deal: 3 Energy Stocks Worth Watching,Zacks,2026-06-17,0.459,6,buy,0.55,"YTD +23.3%, P/E 12.8 with a 3.09% dividend yield, low beta 0.256, and news sentiment 0.344.",YTD +23.3%; P/E 12.8; Dividend yield 3.09%; News sentiment 0.344,,,,,
MPC,Marathon Petroleum,Energy,ep-refining,NYSE,242.91,-0.48%,-6.86%,-7.29%,+48.39%,+44%,53.572,0.522,16.0,2.46,4962400,15189500,54433200,,2.5,buy,2.32,-0.48,99.52,-0.48,995.2,-4.8,9952.0,-48.0,-6.86,93.14,-6.86,931.4,-68.6,9314.0,-686.0,-7.29,92.71,-7.29,927.1,-72.9,9271.0,-729.0,48.39,148.39,48.39,1483.9,483.9,14839.0,4839.0,44.0,144.0,44.0,1440.0,440.0,14400.0,4400.0,Will UK interest rates fall in 2026?,Moneyweek,2026-06-19,0.459,Here's How Declining Crude Oil Prices are Benefiting Valero Energy,Zacks,2026-06-18,-0.382,Bank of England holds interest rates at 3.75% but says inflation still to rise,PA Media: Money,2026-06-18,0.25,4,buy,0.6,"YTD +48.4%, 1Y +44%, P/E 16.0, and refiners benefit from declining crude prices (Brent below $78).",YTD +48.4%; 1Y +44%; P/E 16.0; Benefiting from lower crude,,,,,
VLO,Valero Energy,Energy,ep-refining,NYSE,236.3,-1.95%,-7.55%,-9.59%,+44.50%,+67%,53.006,0.553,17.25,3.47,6141200,18422300,66824700,197.0,3.6,buy,2.4,-1.95,98.05,-1.95,980.5,-19.5,9805.0,-195.0,-7.55,92.45,-7.55,924.5,-75.5,9245.0,-755.0,-9.59,90.41,-9.59,904.1,-95.9,9041.0,-959.0,44.5,144.5,44.5,1445.0,445.0,14450.0,4450.0,67.0,167.0,67.0,1670.0,670.0,16700.0,6700.0,Valero Energy (VLO) Stock Sinks As Market Gains: What You Should Know,Zacks,2026-06-18,0.542,Here's How Declining Crude Oil Prices are Benefiting Valero Energy,Zacks,2026-06-18,-0.382,Stocks Supported as Geopolitical Risks Recede,Barchart,2026-06-18,0.052,5,buy,0.6,"YTD +44.5%, 1Y +67%, P/E 17.3, dividend yield 1.97%, and a headline highlighting declining crude benefits.",YTD +44.5%; 1Y +67%; P/E 17.3; Dividend yield 1.97%,,,,,
SLB,SLB (Schlumberger),Energy,oilfield-services,NYSE,48.09,-4.60%,-14.12%,-14.85%,+20.96%,+34%,54.315,0.708,21.19,15.81,41856500,104186200,336229900,222.0,4.24,buy,1.62,-4.6,95.4,-4.6,954.0,-46.0,9540.0,-460.0,-14.12,85.88,-14.12,858.8,-141.2,8588.0,-1412.0,-14.85,85.15,-14.85,851.5,-148.5,8515.0,-1485.0,20.96,120.96,20.96,1209.6,209.6,12096.0,2096.0,34.0,134.0,34.0,1340.0,340.0,13400.0,3400.0,SLB (SLB) Stock After Recent Pullback Could The Valuation Gap Be An Opportunity,Simply Wall St.,2026-06-19,0.421,SLB (SLB) Stock Could Be 21.7% Undervalued After Digital Marketplace Launch,Simply Wall St.,2026-06-19,0.0,S&P 500 Posts Weekly Gain Amid US-Iran Memorandum of Understanding,MT Newswires,2026-06-18,0.527,,,,,,,,,,
HAL,Halliburton,Energy,oilfield-services,NYSE,34.93,-3.61%,-12.15%,-18.38%,+19.08%,+57%,22.044,0.704,19.3,13.59,24608800,72621400,274066100,,5.22,buy,1.81,-3.61,96.39,-3.61,963.9,-36.1,9639.0,-361.0,-12.15,87.85,-12.15,878.5,-121.5,8785.0,-1215.0,-18.38,81.62,-18.38,816.2,-183.8,8162.0,-1838.0,19.08,119.08,19.08,1190.8,190.8,11908.0,1908.0,57.0,157.0,57.0,1570.0,570.0,15700.0,5700.0,S&P 500 Posts Weekly Gain Amid US-Iran Memorandum of Understanding,MT Newswires,2026-06-18,0.527,"Halliburton, Patterson-UTI, and Talos Energy Shares Plummet, What You Need To Know",StockStory,2026-06-18,0.511,"The SLB Paradox: Short-Term Friction, Long-Cycle Fuel",Trefis,2026-06-18,-0.103,,,,,,,,,,
BKR,Baker Hughes,Energy,oilfield-services,NASDAQ,58.41,-2.76%,-7.99%,-10.78%,+24.79%,+50%,43.776,0.938,18.66,8.34,17607100,44407100,173640300,150.0,2.91,buy,1.77,-2.76,97.24,-2.76,972.4,-27.6,9724.0,-276.0,-7.99,92.01,-7.99,920.1,-79.9,9201.0,-799.0,-10.78,89.22,-10.78,892.2,-107.8,8922.0,-1078.0,24.79,124.79,24.79,1247.9,247.9,12479.0,2479.0,50.0,150.0,50.0,1500.0,500.0,15000.0,5000.0,Stocks Supported as Geopolitical Risks Recede,Barchart,2026-06-18,0.052,Baker Hughes (BKR) Stock Could Be 16% Undervalued After Its Recent Pullback,Simply Wall St.,2026-06-18,0.0,Stocks Indexes Finish Mostly Lower as Chipmakers Retreat,Barchart,2026-06-16,-0.103,8,buy,0.45,"YTD +24.8%, 1Y +50%, P/E 18.7, and dividend yield 1.5%; oilfield services stand to gain from the Iran peace deal reopening the Strait of Hormuz.",YTD +24.8%; 1Y +50%; P/E 18.7; Dividend yield 1.5%,,,,,
NEE,NextEra Energy,Energy,utilities,NYSE,86.75,+1.17%,+2.25%,-2.97%,+8.71%,+21%,136.681,0.671,22.02,10.76,19306600,59510500,283863700,289.0,0.01,buy,1.95,1.17,101.17,1.17,1011.7,11.7,10117.0,117.0,2.25,102.25,2.25,1022.5,22.5,10225.0,225.0,-2.97,97.03,-2.97,970.3,-29.7,9703.0,-297.0,8.71,108.71,8.71,1087.1,87.1,10871.0,871.0,21.0,121.0,21.0,1210.0,210.0,12100.0,2100.0,Expanding Customer Base and Investments Support LNT's Growth,Zacks,2026-06-19,0.649,Can Vistra Unlock More Value for Investors Through Share Buybacks?,Zacks,2026-06-19,0.598,AES Boosts Growth Through Renewable Energy and LNG Investments,Zacks,2026-06-19,0.718,7,buy,0.5,"1W +2.3%, 1D +1.2%—positive momentum in a falling oil market, with low short interest 0.01% and strong news sentiment 0.412.",1W +2.3%; Short interest 0.01%; News sentiment 0.412; P/E 22.0,,,,,
SSE.L,SSE plc,Energy,utilities,LSE,2325.0,+0.56%,-3.12%,+0.00%,+4.21%,+28%,0.28,0.596,22.14,4.25,7564829,21549042,101311805,,,buy,2.0,0.56,100.56,0.56,1005.6,5.6,10056.0,56.0,-3.12,96.88,-3.12,968.8,-31.2,9688.0,-312.0,0.0,100.0,0.0,1000.0,0.0,10000.0,0.0,4.21,104.21,4.21,1042.1,42.1,10421.0,421.0,28.0,128.0,28.0,1280.0,280.0,12800.0,2800.0,"UK, Japan to deepen ties with £18 billion investment agreement",Investing.com,2026-06-14,0.494,"Bears are Losing Control Over SSE (SSEZY), Here's Why It's a 'Buy' Now",Zacks,2026-06-10,-0.382,Are heat pumps an underappreciated lever of power demand growth?,Investing.com,2026-06-07,0.273,10,buy,0.35,1M -0.6% holds relatively stable; P/E 22.0 and 0.077 news sentiment. UK-Japan investment agreement provides a supportive backdrop.,1M -0.6% stable; P/E 22.0; Buy rating; UK-Japan deal catalyst,,,,,
ENPH,Enphase Energy,Energy,clean-energy,NASDAQ,52.28,+8.20%,-4.82%,+11.80%,+54.90%,+46%,5.205,1.572,51.76,7.83,13979200,38930100,192916800,,24.43,hold,2.52,8.2,108.2,8.2,1082.0,82.0,10820.0,820.0,-4.82,95.18,-4.82,951.8,-48.2,9518.0,-482.0,11.8,111.8,11.8,1118.0,118.0,11180.0,1180.0,54.9,154.9,54.9,1549.0,549.0,15490.0,5490.0,46.0,146.0,46.0,1460.0,460.0,14600.0,4600.0,"Enphase Energy, Inc. (ENPH) Is a Trending Stock: Facts to Know Before Betting on It",Zacks,2026-06-19,0.273,Enphase Stock Rises on AI Data Center Upgrade,Barrons.com,2026-06-18,0.0,"SpaceX initiated, Salesforce upgraded: Wall Street's top analyst calls",The Fly,2026-06-18,0.202,1,strong_buy,0.75,"YTD +54.9%, 1M +11.8%, and a 1D surge of +8.2% driven by an AI data center upgrade, with strong positive news sentiment at 0.19.",YTD +54.9%; 1D +8.2% on AI catalyst; 1M +11.8% momentum; Positive news sentiment 0.19,,,,,
FSLR,First Solar,Energy,clean-energy,NASDAQ,257.7,-0.88%,-4.97%,+16.23%,-6.07%,+78%,20.919,1.692,16.64,2.52,3682700,11177300,65610300,,10.39,buy,2.17,-0.88,99.12,-0.88,991.2,-8.8,9912.0,-88.0,-4.97,95.03,-4.97,950.3,-49.7,9503.0,-497.0,16.23,116.23,16.23,1162.3,162.3,11623.0,1623.0,-6.07,93.93,-6.07,939.3,-60.7,9393.0,-607.0,78.0,178.0,78.0,1780.0,780.0,17800.0,7800.0,Renewable Energy Stocks Q1 Results: Benchmarking First Solar (NASDAQ:FSLR),StockStory,2026-06-19,0.273,Why First Solar (FSLR) Outpaced the Stock Market Today,Zacks,2026-06-18,0.0,"Lyft upgraded, Leidos downgraded: Wall Street's top analyst calls",The Fly,2026-06-17,0.202,2,strong_buy,0.7,"1M +16.2% momentum, P/E 16.6, and a buy rating with 0.281 news sentiment; YTD -6.1% offers a dip entry.",1M +16.2%; P/E 16.6 attractive; Buy rating; News sentiment 0.281,,,,,
BEPC,Brookfield Renewable Corp,Energy,clean-energy,NYSE,37.42,+1.96%,-0.69%,+4.57%,-4.41%,+19%,5.156,1.15,,1.55,1872600,7610600,32178300,432.0,,none,,1.96,101.96,1.96,1019.6,19.6,10196.0,196.0,-0.69,99.31,-0.69,993.1,-6.9,9931.0,-69.0,4.57,104.57,4.57,1045.7,45.7,10457.0,457.0,-4.41,95.59,-4.41,955.9,-44.1,9559.0,-441.0,19.0,119.0,19.0,1190.0,190.0,11900.0,1900.0,Brookfield Is Launching Another Renewable Energy Company. Here's What Investors Need to Know.,Motley Fool,2026-06-18,0.273,3 High-Yield Energy Stocks Worth Buying for the Income -- and Holding for the Gains,Motley Fool,2026-06-17,0.66,Brookfield Renewable Corp vs. WEC Energy Group: Which Utilities Stock Is a Better Buy in 2026?,Motley Fool,2026-06-10,0.612,3,buy,0.65,"Highest news sentiment in the universe at 0.501 on Brookfield launching a new renewable company, dividend yield 4.32%, and 1M +4.6%.",News sentiment 0.501; Dividend yield 4.32%; 1M +4.6%; New renewable venture catalyst,,,,,
DNNGY,Ørsted,Energy,clean-energy,NASDAQ,7.39,-1.60%,-9.10%,-12.44%,+10.88%,-47%,22.126,0.634,,0.14,163600,558400,2437500,,,none,,-1.6,98.4,-1.6,984.0,-16.0,9840.0,-160.0,-9.1,90.9,-9.1,909.0,-91.0,9090.0,-910.0,-12.44,87.56,-12.44,875.6,-124.4,8756.0,-1244.0,10.88,110.88,10.88,1108.8,108.8,11088.0,1088.0,-47.0,53.0,-47.0,530.0,-470.0,5300.0,-4700.0,Energy & Utilities Roundup: Market Talk,The Wall Street Journal,2026-06-05,0.273,Ørsted Advances Flagship Offshore Wind Projects With Earnings And Risk In Focus,Simply Wall St.,2026-05-17,-0.178,Ørsted and PGE kick off offshore installation of Baltica 2 project,Energy Global,2026-05-14,0.0,,,,,,,,,,
AAPL,Apple,Tech,mega-cap,NASDAQ,298.01,+0.29%,+0.81%,-0.32%,+10.17%,+48%,3306.589,1.086,36.08,47.95,85962200,253056400,1134668300,36.0,1.06,buy,1.98,0.29,100.29,0.29,1002.9,2.9,10029.0,29.0,0.81,100.81,0.81,1008.1,8.1,10081.0,81.0,-0.32,99.68,-0.32,996.8,-3.2,9968.0,-32.0,10.17,110.17,10.17,1101.7,101.7,11017.0,1017.0,48.0,148.0,48.0,1480.0,480.0,14800.0,4800.0,Making Six Figures but Betting Everything on U.S. Stocks? AVUV Fixes That Problem,24/7 Wall St.,2026-06-19,-0.55,"If You’re 38 With $500K Saved, AVUV Fixes Your Tech-Heavy Portfolio",24/7 Wall St.,2026-06-19,0.421,ASML Faces Fresh China Export Scrutiny,GuruFocus.com,2026-06-19,0.318,,,,,,,,,,
MSFT,Microsoft,Tech,mega-cap,NASDAQ,379.4,-0.75%,-2.80%,-8.91%,-19.42%,-21%,2129.121,1.103,22.61,36.09,59714200,200341000,839800400,92.0,1.19,strong_buy,1.34,-0.75,99.25,-0.75,992.5,-7.5,9925.0,-75.0,-2.8,97.2,-2.8,972.0,-28.0,9720.0,-280.0,-8.91,91.09,-8.91,910.9,-89.1,9109.0,-891.0,-19.42,80.58,-19.42,805.8,-194.2,8058.0,-1942.0,-21.0,79.0,-21.0,790.0,-210.0,7900.0,-2100.0,Making Six Figures but Betting Everything on U.S. Stocks? AVUV Fixes That Problem,24/7 Wall St.,2026-06-19,-0.55,"If You’re 38 With $500K Saved, AVUV Fixes Your Tech-Heavy Portfolio",24/7 Wall St.,2026-06-19,0.421,Amazon's Quantum Bet Nears Reality,GuruFocus.com,2026-06-19,0.0,,,,,,,,,,
GOOGL,Alphabet (Google),Tech,mega-cap,NASDAQ,368.03,+0.65%,+2.87%,-5.01%,+16.93%,+121%,3392.66,1.237,28.09,30.05,44470100,146321900,723940500,24.0,1.42,strong_buy,1.44,0.65,100.65,0.65,1006.5,6.5,10065.0,65.0,2.87,102.87,2.87,1028.7,28.7,10287.0,287.0,-5.01,94.99,-5.01,949.9,-50.1,9499.0,-501.0,16.93,116.93,16.93,1169.3,169.3,11693.0,1693.0,121.0,221.0,121.0,2210.0,1210.0,22100.0,12100.0,How SpaceX benefits from its Cursor acquisition,Yahoo Finance,2026-06-19,0.382,Making Six Figures but Betting Everything on U.S. Stocks? AVUV Fixes That Problem,24/7 Wall St.,2026-06-19,-0.55,"If You’re 38 With $500K Saved, AVUV Fixes Your Tech-Heavy Portfolio",24/7 Wall St.,2026-06-19,0.421,,,,,,,,,,
AMZN,Amazon,Tech,mega-cap,NASDAQ,244.39,+2.08%,+1.19%,-5.76%,+7.90%,+17%,1986.025,1.444,31.45,45.25,75624400,248490800,957639600,,0.94,strong_buy,1.34,2.08,102.08,2.08,1020.8,20.8,10208.0,208.0,1.19,101.19,1.19,1011.9,11.9,10119.0,119.0,-5.76,94.24,-5.76,942.4,-57.6,9424.0,-576.0,7.9,107.9,7.9,1079.0,79.0,10790.0,790.0,17.0,117.0,17.0,1170.0,170.0,11700.0,1700.0,Making Six Figures but Betting Everything on U.S. Stocks? AVUV Fixes That Problem,24/7 Wall St.,2026-06-19,-0.55,"If You’re 38 With $500K Saved, AVUV Fixes Your Tech-Heavy Portfolio",24/7 Wall St.,2026-06-19,0.421,Is Plug Power Inc. (PLUG) A Good Stock To Buy Now?,Insider Monkey,2026-06-19,0.44,,,,,,,,,,
META,Meta Platforms,Tech,mega-cap,NASDAQ,577.22,+0.46%,+1.64%,-4.12%,-11.09%,-15%,1106.907,1.229,21.0,17.54,28824600,92627000,405981500,35.0,1.47,strong_buy,1.31,0.46,100.46,0.46,1004.6,4.6,10046.0,46.0,1.64,101.64,1.64,1016.4,16.4,10164.0,164.0,-4.12,95.88,-4.12,958.8,-41.2,9588.0,-412.0,-11.09,88.91,-11.09,889.1,-110.9,8891.0,-1109.0,-15.0,85.0,-15.0,850.0,-150.0,8500.0,-1500.0,Making Six Figures but Betting Everything on U.S. Stocks? AVUV Fixes That Problem,24/7 Wall St.,2026-06-19,-0.55,"If You’re 38 With $500K Saved, AVUV Fixes Your Tech-Heavy Portfolio",24/7 Wall St.,2026-06-19,0.421,Prediction: Meta's AI Spending Will Pay Off Bigger Than Wall Street Expects,Motley Fool,2026-06-19,-0.103,,,,,,,,,,
NVDA,NVIDIA,Tech,semiconductors,NASDAQ,210.69,+2.13%,+2.84%,-4.39%,+11.70%,+46%,3855.154,2.202,32.26,164.05,241272000,757268100,3838809200,,1.22,strong_buy,1.29,2.13,102.13,2.13,1021.3,21.3,10213.0,213.0,2.84,102.84,2.84,1028.4,28.4,10284.0,284.0,-4.39,95.61,-4.39,956.1,-43.9,9561.0,-439.0,11.7,111.7,11.7,1117.0,117.0,11170.0,1170.0,46.0,146.0,46.0,1460.0,460.0,14600.0,4600.0,Making Six Figures but Betting Everything on U.S. Stocks? AVUV Fixes That Problem,24/7 Wall St.,2026-06-19,-0.55,"After Being Called the Next Trillion-Dollar AI Stock and Joining the S&P 500, Marvell's CFO Just Filed to Dump $65 Million of Stock. Here's Why.",Motley Fool,2026-06-19,-0.382,"If You’re 38 With $500K Saved, AVUV Fixes Your Tech-Heavy Portfolio",24/7 Wall St.,2026-06-19,0.421,,,,,,,,,,
AMD,Advanced Micro Devices,Tech,semiconductors,NASDAQ,537.37,+2.95%,+10.02%,+29.78%,+140.47%,+319%,661.952,2.492,179.72,37.95,43805600,164338100,713771100,,2.71,strong_buy,1.45,2.95,102.95,2.95,1029.5,29.5,10295.0,295.0,10.02,110.02,10.02,1100.2,100.2,11002.0,1002.0,29.78,129.78,29.78,1297.8,297.8,12978.0,2978.0,140.47,240.47,140.47,2404.7,1404.7,24047.0,14047.0,319.0,419.0,319.0,4190.0,3190.0,41900.0,31900.0,"Analyst Warns Intel Valuation ‘Doesn’t Make Sense.’ Suggests NVIDIA, AMD, Micron, and Broadcom as Alternatives.",24/7 Wall St.,2026-06-19,-0.103,AI And Post‑Quantum Push Could Be A Game Changer For TD SYNNEX (SNX),Simply Wall St.,2026-06-19,0.0,Donald Trump’s Under-The-Radar Tech Stock Pick Everyone’s Ignoring,Insider Monkey,2026-06-19,-0.402,5,strong_buy,0.8,"AMD has gained 140.47% YTD and 29.78% in the past month, capturing 33% of the server CPU market, with strong_buy analyst consensus and positive news sentiment of 0.061.",+140.47% YTD; server CPU share 33%; strong_buy consensus; AI chip competition,,,,,
INTC,Intel,Tech,semiconductors,NASDAQ,133.99,+7.77%,+14.56%,+20.93%,+240.25%,+536%,508.746,2.228,,133.41,233906600,767871000,2939177400,,2.69,hold,2.62,7.77,107.77,7.77,1077.7,77.7,10777.0,777.0,14.56,114.56,14.56,1145.6,145.6,11456.0,1456.0,20.93,120.93,20.93,1209.3,209.3,12093.0,2093.0,240.25,340.25,240.25,3402.5,2402.5,34025.0,24025.0,536.0,636.0,536.0,6360.0,5360.0,63600.0,53600.0,"Analyst Warns Intel Valuation ‘Doesn’t Make Sense.’ Suggests NVIDIA, AMD, Micron, and Broadcom as Alternatives.",24/7 Wall St.,2026-06-19,-0.103,Intel Adds Foundry Muscle,GuruFocus.com,2026-06-19,0.0,Beyond Trump Hype: Does Intel (INTC) Have Long-Term Growth Catalysts?,Insider Monkey,2026-06-19,0.382,3,strong_buy,1.0,"Intel surged 240.25% YTD and 7.77% today after Trump announced Apple will partner with Intel for U.S. chip production, validating its foundry turnaround; forward P/E is high at 147x but the strategic catalyst is transformative.",+240.25% YTD; Apple partnership catalyst; foundry turnaround; 18A process progress,,,,,
TSM,Taiwan Semiconductor,Tech,semiconductors,NYSE,462.12,+5.68%,+9.75%,+17.98%,+45.34%,+121%,1810.642,1.25,39.74,13.62,25817100,69242100,283057800,,0.58,strong_buy,1.47,5.68,105.68,5.68,1056.8,56.8,10568.0,568.0,9.75,109.75,9.75,1097.5,97.5,10975.0,975.0,17.98,117.98,17.98,1179.8,179.8,11798.0,1798.0,45.34,145.34,45.34,1453.4,453.4,14534.0,4534.0,121.0,221.0,121.0,2210.0,1210.0,22100.0,12100.0,"Analyst Warns Intel Valuation ‘Doesn’t Make Sense.’ Suggests NVIDIA, AMD, Micron, and Broadcom as Alternatives.",24/7 Wall St.,2026-06-19,-0.103,ASML Draws Fresh China Scrutiny,GuruFocus.com,2026-06-19,0.318,Here Is the 1 Dirt-Cheap Semiconductor Titan I Keep Loading Up on Repeat,24/7 Wall St.,2026-06-19,0.0,4,strong_buy,0.85,"TSMC is up 45.34% YTD and 5.68% today, with a strong_buy consensus, low short interest of 0.58%, and positive news sentiment of 0.164, benefiting from insatiable AI chip demand as the sole supplier of advanced logic.",+45.34% YTD; low short interest 0.58%; strong_buy consensus; AI chip monopoly,,,,,
AVGO,Broadcom,Tech,semiconductors,NASDAQ,411.35,+3.27%,+6.69%,+0.07%,+18.58%,+65%,1478.439,1.433,68.22,25.97,45076100,176650400,743036300,69.0,1.25,strong_buy,1.33,3.27,103.27,3.27,1032.7,32.7,10327.0,327.0,6.69,106.69,6.69,1066.9,66.9,10669.0,669.0,0.07,100.07,0.07,1000.7,0.7,10007.0,7.0,18.58,118.58,18.58,1185.8,185.8,11858.0,1858.0,65.0,165.0,65.0,1650.0,650.0,16500.0,6500.0,"Analyst Warns Intel Valuation ‘Doesn’t Make Sense.’ Suggests NVIDIA, AMD, Micron, and Broadcom as Alternatives.",24/7 Wall St.,2026-06-19,-0.103,"Google, SpaceX, Microsoft, and Amazon Are About to Spend ‘Twice the Entire U.S. Defense Budget’ on AI",24/7 Wall St.,2026-06-19,0.296,Cisco is Overvalued at 7.01X P/S: Should You Still Buy the Stock?,Zacks,2026-06-19,0.0,,,,,,,,,,
