ticker,company_name,sector,category,exchange,price_usd,change_1d,change_1w,change_1m,change_ytd,return_1yr,market_cap_gbp_b,beta,pe_ratio,avg_volume_m,vol_1d,vol_1w,vol_1m,div_yield_pct,short_pct,analyst,analyst_score,pct_1d,val_100_1d,profit_100_1d,val_1000_1d,profit_1000_1d,val_10000_1d,profit_10000_1d,pct_1w,val_100_1w,profit_100_1w,val_1000_1w,profit_1000_1w,val_10000_1w,profit_10000_1w,pct_1m,val_100_1m,profit_100_1m,val_1000_1m,profit_1000_1m,val_10000_1m,profit_10000_1m,pct_ytd,val_100_ytd,profit_100_ytd,val_1000_ytd,profit_1000_ytd,val_10000_ytd,profit_10000_ytd,pct_1y,val_100_1y,profit_100_1y,val_1000_1y,profit_1000_1y,val_10000_1y,profit_10000_1y,news1_title,news1_publisher,news1_date,news1_sentiment,news2_title,news2_publisher,news2_date,news2_sentiment,news3_title,news3_publisher,news3_date,news3_sentiment,signal_rank,signal,signal_confidence,signal_rationale,signal_drivers,portfolio_held,portfolio_quantity,portfolio_avg_price,portfolio_ppl,portfolio_total_value
SNDK,SanDisk Corporation,AI,memory,NASDAQ,2184.75,+8.69%,+16.12%,+57.94%,+693.76%,+4590%,244.418,,74.62,14.73,12178300,52031800,240954100,,9.71,buy,1.59,8.69,108.69,8.69,1086.9,86.9,10869.0,869.0,16.12,116.12,16.12,1161.2,161.2,11612.0,1612.0,57.94,157.94,57.94,1579.4,579.4,15794.0,5794.0,693.76,793.76,693.76,7937.6,6937.6,79376.0,69376.0,4590.0,4690.0,4590.0,46900.0,45900.0,469000.0,459000.0,"Up 700% YTD, How High Can SanDisk Rally?",24/7 Wall St.,2026-06-19,0.0,"Micron Gets the Headlines, But Sandisk Could Offer More Upside",Zacks,2026-06-19,0.0,Missed Out on the AI Memory Rally? These 3 Stocks Are Just Getting Started.,Motley Fool,2026-06-19,-0.296,2,strong_buy,1.0,"SanDisk surged ~700% YTD and +8.69% on the day after Apple's CEO confirmed memory-driven price hikes, reinforcing the NAND shortage trade; the stock has extreme momentum (+57.94% 1M) but a high P/E of 74.62 and beta above 3 warrant caution.",+693.76% YTD; +57.94% 1M; Apple price hike catalyst; high beta 3.45,,,,,
WDC,Western Digital,AI,memory,NASDAQ,746.23,+1.24%,+40.99%,+63.76%,+297.86%,+1159%,194.311,2.2,44.71,7.94,16683900,61921300,171297600,,10.43,buy,1.56,1.24,101.24,1.24,1012.4,12.4,10124.0,124.0,40.99,140.99,40.99,1409.9,409.9,14099.0,4099.0,63.76,163.76,63.76,1637.6,637.6,16376.0,6376.0,297.86,397.86,297.86,3978.6,2978.6,39786.0,29786.0,1159.0,1259.0,1159.0,12590.0,11590.0,125900.0,115900.0,How Is NetApp Capitalizing on Rising All-Flash Adoption?,Zacks,2026-06-19,0.0,Is The AI Super-Cycle Real Enough To Bet On Micron Stock?,Trefis,2026-06-18,0.0,Semiconductors Stocks Q1 In Review: Western Digital (NASDAQ:WDC) Vs Peers,StockStory,2026-06-18,0.0,4,strong_buy,1.0,"Western Digital surged +297.86% YTD and +40.99% in the last week, benefiting from Apple's memory price hike comments and a Morgan Stanley target increase to $650; short interest is elevated at 10.43%.",+297.86% YTD; +40.99% 1W; Apple memory catalyst; short interest 10.43%,,,,,
285A,Kioxia Holdings,AI,memory,TSE,108600.0,+11.64%,+33.74%,+118.20%,+856.83%,+4143%,277.83,,107.15,36.36,34871100,163585500,928373800,,,buy,1.62,11.64,111.64,11.64,1116.4,116.4,11164.0,1164.0,33.74,133.74,33.74,1337.4,337.4,13374.0,3374.0,118.2,218.2,118.2,2182.0,1182.0,21820.0,11820.0,856.83,956.83,856.83,9568.3,8568.3,95683.0,85683.0,4143.0,4243.0,4143.0,42430.0,41430.0,424300.0,414300.0,Japan's Nikkei Soars to Record High,Barrons.com,2026-06-15,0.0,Kioxia Becomes Japan’s Most Valuable Firm as AI Mania Goes On,Bloomberg,2026-06-12,0.526,Chip Stocks Rebound Amid Dip Buying,Barrons.com,2026-06-09,0.0,5,strong_buy,1.0,"285A has the highest YTD return in the universe at +856.83%, with +118.20% in the last month and +11.64% today, driven by the memory boom; however, its P/E of 107.15 and lack of beta data add risk.",+856.83% YTD; +118.20% 1M; memory sector tailwind; high P/E 107.15,,,,,
MU,Micron Technology,AI,memory,NASDAQ,1133.99,+5.22%,+13.87%,+62.29%,+259.67%,+817%,966.099,2.173,53.41,50.9,64642500,242071300,1199481900,,3.34,strong_buy,1.48,5.22,105.22,5.22,1052.2,52.2,10522.0,522.0,13.87,113.87,13.87,1138.7,138.7,11387.0,1387.0,62.29,162.29,62.29,1622.9,622.9,16229.0,6229.0,259.67,359.67,259.67,3596.7,2596.7,35967.0,25967.0,817.0,917.0,817.0,9170.0,8170.0,91700.0,81700.0,"Dow Jones Futures Fall; Nvidia Leads 5 Stocks Near Buy Points, SpaceX Needs This",Investor's Business Daily,2026-06-19,0.0,"Micron Gets the Headlines, But Sandisk Could Offer More Upside",Zacks,2026-06-19,0.0,Everything Could Change for Micron Stock on June 24,Motley Fool,2026-06-19,0.0,1,strong_buy,1.0,"Micron surged 8% to a record high after Deutsche Bank raised its price target to $1,500 and Citi to $1,200, citing an AI-driven memory supply deficit extending through 2028; the stock has +259.67% YTD, a strong_buy analyst consensus (score 1.48), and a forward P/E under 10.","+259.67% YTD; strong_buy consensus (1.48); Deutsche Bank PT $1,500; AI memory shortage catalyst",,,,,
STX,Seagate Technology,AI,memory,NASDAQ,1070.23,-2.08%,+23.29%,+45.94%,+272.85%,+717%,182.926,2.083,101.73,4.11,8424500,27785700,81252400,29.0,4.58,buy,1.54,-2.08,97.92,-2.08,979.2,-20.8,9792.0,-208.0,23.29,123.29,23.29,1232.9,232.9,12329.0,2329.0,45.94,145.94,45.94,1459.4,459.4,14594.0,4594.0,272.85,372.85,272.85,3728.5,2728.5,37285.0,27285.0,717.0,817.0,717.0,8170.0,7170.0,81700.0,71700.0,2 High-Flying Stocks Worth Your Attention and 1 We Question,StockStory,2026-06-19,0.226,How Is NetApp Capitalizing on Rising All-Flash Adoption?,Zacks,2026-06-19,0.0,AI Memory Bottleneck? These ETFs Let You Buy All the Winners,Zacks,2026-06-19,0.477,3,strong_buy,1.0,"Seagate gained +272.85% YTD and +23.29% in the last week, with Morgan Stanley raising its price target to $1,035 on HDD supply shortages driven by cloud and AI storage demand; news sentiment is positive at 0.22.",+272.85% YTD; +23.29% 1W; Morgan Stanley PT hike; positive news sentiment 0.22,,,,,
MRVL,Marvell Technology,AI,memory,NASDAQ,310.58,+4.33%,+10.64%,+76.20%,+247.87%,+323%,205.252,2.277,107.1,40.63,250989400,457808900,1470111300,9.0,4.71,strong_buy,1.45,4.33,104.33,4.33,1043.3,43.3,10433.0,433.0,10.64,110.64,10.64,1106.4,106.4,11064.0,1064.0,76.2,176.2,76.2,1762.0,762.0,17620.0,7620.0,247.87,347.87,247.87,3478.7,2478.7,34787.0,24787.0,323.0,423.0,323.0,4230.0,3230.0,42300.0,32300.0,"After Being Called the Next Trillion-Dollar AI Stock and Joining the S&P 500, Marvell's CFO Just Filed to Dump $65 Million of Stock. Here's Why.",Motley Fool,2026-06-19,-0.382,3 Stocks to Buy Now Before Wall Street Catches On,24/7 Wall St.,2026-06-19,0.0,ALAB Rides on Strong Aries and Taurus Demand: A Sign for More Upside?,Zacks,2026-06-19,0.421,6,strong_buy,1.0,"Marvell hit a new high with +247.87% YTD and +76.20% in the last month, supported by a strong_buy analyst consensus (score 1.45) and positive news sentiment 0.191; a quiet Amazon decision is cited as a catalyst.",+247.87% YTD; +76.20% 1M; strong_buy consensus (1.45); Amazon catalyst,,,,,
P,Everpure,AI,memory,NYSE,74.61,+2.21%,+7.60%,-1.87%,+8.11%,+45%,18.736,1.445,113.05,3.29,7522900,18825700,93878000,,4.16,buy,1.9,2.21,102.21,2.21,1022.1,22.1,10221.0,221.0,7.6,107.6,7.6,1076.0,76.0,10760.0,760.0,-1.87,98.13,-1.87,981.3,-18.7,9813.0,-187.0,8.11,108.11,8.11,1081.1,81.1,10811.0,811.0,45.0,145.0,45.0,1450.0,450.0,14500.0,4500.0,"Google, SpaceX, Microsoft, and Amazon Are About to Spend ‘Twice the Entire U.S. Defense Budget’ on AI",24/7 Wall St.,2026-06-19,0.296,3 Reasons Why Growth Investors Shouldn't Overlook Everpure (P),Zacks,2026-06-19,0.382,"Everpure (P) May Find a Bottom Soon, Here's Why You Should Buy the Stock Now",Zacks,2026-06-19,0.0,,,,,,,,,,
RR.,Rolls-Royce Holdings,AI,nuclear-ops,LSE,1408.2,-0.10%,+7.66%,+20.92%,+17.65%,+59%,1.168,1.22,20.41,34.37,32771920,107310385,662600012,68.0,,buy,1.6,-0.1,99.9,-0.1,999.0,-1.0,9990.0,-10.0,7.66,107.66,7.66,1076.6,76.6,10766.0,766.0,20.92,120.92,20.92,1209.2,209.2,12092.0,2092.0,17.65,117.65,17.65,1176.5,176.5,11765.0,1765.0,59.0,159.0,59.0,1590.0,590.0,15900.0,5900.0,BMW warns of ‘significant’ profit decline as shares fall 7%,Euronews,2026-06-17,0.572,Rolls-Royce secures deal to build small nuclear reactors for Sweden,Euronews,2026-06-16,0.318,Rolls-Royce (LSE:RR.) Stock Price Surge Raises Fresh Questions On Future Valuation,Simply Wall St.,2026-06-15,0.318,,,,,,,,,,
CEG,Constellation Energy,AI,nuclear-ops,NASDAQ,274.06,+2.26%,+11.09%,+5.14%,-24.95%,-10%,73.934,1.091,23.83,3.54,6986000,21383100,94057800,64.0,3.6,buy,1.52,2.26,102.26,2.26,1022.6,22.6,10226.0,226.0,11.09,111.09,11.09,1110.9,110.9,11109.0,1109.0,5.14,105.14,5.14,1051.4,51.4,10514.0,514.0,-24.95,75.05,-24.95,750.5,-249.5,7505.0,-2495.0,-10.0,90.0,-10.0,900.0,-100.0,9000.0,-1000.0,Does Constellation Energy Stock's Surge Broaden Your Portfolio Or Just Amplify It?,Trefis,2026-06-19,0.273,Seeking Nuclear Exposure? Use This Tool,Zacks,2026-06-18,0.0,Constellation Energy Corporation (CEG) Exceeds Market Returns: Some Facts to Consider,Zacks,2026-06-18,0.273,,,,,,,,,,
VST,Vistra Corp,AI,nuclear-ops,NYSE,163.75,+2.09%,+11.87%,+21.56%,-0.76%,-12%,41.711,1.405,27.38,4.76,7976300,26438300,110776800,,5.39,strong_buy,1.4,2.09,102.09,2.09,1020.9,20.9,10209.0,209.0,11.87,111.87,11.87,1118.7,118.7,11187.0,1187.0,21.56,121.56,21.56,1215.6,215.6,12156.0,2156.0,-0.76,99.24,-0.76,992.4,-7.6,9924.0,-76.0,-12.0,88.0,-12.0,880.0,-120.0,8800.0,-1200.0,Can Vistra Unlock More Value for Investors Through Share Buybacks?,Zacks,2026-06-19,0.598,Does Constellation Energy Stock's Surge Broaden Your Portfolio Or Just Amplify It?,Trefis,2026-06-19,0.273,"Forget Critical Metals, Electricity is The Real Bottleneck for AI",Oilprice.com,2026-06-19,-0.494,,,,,,,,,,
TLN,Talen Energy,AI,nuclear-ops,NYSE,436.29,+6.35%,+26.53%,+38.69%,+9.97%,+51%,15.753,1.604,,0.76,1997500,6368100,19314400,,5.58,strong_buy,1.5,6.35,106.35,6.35,1063.5,63.5,10635.0,635.0,26.53,126.53,26.53,1265.3,265.3,12653.0,2653.0,38.69,138.69,38.69,1386.9,386.9,13869.0,3869.0,9.97,109.97,9.97,1099.7,99.7,10997.0,997.0,51.0,151.0,51.0,1510.0,510.0,15100.0,5100.0,"Nuclear Stocks Oklo, Centrus Jump After Signing Uranium Deal",Investor's Business Daily,2026-06-18,0.0,Stocks Supported as Geopolitical Risks Recede,Barchart,2026-06-18,0.052,"Goldman starts Talen at buy, sees PJM power tightness boosting earnings",Investing.com,2026-06-18,0.34,10,buy,0.68,"Talen Energy has +9.97% YTD and +38.69% in the last month, with +26.53% in the last week and positive news sentiment 0.119; nuclear stocks are gaining on uranium deals, but the stock has no P/E and a beta of 1.604.",+38.69% 1M; +26.53% 1W; nuclear sector catalyst; positive news sentiment 0.119,,,,,
BEP,Brookfield Renewable,AI,nuclear-ops,NYSE,35.24,+5.01%,-0.40%,+4.62%,+29.07%,+41%,17.126,0.989,,0.92,1172300,3912000,19897500,,0.66,buy,2.31,5.01,105.01,5.01,1050.1,50.1,10501.0,501.0,-0.4,99.6,-0.4,996.0,-4.0,9960.0,-40.0,4.62,104.62,4.62,1046.2,46.2,10462.0,462.0,29.07,129.07,29.07,1290.7,290.7,12907.0,2907.0,41.0,141.0,41.0,1410.0,410.0,14100.0,4100.0,"HA Sustainable Stock Outlook Turns on Yield, Liquidity, Policy Risks",Zacks,2026-06-19,0.258,HASI Rides Recurring Income and Energy Transition Finance Trends,Zacks,2026-06-19,0.273,Congresswoman Who Bought No Stocks In 2025 Is Back With More 2026 Trades: Here's The Shopping List,Benzinga,2026-06-13,-0.296,,,,,,,,,,
BEPC,Brookfield Renewable Corp,AI,nuclear-ops,NYSE,37.42,+1.96%,-0.69%,+4.57%,-4.41%,+19%,5.156,1.15,,1.55,1872600,7610600,32178300,432.0,,none,,1.96,101.96,1.96,1019.6,19.6,10196.0,196.0,-0.69,99.31,-0.69,993.1,-6.9,9931.0,-69.0,4.57,104.57,4.57,1045.7,45.7,10457.0,457.0,-4.41,95.59,-4.41,955.9,-44.1,9559.0,-441.0,19.0,119.0,19.0,1190.0,190.0,11900.0,1900.0,Brookfield Is Launching Another Renewable Energy Company. Here's What Investors Need to Know.,Motley Fool,2026-06-18,0.273,3 High-Yield Energy Stocks Worth Buying for the Income -- and Holding for the Gains,Motley Fool,2026-06-17,0.66,Brookfield Renewable Corp vs. WEC Energy Group: Which Utilities Stock Is a Better Buy in 2026?,Motley Fool,2026-06-10,0.612,,,,,,,,,,
GEV,GE Vernova,AI,smr,NYSE,1109.73,+4.79%,+22.44%,+9.73%,+63.61%,+128%,225.28,1.045,32.46,2.7,4344700,17317700,65150700,20.0,3.42,buy,1.58,4.79,104.79,4.79,1047.9,47.9,10479.0,479.0,22.44,122.44,22.44,1224.4,224.4,12244.0,2244.0,9.73,109.73,9.73,1097.3,97.3,10973.0,973.0,63.61,163.61,63.61,1636.1,636.1,16361.0,6361.0,128.0,228.0,128.0,2280.0,1280.0,22800.0,12800.0,Can GEV's Sustainability Create Long-Term Competitive Advantages?,Zacks,2026-06-19,0.649,"Forget Critical Metals, Electricity is The Real Bottleneck for AI",Oilprice.com,2026-06-19,-0.494,GE Vernova Supplier Breaks Out As Data Centers Lift Construction Sector,Investor's Business Daily,2026-06-18,0.0,,,,,,,,,,
BWXT,BWX Technologies,AI,smr,NYSE,205.4,+1.07%,+5.51%,+4.09%,+13.26%,+44%,14.216,0.734,54.92,1.02,2279900,5531100,21544800,,3.71,buy,1.93,1.07,101.07,1.07,1010.7,10.7,10107.0,107.0,5.51,105.51,5.51,1055.1,55.1,10551.0,551.0,4.09,104.09,4.09,1040.9,40.9,10409.0,409.0,13.26,113.26,13.26,1132.6,132.6,11326.0,1326.0,44.0,144.0,44.0,1440.0,440.0,14400.0,4400.0,Nuclear Is the Energy Story of 2026. Here Are 3 Stocks to Own All Year.,Motley Fool,2026-06-16,0.273,1 Mid-Cap Stock on Our Buy List and 2 That Underwhelm,StockStory,2026-06-15,0.0,ATI and BWX Technologies Extend Strategic Partnership Through 2030,Zacks,2026-06-12,0.178,,,,,,,,,,
SMR,NuScale Power,AI,smr,NYSE,11.74,+11.17%,+22.68%,+16.70%,-28.02%,-68%*,3.07,2.219,,34.37,68495300,216053600,832407000,,19.97,hold,2.53,11.17,111.17,11.17,1111.7,111.7,11117.0,1117.0,22.68,122.68,22.68,1226.8,226.8,12268.0,2268.0,16.7,116.7,16.7,1167.0,167.0,11670.0,1670.0,-28.02,71.98,-28.02,719.8,-280.2,7198.0,-2802.0,-68.0,32.0,-68.0,320.0,-680.0,3200.0,-6800.0,Is NuScale Power’s (SMR) New UVA Wise E2 Center Quietly Shaping Its Commercialization Path?,Simply Wall St.,2026-06-19,0.477,Should You Buy NuScale While It's Below $15?,Motley Fool,2026-06-18,0.0,"Nuclear Stocks Oklo, Centrus Jump After Signing Uranium Deal",Investor's Business Daily,2026-06-18,0.0,,,,,,,,,,
OKLO,Oklo Inc,AI,smr,NYSE,61.17,+2.39%,+5.72%,+9.47%,-21.38%,+6%*,8.04,1.113,,13.38,14444000,51865500,305073700,,18.02,buy,1.96,2.39,102.39,2.39,1023.9,23.9,10239.0,239.0,5.72,105.72,5.72,1057.2,57.2,10572.0,572.0,9.47,109.47,9.47,1094.7,94.7,10947.0,947.0,-21.38,78.62,-21.38,786.2,-213.8,7862.0,-2138.0,6.0,106.0,6.0,1060.0,60.0,10600.0,600.0,"OKLO, Centrus sign fuel agreement in Piketon, positioning southern Ohio as an advanced nuclear energy hub","The Portsmouth Daily Times, Ohio",2026-06-19,0.743,Oklo Locks In Domestic Nuclear Fuel Supply for Its Ohio Gigawatt Campus,GuruFocus.com,2026-06-19,0.0,Oklo and Centrus Forge Nuclear Fuel Deal for Ohio Campus,Zacks,2026-06-19,0.0,,,,,,,,,,
NNE,NANO Nuclear Energy,AI,smr,NASDAQ,28.21,+9.34%,+19.79%,+26.53%,+2.17%,-24%*,1.111,5.044,,2.59,5405200,16329800,71889200,,23.75,strong_buy,1.4,9.34,109.34,9.34,1093.4,93.4,10934.0,934.0,19.79,119.79,19.79,1197.9,197.9,11979.0,1979.0,26.53,126.53,26.53,1265.3,265.3,12653.0,2653.0,2.17,102.17,2.17,1021.7,21.7,10217.0,217.0,-24.0,76.0,-24.0,760.0,-240.0,7600.0,-2400.0,"Nuclear Stocks Oklo, Centrus Jump After Signing Uranium Deal",Investor's Business Daily,2026-06-18,0.0,Why Nano Nuclear Energy Stock Is Charging Higher Today,Motley Fool,2026-06-17,0.273,1 Reason to Buy NuScale Power and Hold Until 2033,Motley Fool,2026-06-16,0.0,,,,,,,,,,
CCJ,Cameco Corporation,AI,uranium,NYSE,106.49,-0.09%,+7.60%,+2.87%,+8.05%,+56%,35.038,0.983,99.52,3.19,3099500,14121300,72427000,,,buy,1.79,-0.09,99.91,-0.09,999.1,-0.9,9991.0,-9.0,7.6,107.6,7.6,1076.0,76.0,10760.0,760.0,2.87,102.87,2.87,1028.7,28.7,10287.0,287.0,8.05,108.05,8.05,1080.5,80.5,10805.0,805.0,56.0,156.0,56.0,1560.0,560.0,15600.0,5600.0,Is Now the Time to Buy a Uranium ETF?,Barchart,2026-06-19,0.0,Cameco vs. Centrus Energy: Which Uranium Stock is the Better Buy Now?,Zacks,2026-06-18,0.612,Can Cameco's Contract Portfolio Power Its Next Growth Phase?,Zacks,2026-06-17,0.382,,,,,,,,,,
UEC,Uranium Energy Corp,AI,uranium,NYSE,12.01,+1.87%,+12.98%,+0.84%,-8.39%,+86%,4.49,1.145,,10.3,25345000,74148300,278810500,,12.92,strong_buy,1.44,1.87,101.87,1.87,1018.7,18.7,10187.0,187.0,12.98,112.98,12.98,1129.8,129.8,11298.0,1298.0,0.84,100.84,0.84,1008.4,8.4,10084.0,84.0,-8.39,91.61,-8.39,916.1,-83.9,9161.0,-839.0,86.0,186.0,86.0,1860.0,860.0,18600.0,8600.0,Brokers Suggest Investing in Uranium Energy (UEC): Read This Before Placing a Bet,Zacks,2026-06-19,0.273,Cameco vs. Centrus Energy: Which Uranium Stock is the Better Buy Now?,Zacks,2026-06-18,0.612,Optimism Surrounds Uranium Energy (UEC) Following an Impressive Quarter,Insider Monkey,2026-06-17,0.836,,,,,,,,,,
LEU,Centrus Energy,AI,uranium,NYSE,191.39,+11.79%,+20.61%,+13.25%,-29.77%,+1%,2.844,1.339,69.6,0.9,2157300,5078500,20514100,,22.09,buy,1.75,11.79,111.79,11.79,1117.9,117.9,11179.0,1179.0,20.61,120.61,20.61,1206.1,206.1,12061.0,2061.0,13.25,113.25,13.25,1132.5,132.5,11325.0,1325.0,-29.77,70.23,-29.77,702.3,-297.7,7023.0,-2977.0,1.0,101.0,1.0,1010.0,10.0,10100.0,100.0,"OKLO, Centrus sign fuel agreement in Piketon, positioning southern Ohio as an advanced nuclear energy hub","The Portsmouth Daily Times, Ohio",2026-06-19,0.743,Oklo Locks In Domestic Nuclear Fuel Supply for Its Ohio Gigawatt Campus,GuruFocus.com,2026-06-19,0.0,Oklo and Centrus Forge Nuclear Fuel Deal for Ohio Campus,Zacks,2026-06-19,0.0,,,,,,,,,,
VRT,Vertiv Holdings,AI,power-infra,NYSE,333.05,+2.42%,+11.83%,+3.25%,+89.74%,+181%,96.643,2.037,83.68,7.14,7262600,28330400,134620300,8.0,3.73,strong_buy,1.48,2.42,102.42,2.42,1024.2,24.2,10242.0,242.0,11.83,111.83,11.83,1118.3,118.3,11183.0,1183.0,3.25,103.25,3.25,1032.5,32.5,10325.0,325.0,89.74,189.74,89.74,1897.4,897.4,18974.0,8974.0,181.0,281.0,181.0,2810.0,1810.0,28100.0,18100.0,"Dow Jones Futures Fall; Nvidia Leads 5 Stocks Near Buy Points, SpaceX Needs This",Investor's Business Daily,2026-06-19,0.0,Jim Cramer on Vertiv: “I Do Not Think It’s Over”,Insider Monkey,2026-06-19,0.0,The ‘Mini Vertiv’ AI Stock Wall Street Is Strongly Bullish About,Barchart,2026-06-19,0.273,,,,,,,,,,
ETN,Eaton Corporation,AI,power-infra,NYSE,421.77,+1.15%,+7.15%,+13.42%,+29.62%,+27%,123.723,1.192,41.23,2.58,3715600,12258600,55148200,108.0,2.52,buy,1.72,1.15,101.15,1.15,1011.5,11.5,10115.0,115.0,7.15,107.15,7.15,1071.5,71.5,10715.0,715.0,13.42,113.42,13.42,1134.2,134.2,11342.0,1342.0,29.62,129.62,29.62,1296.2,296.2,12962.0,2962.0,27.0,127.0,27.0,1270.0,270.0,12700.0,2700.0,Eaton (ETN) Stock Could Be 6.6% Undervalued as Data Center Demand Lifts the Narrative,Simply Wall St.,2026-06-19,-0.128,Eaton vs. Rockwell Automation: Which Industrial Tech Stock Leads?,Zacks,2026-06-19,0.0,Can GEV's Sustainability Create Long-Term Competitive Advantages?,Zacks,2026-06-19,0.649,,,,,,,,,,
POWL,Powell Industries,AI,power-infra,NASDAQ,297.2,+2.39%,+2.31%,+13.66%,+153.13%,+408%,8.18,1.128,58.05,0.67,1166500,3188000,12580200,12.0,11.45,none,,2.39,102.39,2.39,1023.9,23.9,10239.0,239.0,2.31,102.31,2.31,1023.1,23.1,10231.0,231.0,13.66,113.66,13.66,1136.6,136.6,11366.0,1366.0,153.13,253.13,153.13,2531.3,1531.3,25313.0,15313.0,408.0,508.0,408.0,5080.0,4080.0,50800.0,40800.0,3 Market-Beating Stocks to Own for Decades,StockStory,2026-06-18,0.0,Why Powell Industries (POWL) Dipped More Than Broader Market Today,Zacks,2026-06-16,0.0,"Is Trending Stock Powell Industries, Inc. (POWL) a Buy Now?",Zacks,2026-06-12,0.0,,,,,,,,,,
EQIX,Equinix,AI,dc-operators,NASDAQ,1092.19,+0.29%,+4.70%,+4.69%,+44.43%,+24%,81.374,0.97,75.58,0.57,807800,3379200,12862500,180.0,2.26,buy,1.58,0.29,100.29,0.29,1002.9,2.9,10029.0,29.0,4.7,104.7,4.7,1047.0,47.0,10470.0,470.0,4.69,104.69,4.69,1046.9,46.9,10469.0,469.0,44.43,144.43,44.43,1444.3,444.3,14443.0,4443.0,24.0,124.0,24.0,1240.0,240.0,12400.0,2400.0,Cisco (CSCO) Pushes Further Into Quantum Security And Enterprise AI,Simply Wall St.,2026-06-19,0.34,Equinix Is Now Becoming a Key Stop in the AI Supply Chain. How to Play EQIX Stock Here.,Barchart,2026-06-18,0.052,Equinix Strengthens AI Infrastructure With Cisco & NVIDIA Partnerships,Zacks,2026-06-17,0.459,,,,,,,,,,
DLR,Digital Realty,AI,dc-operators,NYSE,188.15,-0.13%,+3.59%,+1.68%,+23.00%,+7%,50.843,1.046,49.91,2.17,5037200,16972400,52479500,256.0,0.01,buy,1.72,-0.13,99.87,-0.13,998.7,-1.3,9987.0,-13.0,3.59,103.59,3.59,1035.9,35.9,10359.0,359.0,1.68,101.68,1.68,1016.8,16.8,10168.0,168.0,23.0,123.0,23.0,1230.0,230.0,12300.0,2300.0,7.0,107.0,7.0,1070.0,70.0,10700.0,700.0,APLD's Customer Concentration Remains Elevated: Is Growth at Risk?,Zacks,2026-06-17,0.128,"Oppenheimer Picks Alphabet, Dumps Meta in Highest-Conviction Stock Picks",GuruFocus.com,2026-06-16,-0.402,Is Iron Mountain Stock Underperforming the Nasdaq?,Barchart,2026-06-15,0.0,,,,,,,,,,
AMT,American Tower,AI,dc-operators,NYSE,176.05,-2.73%,-6.12%,-2.88%,+2.69%,-19%,61.962,0.891,28.4,3.18,4453100,16035000,69571100,378.0,2.24,buy,1.68,-2.73,97.27,-2.73,972.7,-27.3,9727.0,-273.0,-6.12,93.88,-6.12,938.8,-61.2,9388.0,-612.0,-2.88,97.12,-2.88,971.2,-28.8,9712.0,-288.0,2.69,102.69,2.69,1026.9,26.9,10269.0,269.0,-19.0,81.0,-19.0,810.0,-190.0,8100.0,-1900.0,Is American Tower Corporation (AMT) among the 7 Best “Land Owner” Stocks to Buy for Hard Asset Value,Insider Monkey,2026-06-19,0.827,Why American Tower (AMT) Dipped More Than Broader Market Today,Zacks,2026-06-17,0.0,9 AI Stocks That Aren’t Super Volatile,Barrons.com,2026-06-16,0.599,,,,,,,,,,
GOOGL,Alphabet (Google),AI,hyperscalers,NASDAQ,368.03,+0.65%,+2.87%,-5.01%,+16.93%,+121%,3392.66,1.237,28.09,30.05,44470100,146321900,723940500,24.0,1.42,strong_buy,1.44,0.65,100.65,0.65,1006.5,6.5,10065.0,65.0,2.87,102.87,2.87,1028.7,28.7,10287.0,287.0,-5.01,94.99,-5.01,949.9,-50.1,9499.0,-501.0,16.93,116.93,16.93,1169.3,169.3,11693.0,1693.0,121.0,221.0,121.0,2210.0,1210.0,22100.0,12100.0,How SpaceX benefits from its Cursor acquisition,Yahoo Finance,2026-06-19,0.382,Making Six Figures but Betting Everything on U.S. Stocks? AVUV Fixes That Problem,24/7 Wall St.,2026-06-19,-0.55,"If You’re 38 With $500K Saved, AVUV Fixes Your Tech-Heavy Portfolio",24/7 Wall St.,2026-06-19,0.421,,,,,,,,,,
MSFT,Microsoft,AI,hyperscalers,NASDAQ,379.4,-0.75%,-2.80%,-8.91%,-19.42%,-21%,2129.121,1.103,22.61,36.09,59714200,200341000,839800400,92.0,1.19,strong_buy,1.34,-0.75,99.25,-0.75,992.5,-7.5,9925.0,-75.0,-2.8,97.2,-2.8,972.0,-28.0,9720.0,-280.0,-8.91,91.09,-8.91,910.9,-89.1,9109.0,-891.0,-19.42,80.58,-19.42,805.8,-194.2,8058.0,-1942.0,-21.0,79.0,-21.0,790.0,-210.0,7900.0,-2100.0,Making Six Figures but Betting Everything on U.S. Stocks? AVUV Fixes That Problem,24/7 Wall St.,2026-06-19,-0.55,"If You’re 38 With $500K Saved, AVUV Fixes Your Tech-Heavy Portfolio",24/7 Wall St.,2026-06-19,0.421,Amazon's Quantum Bet Nears Reality,GuruFocus.com,2026-06-19,0.0,,,,,,,,,,
AMZN,Amazon,AI,hyperscalers,NASDAQ,244.39,+2.08%,+1.19%,-5.76%,+7.90%,+17%,1986.025,1.444,31.45,45.25,75624400,248490800,957639600,,0.94,strong_buy,1.34,2.08,102.08,2.08,1020.8,20.8,10208.0,208.0,1.19,101.19,1.19,1011.9,11.9,10119.0,119.0,-5.76,94.24,-5.76,942.4,-57.6,9424.0,-576.0,7.9,107.9,7.9,1079.0,79.0,10790.0,790.0,17.0,117.0,17.0,1170.0,170.0,11700.0,1700.0,Making Six Figures but Betting Everything on U.S. Stocks? AVUV Fixes That Problem,24/7 Wall St.,2026-06-19,-0.55,"If You’re 38 With $500K Saved, AVUV Fixes Your Tech-Heavy Portfolio",24/7 Wall St.,2026-06-19,0.421,Is Plug Power Inc. (PLUG) A Good Stock To Buy Now?,Insider Monkey,2026-06-19,0.44,,,,,,,,,,
META,Meta Platforms,AI,hyperscalers,NASDAQ,577.22,+0.46%,+1.64%,-4.12%,-11.09%,-15%,1106.907,1.229,21.0,17.54,28824600,92627000,405981500,35.0,1.47,strong_buy,1.31,0.46,100.46,0.46,1004.6,4.6,10046.0,46.0,1.64,101.64,1.64,1016.4,16.4,10164.0,164.0,-4.12,95.88,-4.12,958.8,-41.2,9588.0,-412.0,-11.09,88.91,-11.09,889.1,-110.9,8891.0,-1109.0,-15.0,85.0,-15.0,850.0,-150.0,8500.0,-1500.0,Making Six Figures but Betting Everything on U.S. Stocks? AVUV Fixes That Problem,24/7 Wall St.,2026-06-19,-0.55,"If You’re 38 With $500K Saved, AVUV Fixes Your Tech-Heavy Portfolio",24/7 Wall St.,2026-06-19,0.421,Prediction: Meta's AI Spending Will Pay Off Bigger Than Wall Street Expects,Motley Fool,2026-06-19,-0.103,,,,,,,,,,
IREN,Iris Energy,AI,ai-compute,NASDAQ,59.96,+1.51%,+5.73%,+25.60%,+40.42%,+473%*,16.188,4.232,77.87,44.46,39394600,186144200,1046039500,,16.05,buy,1.81,1.51,101.51,1.51,1015.1,15.1,10151.0,151.0,5.73,105.73,5.73,1057.3,57.3,10573.0,573.0,25.6,125.6,25.6,1256.0,256.0,12560.0,2560.0,40.42,140.42,40.42,1404.2,404.2,14042.0,4042.0,473.0,573.0,473.0,5730.0,4730.0,57300.0,47300.0,IREN (IREN) Enters Europe With Nostrum Deal And 500MW In Spain,Simply Wall St.,2026-06-18,0.0,IREN vs. WULF: Which AI Data Center Stock Has an Edge Right Now?,Zacks,2026-06-18,0.0,IREN Stock Gets Fresh Bull Case: Jefferies Sees AI Pivot Unlocking $3.1B In Annual Revenue,Stocktwits,2026-06-18,0.318,,,,,,,,,,
CORZ,Core Scientific,AI,ai-compute,NASDAQ,29.16,+1.46%,+7.13%,+27.23%,+82.36%,+146%*,7.003,5.484,,13.81,17471700,57847600,285289900,,25.59,strong_buy,1.39,1.46,101.46,1.46,1014.6,14.6,10146.0,146.0,7.13,107.13,7.13,1071.3,71.3,10713.0,713.0,27.23,127.23,27.23,1272.3,272.3,12723.0,2723.0,82.36,182.36,82.36,1823.6,823.6,18236.0,8236.0,146.0,246.0,146.0,2460.0,1460.0,24600.0,14600.0,"Core Scientific Shows Huge, Unusual Put Option Activity - Is CORZ Undervalued?",Barchart,2026-06-17,0.318,Will KEEL's Near-Term Lease Execution Demonstrate Its Worth?,Zacks,2026-06-17,0.226,"Palantir upgraded, Rocket Companies downgraded: Wall Street's top analyst calls",The Fly,2026-06-16,0.202,,,,,,,,,,
