ticker,company_name,sector,category,exchange,price_usd,change_1d,change_1w,change_1m,change_ytd,return_1yr,market_cap_gbp_b,beta,pe_ratio,avg_volume_m,vol_1d,vol_1w,vol_1m,div_yield_pct,short_pct,analyst,analyst_score,pct_1d,val_100_1d,profit_100_1d,val_1000_1d,profit_1000_1d,val_10000_1d,profit_10000_1d,pct_1w,val_100_1w,profit_100_1w,val_1000_1w,profit_1000_1w,val_10000_1w,profit_10000_1w,pct_1m,val_100_1m,profit_100_1m,val_1000_1m,profit_1000_1m,val_10000_1m,profit_10000_1m,pct_ytd,val_100_ytd,profit_100_ytd,val_1000_ytd,profit_1000_ytd,val_10000_ytd,profit_10000_ytd,pct_1y,val_100_1y,profit_100_1y,val_1000_1y,profit_1000_1y,val_10000_1y,profit_10000_1y,news1_title,news1_publisher,news1_date,news1_sentiment,news2_title,news2_publisher,news2_date,news2_sentiment,news3_title,news3_publisher,news3_date,news3_sentiment,signal_rank,signal,signal_confidence,signal_rationale,signal_drivers,portfolio_held,portfolio_quantity,portfolio_avg_price,portfolio_ppl,portfolio_total_value
SNDK,SanDisk Corporation,AI,memory,NASDAQ,2050.39,-2.78%,-9.82%,+16.40%,+644.95%,+4510%,229.04,,70.05,14.13,10808419,65927319,228936219,,11.5,buy,1.59,-2.78,97.22,-2.78,972.2,-27.8,9722.0,-278.0,-9.82,90.18,-9.82,901.8,-98.2,9018.0,-982.0,16.4,116.4,16.4,1164.0,164.0,11640.0,1640.0,644.95,744.95,644.95,7449.5,6449.5,74495.0,64495.0,4510.0,4610.0,4510.0,46100.0,45100.0,461000.0,451000.0,Micron CEO Sanjay Mehrotra Says Watching Berkeley’s ‘The Play’ Helped Shape A Leadership Quality He Later Brought To SanDisk,Benzinga,2026-06-29,0.0,Micron and Intel Lead Chip Selloff,GuruFocus.com,2026-06-29,0.0,"Citi Just Slapped a Massive $2,500 Price Target on SanDisk. Here’s Why They’re So Bullish",24/7 Wall St.,2026-06-29,0.0,5,strong_buy,1.0,"SanDisk rides Micron's coattails with a +659.6% YTD, 1M gain of +31.5%, and a buy consensus. It reported Q3 revenue of $5.95B (+251% YoY) and guided Q4 higher, supported by multi-year customer agreements validated by Micron's $100B disclosure. [247wallst.com](https://247wallst.com/investing/2026/06/25/micron-soars-17-sandisk-jumps-15-western-digital-climbs-13-after-blowout-quarter-locks-in-100b-of-ai-memory-demand/)",+660% YTD; +31.5% 1M; revenue +251% YoY; analyst buy,,,,,
WDC,Western Digital,AI,memory,NASDAQ,651.88,+10.77%,-11.02%,+19.38%,+247.56%,+816%,169.487,2.2,39.01,8.39,11223777,71209077,206721877,10.0,8.66,buy,1.52,10.77,110.77,10.77,1107.7,107.7,11077.0,1077.0,-11.02,88.98,-11.02,889.8,-110.2,8898.0,-1102.0,19.38,119.38,19.38,1193.8,193.8,11938.0,1938.0,247.56,347.56,247.56,3475.6,2475.6,34756.0,24756.0,816.0,916.0,816.0,9160.0,8160.0,91600.0,81600.0,Micron and Intel Lead Chip Selloff,GuruFocus.com,2026-06-29,0.0,3 AI Infrastructure Stocks Up 500%+ With More Upside in 2H 2026,Zacks,2026-06-29,0.0,"Citi Just Slapped a Massive $2,500 Price Target on SanDisk. Here’s Why They’re So Bullish",24/7 Wall St.,2026-06-29,0.0,9,strong_buy,1.0,"Western Digital is up +212.67% YTD with a P/E of 35.1 and a dividend yield of 10%. It climbed 13% after Micron's earnings, and CEO Irving Tan confirmed strong HDD demand from AI workloads. [247wallst.com](https://247wallst.com/investing/2026/06/25/micron-soars-17-sandisk-jumps-15-western-digital-climbs-13-after-blowout-quarter-locks-in-100b-of-ai-memory-demand/)",+213% YTD; P/E 35.1; 10% dividend yield; AI HDD demand,,,,,
285A,Kioxia Holdings,AI,memory,TSE,88450.0,-3.57%,-18.63%,+34.32%,+679.30%,+3583%,225.548,,91.74,36.27,44715800,211805300,844368400,,,buy,1.62,-3.57,96.43,-3.57,964.3,-35.7,9643.0,-357.0,-18.63,81.37,-18.63,813.7,-186.3,8137.0,-1863.0,34.32,134.32,34.32,1343.2,343.2,13432.0,3432.0,679.3,779.3,679.3,7793.0,6793.0,77930.0,67930.0,3583.0,3683.0,3583.0,36830.0,35830.0,368300.0,358300.0,BlueBay Sees Near-Term Risk in Japan AI Stocks Followed by Rally,Bloomberg,2026-06-28,-0.273,Apple Price Hikes Spark Asia Tech Selloff on Memory Cost Concern,Bloomberg,2026-06-26,0.226,Micron Jumps 267% as It Sees Memory Shortages Beyond 2027,GuruFocus.com,2026-06-25,-0.153,6,strong_buy,1.0,"Japan-listed memory stock 285A has surged +674% YTD and +33.4% in the past month. With news sentiment of 0.233 and a buy rating, it benefits from the same AI memory supply tightness, though its P/E of 87.43 is elevated.",+674% YTD; +33.4% 1M; positive news sentiment; AI memory upcycle,,,,,
MU,Micron Technology,AI,memory,NASDAQ,1145.28,+1.05%,-5.46%,+10.60%,+263.25%,+819%,975.678,2.173,25.87,52.23,59870891,357308791,1161798191,5.0,3.69,strong_buy,1.47,1.05,101.05,1.05,1010.5,10.5,10105.0,105.0,-5.46,94.54,-5.46,945.4,-54.6,9454.0,-546.0,10.6,110.6,10.6,1106.0,106.0,11060.0,1060.0,263.25,363.25,263.25,3632.5,2632.5,36325.0,26325.0,819.0,919.0,819.0,9190.0,8190.0,91900.0,81900.0,Why Samsung & SK Hynix are investing so much in South Korea's AI build-out,Yahoo Finance Video,2026-06-29,0.0,"Nvidia, Micron, and Broadcom hold the stock market's fate in the palm of their hands",Yahoo Finance,2026-06-29,0.0,Inside SOXX: The Few Names Behind The Fund's Big Year,Trefis,2026-06-29,0.0,1,strong_buy,1.0,"Micron's record FQ3 revenue of $41.5B (+346% YoY), $25.11 EPS beat, and $100B in contracted AI memory revenue with $22B in customer deposits justify analyst strong_buy. Its P/E of 25.58 is the cheapest among memory peers despite +819% 1Y return. [fortune.com](https://fortune.com/2026/06/25/why-did-stock-market-tech-selloff-stop-micron-technology/)",record revenue $41.5B; P/E 25.58; $100B contracted revenue; strong_buy consensus,,,,,
STX,Seagate Technology,AI,memory,NASDAQ,968.53,+7.38%,-11.41%,+5.21%,+237.66%,+524%,165.293,2.083,91.98,4.26,5337614,29652414,91112714,33.0,4.27,buy,1.54,7.38,107.38,7.38,1073.8,73.8,10738.0,738.0,-11.41,88.59,-11.41,885.9,-114.1,8859.0,-1141.0,5.21,105.21,5.21,1052.1,52.1,10521.0,521.0,237.66,337.66,237.66,3376.6,2376.6,33766.0,23766.0,524.0,624.0,524.0,6240.0,5240.0,62400.0,52400.0,Micron and Intel Lead Chip Selloff,GuruFocus.com,2026-06-29,0.0,3 AI Infrastructure Stocks Up 500%+ With More Upside in 2H 2026,Zacks,2026-06-29,0.0,"Seagate (STX): Buy, Sell, or Hold Post Q1 Earnings?",StockStory,2026-06-29,0.0,,,,,,,,,,
MRVL,Marvell Technology,AI,memory,NASDAQ,277.75,+4.62%,-9.78%,+26.58%,+211.10%,+245%,183.279,2.277,95.45,42.81,31025441,194182041,1433971441,9.0,5.26,strong_buy,1.45,4.62,104.62,4.62,1046.2,46.2,10462.0,462.0,-9.78,90.22,-9.78,902.2,-97.8,9022.0,-978.0,26.58,126.58,26.58,1265.8,265.8,12658.0,2658.0,211.1,311.1,211.1,3111.0,2111.0,31110.0,21110.0,245.0,345.0,245.0,3450.0,2450.0,34500.0,24500.0,Micron and Intel Lead Chip Selloff,GuruFocus.com,2026-06-29,0.0,What Was AMD Stock Really Saying Before Its AI Breakout?,Trefis,2026-06-29,0.0,Wall Street Just Supersized Its Price Target on Intel. Is the Stock Still Too Cheap?,24/7 Wall St.,2026-06-29,0.0,2,strong_buy,0.994,"Marvell has surged +34.3% over the past month and boasts a strong_buy analyst consensus (score 1.45) with a positive news sentiment of 0.368, benefiting from AI connectivity demand as part of the new 'MANIA' trade replacing the Magnificent 7.",+34% 1M momentum; strong_buy consensus (1.45); positive news sentiment; AI connectivity tailwind,,,,,
P,Everpure,AI,memory,NYSE,72.32,+4.06%,-6.13%,-14.36%,+4.80%,+20%,18.133,1.445,109.58,3.37,1683598,14736698,68991798,,3.95,buy,1.9,4.06,104.06,4.06,1040.6,40.6,10406.0,406.0,-6.13,93.87,-6.13,938.7,-61.3,9387.0,-613.0,-14.36,85.64,-14.36,856.4,-143.6,8564.0,-1436.0,4.8,104.8,4.8,1048.0,48.0,10480.0,480.0,20.0,120.0,20.0,1200.0,200.0,12000.0,2000.0,3 Cash-Producing Stocks to Own for Decades,StockStory,2026-06-29,0.0,"Quantum's Q4 Adjusted Loss Narrows Y/Y, Revenues Match Estimates",Zacks,2026-06-26,-0.318,KEEL vs. P: Which AI Infrastructure Stock Provides an Upside?,Zacks,2026-06-26,0.0,,,,,,,,,,
RR.,Rolls-Royce Holdings,AI,nuclear-ops,LSE,1415.2,+0.64%,+0.24%,+5.82%,+18.23%,+45%,1.173,1.22,20.51,34.52,17664785,185530579,710423396,68.0,,buy,1.6,0.64,100.64,0.64,1006.4,6.4,10064.0,64.0,0.24,100.24,0.24,1002.4,2.4,10024.0,24.0,5.82,105.82,5.82,1058.2,58.2,10582.0,582.0,18.23,118.23,18.23,1182.3,182.3,11823.0,1823.0,45.0,145.0,45.0,1450.0,450.0,14500.0,4500.0,AirAsia Shares Drop 30% as Carrier Seeks Payment Deferrals,GuruFocus.com,2026-06-24,0.026,Is Heico (HEI) Stock Outpacing Its Aerospace Peers This Year?,Zacks,2026-06-24,0.0,The hidden reality behind Britain’s homegrown nuclear age,The Telegraph,2026-06-21,0.0,,,,,,,,,,
CEG,Constellation Energy,AI,nuclear-ops,NASDAQ,259.32,-1.59%,-5.88%,-2.40%,-28.99%,-18%,69.852,1.091,22.53,3.55,2973378,16495678,88205378,65.0,3.56,buy,1.52,-1.59,98.41,-1.59,984.1,-15.9,9841.0,-159.0,-5.88,94.12,-5.88,941.2,-58.8,9412.0,-588.0,-2.4,97.6,-2.4,976.0,-24.0,9760.0,-240.0,-28.99,71.01,-28.99,710.1,-289.9,7101.0,-2899.0,-18.0,82.0,-18.0,820.0,-180.0,8200.0,-1800.0,V&E Appoints Michael Jay as New IP Litigation Partner in LA,CorpGov.com,2026-06-29,-0.202,Walmart (WMT) Secures Long Term Nuclear Power Deal With Constellation Energy,Simply Wall St.,2026-06-29,0.527,Will Constellation's Long-Term Nuclear PPAs Drive Sustainable Growth?,Zacks,2026-06-29,0.382,,,,,,,,,,
VST,Vistra Corp,AI,nuclear-ops,NYSE,162.38,-0.69%,-2.92%,+5.07%,-1.45%,-16%,41.3,1.405,27.15,4.66,2800978,19495878,88009778,56.0,5.27,strong_buy,1.4,-0.69,99.31,-0.69,993.1,-6.9,9931.0,-69.0,-2.92,97.08,-2.92,970.8,-29.2,9708.0,-292.0,5.07,105.07,5.07,1050.7,50.7,10507.0,507.0,-1.45,98.55,-1.45,985.5,-14.5,9855.0,-145.0,-16.0,84.0,-16.0,840.0,-160.0,8400.0,-1600.0,Vistra (VST) Buys Cogentrix For $4 Billion And Locks In Meta And AWS Deals,Simply Wall St.,2026-06-29,0.0,Vistra or Public Service Enterprise: Which Utility Stock Stands Out?,Zacks,2026-06-29,0.0,"Nancy Pelosi Has Added These 9 Stocks To Her Portfolio Since 2025, Including Three Magnificent Seven Names",Benzinga,2026-06-28,0.599,,,,,,,,,,
TLN,Talen Energy,AI,nuclear-ops,NASDAQ,399.34,-1.88%,-8.85%,+5.87%,+0.66%,+39%,14.397,1.604,,0.79,694488,5851688,19400288,,5.56,buy,1.59,-1.88,98.12,-1.88,981.2,-18.8,9812.0,-188.0,-8.85,91.15,-8.85,911.5,-88.5,9115.0,-885.0,5.87,105.87,5.87,1058.7,58.7,10587.0,587.0,0.66,100.66,0.66,1006.6,6.6,10066.0,66.0,39.0,139.0,39.0,1390.0,390.0,13900.0,3900.0,"Talen Energy, Stock Of The Day, Delivers For Amazon, AI Data Centers",Investor's Business Daily,2026-06-29,0.421,Talen Energy (TLN) Is Down 7.4% After Russell Index Additions And $984M Shelf Filing - What's Changed,Simply Wall St.,2026-06-29,0.273,Talen Energy (TLN) Downgraded at Jefferies. Here is Why,Insider Monkey,2026-06-28,0.273,10,buy,0.5,"Talen Energy has +1.86% YTD, +6.4% 1M momentum, and a positive news sentiment of 0.319. With a buy rating and a beta of 1.6, it offers nuclear-powered AI infrastructure exposure at a more reasonable valuation than peers.",+6.4% 1M; positive news sentiment; nuclear AI play; buy consensus,,,,,
BEP,Brookfield Renewable,AI,nuclear-ops,NYSE,34.9,-2.95%,-2.35%,+0.00%,+27.83%,+38%,16.935,0.989,,0.89,363181,3507381,16292281,445.0,0.59,buy,2.31,-2.95,97.05,-2.95,970.5,-29.5,9705.0,-295.0,-2.35,97.65,-2.35,976.5,-23.5,9765.0,-235.0,0.0,100.0,0.0,1000.0,0.0,10000.0,0.0,27.83,127.83,27.83,1278.3,278.3,12783.0,2783.0,38.0,138.0,38.0,1380.0,380.0,13800.0,3800.0,Solar Beats Coal for the First Time: 3 Dividend Stocks to Buy Now,Motley Fool,2026-06-27,0.0,The U.S. Government is Supercharging the Nuclear Energy Resurgence With $17.5 Billion in Loans. Here's What it Means for Utility Stocks.,Motley Fool,2026-06-24,0.273,Is Cameco Set to Benefit From DOE-Backed Nuclear Expansion?,Zacks,2026-06-24,0.459,,,,,,,,,,
BEPC,Brookfield Renewable Corp,AI,nuclear-ops,NYSE,37.23,-1.25%,-1.87%,+0.00%,-4.89%,+15%,5.122,1.15,,1.53,1061861,7864061,31251361,416.0,,none,,-1.25,98.75,-1.25,987.5,-12.5,9875.0,-125.0,-1.87,98.13,-1.87,981.3,-18.7,9813.0,-187.0,0.0,100.0,0.0,1000.0,0.0,10000.0,0.0,-4.89,95.11,-4.89,951.1,-48.9,9511.0,-489.0,15.0,115.0,15.0,1150.0,150.0,11500.0,1500.0,Here's Why Buying Brookfield Renewable Today Could Be the Best Financial Decision You Ever Make,Motley Fool,2026-06-27,0.637,This is My Favorite Nuclear Energy Stock to Capitalize on the AI Power Boom,Motley Fool,2026-06-20,0.625,Brookfield Is Launching Another Renewable Energy Company. Here's What Investors Need to Know.,Motley Fool,2026-06-18,0.273,,,,,,,,,,
GEV,GE Vernova,AI,smr,NYSE,1102.51,+5.36%,-2.22%,+16.05%,+62.54%,+98%,223.477,1.045,32.26,2.71,2610310,15876810,64600610,19.0,3.93,buy,1.58,5.36,105.36,5.36,1053.6,53.6,10536.0,536.0,-2.22,97.78,-2.22,977.8,-22.2,9778.0,-222.0,16.05,116.05,16.05,1160.5,160.5,11605.0,1605.0,62.54,162.54,62.54,1625.4,625.4,16254.0,6254.0,98.0,198.0,98.0,1980.0,980.0,19800.0,9800.0,These 2 Industrial Giants Have Crushed Tesla's Returns Over the Last 12 Months. Will The Party Continue?,Motley Fool,2026-06-29,-0.026,SpaceX Has Real Value—But These 3 Stocks Have Better Odds Right Now,MarketBeat,2026-06-28,0.44,Nuclear Stocks And Small Modular Reactors Ace Big Wins. A DOE Deadline Looms.,Investor's Business Daily,2026-06-26,0.477,,,,,,,,,,
BWXT,BWX Technologies,AI,smr,NYSE,189.25,-4.42%,-9.88%,+0.46%,+4.35%,+37%,13.078,0.734,50.6,1.03,1037287,6684787,22704087,53.0,4.05,buy,1.8,-4.42,95.58,-4.42,955.8,-44.2,9558.0,-442.0,-9.88,90.12,-9.88,901.2,-98.8,9012.0,-988.0,0.46,100.46,0.46,1004.6,4.6,10046.0,46.0,4.35,104.35,4.35,1043.5,43.5,10435.0,435.0,37.0,137.0,37.0,1370.0,370.0,13700.0,3700.0,Innovative Solutions and Support (ISSC) Moves 5.3% Higher: Will This Strength Last?,Zacks,2026-06-29,0.876,SMR or BWXT: Why One Nuclear Stock Looks More Attractive,Zacks,2026-06-26,0.493,"Micron’s Blowout Sparked a Chip Rally, but the Smart Money Is Already Rotating Into Defense and Space",24/7 Wall St.,2026-06-25,0.649,,,,,,,,,,
SMR,NuScale Power,AI,smr,NYSE,10.26,+1.38%,-8.72%,-20.40%,-37.09%,-74%*,2.679,2.219,,35.73,19308401,153327301,768978901,,22.83,hold,2.53,1.38,101.38,1.38,1013.8,13.8,10138.0,138.0,-8.72,91.28,-8.72,912.8,-87.2,9128.0,-872.0,-20.4,79.6,-20.4,796.0,-204.0,7960.0,-2040.0,-37.09,62.91,-37.09,629.1,-370.9,6291.0,-3709.0,-74.0,26.0,-74.0,260.0,-740.0,2600.0,-7400.0,NuScale Power (SMR) Secures Paragon Contract As SMR Rollout Gets More Real,Simply Wall St.,2026-06-27,0.318,Nuclear Stocks And Small Modular Reactors Ace Big Wins. A DOE Deadline Looms.,Investor's Business Daily,2026-06-26,0.477,Where Will NuScale Power Stock Be in 100 Years?,Motley Fool,2026-06-26,0.0,,,,,,,,,,
OKLO,Oklo Inc,AI,smr,NYSE,52.76,+4.95%,-9.66%,-21.12%,-32.19%,-11%*,6.924,1.113,,13.77,9034113,60367413,257414513,,17.91,buy,2.0,4.95,104.95,4.95,1049.5,49.5,10495.0,495.0,-9.66,90.34,-9.66,903.4,-96.6,9034.0,-966.0,-21.12,78.88,-21.12,788.8,-211.2,7888.0,-2112.0,-32.19,67.81,-32.19,678.1,-321.9,6781.0,-3219.0,-11.0,89.0,-11.0,890.0,-110.0,8900.0,-1100.0,OKLO or NNE: Which Nuclear Name Deserves Your Attention?,Zacks,2026-06-29,0.0,Nuclear Stocks And Small Modular Reactors Ace Big Wins. A DOE Deadline Looms.,Investor's Business Daily,2026-06-26,0.477,Should You Forget NuScale Power and Buy Oklo Stock Instead?,Motley Fool,2026-06-26,-0.226,,,,,,,,,,
NNE,NANO Nuclear Energy,AI,smr,NASDAQ,21.32,+6.18%,-16.85%,-28.22%,-22.78%,-42%*,0.838,5.044,,2.73,2693268,16308468,70002668,,27.74,strong_buy,1.4,6.18,106.18,6.18,1061.8,61.8,10618.0,618.0,-16.85,83.15,-16.85,831.5,-168.5,8315.0,-1685.0,-28.22,71.78,-28.22,717.8,-282.2,7178.0,-2822.0,-22.78,77.22,-22.78,772.2,-227.8,7722.0,-2278.0,-42.0,58.0,-42.0,580.0,-420.0,5800.0,-4200.0,Nano Nuclear Shares Jump on Report of Potential UAE Investment Talks (NNE),InvestorsHub,2026-06-29,0.296,"Got $1,000 to Invest? This Stock Could Turn It Into $100,000 in 10 Years.",Motley Fool,2026-06-27,0.0,Nuclear Stocks And Small Modular Reactors Ace Big Wins. A DOE Deadline Looms.,Investor's Business Daily,2026-06-26,0.477,,,,,,,,,,
CCJ,Cameco Corporation,AI,uranium,NYSE,103.47,-0.88%,-3.36%,-8.10%,+4.98%,+41%,33.993,0.983,99.49,3.15,1894484,14009384,66532984,17.0,,buy,1.79,-0.88,99.12,-0.88,991.2,-8.8,9912.0,-88.0,-3.36,96.64,-3.36,966.4,-33.6,9664.0,-336.0,-8.1,91.9,-8.1,919.0,-81.0,9190.0,-810.0,4.98,104.98,4.98,1049.8,49.8,10498.0,498.0,41.0,141.0,41.0,1410.0,410.0,14100.0,4100.0,Cameco's Adjusted EBITDA Up 44% in Q126: More Upside Ahead?,Zacks,2026-06-29,0.0,What Cameco (TSX:CCO)'s AP1000-Linked US$17.5 Billion Loan Tailwind Means For Shareholders,Simply Wall St.,2026-06-27,0.0,Can Canada become a nuclear powerhouse? FP Video Explains,Financial Post,2026-06-27,0.0,,,,,,,,,,
UEC,Uranium Energy Corp,AI,uranium,NYSE,10.83,+1.59%,-5.58%,-20.31%,-17.39%,+59%,4.043,1.145,,10.24,6743757,53753257,270968657,,14.08,strong_buy,1.44,1.59,101.59,1.59,1015.9,15.9,10159.0,159.0,-5.58,94.42,-5.58,944.2,-55.8,9442.0,-558.0,-20.31,79.69,-20.31,796.9,-203.1,7969.0,-2031.0,-17.39,82.61,-17.39,826.1,-173.9,8261.0,-1739.0,59.0,159.0,59.0,1590.0,590.0,15900.0,5900.0,Brokers Suggest Investing in Uranium Energy (UEC): Read This Before Placing a Bet,Zacks,2026-06-19,0.273,Cameco vs. Centrus Energy: Which Uranium Stock is the Better Buy Now?,Zacks,2026-06-18,0.612,Optimism Surrounds Uranium Energy (UEC) Following an Impressive Quarter,Insider Monkey,2026-06-17,0.836,,,,,,,,,,
LEU,Centrus Energy,AI,uranium,NYSE,160.25,-2.88%,-12.76%,-15.21%,-41.19%,-10%,2.378,1.339,58.27,0.91,651764,4176964,19371864,,22.45,buy,1.75,-2.88,97.12,-2.88,971.2,-28.8,9712.0,-288.0,-12.76,87.24,-12.76,872.4,-127.6,8724.0,-1276.0,-15.21,84.79,-15.21,847.9,-152.1,8479.0,-1521.0,-41.19,58.81,-41.19,588.1,-411.9,5881.0,-4119.0,-10.0,90.0,-10.0,900.0,-100.0,9000.0,-1000.0,Cameco's Adjusted EBITDA Up 44% in Q126: More Upside Ahead?,Zacks,2026-06-29,0.0,3 Reasons to Avoid LEU and 1 Stock to Buy Instead,StockStory,2026-06-29,-0.296,1 Profitable Stock Worth Your Attention and 2 We Ignore,StockStory,2026-06-26,0.318,,,,,,,,,,
VRT,Vertiv Holdings,AI,power-infra,NYSE,306.97,+0.99%,-14.24%,-5.06%,+74.88%,+137%,88.941,2.037,77.13,6.13,6507003,51170303,143578703,8.0,3.91,strong_buy,1.46,0.99,100.99,0.99,1009.9,9.9,10099.0,99.0,-14.24,85.76,-14.24,857.6,-142.4,8576.0,-1424.0,-5.06,94.94,-5.06,949.4,-50.6,9494.0,-506.0,74.88,174.88,74.88,1748.8,748.8,17488.0,7488.0,137.0,237.0,137.0,2370.0,1370.0,23700.0,13700.0,V&E Appoints Michael Jay as New IP Litigation Partner in LA,CorpGov.com,2026-06-29,-0.202,Vertiv (VRT) Expands AI Cooling Reach With ThermoKey And Strategic Thermal Labs,Simply Wall St.,2026-06-27,0.128,Data Center Delays Create Opportunity in These 3 Stocks,MarketBeat,2026-06-26,0.599,,,,,,,,,,
ETN,Eaton Corporation,AI,power-infra,NYSE,408.26,+0.13%,-6.32%,+2.04%,+25.47%,+13%,119.579,1.192,39.91,2.59,1643141,13667841,50122941,109.0,2.43,buy,1.63,0.13,100.13,0.13,1001.3,1.3,10013.0,13.0,-6.32,93.68,-6.32,936.8,-63.2,9368.0,-632.0,2.04,102.04,2.04,1020.4,20.4,10204.0,204.0,25.47,125.47,25.47,1254.7,254.7,12547.0,2547.0,13.0,113.0,13.0,1130.0,130.0,11300.0,1300.0,Eaton (ETN) Dips More Than Broader Market: What You Should Know,Zacks,2026-06-26,0.0,Beyond Cloud & Memory: Infrastructure ETFs to Buy Amid AI Data Center Boom,Zacks,2026-06-26,0.0,Data Center Delays Create Opportunity in These 3 Stocks,MarketBeat,2026-06-26,0.599,,,,,,,,,,
POWL,Powell Industries,AI,power-infra,NASDAQ,281.09,-0.99%,-8.68%,-2.44%,+139.41%,+299%,7.725,1.128,54.79,0.71,730793,6477193,15890193,13.0,10.95,buy,2.25,-0.99,99.01,-0.99,990.1,-9.9,9901.0,-99.0,-8.68,91.32,-8.68,913.2,-86.8,9132.0,-868.0,-2.44,97.56,-2.44,975.6,-24.4,9756.0,-244.0,139.41,239.41,139.41,2394.1,1394.1,23941.0,13941.0,299.0,399.0,299.0,3990.0,2990.0,39900.0,29900.0,Here's Why You Should Retain Powell Industries in Your Portfolio,Zacks,2026-06-29,0.0,Wall Street Analysts Think Powell Industries (POWL) Is a Good Investment: Is It?,Zacks,2026-06-29,0.44,Why Powell (POWL) Stock Is Trading Up Today,StockStory,2026-06-25,0.0,,,,,,,,,,
EQIX,Equinix,AI,dc-operators,NASDAQ,1085.17,-2.19%,-2.76%,+3.27%,+43.50%,+37%,80.729,0.97,74.79,0.57,446978,3615978,12243078,181.0,2.2,buy,1.58,-2.19,97.81,-2.19,978.1,-21.9,9781.0,-219.0,-2.76,97.24,-2.76,972.4,-27.6,9724.0,-276.0,3.27,103.27,3.27,1032.7,32.7,10327.0,327.0,43.5,143.5,43.5,1435.0,435.0,14350.0,4350.0,37.0,137.0,37.0,1370.0,370.0,13700.0,3700.0,Multiple Factors Lifted Equinix (EQIX) in Q1,Insider Monkey,2026-06-29,0.0,Here’s Why Cisco (CSCO) is Among the 15 Best AI Stocks That Will Make You Rich in 10 Years,Insider Monkey,2026-06-27,0.832,AI Data Center Boom Could Drive Fuel Cell Market to $30 Billion by 2030,Oilprice.com,2026-06-25,0.0,,,,,,,,,,
DLR,Digital Realty,AI,dc-operators,NYSE,190.58,-1.56%,-2.54%,+3.70%,+24.59%,+11%,51.422,1.046,50.69,2.3,1508514,14743414,54825214,253.0,0.01,buy,1.72,-1.56,98.44,-1.56,984.4,-15.6,9844.0,-156.0,-2.54,97.46,-2.54,974.6,-25.4,9746.0,-254.0,3.7,103.7,3.7,1037.0,37.0,10370.0,370.0,24.59,124.59,24.59,1245.9,245.9,12459.0,2459.0,11.0,111.0,11.0,1110.0,110.0,11100.0,1100.0,Digital Realty Trust Reports $2.35 Billion Common Stock Offering by Blackstone,MT Newswires,2026-06-29,0.511,Nebius vs. Digital Realty: Which AI Infrastructure Stock is the Better Buy?,Zacks,2026-06-26,0.44,Digital Realty Bets on AI Growth With Major Expansion Moves,Zacks,2026-06-23,0.382,,,,,,,,,,
AMT,American Tower,AI,dc-operators,NYSE,168.67,-3.66%,-4.40%,-9.20%,-1.61%,-21%,59.275,0.891,27.2,3.19,3598259,22385359,70242159,398.0,2.21,buy,1.64,-3.66,96.34,-3.66,963.4,-36.6,9634.0,-366.0,-4.4,95.6,-4.4,956.0,-44.0,9560.0,-440.0,-9.2,90.8,-9.2,908.0,-92.0,9080.0,-920.0,-1.61,98.39,-1.61,983.9,-16.1,9839.0,-161.0,-21.0,79.0,-21.0,790.0,-210.0,7900.0,-2100.0,American Tower (AMT) Moves 4.1% Higher: Will This Strength Last?,Zacks,2026-06-29,0.579,"American Tower Set to Outpace Competitors' Revenue Growth, RBC Says",MT Newswires,2026-06-26,0.382,American Tower seen as top U.S. tower pick as analysts turn more bullish,Investing.com,2026-06-26,0.202,,,,,,,,,,
GOOGL,Alphabet (Google),AI,hyperscalers,NASDAQ,353.65,+4.59%,+1.14%,-5.98%,+12.36%,+91%,3255.179,1.237,26.96,31.76,32451932,270590932,811153232,26.0,1.53,strong_buy,1.44,4.59,104.59,4.59,1045.9,45.9,10459.0,459.0,1.14,101.14,1.14,1011.4,11.4,10114.0,114.0,-5.98,94.02,-5.98,940.2,-59.8,9402.0,-598.0,12.36,112.36,12.36,1123.6,123.6,11236.0,1236.0,91.0,191.0,91.0,1910.0,910.0,19100.0,9100.0,"Stock market today: Dow closes above 52,000 for first time, S&P 500 and Nasdaq rally as tech gains",Yahoo Finance,2026-06-28,0.34,"Tech giants are not going to slash their AI spending plans, bullish tech analyst says",Yahoo Finance,2026-06-29,0.206,'Magnificent 7' stocks are having a dreadful year,Yahoo Finance,2026-06-29,0.25,,,,,,,,,,
MSFT,Microsoft,AI,hyperscalers,NASDAQ,368.57,-1.13%,+0.33%,-19.97%,-21.72%,-25%,2065.224,1.103,21.96,39.15,50623520,388072220,972172820,98.0,1.28,strong_buy,1.34,-1.13,98.87,-1.13,988.7,-11.3,9887.0,-113.0,0.33,100.33,0.33,1003.3,3.3,10033.0,33.0,-19.97,80.03,-19.97,800.3,-199.7,8003.0,-1997.0,-21.72,78.28,-21.72,782.8,-217.2,7828.0,-2172.0,-25.0,75.0,-25.0,750.0,-250.0,7500.0,-2500.0,"Tech giants are not going to slash their AI spending plans, bullish tech analyst says",Yahoo Finance,2026-06-29,0.206,Microsoft stock is headed for its worst month since 2000,Yahoo Finance,2026-06-29,-0.625,"Nvidia, Micron, and Broadcom hold the stock market's fate in the palm of their hands",Yahoo Finance,2026-06-29,0.0,,,,,,,,,,
AMZN,Amazon,AI,hyperscalers,NASDAQ,240.14,+3.51%,+3.16%,-8.08%,+6.02%,+6%,1948.543,1.444,32.67,49.9,74685016,531425616,1244582616,,1.01,strong_buy,1.34,3.51,103.51,3.51,1035.1,35.1,10351.0,351.0,3.16,103.16,3.16,1031.6,31.6,10316.0,316.0,-8.08,91.92,-8.08,919.2,-80.8,9192.0,-808.0,6.02,106.02,6.02,1060.2,60.2,10602.0,602.0,6.0,106.0,6.0,1060.0,60.0,10600.0,600.0,Retail 'FOMO' drives record SpaceX Options volume following blockbuster IPO,Yahoo Finance Video,2026-06-29,0.599,The next investing opportunity may be outside Big Tech,Yahoo Finance Video,2026-06-29,0.421,'Magnificent 7' stocks are having a dreadful year,Yahoo Finance,2026-06-29,0.25,,,,,,,,,,
META,Meta Platforms,AI,hyperscalers,NASDAQ,562.6,+2.06%,-0.22%,-6.22%,-13.35%,-25%,1077.243,1.229,20.45,17.09,14265970,77146670,378332670,38.0,1.37,strong_buy,1.31,2.06,102.06,2.06,1020.6,20.6,10206.0,206.0,-0.22,99.78,-0.22,997.8,-2.2,9978.0,-22.0,-6.22,93.78,-6.22,937.8,-62.2,9378.0,-622.0,-13.35,86.65,-13.35,866.5,-133.5,8665.0,-1335.0,-25.0,75.0,-25.0,750.0,-250.0,7500.0,-2500.0,Retail 'FOMO' drives record SpaceX Options volume following blockbuster IPO,Yahoo Finance Video,2026-06-29,0.599,'Magnificent 7' stocks are having a dreadful year,Yahoo Finance,2026-06-29,0.25,Amazon Stock Climbs During Strong Day For Magnificent Seven,Investor's Business Daily,2026-06-29,0.836,,,,,,,,,,
IREN,Iris Energy,AI,ai-compute,NASDAQ,45.91,-2.28%,-19.27%,-29.73%,+7.52%,+224%*,12.376,4.232,59.62,45.06,34060783,192246183,880141783,,18.63,buy,1.75,-2.28,97.72,-2.28,977.2,-22.8,9772.0,-228.0,-19.27,80.73,-19.27,807.3,-192.7,8073.0,-1927.0,-29.73,70.27,-29.73,702.7,-297.3,7027.0,-2973.0,7.52,107.52,7.52,1075.2,75.2,10752.0,752.0,224.0,324.0,224.0,3240.0,2240.0,32400.0,22400.0,Another crypto firm joins Russell 1000,TheStreet,2026-06-29,0.0,IREN Shares Gain After Joining the Russell 1000 Index (IREN),InvestorsHub,2026-06-29,0.681,3 Artificial Intelligence Stocks You Can Buy and Hold for the Next Decade,Motley Fool,2026-06-28,0.477,,,,,,,,,,
CORZ,Core Scientific,AI,ai-compute,NASDAQ,25.94,-4.39%,-10.80%,-9.14%,+62.23%,+59%*,6.22,5.484,,14.13,10277442,62225842,246970242,,26.61,strong_buy,1.39,-4.39,95.61,-4.39,956.1,-43.9,9561.0,-439.0,-10.8,89.2,-10.8,892.0,-108.0,8920.0,-1080.0,-9.14,90.86,-9.14,908.6,-91.4,9086.0,-914.0,62.23,162.23,62.23,1622.3,622.3,16223.0,6223.0,59.0,159.0,59.0,1590.0,590.0,15900.0,5900.0,Leopold Aschenbrenner’s Situational Awareness Top AI Pick-And-Shovel Stock Pick in 2026,Insider Monkey,2026-06-25,0.202,Leopold Aschenbrenner’s Situational Awareness Likes This Crypto Stock Despite Bitcoin Declines,Insider Monkey,2026-06-25,0.421,These 3 Bitcoin Miner Stocks Are Riding the AI Data Center Boom,MarketBeat,2026-06-22,0.0,,,,,,,,,,
