ticker,company_name,sector,category,exchange,price_usd,change_1d,change_1w,change_1m,change_ytd,return_1yr,market_cap_gbp_b,beta,pe_ratio,avg_volume_m,vol_1d,vol_1w,vol_1m,div_yield_pct,short_pct,analyst,analyst_score,pct_1d,val_100_1d,profit_100_1d,val_1000_1d,profit_1000_1d,val_10000_1d,profit_10000_1d,pct_1w,val_100_1w,profit_100_1w,val_1000_1w,profit_1000_1w,val_10000_1w,profit_10000_1w,pct_1m,val_100_1m,profit_100_1m,val_1000_1m,profit_1000_1m,val_10000_1m,profit_10000_1m,pct_ytd,val_100_ytd,profit_100_ytd,val_1000_ytd,profit_1000_ytd,val_10000_ytd,profit_10000_ytd,pct_1y,val_100_1y,profit_100_1y,val_1000_1y,profit_1000_1y,val_10000_1y,profit_10000_1y,news1_title,news1_publisher,news1_date,news1_sentiment,news2_title,news2_publisher,news2_date,news2_sentiment,news3_title,news3_publisher,news3_date,news3_sentiment,signal_rank,signal,signal_confidence,signal_rationale,signal_drivers,portfolio_held,portfolio_quantity,portfolio_avg_price,portfolio_ppl,portfolio_total_value
EXEL,Exelixis,Biotech,oncology,NASDAQ,51.91,-0.94%,-2.97%,+6.66%,+19.11%,+29%,9.857,0.435,17.19,2.61,6545200,13847700,54856000,,16.07,buy,2.16,-0.94,99.06,-0.94,990.6,-9.4,9906.0,-94.0,-2.97,97.03,-2.97,970.3,-29.7,9703.0,-297.0,6.66,106.66,6.66,1066.6,66.6,10666.0,666.0,19.11,119.11,19.11,1191.1,191.1,11911.0,1911.0,29.0,129.0,29.0,1290.0,290.0,12900.0,2900.0,Exelixis CABINET Win Extends CABOMETYX Reach And Raises Valuation Questions,Simply Wall St.,2026-06-13,0.66,Halozyme Therapeutics (HALO) Up 0.8% Since Last Earnings Report: Can It Continue?,Zacks,2026-06-10,0.0,"Exelixis Hits High on Growing Sales, Institutional Inflows",FX Empire,2026-06-10,0.178,7,buy,0.64,"YTD +19.1%, 1M +6.7%, P/E 17.2 — CABINET trial win extends CABOMETYX label. Analyst consensus buy (score 2.16) with positive news sentiment 0.252. Profitable oncology compounder with manageable valuation.",YTD +19.1% return; P/E 17.2 profitable; CABINET label expansion; analyst consensus buy,,,,,
ALNY,Alnylam Pharmaceuticals,Biotech,oncology,NASDAQ,278.09,-1.16%,-3.90%,-5.51%,-30.51%,-10%,28.049,0.267,70.05,1.13,2204500,7278500,24960100,,5.29,buy,1.79,-1.16,98.84,-1.16,988.4,-11.6,9884.0,-116.0,-3.9,96.1,-3.9,961.0,-39.0,9610.0,-390.0,-5.51,94.49,-5.51,944.9,-55.1,9449.0,-551.0,-30.51,69.49,-30.51,694.9,-305.1,6949.0,-3051.0,-10.0,90.0,-10.0,900.0,-100.0,9000.0,-1000.0,Alnylam Taps Generative AI And Nordic Expansion As Market Lags Targets,Simply Wall St.,2026-06-14,-0.361,Can Alnylam Rely on Amvuttra to Sustain Its Rapid Sales Momentum?,Zacks,2026-06-12,0.0,"Alnylam Pharmaceuticals Unveils 2030 Targets, Betting on AMVUTTRA and Pipeline Readouts",MarketBeat,2026-06-09,0.0,,,,,,,,,,
RCUS,Arcus Biosciences,Biotech,oncology,NYSE,24.31,-1.26%,+4.33%,+6.86%,+4.38%,+182%*,2.31,0.837,,1.19,2309000,6590500,24589900,,15.32,strong_buy,1.46,-1.26,98.74,-1.26,987.4,-12.6,9874.0,-126.0,4.33,104.33,4.33,1043.3,43.3,10433.0,433.0,6.86,106.86,6.86,1068.6,68.6,10686.0,686.0,4.38,104.38,4.38,1043.8,43.8,10438.0,438.0,182.0,282.0,182.0,2820.0,1820.0,28200.0,18200.0,Bristol Myers Squibb’s AI Overhaul And Oncology Trials Shape Value Story,Simply Wall St.,2026-06-12,0.34,"Arcus, Bristol Myers Team Up to Advance Kidney Cancer Study",Zacks,2026-06-04,-0.66,How Eisai (TSE:4523) Is Reframing Its Story With A Tweaked Fair Value Outlook,Simply Wall St.,2026-05-21,0.572,,,,,,,,,,
MRNA,Moderna,Biotech,mrna,NASDAQ,63.96,+3.04%,+28.85%,+39.90%,+107.26%,+147%,19.172,1.03,,7.01,24078800,60999500,149953300,,17.82,hold,3.09,3.04,103.04,3.04,1030.4,30.4,10304.0,304.0,28.85,128.85,28.85,1288.5,288.5,12885.0,2885.0,39.9,139.9,39.9,1399.0,399.0,13990.0,3990.0,107.26,207.26,107.26,2072.6,1072.6,20726.0,10726.0,147.0,247.0,147.0,2470.0,1470.0,24700.0,14700.0,MRNA Up as Influenza Vaccine Wins Unanimous FDA Advisory Panel Backing,Zacks,2026-06-19,0.586,MRNA Stock Clocks Best Week In Over 4 Years On FDA Advisory Committee Endorsement For Flu Vaccine,Stocktwits,2026-06-18,0.599,🔎 Under the Radar: Moderna Stock Rises on Flu-Shot Recommendation,The Wall Street Journal,2026-06-18,0.0,1,strong_buy,0.82,"YTD +107%, 1M +39.9%, 1W +28.9% — FDA advisory committee voted 9–0 in favor of its flu vaccine mRNA-1010, with a PDUFA date of Aug 5, 2026. Huge near-term binary catalyst and the best weekly gain in over 4 years.",YTD +107% return; 1W +28.9% surge; FDA advisory 9-0 for flu vaccine; PDUFA Aug 5 catalyst,,,,,
BNTX,BioNTech,Biotech,mrna,NASDAQ,90.89,-1.74%,+1.51%,+3.53%,-6.00%,-15%,17.364,1.324,,0.96,939600,4616900,23520300,,3.3,buy,1.55,-1.74,98.26,-1.74,982.6,-17.4,9826.0,-174.0,1.51,101.51,1.51,1015.1,15.1,10151.0,151.0,3.53,103.53,3.53,1035.3,35.3,10353.0,353.0,-6.0,94.0,-6.0,940.0,-60.0,9400.0,-600.0,-15.0,85.0,-15.0,850.0,-150.0,8500.0,-1500.0,"VERAXA Unveils Cancer Therapy Platform, Sparks Partnering Talks at BIO 2026",Exec Edge,2026-06-18,-0.66,PTC Therapeutics (PTCT) Moves 7.2% Higher: Will This Strength Last?,Zacks,2026-06-18,0.579,"US Equity Markets End Lower After Government Bond Yields Rise, Fed's Policy Statement",MT Newswires,2026-06-17,-0.296,,,,,,,,,,
NVAX,Novavax,Biotech,mrna,NASDAQ,9.13,-4.80%,+1.11%,+2.58%,+28.05%,+42%*,1.134,2.414,,4.67,9458300,23693000,112754100,,28.13,buy,2.33,-4.8,95.2,-4.8,952.0,-48.0,9520.0,-480.0,1.11,101.11,1.11,1011.1,11.1,10111.0,111.0,2.58,102.58,2.58,1025.8,25.8,10258.0,258.0,28.05,128.05,28.05,1280.5,280.5,12805.0,2805.0,42.0,142.0,42.0,1420.0,420.0,14200.0,4200.0,Novavax (NVAX) Stock Falls Amid Market Uptick: What Investors Need to Know,Zacks,2026-06-18,0.0,Moderna Is Up 94% This Year: Is It Outperforming Other Vaccine Stocks Like Pfizer and Novavax?,24/7 Wall St.,2026-06-16,0.361,A Look Back at Therapeutics Stocks’ Q1 Earnings: Novavax (NASDAQ:NVAX) Vs The Rest Of The Pack,StockStory,2026-06-16,0.0,,,,,,,,,,
BMRN,BioMarin Pharmaceutical,Biotech,rare-disease,NASDAQ,54.69,-0.60%,-1.53%,+9.80%,-8.01%,-1%,7.986,0.24,39.35,2.03,3481200,9283900,53099900,,6.02,buy,1.69,-0.6,99.4,-0.6,994.0,-6.0,9940.0,-60.0,-1.53,98.47,-1.53,984.7,-15.3,9847.0,-153.0,9.8,109.8,9.8,1098.0,98.0,10980.0,980.0,-8.01,91.99,-8.01,919.9,-80.1,9199.0,-801.0,-1.0,99.0,-1.0,990.0,-10.0,9900.0,-100.0,2 Profitable Stocks Worth Your Attention and 1 We Find Risky,StockStory,2026-06-11,0.459,Biomarin Pharmaceutical (BMRN): Most Undervalued Stocks to Buy and Hold for 2 Years,Insider Monkey,2026-06-08,0.0,BioMarin’s VOXZOGO Win In Hypochondroplasia Shapes Rare Disease Growth Story,Simply Wall St.,2026-06-05,0.751,,,,,,,,,,
SRPT,Sarepta Therapeutics,Biotech,rare-disease,NASDAQ,17.53,+3.73%,+16.87%,+5.35%,-17.74%,-13%,1.398,0.205,50.09,3.17,5610400,16901100,63615800,,28.53,hold,2.83,3.73,103.73,3.73,1037.3,37.3,10373.0,373.0,16.87,116.87,16.87,1168.7,168.7,11687.0,1687.0,5.35,105.35,5.35,1053.5,53.5,10535.0,535.0,-17.74,82.26,-17.74,822.6,-177.4,8226.0,-1774.0,-13.0,87.0,-13.0,870.0,-130.0,8700.0,-1300.0,"Sarepta's Elevidys Showing Signs of Stabilization as siRNA Pipeline Gains Importance, RBC Says",MT Newswires,2026-06-18,0.599,Is Sarepta (SRPT) Using New Equity Plans To Quietly Redefine Its Post‑Profitability Playbook?,Simply Wall St.,2026-06-08,0.0,All You Need to Know About Sarepta Therapeutics (SRPT) Rating Upgrade to Buy,Zacks,2026-06-08,0.0,10,buy,0.55,"1W +16.9%, 1D +3.7% — Elevidys stabilization signs noted by RBC; siRNA pipeline gaining importance. Positive news sentiment 0.4, high conviction in rare-disease DMD franchise recovery.",1W +16.9% recovery; positive news sentiment 0.4; Elevidys stabilization; siRNA pipeline momentum,,,,,
COAG,Hemab Therapeutics,Biotech,rare-disease,NASDAQ,29.24,+10.55%,+8.54%,+14.94%,-14.00%,-14%,1.032,,,0.37,1548100,2664600,5594400,,,strong_buy,1.0,10.55,110.55,10.55,1105.5,105.5,11055.0,1055.0,8.54,108.54,8.54,1085.4,85.4,10854.0,854.0,14.94,114.94,14.94,1149.4,149.4,11494.0,1494.0,-14.0,86.0,-14.0,860.0,-140.0,8600.0,-1400.0,-14.0,86.0,-14.0,860.0,-140.0,8600.0,-1400.0,"Hemab Therapeutics Details Post-IPO Pipeline Push, Sutacimig Phase III Plans",MarketBeat,2026-06-09,0.0,Hemab Therapeutics IPO Debut Puts COAG And Pipeline Risks In Focus,Simply Wall St.,2026-05-03,-0.273,,,,,6,strong_buy,0.65,"1D +10.6%, 1W +8.5%, 1M +14.9% — Strongest analyst score in universe at 1.0 (strong_buy). Rare-disease biotech advancing sutacimig Phase III plans post-IPO, with meaningful near-term upside potential on pipeline catalysts.",analyst score 1.0 (strong_buy); 1D +10.6% surge; 1M +14.9% gain; post-IPO pipeline push,,,,,
NVO,Novo Nordisk,Biotech,metabolic,NYSE,43.19,-0.94%,-1.75%,-2.46%,-14.54%,-41%,144.474,0.349,10.16,15.59,8996700,51028600,273677800,414.0,0.71,buy,2.36,-0.94,99.06,-0.94,990.6,-9.4,9906.0,-94.0,-1.75,98.25,-1.75,982.5,-17.5,9825.0,-175.0,-2.46,97.54,-2.46,975.4,-24.6,9754.0,-246.0,-14.54,85.46,-14.54,854.6,-145.4,8546.0,-1454.0,-41.0,59.0,-41.0,590.0,-410.0,5900.0,-4100.0,Novo Nordisk Stock Rally as Owner Unveils $69 Million Obesity Research Push,GuruFocus.com,2026-06-19,0.0,Novo Nordisk Rises as Foundation Launches EUR 60 Million Incubator,GuruFocus.com,2026-06-19,0.0,"Novo Nordisk faces limited upside from ZEUS trial as patent cliff looms, Deutsche Bank warns",Proactive,2026-06-19,-0.44,,,,,,,,,,
LLY,Eli Lilly,Biotech,metabolic,NYSE,1098.57,-1.28%,-5.37%,+7.55%,+2.03%,+44%,740.069,0.517,39.0,3.2,4470500,14720100,72178500,,1.1,buy,1.74,-1.28,98.72,-1.28,987.2,-12.8,9872.0,-128.0,-5.37,94.63,-5.37,946.3,-53.7,9463.0,-537.0,7.55,107.55,7.55,1075.5,75.5,10755.0,755.0,2.03,102.03,2.03,1020.3,20.3,10203.0,203.0,44.0,144.0,44.0,1440.0,440.0,14400.0,4400.0,"Prediction: Eli Lilly Will Trade at $1,200 on This Date",24/7 Wall St.,2026-06-19,0.0,"Cathie Wood Makes Bold Tesla Bet, Dumps $77 Million in Roku Shares",GuruFocus.com,2026-06-19,0.273,Cathie Wood Rotates Into Tesla and Snowflake,GuruFocus.com,2026-06-19,0.0,,,,,,,,,,
LEGN,Legend Biotech,Biotech,neuroscience,NASDAQ,27.93,-11.33%,-23.02%,+3.67%,+29.85%,-18%,3.919,0.352,,2.61,13608400,19822300,70159400,,17.1,buy,1.6,-11.33,88.67,-11.33,886.7,-113.3,8867.0,-1133.0,-23.02,76.98,-23.02,769.8,-230.2,7698.0,-2302.0,3.67,103.67,3.67,1036.7,36.7,10367.0,367.0,29.85,129.85,29.85,1298.5,298.5,12985.0,2985.0,-18.0,82.0,-18.0,820.0,-180.0,8200.0,-1800.0,"Exchange-Traded Funds, Equity Futures Higher Pre-Bell Thursday as Interim US-Iran Deal Lifts Risk Sentiment",MT Newswires,2026-06-18,-0.273,Imviva Unveils Leukemia Data at EHA 2026 With 86% Response Rates,Exec Edge,2026-06-11,0.0,Legend Biotech (LEGN) Is Up 26.2% After Early In Vivo CAR-T Success in B-Cell Lymphoma,Simply Wall St.,2026-06-04,0.572,,,,,,,,,,
IONS,Ionis Pharmaceuticals,Biotech,neuroscience,NASDAQ,74.12,-2.20%,+0.41%,+0.38%,-6.97%,+98%,9.254,0.37,,1.83,2984400,10045200,38443600,,13.64,buy,1.62,-2.2,97.8,-2.2,978.0,-22.0,9780.0,-220.0,0.41,100.41,0.41,1004.1,4.1,10041.0,41.0,0.38,100.38,0.38,1003.8,3.8,10038.0,38.0,-6.97,93.03,-6.97,930.3,-69.7,9303.0,-697.0,98.0,198.0,98.0,1980.0,980.0,19800.0,9800.0,"Is lonis Pharmaceuticals, Inc. (IONS) Among the Best Genomics Stocks to Buy According to Analysts?",Insider Monkey,2026-06-16,0.637,Intellia Surges; Can Its Gene-Editing Drug Solve The Chronic Treatment Problem?,Investor's Business Daily,2026-06-15,-0.226,Assessing Ionis Pharmaceuticals (IONS) Valuation After New Olezarsen Data Plans And Bullish Pipeline Updates,Simply Wall St.,2026-06-06,0.0,,,,,,,,,,
BTC,Bitcoin,Crypto,bitcoin,Crypto,63071.092667,+0.37%,-0.68%,-18.67%,-27.94%,-28%,955.091,,,27379.93,31279738052,191659519567,1050239368466,,,,,0.37,100.37,0.37,1003.7,3.7,10037.0,37.0,-0.68,99.32,-0.68,993.2,-6.8,9932.0,-68.0,-18.67,81.33,-18.67,813.3,-186.7,8133.0,-1867.0,-27.94,72.06,-27.94,720.6,-279.4,7206.0,-2794.0,-28.0,72.0,-28.0,720.0,-280.0,7200.0,-2800.0,"Bitcoin and ethereum prices today, Friday, June 19, 2026: Prices keep falling post-Fed decision",Yahoo Personal Finance,2026-06-19,-0.153,Why the 2 biggest billionaires in crypto think bitcoin has bottomed,Yahoo Finance,2026-06-19,0.0,Early Bitcoiner makes a bold prediction,TheStreet,2026-06-19,0.382,,,,,,,,,,
ETH,Ethereum,Crypto,layer1,Crypto,1702.38909,-0.11%,+2.23%,-20.09%,-42.62%,-43%,155.208,,,11646.94,11895492397,81528574398,447107749094,,,,,-0.11,99.89,-0.11,998.9,-1.1,9989.0,-11.0,2.23,102.23,2.23,1022.3,22.3,10223.0,223.0,-20.09,79.91,-20.09,799.1,-200.9,7991.0,-2009.0,-42.62,57.38,-42.62,573.8,-426.2,5738.0,-4262.0,-43.0,57.0,-43.0,570.0,-430.0,5700.0,-4300.0,"Bitcoin and ethereum prices today, Friday, June 19, 2026: Prices keep falling post-Fed decision",Yahoo Personal Finance,2026-06-19,-0.153,Ethereum's New Tech Upgrade Is Coming Soon. Is It Time to Buy ETH?,Motley Fool,2026-06-19,0.0,The Morgan Stanley 0.14% Fee Sets New Floor in Crypto ETF Fee War,99bitcoins,2026-06-19,-0.599,,,,,,,,,,
SOL,Solana,Crypto,layer1,Crypto,68.940408,-0.64%,+3.32%,-19.91%,-44.63%,-45%,30.216,,,2405.41,2467220255,16837875986,88395776625,,,,,-0.64,99.36,-0.64,993.6,-6.4,9936.0,-64.0,3.32,103.32,3.32,1033.2,33.2,10332.0,332.0,-19.91,80.09,-19.91,800.9,-199.1,8009.0,-1991.0,-44.63,55.37,-44.63,553.7,-446.3,5537.0,-4463.0,-45.0,55.0,-45.0,550.0,-450.0,5500.0,-4500.0,Moody's Credit Ratings Are Coming for Tokenized Assets. What This Means For Solana Might Surprise You.,Motley Fool,2026-06-19,0.66,The Morgan Stanley 0.14% Fee Sets New Floor in Crypto ETF Fee War,99bitcoins,2026-06-19,-0.599,The 5 Largest Publicly Traded Solana Treasury Firms,decrypt,2026-06-19,0.202,,,,,,,,,,
BNB,BNB,Crypto,layer1,Crypto,579.9584,+0.23%,-3.97%,-10.75%,-32.81%,-33%,59.053,,,776.53,756506074,5435697151,33342111166,,,,,0.23,100.23,0.23,1002.3,2.3,10023.0,23.0,-3.97,96.03,-3.97,960.3,-39.7,9603.0,-397.0,-10.75,89.25,-10.75,892.5,-107.5,8925.0,-1075.0,-32.81,67.19,-32.81,671.9,-328.1,6719.0,-3281.0,-33.0,67.0,-33.0,670.0,-330.0,6700.0,-3300.0,"Top Cryptocurrencies Drop; Bitcoin Falls Below $63,000",MT Newswires,2026-06-18,-0.077,BNB Chain’s LAB Token Keeps Exploding in a Parabolic Rally: What’s Next?,BeInCrypto,2026-06-18,0.0,"Top Cryptocurrencies Fall; Bitcoin Drops Below $65,000 Level",MT Newswires,2026-06-17,0.202,,,,,,,,,,
ADA,Cardano,Crypto,layer1,Crypto,0.160806,-1.12%,-5.37%,-35.78%,-51.66%,-52%,4.419,,,467.25,358406569,3270722368,14749362239,,,,,-1.12,98.88,-1.12,988.8,-11.2,9888.0,-112.0,-5.37,94.63,-5.37,946.3,-53.7,9463.0,-537.0,-35.78,64.22,-35.78,642.2,-357.8,6422.0,-3578.0,-51.66,48.34,-51.66,483.4,-516.6,4834.0,-5166.0,-52.0,48.0,-52.0,480.0,-520.0,4800.0,-5200.0,Better Crypto Under $1: Cardano vs. Canton,Motley Fool,2026-06-19,0.44,"Top Cryptocurrencies Drop; Bitcoin Falls Below $63,000",MT Newswires,2026-06-18,-0.077,"Hoskinson Has a Plan to Save Cardano, But ADA Holders aren’t Buying It",BeInCrypto,2026-06-18,0.273,,,,,,,,,,
AVAX,Avalanche,Crypto,layer1,Crypto,5.896168,-6.36%,-10.58%,-36.52%,-52.10%,-52%,1.923,,,189.23,236338341,1324575519,6287189760,,,,,-6.36,93.64,-6.36,936.4,-63.6,9364.0,-636.0,-10.58,89.42,-10.58,894.2,-105.8,8942.0,-1058.0,-36.52,63.48,-36.52,634.8,-365.2,6348.0,-3652.0,-52.1,47.9,-52.1,479.0,-521.0,4790.0,-5210.0,-52.0,48.0,-52.0,480.0,-520.0,4800.0,-5200.0,FIFA World Cup Push Lifts Avalanche Adoption: Will AVAX Price Rally?,BeInCrypto,2026-06-15,0.0,Is Avalanche About to Have Its Biggest Year Yet?,Motley Fool,2026-06-15,0.0,,,,,,,,,,,,,,
XRP,XRP,Crypto,payments,Crypto,1.129546,-1.10%,-0.36%,-17.43%,-38.59%,-39%,52.952,,,1852.41,1926379070,12966852762,59408136310,,,,,-1.1,98.9,-1.1,989.0,-11.0,9890.0,-110.0,-0.36,99.64,-0.36,996.4,-3.6,9964.0,-36.0,-17.43,82.57,-17.43,825.7,-174.3,8257.0,-1743.0,-38.59,61.41,-38.59,614.1,-385.9,6141.0,-3859.0,-39.0,61.0,-39.0,610.0,-390.0,6100.0,-3900.0,Whales dump XRP worth millions,TheStreet,2026-06-19,-0.178,Ripple Swell 2026: What XRP Holders Should Expect From Ripple’s Biggest Event Yet,24/7 Wall St.,2026-06-19,0.0,The 5 Largest Publicly Traded Solana Treasury Firms,decrypt,2026-06-19,0.202,,,,,,,,,,
XLM,Stellar,Crypto,payments,Crypto,0.216939,-6.38%,+14.31%,+50.94%,+8.13%,+8%,5.54,,,462.64,734942987,3238472976,18909074141,,,,,-6.38,93.62,-6.38,936.2,-63.8,9362.0,-638.0,14.31,114.31,14.31,1143.1,143.1,11431.0,1431.0,50.94,150.94,50.94,1509.4,509.4,15094.0,5094.0,8.13,108.13,8.13,1081.3,81.3,10813.0,813.0,8.0,108.0,8.0,1080.0,80.0,10800.0,800.0,,,,,,,,,,,,,3,buy,0.75,"+54.25% 1-month, +17.21% 1-week, DTCC tokenization partnership for U.S. equities/ETFs, institutional adoption catalyst.",+54.25% 1-month; +17.21% 1-week; DTCC tokenization; institutional adoption,,,,,
TRX,TRON,Crypto,payments,Crypto,0.322929,+0.90%,+2.45%,-10.13%,+13.57%,+14%,23.136,,,526.49,485147159,3685432905,17716134757,,,,,0.9,100.9,0.9,1009.0,9.0,10090.0,90.0,2.45,102.45,2.45,1024.5,24.5,10245.0,245.0,-10.13,89.87,-10.13,898.7,-101.3,8987.0,-1013.0,13.57,113.57,13.57,1135.7,135.7,11357.0,1357.0,14.0,114.0,14.0,1140.0,140.0,11400.0,1400.0,Tron Shows 3 Bullish Signals While Topping Weekly Loser List,BeInCrypto,2026-06-13,-0.527,,,,,,,,,,,,,,,,,,
SUI,Sui,Crypto,emerging,Crypto,0.709839,-1.54%,-5.45%,-33.77%,-49.39%,-49%,2.161,,,372.68,414342548,2608785983,17177455479,,,,,-1.54,98.46,-1.54,984.6,-15.4,9846.0,-154.0,-5.45,94.55,-5.45,945.5,-54.5,9455.0,-545.0,-33.77,66.23,-33.77,662.3,-337.7,6623.0,-3377.0,-49.39,50.61,-49.39,506.1,-493.9,5061.0,-4939.0,-49.0,51.0,-49.0,510.0,-490.0,5100.0,-4900.0,4 AI Models Reveal SOL Price Predictions for 2026 — One Calls for a Massive Surge,CCN,2026-06-14,0.0,,,,,,,,,,,,,,,,,,
HBAR,Hedera,Crypto,emerging,Crypto,0.080245,+0.17%,+2.72%,-9.99%,-24.43%,-24%,2.635,,,73.12,74959394,511859141,3112478556,,,,,0.17,100.17,0.17,1001.7,1.7,10017.0,17.0,2.72,102.72,2.72,1027.2,27.2,10272.0,272.0,-9.99,90.01,-9.99,900.1,-99.9,9001.0,-999.0,-24.43,75.57,-24.43,755.7,-244.3,7557.0,-2443.0,-24.0,76.0,-24.0,760.0,-240.0,7600.0,-2400.0,,,,,,,,,,,,,,,,,,,,,,
ALGO,Algorand,Crypto,emerging,Crypto,0.094036,-4.99%,+7.70%,-19.66%,-14.65%,-15%,0.634,,,42.87,55386873,300087008,1367319924,,,,,-4.99,95.01,-4.99,950.1,-49.9,9501.0,-499.0,7.7,107.7,7.7,1077.0,77.0,10770.0,770.0,-19.66,80.34,-19.66,803.4,-196.6,8034.0,-1966.0,-14.65,85.35,-14.65,853.5,-146.5,8535.0,-1465.0,-15.0,85.0,-15.0,850.0,-150.0,8500.0,-1500.0,,,,,,,,,,,,,,,,,,,,,,
MINA,Mina,Crypto,emerging,Crypto,0.04221,+0.98%,-0.09%,-26.55%,-44.13%,-44%,0.041,,,4.21,3314734,29491953,317477204,,,,,0.98,100.98,0.98,1009.8,9.8,10098.0,98.0,-0.09,99.91,-0.09,999.1,-0.9,9991.0,-9.0,-26.55,73.45,-26.55,734.5,-265.5,7345.0,-2655.0,-44.13,55.87,-44.13,558.7,-441.3,5587.0,-4413.0,-44.0,56.0,-44.0,560.0,-440.0,5600.0,-4400.0,,,,,,,,,,,,,,,,,,,,,,
POL,Polygon (MATIC),Crypto,infra,Crypto,0.079378,+2.16%,+6.94%,-12.68%,-20.97%,-21%,0.639,,,33.74,48244375,236176265,1326445659,,,,,2.16,102.16,2.16,1021.6,21.6,10216.0,216.0,6.94,106.94,6.94,1069.4,69.4,10694.0,694.0,-12.68,87.32,-12.68,873.2,-126.8,8732.0,-1268.0,-20.97,79.03,-20.97,790.3,-209.7,7903.0,-2097.0,-21.0,79.0,-21.0,790.0,-210.0,7900.0,-2100.0,,,,,,,,,,,,,,,,,,,,,,
DOT,Polkadot,Crypto,infra,Crypto,0.953153,-1.41%,-0.48%,-24.00%,-46.75%,-47%,1.217,,,102.63,101123283,718430712,4314715089,,,,,-1.41,98.59,-1.41,985.9,-14.1,9859.0,-141.0,-0.48,99.52,-0.48,995.2,-4.8,9952.0,-48.0,-24.0,76.0,-24.0,760.0,-240.0,7600.0,-2400.0,-46.75,53.25,-46.75,532.5,-467.5,5325.0,-4675.0,-47.0,53.0,-47.0,530.0,-470.0,5300.0,-4700.0,DOT Is Repeating XRP’s June Sentiment Crash — Except for One Crucial Catch,BeInCrypto,2026-06-19,-0.402,,,,,,,,,,,,,,,,,,
LINK,Chainlink,Crypto,infra,Crypto,7.887951,-1.04%,+0.38%,-18.09%,-35.31%,-35%,4.333,,,212.74,226405925,1489162527,8887757334,,,,,-1.04,98.96,-1.04,989.6,-10.4,9896.0,-104.0,0.38,100.38,0.38,1003.8,3.8,10038.0,38.0,-18.09,81.91,-18.09,819.1,-180.9,8191.0,-1809.0,-35.31,64.69,-35.31,646.9,-353.1,6469.0,-3531.0,-35.0,65.0,-35.0,650.0,-350.0,6500.0,-3500.0,What Crypto Whales Are Buying and Selling Ahead of the June FOMC Meeting,BeInCrypto,2026-06-17,0.0,Chainlink Bets Big on Prediction Markets with New Oracle Strategy,CoinGape,2026-06-15,0.0,Best Altcoins to Buy in 2026,Motley Fool,2026-06-14,0.637,,,,,,,,,,
DOGE,Dogecoin,Crypto,meme,Crypto,0.082928,-0.35%,-5.38%,-20.26%,-29.30%,-29%,10.678,,,786.17,553968845,5503219143,25194072919,,,,,-0.35,99.65,-0.35,996.5,-3.5,9965.0,-35.0,-5.38,94.62,-5.38,946.2,-53.8,9462.0,-538.0,-20.26,79.74,-20.26,797.4,-202.6,7974.0,-2026.0,-29.3,70.7,-29.3,707.0,-293.0,7070.0,-2930.0,-29.0,71.0,-29.0,710.0,-290.0,7100.0,-2900.0,Why Dogecoin Still Has a Legitimate Case as a Long-Term Investment,Motley Fool,2026-06-19,0.0,"Bitcoin, Ethereum, XRP, Dogecoin Slide Further Amid Fed's Hawkish Shift: Analyst Paints This Upside Target For BTC If It Holds $64,000 As Support",Benzinga,2026-06-19,0.402,Prediction: Bittensor Will Become a Top 10 Crypto by Market Cap,Motley Fool,2026-06-18,0.202,,,,,,,,,,
PEPE,Pepe,Crypto,meme,Crypto,3e-06,-1.12%,-0.58%,-24.67%,-30.53%,-31%,0.876,,,179.86,138571853,1259027038,5775277373,,,,,-1.12,98.88,-1.12,988.8,-11.2,9888.0,-112.0,-0.58,99.42,-0.58,994.2,-5.8,9942.0,-58.0,-24.67,75.33,-24.67,753.3,-246.7,7533.0,-2467.0,-30.53,69.47,-30.53,694.7,-305.3,6947.0,-3053.0,-31.0,69.0,-31.0,690.0,-310.0,6900.0,-3100.0,,,,,,,,,,,,,,,,,,,,,,
TAO,Bittensor,Crypto,ai,Crypto,223.673719,-4.79%,+5.29%,-17.98%,+2.29%,+2%,1.865,,,313.27,200782619,2192879354,6980441678,,,,,-4.79,95.21,-4.79,952.1,-47.9,9521.0,-479.0,5.29,105.29,5.29,1052.9,52.9,10529.0,529.0,-17.98,82.02,-17.98,820.2,-179.8,8202.0,-1798.0,2.29,102.29,2.29,1022.9,22.9,10229.0,229.0,2.0,102.0,2.0,1020.0,20.0,10200.0,200.0,,,,,,,,,,,,,8,buy,0.55,"+9.29% 1-week, +4.62% YTD, decentralized AI compute, positive weekly momentum.",+9.29% 1-week; +4.62% YTD; AI compute; positive weekly,,,,,
FET,ASI Alliance,Crypto,ai,Crypto,0.190683,-2.52%,+1.22%,-1.00%,-4.04%,-4%,0.325,,,88.27,56767049,617890314,4048918793,,,,,-2.52,97.48,-2.52,974.8,-25.2,9748.0,-252.0,1.22,101.22,1.22,1012.2,12.2,10122.0,122.0,-1.0,99.0,-1.0,990.0,-10.0,9900.0,-100.0,-4.04,95.96,-4.04,959.6,-40.4,9596.0,-404.0,-4.0,96.0,-4.0,960.0,-40.0,9600.0,-400.0,,,,,,,,,,,,,9,buy,0.5,"+3.22% 1-week, +1.60% 1-month, slight positive momentum in AI agent token, low market cap.",+3.22% 1-week; +1.60% 1-month; AI agent; low cap,,,,,
RNDR,Render,Crypto,ai,Crypto,1.720446,+3.45%,+3.38%,-9.72%,+33.98%,+34%,0.674,,,59.17,55226354,414168429,3011112701,,,,,3.45,103.45,3.45,1034.5,34.5,10345.0,345.0,3.38,103.38,3.38,1033.8,33.8,10338.0,338.0,-9.72,90.28,-9.72,902.8,-97.2,9028.0,-972.0,33.98,133.98,33.98,1339.8,339.8,13398.0,3398.0,34.0,134.0,34.0,1340.0,340.0,13400.0,3400.0,,,,,,,,,,,,,4,buy,0.72,"+31.67% YTD, +5.08% 1-week, real revenue from decentralized rendering, mentioned as top altcoin pick by analysts.",+31.67% YTD; +5.08% 1-week; real revenue; analyst pick,,,,,
OCEAN,Ocean Protocol,Crypto,ai,Crypto,0.103129,+0.82%,+0.59%,-14.40%,-31.51%,-32%,,,,0.05,80802,322958,2094242,,,,,0.82,100.82,0.82,1008.2,8.2,10082.0,82.0,0.59,100.59,0.59,1005.9,5.9,10059.0,59.0,-14.4,85.6,-14.4,856.0,-144.0,8560.0,-1440.0,-31.51,68.49,-31.51,684.9,-315.1,6849.0,-3151.0,-32.0,68.0,-32.0,680.0,-320.0,6800.0,-3200.0,,,,,,,,,,,,,,,,,,,,,,
GRT,The Graph,Crypto,ai,Crypto,0.019292,+0.24%,-3.10%,-22.98%,-41.97%,-42%,0.158,,,12.43,12491282,87017928,540953417,,,,,0.24,100.24,0.24,1002.4,2.4,10024.0,24.0,-3.1,96.9,-3.1,969.0,-31.0,9690.0,-310.0,-22.98,77.02,-22.98,770.2,-229.8,7702.0,-2298.0,-41.97,58.03,-41.97,580.3,-419.7,5803.0,-4197.0,-42.0,58.0,-42.0,580.0,-420.0,5800.0,-4200.0,,,,,,,,,,,,,,,,,,,,,,
AGIX,SingularityNET,Crypto,ai,Crypto,0.083417,+1.11%,-0.68%,-0.71%,-2.72%,-3%,,,,0.01,11666,81397,841844,,,,,1.11,101.11,1.11,1011.1,11.1,10111.0,111.0,-0.68,99.32,-0.68,993.2,-6.8,9932.0,-68.0,-0.71,99.29,-0.71,992.9,-7.1,9929.0,-71.0,-2.72,97.28,-2.72,972.8,-27.2,9728.0,-272.0,-3.0,97.0,-3.0,970.0,-30.0,9700.0,-300.0,,,,,,,,,,,,,10,buy,0.45,"+2.12% 1-month, -1.95% YTD, marginal positive in AI token, small cap rebound potential.",+2.12% 1-month; -1.95% YTD; AI token; small cap rebound,,,,,
NMR,Numeraire,Crypto,ai,Crypto,9.044615,+5.74%,+7.41%,-3.75%,-5.34%,-5%,0.051,,,4.36,5715175,30553467,189129530,,,,,5.74,105.74,5.74,1057.4,57.4,10574.0,574.0,7.41,107.41,7.41,1074.1,74.1,10741.0,741.0,-3.75,96.25,-3.75,962.5,-37.5,9625.0,-375.0,-5.34,94.66,-5.34,946.6,-53.4,9466.0,-534.0,-5.0,95.0,-5.0,950.0,-50.0,9500.0,-500.0,,,,,,,,,,,,,,,,,,,,,,
ALT,AltLayer,Crypto,ai,Crypto,0.006863,+1.79%,+10.14%,-9.64%,-40.06%,-40%,0.033,,,9.59,8690450,67105372,882256945,,,,,1.79,101.79,1.79,1017.9,17.9,10179.0,179.0,10.14,110.14,10.14,1101.4,101.4,11014.0,1014.0,-9.64,90.36,-9.64,903.6,-96.4,9036.0,-964.0,-40.06,59.94,-40.06,599.4,-400.6,5994.0,-4006.0,-40.0,60.0,-40.0,600.0,-400.0,6000.0,-4000.0,,,,,,,,,,,,,7,buy,0.55,"+13.01% 1-week, +7.13% 1-day, very small cap with explosive short-term momentum despite poor YTD.",+13.01% 1-week; +7.13% 1-day; short-term momentum; small cap,,,,,
AIOZ,AIOZ Network,Crypto,ai,Crypto,0.059742,+0.69%,+8.27%,-14.10%,-31.05%,-31%,0.057,,,4.51,4092081,31600674,142793213,,,,,0.69,100.69,0.69,1006.9,6.9,10069.0,69.0,8.27,108.27,8.27,1082.7,82.7,10827.0,827.0,-14.1,85.9,-14.1,859.0,-141.0,8590.0,-1410.0,-31.05,68.95,-31.05,689.5,-310.5,6895.0,-3105.0,-31.0,69.0,-31.0,690.0,-310.0,6900.0,-3100.0,,,,,,,,,,,,,,,,,,,,,,
ARKM,Arkham,Crypto,ai,Crypto,0.13204,-0.34%,+8.36%,+6.84%,-25.17%,-25%,0.022,,,12.33,9715577,86329941,482049438,,,,,-0.34,99.66,-0.34,996.6,-3.4,9966.0,-34.0,8.36,108.36,8.36,1083.6,83.6,10836.0,836.0,6.84,106.84,6.84,1068.4,68.4,10684.0,684.0,-25.17,74.83,-25.17,748.3,-251.7,7483.0,-2517.0,-25.0,75.0,-25.0,750.0,-250.0,7500.0,-2500.0,,,,,,,,,,,,,6,buy,0.6,"+10.43% 1-week, +9.28% 1-month, recovering from YTD lows, on-chain data AI narrative.",+10.43% 1-week; +9.28% 1-month; recovery; AI narrative,,,,,
