ticker,company_name,sector,category,exchange,price_usd,change_1d,change_1w,change_1m,change_ytd,return_1yr,market_cap_gbp_b,beta,pe_ratio,avg_volume_m,vol_1d,vol_1w,vol_1m,div_yield_pct,short_pct,analyst,analyst_score,pct_1d,val_100_1d,profit_100_1d,val_1000_1d,profit_1000_1d,val_10000_1d,profit_10000_1d,pct_1w,val_100_1w,profit_100_1w,val_1000_1w,profit_1000_1w,val_10000_1w,profit_10000_1w,pct_1m,val_100_1m,profit_100_1m,val_1000_1m,profit_1000_1m,val_10000_1m,profit_10000_1m,pct_ytd,val_100_ytd,profit_100_ytd,val_1000_ytd,profit_1000_ytd,val_10000_ytd,profit_10000_ytd,pct_1y,val_100_1y,profit_100_1y,val_1000_1y,profit_1000_1y,val_10000_1y,profit_10000_1y,news1_title,news1_publisher,news1_date,news1_sentiment,news2_title,news2_publisher,news2_date,news2_sentiment,news3_title,news3_publisher,news3_date,news3_sentiment,signal_rank,signal,signal_confidence,signal_rationale,signal_drivers,portfolio_held,portfolio_quantity,portfolio_avg_price,portfolio_ppl,portfolio_total_value
INCY,Incyte,Biotech,oncology,NASDAQ,114.66,+0.65%,+10.61%,+19.95%,+13.05%,+67%,17.278,0.79,16.19,1.66,1406517,10668617,45080117,,9.1,buy,2.33,0.65,100.65,0.65,1006.5,6.5,10065.0,65.0,10.61,110.61,10.61,1106.1,106.1,11061.0,1061.0,19.95,119.95,19.95,1199.5,199.5,11995.0,1995.0,13.05,113.05,13.05,1130.5,130.5,11305.0,1305.0,67.0,167.0,67.0,1670.0,670.0,16700.0,6700.0,INCY Stock Hits 52-Week High on Regulatory Updates for Opzelura,Zacks,2026-06-29,0.0,Incyte (INCY) Surges 5.8%: Is This an Indication of Further Gains?,Zacks,2026-06-29,0.34,1 Cash-Producing Stock with Solid Fundamentals and 2 We Turn Down,StockStory,2026-06-29,0.153,5,buy,0.8,"1Y +67%, 1W +15.81%, P/E 16.07 attractive for biotech, news_s 0.329 positive. Strong pipeline in myelofibrosis and immunotherapy, earnings growth offers fundamental support.",1Y +67%; P/E 16.07; news_s 0.329; strong weekly momentum,,,,,
EXEL,Exelixis,Biotech,oncology,NASDAQ,54.28,-1.13%,+5.71%,+7.96%,+24.55%,+24%,10.291,0.435,17.97,2.66,2520682,17214282,56223082,,16.57,buy,2.26,-1.13,98.87,-1.13,988.7,-11.3,9887.0,-113.0,5.71,105.71,5.71,1057.1,57.1,10571.0,571.0,7.96,107.96,7.96,1079.6,79.6,10796.0,796.0,24.55,124.55,24.55,1245.5,245.5,12455.0,2455.0,24.0,124.0,24.0,1240.0,240.0,12400.0,2400.0,"Qualcomm upgrade, Intel initiation among today's top calls on Wall Street",The Fly,2026-06-25,0.202,"Here Are Thursday’s Best Wall Street Analyst Research Calls: Brown-Forman, CoreWeave, Intel, JFrog, Keurig Dr. Pepper, Klarna Group, Qualcomm, Shift 4 Payments, and More",24/7 Wall St.,2026-06-25,0.637,EXEL Down on Colorectal Cancer Study Data on Zanzalintinib,Zacks,2026-06-23,-0.66,,,,,,,,,,
ALNY,Alnylam Pharmaceuticals,Biotech,oncology,NASDAQ,293.52,+0.82%,+2.48%,-0.71%,-26.65%,-11%,29.559,0.267,73.56,1.13,1335413,6341313,25243513,,5.43,buy,1.79,0.82,100.82,0.82,1008.2,8.2,10082.0,82.0,2.48,102.48,2.48,1024.8,24.8,10248.0,248.0,-0.71,99.29,-0.71,992.9,-7.1,9929.0,-71.0,-26.65,73.35,-26.65,733.5,-266.5,7335.0,-2665.0,-11.0,89.0,-11.0,890.0,-110.0,8900.0,-1100.0,"Alnylam Pharmaceuticals, Inc. (ALNY) and GENESIS Pharma Expand Commercial Partnership",Insider Monkey,2026-06-23,0.318,"Alnylam Pharmaceuticals (ALNY), Inceptive Form $2B Partnership to Advance RNAi Drug Discovery",Insider Monkey,2026-06-23,0.0,Alnylam (ALNY) Expands Its RNAi Therapeutics Reach Into Four More Nordic Countries,Insider Monkey,2026-06-22,0.128,,,,,,,,,,
RCUS,Arcus Biosciences,Biotech,oncology,NYSE,31.08,-0.89%,+14.14%,+21.08%,+33.45%,+281%*,2.949,0.837,,1.3,1185171,12178071,33111971,,17.36,none,,-0.89,99.11,-0.89,991.1,-8.9,9911.0,-89.0,14.14,114.14,14.14,1141.4,141.4,11414.0,1414.0,21.08,121.08,21.08,1210.8,210.8,12108.0,2108.0,33.45,133.45,33.45,1334.5,334.5,13345.0,3345.0,281.0,381.0,281.0,3810.0,2810.0,38100.0,28100.0,Bristol Myers Squibb’s AI Overhaul And Oncology Trials Shape Value Story,Simply Wall St.,2026-06-12,0.34,"Arcus, Bristol Myers Team Up to Advance Kidney Cancer Study",Zacks,2026-06-04,-0.66,How Eisai (TSE:4523) Is Reframing Its Story With A Tweaked Fair Value Outlook,Simply Wall St.,2026-05-21,0.572,4,buy,0.8,"1Y +281%*, YTD +33.10%, 1W +27.52% with strong momentum, no analyst consensus but rapid price appreciation signals market optimism. Low market cap £2.95B provides asymmetric upside if clinical catalysts hit.",1Y +281%*; 1W +27.52%; high momentum; low market cap,,,,,
MRNA,Moderna,Biotech,mrna,NASDAQ,69.7,+3.74%,+17.45%,+51.32%,+125.86%,+144%,20.86,1.03,,7.23,7919152,47676852,168124252,,18.09,hold,3.0,3.74,103.74,3.74,1037.4,37.4,10374.0,374.0,17.45,117.45,17.45,1174.5,174.5,11745.0,1745.0,51.32,151.32,51.32,1513.2,513.2,15132.0,5132.0,125.86,225.86,125.86,2258.6,1258.6,22586.0,12586.0,144.0,244.0,144.0,2440.0,1440.0,24400.0,14400.0,MRNA Stock Jumps to 52-Week High on Expansion Plans Beyond Vaccines,Zacks,2026-06-29,0.0,MRNA Stock Spikes as Moderna Shares mRNA Pipeline Update,Barchart,2026-06-29,0.296,US Stock Market Today: S&P 500 Futures Slip As Sticky Inflation Keeps Fed Cautious,Simply Wall St.,2026-06-29,-0.103,2,strong_buy,0.85,"YTD +117.98%, 1M +41.29%, strong momentum driven by FDA backing of flu vaccine mRNA-1010 and ambitious cancer/autoimmune pipeline. Web search highlights unanimous FDA panel vote and AI-driven pipeline, supporting a turnaround story.",YTD +117.98%; 1M +41.29%; FDA backing of flue vaccine; cancer pipeline,,,,,
BNTX,BioNTech,Biotech,mrna,NASDAQ,94.26,+4.15%,+4.51%,+2.79%,-2.51%,-14%,17.98,1.324,,0.95,919424,4499324,21229924,,4.01,buy,1.55,4.15,104.15,4.15,1041.5,41.5,10415.0,415.0,4.51,104.51,4.51,1045.1,45.1,10451.0,451.0,2.79,102.79,2.79,1027.9,27.9,10279.0,279.0,-2.51,97.49,-2.51,974.9,-25.1,9749.0,-251.0,-14.0,86.0,-14.0,860.0,-140.0,8600.0,-1400.0,"VERAXA Unveils Cancer Therapy Platform, Sparks Partnering Talks at BIO 2026",Exec Edge,2026-06-18,-0.66,PTC Therapeutics (PTCT) Moves 7.2% Higher: Will This Strength Last?,Zacks,2026-06-18,0.579,"US Equity Markets End Lower After Government Bond Yields Rise, Fed's Policy Statement",MT Newswires,2026-06-17,-0.296,,,,,,,,,,
NVAX,Novavax,Biotech,mrna,NASDAQ,9.36,+5.41%,+4.00%,-10.94%,+31.28%,+41%*,1.161,2.414,,4.75,3963060,24460460,92244760,,27.61,buy,2.33,5.41,105.41,5.41,1054.1,54.1,10541.0,541.0,4.0,104.0,4.0,1040.0,40.0,10400.0,400.0,-10.94,89.06,-10.94,890.6,-109.4,8906.0,-1094.0,31.28,131.28,31.28,1312.8,312.8,13128.0,3128.0,41.0,141.0,41.0,1410.0,410.0,14100.0,4100.0,Novavax (NVAX) Suffers a Larger Drop Than the General Market: Key Insights,Zacks,2026-06-24,-0.637,"Investors Heavily Search Novavax, Inc. (NVAX): Here is What You Need to Know",Zacks,2026-06-23,0.0,Novavax (NVAX) Stock Falls Amid Market Uptick: What Investors Need to Know,Zacks,2026-06-18,0.0,,,,,,,,,,
BMRN,BioMarin Pharmaceutical,Biotech,rare-disease,NASDAQ,57.67,-1.59%,+3.17%,+4.80%,-2.99%,+7%,8.408,0.24,41.49,2.08,1708643,11675543,44568243,,6.49,buy,1.69,-1.59,98.41,-1.59,984.1,-15.9,9841.0,-159.0,3.17,103.17,3.17,1031.7,31.7,10317.0,317.0,4.8,104.8,4.8,1048.0,48.0,10480.0,480.0,-2.99,97.01,-2.99,970.1,-29.9,9701.0,-299.0,7.0,107.0,7.0,1070.0,70.0,10700.0,700.0,2 Cash-Heavy Stocks with Exciting Potential and 1 We Ignore,StockStory,2026-06-29,0.178,2 Healthcare Stocks for Long-Term Investors and 1 We Brush Off,StockStory,2026-06-26,0.0,Therapeutics Stocks Q1 Teardown: BioMarin Pharmaceutical (NASDAQ:BMRN) Vs The Rest,StockStory,2026-06-25,0.0,9,buy,0.7,"1M +12.64%, 1W +7.88%, P/E 42.45 but analyst buy consensus (an_score 1.69) with low beta 0.24. Consistent rare disease revenue from Vimizim and pipeline progress, news_s 0.271 positive.",1M +12.64%; analyst buy; news_s 0.271; low beta,,,,,
SRPT,Sarepta Therapeutics,Biotech,rare-disease,NASDAQ,17.02,+0.97%,-3.57%,-3.35%,-20.13%,-1%,1.355,0.205,48.63,3.11,3745623,31399023,76939323,,28.57,hold,2.83,0.97,100.97,0.97,1009.7,9.7,10097.0,97.0,-3.57,96.43,-3.57,964.3,-35.7,9643.0,-357.0,-3.35,96.65,-3.35,966.5,-33.5,9665.0,-335.0,-20.13,79.87,-20.13,798.7,-201.3,7987.0,-2013.0,-1.0,99.0,-1.0,990.0,-10.0,9900.0,-100.0,"Sarepta's Elevidys Showing Signs of Stabilization as siRNA Pipeline Gains Importance, RBC Says",MT Newswires,2026-06-18,0.599,Is Sarepta (SRPT) Using New Equity Plans To Quietly Redefine Its Post‑Profitability Playbook?,Simply Wall St.,2026-06-08,0.0,All You Need to Know About Sarepta Therapeutics (SRPT) Rating Upgrade to Buy,Zacks,2026-06-08,0.0,,,,,,,,,,
COAG,Hemab Therapeutics,Biotech,rare-disease,NASDAQ,36.73,+11.27%,+15.72%,+35.39%,+8.03%,-5%,1.294,,,0.36,362211,1300711,5952411,,,strong_buy,1.0,11.27,111.27,11.27,1112.7,112.7,11127.0,1127.0,15.72,115.72,15.72,1157.2,157.2,11572.0,1572.0,35.39,135.39,35.39,1353.9,353.9,13539.0,3539.0,8.03,108.03,8.03,1080.3,80.3,10803.0,803.0,-5.0,95.0,-5.0,950.0,-50.0,9500.0,-500.0,"Hemab Therapeutics Details Post-IPO Pipeline Push, Sutacimig Phase III Plans",MarketBeat,2026-06-09,0.0,Hemab Therapeutics IPO Debut Puts COAG And Pipeline Risks In Focus,Simply Wall St.,2026-05-03,-0.273,,,,,8,strong_buy,0.75,"Analyst strong_buy consensus (an_score 1.0), 1W +10.70%, 1D +16.77% shows strong momentum. Pipeline push with sutacimig Phase III plans, rare disease focus reduces binary risk. Low market cap £1.144B.",analyst strong_buy; 1W +10.70%; sutacimig Phase III; low market cap,,,,,
NVO,Novo Nordisk,Biotech,metabolic,NYSE,48.34,+0.69%,+5.36%,+9.69%,-4.35%,-30%,161.412,0.349,11.62,15.41,7671488,73019988,274645888,375.0,0.77,buy,2.43,0.69,100.69,0.69,1006.9,6.9,10069.0,69.0,5.36,105.36,5.36,1053.6,53.6,10536.0,536.0,9.69,109.69,9.69,1096.9,96.9,10969.0,969.0,-4.35,95.65,-4.35,956.5,-43.5,9565.0,-435.0,-30.0,70.0,-30.0,700.0,-300.0,7000.0,-3000.0,Novo Nordisk vs. Viking: Which Obesity Drug Stock Is the Better Buy?,Zacks,2026-06-29,0.44,Here's Why Shares of Eli Lilly Hit an All-Time High on Friday,Zacks,2026-06-29,0.296,Novo Nordisk A/S (NVO) Is a Trending Stock: Facts to Know Before Betting on It,Zacks,2026-06-29,0.0,,,,,,,,,,
LLY,Eli Lilly,Biotech,metabolic,NYSE,1229.93,+1.56%,+11.60%,+13.65%,+14.23%,+55%,827.279,0.517,43.69,3.29,2892162,19595462,67052862,57.0,1.09,buy,1.74,1.56,101.56,1.56,1015.6,15.6,10156.0,156.0,11.6,111.6,11.6,1116.0,116.0,11160.0,1160.0,13.65,113.65,13.65,1136.5,136.5,11365.0,1365.0,14.23,114.23,14.23,1142.3,142.3,11423.0,1423.0,55.0,155.0,55.0,1550.0,550.0,15500.0,5500.0,AbbVie Stock Rockets 17% With 5-Day Winning Streak,Trefis,2026-06-29,0.527,Should You Chase The Breakout In Eli Lilly Stock?,Trefis,2026-06-29,0.0,"Biotech Bigwigs ABBV, JNJ, BIIB & LLY Hit New 52-Week Highs",Zacks,2026-06-29,0.0,,,,,,,,,,
LEGN,Legend Biotech,Biotech,neuroscience,NASDAQ,29.39,+0.31%,+0.17%,+15.21%,+36.63%,-19%,4.288,0.352,,2.75,1204702,10830102,71725702,,17.67,buy,1.6,0.31,100.31,0.31,1003.1,3.1,10031.0,31.0,0.17,100.17,0.17,1001.7,1.7,10017.0,17.0,15.21,115.21,15.21,1152.1,152.1,11521.0,1521.0,36.63,136.63,36.63,1366.3,366.3,13663.0,3663.0,-19.0,81.0,-19.0,810.0,-190.0,8100.0,-1900.0,Legend Biotech Corporation (LEGN) Price Target Raised to $49 on LB5006 Clinical Progress,Insider Monkey,2026-06-25,0.421,"After Apogee, 3 More Biotech Buyout Targets Wall Street Can’t Stop Watching",24/7 Wall St.,2026-06-24,-0.296,Legend Biotech (LEGN) Reports a Complete Response in Five of Six Patients at Its Highest Dose,Insider Monkey,2026-06-22,0.0,,,,,,,,,,
IONS,Ionis Pharmaceuticals,Biotech,neuroscience,NASDAQ,80.69,-1.61%,+6.32%,+7.04%,+1.28%,+105%,10.058,0.37,,1.8,2729935,13032435,40133835,,14.26,buy,1.67,-1.61,98.39,-1.61,983.9,-16.1,9839.0,-161.0,6.32,106.32,6.32,1063.2,63.2,10632.0,632.0,7.04,107.04,7.04,1070.4,70.4,10704.0,704.0,1.28,101.28,1.28,1012.8,12.8,10128.0,128.0,105.0,205.0,105.0,2050.0,1050.0,20500.0,10500.0,Ionis Pharmaceuticals (IONS) Signs Recordati Deal For Zilganersen Outside The U.S.,Simply Wall St.,2026-06-28,0.0,Ionis Pharmaceuticals (IONS) Is Up 9.5% After FDA Expands Tryngolza Label For Severe Hypertriglyceridemia,Simply Wall St.,2026-06-28,-0.296,IONS Out-Licenses ex-U.S. Rights for Rare Neurology Drug to Recordati,Zacks,2026-06-26,0.0,,,,,,,,,,
BTC,Bitcoin,Crypto,bitcoin,Crypto,60417.955985,+1.78%,-5.90%,-18.17%,-30.97%,-31%,913.776,,,30248.5,16805740159,211739494030,1002485411822,,,,,1.78,101.78,1.78,1017.8,17.8,10178.0,178.0,-5.9,94.1,-5.9,941.0,-59.0,9410.0,-590.0,-18.17,81.83,-18.17,818.3,-181.7,8183.0,-1817.0,-30.97,69.03,-30.97,690.3,-309.7,6903.0,-3097.0,-31.0,69.0,-31.0,690.0,-310.0,6900.0,-3100.0,Bitcoin ETFs see worst month of outflows as investors pile into AI trade,Yahoo Finance Video,2026-06-29,-0.625,"Bitcoin and ethereum prices today, Monday, June 29, 2026: Prices continue to move lower",Yahoo Personal Finance,2026-06-29,-0.296,Billionaire investor reveals key reasons behind Bitcoin's decline,TheStreet,2026-06-29,0.0,8,buy,0.55,"BTC is range-bound near $60,100 with whale accumulation underway and analyst capitulation signals historically marking cycle bottoms. A £911B market cap provides stability; ETF outflows are a near-term headwind.",whale accumulation signal; capitulation bottom pattern; historical cycle low indicator; largest market cap £911B,,,,,
ETH,Ethereum,Crypto,layer1,Crypto,1619.051197,+3.71%,-6.40%,-20.09%,-45.43%,-45%,147.391,,,11317.59,5705470558,79223119733,419617696336,,,,,3.71,103.71,3.71,1037.1,37.1,10371.0,371.0,-6.4,93.6,-6.4,936.0,-64.0,9360.0,-640.0,-20.09,79.91,-20.09,799.1,-200.9,7991.0,-2009.0,-45.43,54.57,-45.43,545.7,-454.3,5457.0,-4543.0,-45.0,55.0,-45.0,550.0,-450.0,5500.0,-4500.0,"Bitcoin and ethereum prices today, Monday, June 29, 2026: Prices continue to move lower",Yahoo Personal Finance,2026-06-29,-0.296,"Top Cryptocurrencies Rise; Bitcoin Tops $60,000",MT Newswires,2026-06-29,0.625,BlackRock Fuels 10% Surge for Ethena as USDe Joins $25 Trillion Aladdin Platform,BeInCrypto,2026-06-29,0.0,7,buy,0.6,ETH has positive news sentiment (0.328) and a +1.06% 1D bounce; its £144B market cap makes it the core L2/liquidity proxy. Capitulation signals on BTC may precede a broader market recovery led by ETH.,positive news sentiment 0.328; L2 ecosystem leader; core liquidity proxy; capitulation bottom setup,,,,,
SOL,Solana,Crypto,layer1,Crypto,75.577346,+7.37%,+4.21%,-8.88%,-39.30%,-39%,33.11,,,2798.84,1810580463,19591874812,87307648326,,,,,7.37,107.37,7.37,1073.7,73.7,10737.0,737.0,4.21,104.21,4.21,1042.1,42.1,10421.0,421.0,-8.88,91.12,-8.88,911.2,-88.8,9112.0,-888.0,-39.3,60.7,-39.3,607.0,-393.0,6070.0,-3930.0,-39.0,61.0,-39.0,610.0,-390.0,6100.0,-3900.0,"Top Cryptocurrencies Rise; Bitcoin Tops $60,000",MT Newswires,2026-06-29,0.625,"Bitcoin Holds Below $60,000 as Cryptos Slide",Barrons.com,2026-06-29,0.0,"ANSEM Climbs 19,878% After The Black Bull Ansem Announces Creator Fee Airdrops",BeInCrypto,2026-06-29,0.0,3,buy,0.7,"SOL shows a strong 1D bounce +3.47% and modest 1W -1.37%, with positive news sentiment 0.224 and a large £31.96B market cap, making it a leading L1 recovery play.",+3.47% 1D bounce; positive news sentiment 0.224; large-cap L1 liquidity; modest 1W drawdown,,,,,
BNB,BNB,Crypto,layer1,Crypto,560.343468,+1.98%,-4.97%,-22.44%,-35.08%,-35%,56.971,,,729.3,513456918,5105082213,32550087318,,,,,1.98,101.98,1.98,1019.8,19.8,10198.0,198.0,-4.97,95.03,-4.97,950.3,-49.7,9503.0,-497.0,-22.44,77.56,-22.44,775.6,-224.4,7756.0,-2244.0,-35.08,64.92,-35.08,649.2,-350.8,6492.0,-3508.0,-35.0,65.0,-35.0,650.0,-350.0,6500.0,-3500.0,"Top Cryptocurrencies Rise; Bitcoin Tops $60,000",MT Newswires,2026-06-29,0.625,"Top Cryptocurrencies Rise; Bitcoin Holds Above $59,000",MT Newswires,2026-06-26,0.202,"Top Cryptocurrencies Mixed; Bitcoin Holds Above $59,000 Level",MT Newswires,2026-06-25,0.202,10,buy,0.5,BNB holds a £56.5B market cap with modest drawdown and slight positive news sentiment (0.06). It remains a liquid exchange-backed L1 with potential to stabilise as crypto risk appetite returns.,large-cap £56.5B stability; exchange-backed narrative; modest 1M -16.82%; near-zero 1D change,,,,,
ADA,Cardano,Crypto,layer1,Crypto,0.147394,+3.60%,-7.14%,-38.02%,-55.69%,-56%,4.047,,,380.41,211080141,2662870530,14633862367,,,,,3.6,103.6,3.6,1036.0,36.0,10360.0,360.0,-7.14,92.86,-7.14,928.6,-71.4,9286.0,-714.0,-38.02,61.98,-38.02,619.8,-380.2,6198.0,-3802.0,-55.69,44.31,-55.69,443.1,-556.9,4431.0,-5569.0,-56.0,44.0,-56.0,440.0,-560.0,4400.0,-5600.0,"Top Cryptocurrencies Rise; Bitcoin Tops $60,000",MT Newswires,2026-06-29,0.625,Cardano Whales Keep Buying ADA While Network Use Sinks to a 45-Day Low,BeInCrypto,2026-06-29,-0.273,"Nobody Knows Who Stole $18.5M in ADA, Including the Company That Built the Wallet",Cryptonews,2026-06-29,0.0,,,,,,,,,,
AVAX,Avalanche,Crypto,layer1,Crypto,6.698868,+5.83%,+7.55%,-25.53%,-45.57%,-46%,2.182,,,231.23,143457357,1618605524,7045579451,,,,,5.83,105.83,5.83,1058.3,58.3,10583.0,583.0,7.55,107.55,7.55,1075.5,75.5,10755.0,755.0,-25.53,74.47,-25.53,744.7,-255.3,7447.0,-2553.0,-45.57,54.43,-45.57,544.3,-455.7,5443.0,-4557.0,-46.0,54.0,-46.0,540.0,-460.0,5400.0,-4600.0,MXNB Lands on Ripple XRPL Permissioned DEX to Power USD/MXN Settlement Rail,Coinspeaker,2026-06-24,0.0,,,,,,,,,5,buy,0.65,"AVAX leads L1s with +5.70% 1W and +4.72% 1D gains, signaling short-term momentum reversal. A £2.16B market cap provides room for leveraged upside if momentum sustains.",+5.70% 1W momentum; +4.72% 1D gain; short-term reversal signal; mid-cap L1,,,,,
XRP,XRP,Crypto,payments,Crypto,1.062656,+2.18%,-5.80%,-21.21%,-42.23%,-42%,49.892,,,1705.42,1077570236,11937944389,57942927315,,,,,2.18,102.18,2.18,1021.8,21.8,10218.0,218.0,-5.8,94.2,-5.8,942.0,-58.0,9420.0,-580.0,-21.21,78.79,-21.21,787.9,-212.1,7879.0,-2121.0,-42.23,57.77,-42.23,577.7,-422.3,5777.0,-4223.0,-42.0,58.0,-42.0,580.0,-420.0,5800.0,-4200.0,"Top Cryptocurrencies Rise; Bitcoin Tops $60,000",MT Newswires,2026-06-29,0.625,XRP Price Prediction for July 2026: Can Buyers Finally Break the Downtrend?,BeInCrypto,2026-06-29,0.0,Ripple CEO Brad Garlinghouse has a blunt message for Michael Saylor,TheStreet,2026-06-29,0.0,,,,,,,,,,
XLM,Stellar,Crypto,payments,Crypto,0.176381,+3.48%,-13.49%,-26.28%,-12.09%,-12%,4.52,,,187.81,121341551,1314674968,15894604034,,,,,3.48,103.48,3.48,1034.8,34.8,10348.0,348.0,-13.49,86.51,-13.49,865.1,-134.9,8651.0,-1349.0,-26.28,73.72,-26.28,737.2,-262.8,7372.0,-2628.0,-12.09,87.91,-12.09,879.1,-120.9,8791.0,-1209.0,-12.0,88.0,-12.0,880.0,-120.0,8800.0,-1200.0,,,,,,,,,,,,,,,,,,,,,,
TRX,TRON,Crypto,payments,Crypto,0.321316,-0.33%,-3.57%,-7.47%,+13.00%,+13%,22.989,,,551.4,464754723,3859787419,17014707103,,,,,-0.33,99.67,-0.33,996.7,-3.3,9967.0,-33.0,-3.57,96.43,-3.57,964.3,-35.7,9643.0,-357.0,-7.47,92.53,-7.47,925.3,-74.7,9253.0,-747.0,13.0,113.0,13.0,1130.0,130.0,11300.0,1300.0,13.0,113.0,13.0,1130.0,130.0,11300.0,1300.0,"Tron (TRX) Looks Incredibly Healthy, But Nobody Is Talking About It",BeInCrypto,2026-06-24,0.249,,,,,,,,,2,strong_buy,0.75,"TRX is the sole asset with positive YTD (+13.68%) and 1Y (+14%) returns, supported by strong news sentiment (0.249) and a healthy £23.2B market cap, showing resilient relative strength.",positive YTD +13.68%; positive 1Y +14%; strong news sentiment 0.249; resilient price action,,,,,
SUI,Sui,Crypto,emerging,Crypto,0.704641,+4.09%,-2.07%,-22.82%,-49.76%,-50%,2.142,,,332.77,181367456,2329401367,13408113260,,,,,4.09,104.09,4.09,1040.9,40.9,10409.0,409.0,-2.07,97.93,-2.07,979.3,-20.7,9793.0,-207.0,-22.82,77.18,-22.82,771.8,-228.2,7718.0,-2282.0,-49.76,50.24,-49.76,502.4,-497.6,5024.0,-4976.0,-50.0,50.0,-50.0,500.0,-500.0,5000.0,-5000.0,SUI Group Deepens Bluefin Partnership With an Additional 4M SUI Loan,CryptoProwl,2026-06-25,0.0,,,,,,,,,,,,,,,,,,
HBAR,Hedera,Crypto,emerging,Crypto,0.071784,+1.56%,-9.17%,-25.29%,-32.40%,-32%,2.354,,,58.58,40898640,410057594,2681448222,,,,,1.56,101.56,1.56,1015.6,15.6,10156.0,156.0,-9.17,90.83,-9.17,908.3,-91.7,9083.0,-917.0,-25.29,74.71,-25.29,747.1,-252.9,7471.0,-2529.0,-32.4,67.6,-32.4,676.0,-324.0,6760.0,-3240.0,-32.0,68.0,-32.0,680.0,-320.0,6800.0,-3200.0,,,,,,,,,,,,,,,,,,,,,,
ALGO,Algorand,Crypto,emerging,Crypto,0.08611,-1.08%,-4.14%,-32.18%,-21.85%,-22%,0.581,,,36.32,24502447,254253006,1296508604,,,,,-1.08,98.92,-1.08,989.2,-10.8,9892.0,-108.0,-4.14,95.86,-4.14,958.6,-41.4,9586.0,-414.0,-32.18,67.82,-32.18,678.2,-321.8,6782.0,-3218.0,-21.85,78.15,-21.85,781.5,-218.5,7815.0,-2185.0,-22.0,78.0,-22.0,780.0,-220.0,7800.0,-2200.0,,,,,,,,,,,,,,,,,,,,,,
MINA,Mina,Crypto,emerging,Crypto,0.038779,+1.60%,-7.38%,-30.84%,-48.67%,-49%,0.038,,,3.86,1971530,26997031,321255326,,,,,1.6,101.6,1.6,1016.0,16.0,10160.0,160.0,-7.38,92.62,-7.38,926.2,-73.8,9262.0,-738.0,-30.84,69.16,-30.84,691.6,-308.4,6916.0,-3084.0,-48.67,51.33,-48.67,513.3,-486.7,5133.0,-4867.0,-49.0,51.0,-49.0,510.0,-490.0,5100.0,-4900.0,,,,,,,,,,,,,,,,,,,,,,
POL,Polygon (MATIC),Crypto,infra,Crypto,0.071288,+0.85%,-10.43%,-21.16%,-29.02%,-29%,0.574,,,41.74,26911565,292173288,1377751959,,,,,0.85,100.85,0.85,1008.5,8.5,10085.0,85.0,-10.43,89.57,-10.43,895.7,-104.3,8957.0,-1043.0,-21.16,78.84,-21.16,788.4,-211.6,7884.0,-2116.0,-29.02,70.98,-29.02,709.8,-290.2,7098.0,-2902.0,-29.0,71.0,-29.0,710.0,-290.0,7100.0,-2900.0,,,,,,,,,,,,,,,,,,,,,,
DOT,Polkadot,Crypto,infra,Crypto,0.828927,+3.22%,-12.08%,-30.93%,-53.69%,-54%,1.057,,,86.82,81518968,607729054,3678032057,,,,,3.22,103.22,3.22,1032.2,32.2,10322.0,322.0,-12.08,87.92,-12.08,879.2,-120.8,8792.0,-1208.0,-30.93,69.07,-30.93,690.7,-309.3,6907.0,-3093.0,-53.69,46.31,-53.69,463.1,-536.9,4631.0,-5369.0,-54.0,46.0,-54.0,460.0,-540.0,4600.0,-5400.0,,,,,,,,,,,,,,,,,,,,,,
LINK,Chainlink,Crypto,infra,Crypto,7.458955,+3.73%,-5.42%,-19.50%,-38.83%,-39%,4.091,,,221.95,162590274,1553649038,8020923808,,,,,3.73,103.73,3.73,1037.3,37.3,10373.0,373.0,-5.42,94.58,-5.42,945.8,-54.2,9458.0,-542.0,-19.5,80.5,-19.5,805.0,-195.0,8050.0,-1950.0,-38.83,61.17,-38.83,611.7,-388.3,6117.0,-3883.0,-39.0,61.0,-39.0,610.0,-390.0,6100.0,-3900.0,3 Reasons Chainlink Could Skyrocket in 2026,Motley Fool,2026-06-29,0.0,Project Pangea Targets $150B Trade Corridor: Can Chainlink Challenge XRP and XLM in Cross-Border Payments?,CCN,2026-06-25,0.077,"Crypto News Today (June 24): BTC Struggling to Reclaim $63K, THORChain Resumes Trading, and Chainlink Joins Bank Stablecoin Push",99bitcoins,2026-06-24,-0.421,,,,,,,,,,
DOGE,Dogecoin,Crypto,meme,Crypto,0.073976,+1.70%,-10.36%,-26.95%,-36.93%,-37%,8.642,,,617.94,440296274,4325604634,23347170746,,,,,1.7,101.7,1.7,1017.0,17.0,10170.0,170.0,-10.36,89.64,-10.36,896.4,-103.6,8964.0,-1036.0,-26.95,73.05,-26.95,730.5,-269.5,7305.0,-2695.0,-36.93,63.07,-36.93,630.7,-369.3,6307.0,-3693.0,-37.0,63.0,-37.0,630.0,-370.0,6300.0,-3700.0,"Top Cryptocurrencies Rise; Bitcoin Tops $60,000",MT Newswires,2026-06-29,0.625,Do Meme Coins Such as Dogecoin Have a Legitimate Case as a Long-Term Investment?,Motley Fool,2026-06-29,0.0,"Bitcoin, Ethereum, Dogecoin Slide, XRP Flat As US-Iran Tensions Escalate Over The Weekend: Analyst Notes 'Pretty Interesting Signal' About The BTC Market",Benzinga,2026-06-29,0.494,,,,,,,,,,
PEPE,Pepe,Crypto,meme,Crypto,2e-06,+1.57%,-15.09%,-30.59%,-40.82%,-41%,0.745,,,142.25,94815879,995746514,5335677107,,,,,1.57,101.57,1.57,1015.7,15.7,10157.0,157.0,-15.09,84.91,-15.09,849.1,-150.9,8491.0,-1509.0,-30.59,69.41,-30.59,694.1,-305.9,6941.0,-3059.0,-40.82,59.18,-40.82,591.8,-408.2,5918.0,-4082.0,-41.0,59.0,-41.0,590.0,-410.0,5900.0,-4100.0,"Pavel Durov Gifts $12,000 Worth of Plush Pepe NFT to a Telegram Designer",BeInCrypto,2026-06-27,0.226,,,,,,,,,,,,,,,,,,
TAO,Bittensor,Crypto,ai,Crypto,208.510093,+2.71%,-9.57%,-18.56%,-4.65%,-5%,1.741,,,271.94,90277198,1903573146,7472867140,,,,,2.71,102.71,2.71,1027.1,27.1,10271.0,271.0,-9.57,90.43,-9.57,904.3,-95.7,9043.0,-957.0,-18.56,81.44,-18.56,814.4,-185.6,8144.0,-1856.0,-4.65,95.35,-4.65,953.5,-46.5,9535.0,-465.0,-5.0,95.0,-5.0,950.0,-50.0,9500.0,-500.0,,,,,,,,,,,,,6,buy,0.6,"TAO has minimal YTD drawdown (-5.13%) and a +0.21% 1D tick, with bullish mainstream coverage comparing it to Bitcoin's scarcity. The £1.74B market cap positions it well for AI narrative re-rating.",minimal YTD drawdown -5.13%; positive mainstream coverage; AI narrative scarcity play; mid-cap DePIN leader,,,,,
FET,ASI Alliance,Crypto,ai,Crypto,0.177077,+0.99%,-1.65%,-35.52%,-10.89%,-11%,0.301,,,54.55,44232074,381874058,3282225188,,,,,0.99,100.99,0.99,1009.9,9.9,10099.0,99.0,-1.65,98.35,-1.65,983.5,-16.5,9835.0,-165.0,-35.52,64.48,-35.52,644.8,-355.2,6448.0,-3552.0,-10.89,89.11,-10.89,891.1,-108.9,8911.0,-1089.0,-11.0,89.0,-11.0,890.0,-110.0,8900.0,-1100.0,,,,,,,,,,,,,,,,,,,,,,
RNDR,Render,Crypto,ai,Crypto,1.570928,+3.02%,-4.66%,-26.19%,+22.34%,+22%,0.615,,,44.25,29973754,309721870,2229739577,,,,,3.02,103.02,3.02,1030.2,30.2,10302.0,302.0,-4.66,95.34,-4.66,953.4,-46.6,9534.0,-466.0,-26.19,73.81,-26.19,738.1,-261.9,7381.0,-2619.0,22.34,122.34,22.34,1223.4,223.4,12234.0,2234.0,22.0,122.0,22.0,1220.0,220.0,12200.0,2200.0,,,,,,,,,,,,,,,,,,,,,,
OCEAN,Ocean Protocol,Crypto,ai,Crypto,0.113596,-0.04%,+13.17%,-14.74%,-24.56%,-25%,,,,0.25,46064,1734664,3397144,,,,,-0.04,99.96,-0.04,999.6,-0.4,9996.0,-4.0,13.17,113.17,13.17,1131.7,131.7,11317.0,1317.0,-14.74,85.26,-14.74,852.6,-147.4,8526.0,-1474.0,-24.56,75.44,-24.56,754.4,-245.6,7544.0,-2456.0,-25.0,75.0,-25.0,750.0,-250.0,7500.0,-2500.0,,,,,,,,,,,,,4,buy,0.65,"OCEAN has exceptional 1W momentum (+11.97%) and moderate 1M decline (-7.71%), outperforming most AI tokens. Its small cap and data-economy narrative offer asymmetric upside.",+11.97% 1W momentum; moderate 1M drawdown -7.71%; AI data-economy narrative; small-cap asymmetry,,,,,
GRT,The Graph,Crypto,ai,Crypto,0.017988,+2.70%,-7.83%,-32.42%,-45.89%,-46%,0.148,,,14.98,14687904,104865976,445605295,,,,,2.7,102.7,2.7,1027.0,27.0,10270.0,270.0,-7.83,92.17,-7.83,921.7,-78.3,9217.0,-783.0,-32.42,67.58,-32.42,675.8,-324.2,6758.0,-3242.0,-45.89,54.11,-45.89,541.1,-458.9,5411.0,-4589.0,-46.0,54.0,-46.0,540.0,-460.0,5400.0,-4600.0,,,,,,,,,,,,,,,,,,,,,,
