ticker,company_name,sector,category,exchange,price_usd,change_1d,change_1w,change_1m,change_ytd,return_1yr,market_cap_gbp_b,beta,pe_ratio,avg_volume_m,vol_1d,vol_1w,vol_1m,div_yield_pct,short_pct,analyst,analyst_score,pct_1d,val_100_1d,profit_100_1d,val_1000_1d,profit_1000_1d,val_10000_1d,profit_10000_1d,pct_1w,val_100_1w,profit_100_1w,val_1000_1w,profit_1000_1w,val_10000_1w,profit_10000_1w,pct_1m,val_100_1m,profit_100_1m,val_1000_1m,profit_1000_1m,val_10000_1m,profit_10000_1m,pct_ytd,val_100_ytd,profit_100_ytd,val_1000_ytd,profit_1000_ytd,val_10000_ytd,profit_10000_ytd,pct_1y,val_100_1y,profit_100_1y,val_1000_1y,profit_1000_1y,val_10000_1y,profit_10000_1y,news1_title,news1_publisher,news1_date,news1_sentiment,news2_title,news2_publisher,news2_date,news2_sentiment,news3_title,news3_publisher,news3_date,news3_sentiment,signal_rank,signal,signal_confidence,signal_rationale,signal_drivers,portfolio_held,portfolio_quantity,portfolio_avg_price,portfolio_ppl,portfolio_total_value
AXON,Axon Enterprise,Defence,weapons,NASDAQ,510.6,+10.10%,+24.53%,+7.07%,-9.38%,-44%,31.043,1.422,207.56,1.19,1817130,6678830,23391830,,5.65,buy,1.6,10.1,110.1,10.1,1101.0,101.0,11010.0,1010.0,24.53,124.53,24.53,1245.3,245.3,12453.0,2453.0,7.07,107.07,7.07,1070.7,70.7,10707.0,707.0,-9.38,90.62,-9.38,906.2,-93.8,9062.0,-938.0,-44.0,56.0,-44.0,560.0,-440.0,5600.0,-4400.0,AXON Stock Set For Best Month In Over A Year – What’s The Trump Connection?,Stocktwits,2026-06-29,0.637,Why Axon Enterprise Stock Popped Today,Motley Fool,2026-06-29,0.0,"Trump Bought Up to $5 Million of Taser Maker Axon, Two Weeks Before ICE’s $220 Million Order",24/7 Wall St.,2026-06-29,0.0,8,buy,0.6,Axon has bounced strongly with +18.79% 1m and +9.79% 1w momentum; +4.22% 1d gain; despite -44% 1yr drawdown the AI policing catalyst and Taser franchise provide growth optionality; analyst consensus buy with score 1.6 supports rebound case.,+18.79% 1m bounce; analyst score 1.6 buy; AI policing catalyst; +9.79% 1w,,,,,
OLN,Olin Corporation,Defence,weapons,NYSE,20.82,-6.00%,-3.34%,-19.11%,-1.93%,+8%,1.79,1.171,,2.56,3280372,20088572,63667272,368.0,15.47,hold,2.64,-6.0,94.0,-6.0,940.0,-60.0,9400.0,-600.0,-3.34,96.66,-3.34,966.6,-33.4,9666.0,-334.0,-19.11,80.89,-19.11,808.9,-191.1,8089.0,-1911.0,-1.93,98.07,-1.93,980.7,-19.3,9807.0,-193.0,8.0,108.0,8.0,1080.0,80.0,10800.0,800.0,JPMorgan Tweaks Its Olin (OLN) Outlook But the Bigger Question Remains Unanswered,Insider Monkey,2026-06-26,0.0,Olin (OLN) Stock Could Be 16.3% Undervalued On Cost Cutting Narrative,Simply Wall St.,2026-06-21,-0.128,Olin (OLN) Agrees Huntsman Merger As Deal Fairness Probe Begins,Simply Wall St.,2026-06-21,0.202,,,,,,,,,,
MRCY,Mercury Systems,Defence,weapons,NASDAQ,110.22,-3.67%,-1.38%,-0.95%,+44.97%,+103%,4.992,0.949,,0.65,702219,5442319,17235519,,8.83,none,,-3.67,96.33,-3.67,963.3,-36.7,9633.0,-367.0,-1.38,98.62,-1.38,986.2,-13.8,9862.0,-138.0,-0.95,99.05,-0.95,990.5,-9.5,9905.0,-95.0,44.97,144.97,44.97,1449.7,449.7,14497.0,4497.0,103.0,203.0,103.0,2030.0,1030.0,20300.0,10300.0,Mercury Systems (MRCY) Surges 3.6%: Is This an Indication of Further Gains?,Zacks,2026-06-29,0.34,Mercury Systems Inc (MRCY) Sits on $1.6 Billion Backlog. Jefferies Commented About It,Insider Monkey,2026-06-26,0.0,"Mercury Systems, Inc. (MRCY): Among The Best Mid Cap Defense Stocks to Buy",Insider Monkey,2026-06-26,0.691,3,buy,0.7,Mercury Systems has surged +103% in 1yr and +43.86% YTD with +12.64% 1m momentum; $1.6bn backlog cited by Jefferies provides revenue visibility; P/E not applicable (negative earnings) but the defence electronics cycle supports continued order growth.,+103% 1yr return; +43.86% YTD; $1.6bn backlog; +12.64% 1m momentum,,,,,
DRS,Leonardo DRS,Defence,weapons,NYSE,40.95,-5.27%,-8.98%,-14.62%,+18.21%,-9%,8.24,0.121,38.27,0.99,1492780,6261480,19713880,85.0,1.35,none,,-5.27,94.73,-5.27,947.3,-52.7,9473.0,-527.0,-8.98,91.02,-8.98,910.2,-89.8,9102.0,-898.0,-14.62,85.38,-14.62,853.8,-146.2,8538.0,-1462.0,18.21,118.21,18.21,1182.1,182.1,11821.0,1821.0,-9.0,91.0,-9.0,910.0,-90.0,9100.0,-900.0,3 Reasons DRS is Risky and 1 Stock to Buy Instead,StockStory,2026-06-29,-0.202,Winners And Losers Of Q1: Leonardo DRS (NASDAQ:DRS) Vs The Rest Of The Defense Contractors Stocks,StockStory,2026-06-22,0.052,Leonardo DRS (DRS) Stock Valuation Check After Strong Multi Year Returns,Simply Wall St.,2026-06-12,0.511,,,,,,,,,,
XOM,ExxonMobil,Energy,oil-majors,NYSE,136.06,-0.73%,-1.74%,-8.92%,+12.43%,+27%,425.374,0.149,22.91,18.95,11888577,77759577,352406977,302.0,1.29,buy,2.29,-0.73,99.27,-0.73,992.7,-7.3,9927.0,-73.0,-1.74,98.26,-1.74,982.6,-17.4,9826.0,-174.0,-8.92,91.08,-8.92,910.8,-89.2,9108.0,-892.0,12.43,112.43,12.43,1124.3,124.3,11243.0,1243.0,27.0,127.0,27.0,1270.0,270.0,12700.0,2700.0,"Nvidia, Micron, and Broadcom hold the stock market's fate in the palm of their hands",Yahoo Finance,2026-06-29,0.0,Energy ETFs to Buy as Oil Price Slides to Pre-Iran War Level,Zacks,2026-06-29,-0.421,Why Wall Street Thinks Cheap Oil Is Here to Stay,Barrons.com,2026-06-29,0.0,7,buy,0.6,"ExxonMobil has +12.83% YTD and +27% 1-year return, P/E 22.99, dividend yield 3.02%, and a buy rating; despite recent oil-driven pullback, Permian production and integrated model provide stability.",+12.83% YTD; dividend yield 3.02%; buy consensus; Permian production,,,,,
CVX,Chevron,Energy,oil-majors,NYSE,168.47,-2.01%,-3.76%,-9.34%,+10.12%,+19%,253.073,0.472,29.3,10.35,8628635,46869135,179862835,416.0,1.09,buy,1.79,-2.01,97.99,-2.01,979.9,-20.1,9799.0,-201.0,-3.76,96.24,-3.76,962.4,-37.6,9624.0,-376.0,-9.34,90.66,-9.34,906.6,-93.4,9066.0,-934.0,10.12,110.12,10.12,1101.2,101.2,11012.0,1012.0,19.0,119.0,19.0,1190.0,190.0,11900.0,1900.0,Chevron surprises investors with eye-catching disclosure,TheStreet,2026-06-29,0.226,Energy ETFs to Buy as Oil Price Slides to Pre-Iran War Level,Zacks,2026-06-29,-0.421,Why Wall Street Thinks Cheap Oil Is Here to Stay,Barrons.com,2026-06-29,0.0,8,buy,0.58,"Chevron has +11.81% YTD and +19% 1-year return, dividend yield 4.16%, and a buy rating with strong analyst score of 1.79; 39-year dividend growth streak supports income-focused investors.",+11.81% YTD; dividend yield 4.16%; analyst score 1.79; 39-year dividend growth,,,,,
SHEL,Shell,Energy,oil-majors,NYSE,76.89,+0.17%,-3.48%,-9.98%,+3.81%,+9%,160.763,-0.248,11.98,7.66,7582152,33114014,132056770,408.0,1.96,buy,2.07,0.17,100.17,0.17,1001.7,1.7,10017.0,17.0,-3.48,96.52,-3.48,965.2,-34.8,9652.0,-348.0,-9.98,90.02,-9.98,900.2,-99.8,9002.0,-998.0,3.81,103.81,3.81,1038.1,38.1,10381.0,381.0,9.0,109.0,9.0,1090.0,90.0,10900.0,900.0,Energy ETFs to Buy as Oil Price Slides to Pre-Iran War Level,Zacks,2026-06-29,-0.421,Is Libya Quietly Becoming the Biggest Oil Prize the West Can’t Afford to Ignore?,Oilprice.com,2026-06-29,0.202,"Forget Shell Stock, A Pipeline ETF Quietly Pays Retirees 7.79% Every Month and Still Returned 15% This Year",24/7 Wall St.,2026-06-29,-0.226,10,buy,0.5,"Shell has +3.32% YTD and +9% 1-year return, low P/E of 11.92, dividend yield 4.08%, and a buy rating; buyback pause and oil slump create near-term headwinds but valuation is compelling.",P/E 11.92; dividend yield 4.08%; buy consensus; low valuation,,,,,
BP,BP p.l.c.,Energy,oil-majors,NYSE,37.35,+0.13%,-6.11%,-13.02%,+6.80%,+24%,72.544,-0.239,30.12,10.81,17664168,60094668,179338668,538.0,0.73,hold,2.53,0.13,100.13,0.13,1001.3,1.3,10013.0,13.0,-6.11,93.89,-6.11,938.9,-61.1,9389.0,-611.0,-13.02,86.98,-13.02,869.8,-130.2,8698.0,-1302.0,6.8,106.8,6.8,1068.0,68.0,10680.0,680.0,24.0,124.0,24.0,1240.0,240.0,12400.0,2400.0,Energy ETFs to Buy as Oil Price Slides to Pre-Iran War Level,Zacks,2026-06-29,-0.421,Is Libya Quietly Becoming the Biggest Oil Prize the West Can’t Afford to Ignore?,Oilprice.com,2026-06-29,0.202,European Equities Traded in the US as American Depositary Receipts Track Higher in Monday Trading,MT Newswires,2026-06-29,0.0,,,,,,,,,,
TTE,TotalEnergies,Energy,oil-majors,NYSE,77.67,+0.74%,-3.72%,-12.45%,+18.04%,+25%,130.239,0.045,11.52,1.68,2304964,9702064,32834664,549.0,0.2,buy,2.0,0.74,100.74,0.74,1007.4,7.4,10074.0,74.0,-3.72,96.28,-3.72,962.8,-37.2,9628.0,-372.0,-12.45,87.55,-12.45,875.5,-124.5,8755.0,-1245.0,18.04,118.04,18.04,1180.4,180.4,11804.0,1804.0,25.0,125.0,25.0,1250.0,250.0,12500.0,2500.0,Energy ETFs to Buy as Oil Price Slides to Pre-Iran War Level,Zacks,2026-06-29,-0.421,Is Libya Quietly Becoming the Biggest Oil Prize the West Can’t Afford to Ignore?,Oilprice.com,2026-06-29,0.202,Will Constellation's Long-Term Nuclear PPAs Drive Sustainable Growth?,Zacks,2026-06-29,0.382,,,,,,,,,,
EQNR,Equinor,Energy,oil-majors,NYSE,31.18,-0.45%,-5.14%,-16.45%,+30.02%,+23%,58.551,-0.752,14.11,4.86,2145630,15603430,75928830,490.0,3.06,hold,3.33,-0.45,99.55,-0.45,995.5,-4.5,9955.0,-45.0,-5.14,94.86,-5.14,948.6,-51.4,9486.0,-514.0,-16.45,83.55,-16.45,835.5,-164.5,8355.0,-1645.0,30.02,130.02,30.02,1300.2,300.2,13002.0,3002.0,23.0,123.0,23.0,1230.0,230.0,12300.0,2300.0,Equinor to end offshore wind operations in Japan,Power Technology,2026-06-29,0.0,Sector Update: Energy Stocks Decline Late Afternoon,MT Newswires,2026-06-26,0.273,Sector Update: Energy Stocks Decline Friday Afternoon,MT Newswires,2026-06-26,0.273,,,,,,,,,,
COP,ConocoPhillips,Energy,ep-refining,NYSE,104.2,-2.43%,-5.01%,-9.85%,+9.40%,+18%,95.75,0.106,17.66,8.23,4767657,38415457,158787157,317.0,1.97,buy,1.73,-2.43,97.57,-2.43,975.7,-24.3,9757.0,-243.0,-5.01,94.99,-5.01,949.9,-50.1,9499.0,-501.0,-9.85,90.15,-9.85,901.5,-98.5,9015.0,-985.0,9.4,109.4,9.4,1094.0,94.0,10940.0,940.0,18.0,118.0,18.0,1180.0,180.0,11800.0,1800.0,2 Oil Stocks Still Worth Buying With Oil Down to $70 a Barrel,Motley Fool,2026-06-27,0.226,3 Profitable Stocks with Solid Fundamentals,StockStory,2026-06-26,0.542,ConocoPhillips (COP) Plans General Counsel Kelly B. Rose Retirement For 2026,Simply Wall St.,2026-06-26,0.0,6,buy,0.65,"ConocoPhillips has +11.25% YTD and +18% 1-year return, P/E 17.96, low beta of 0.106, and a buy rating with strong analyst score of 1.73; attractive at current oil prices near $70.",+11.25% YTD; P/E 17.96; analyst score 1.73; low beta 0.106,,,,,
OXY,Occidental Petroleum,Energy,ep-refining,NYSE,49.09,-2.46%,-5.60%,-16.30%,+16.92%,+19%,36.828,0.124,66.34,12.93,9610679,47554279,198082779,208.0,0.02,hold,2.54,-2.46,97.54,-2.46,975.4,-24.6,9754.0,-246.0,-5.6,94.4,-5.6,944.0,-56.0,9440.0,-560.0,-16.3,83.7,-16.3,837.0,-163.0,8370.0,-1630.0,16.92,116.92,16.92,1169.2,169.2,11692.0,1692.0,19.0,119.0,19.0,1190.0,190.0,11900.0,1900.0,Occidental Petroleum or Chevron: Which Oil Stock Offers More Upside?,Zacks,2026-06-29,0.0,Occidental Petroleum Corporation (OXY) Is a Trending Stock: Facts to Know Before Betting on It,Zacks,2026-06-26,0.0,Trump turns on Big Oil donors who spent nearly $100 million to get him elected—now he wants the DOJ to investigate them for price gouging,Fortune,2026-06-25,0.0,,,,,,,,,,
EOG,EOG Resources,Energy,ep-refining,NYSE,131.93,-0.57%,-0.68%,-3.43%,+25.13%,+11%,53.002,0.256,12.97,4.03,2527509,22285109,83242409,308.0,3.87,buy,2.17,-0.57,99.43,-0.57,994.3,-5.7,9943.0,-57.0,-0.68,99.32,-0.68,993.2,-6.8,9932.0,-68.0,-3.43,96.57,-3.43,965.7,-34.3,9657.0,-343.0,25.13,125.13,25.13,1251.3,251.3,12513.0,2513.0,11.0,111.0,11.0,1110.0,110.0,11100.0,1100.0,Can Devon's Multi-Basin Assets Sustain Growth for Years to Come?,Zacks,2026-06-18,0.511,"The Zacks Analyst Blog Highlights Exxon Mobil, ConocoPhillips and EOG Resources",Zacks,2026-06-18,0.0,Oil Prices Slide on US-Iran Deal: 3 Energy Stocks Worth Watching,Zacks,2026-06-17,0.459,3,buy,0.75,"EOG Resources has +25.76% YTD and +11% 1-year return, 1W momentum of +2.02%, low P/E of 13.04, and a buy rating; resilient E&P cash flows and low valuation offer value.",+25.76% YTD; +2.02% 1W momentum; P/E 13.04; buy consensus,,,,,
MPC,Marathon Petroleum,Energy,ep-refining,NYSE,259.22,+1.29%,+4.82%,+0.22%,+58.36%,+53%,57.079,0.522,17.07,2.4,2380452,14332352,52024752,154.0,3.04,buy,2.33,1.29,101.29,1.29,1012.9,12.9,10129.0,129.0,4.82,104.82,4.82,1048.2,48.2,10482.0,482.0,0.22,100.22,0.22,1002.2,2.2,10022.0,22.0,58.36,158.36,58.36,1583.6,583.6,15836.0,5836.0,53.0,153.0,53.0,1530.0,530.0,15300.0,5300.0,Marathon Petroleum (MPC) Stock After 366% Five-Year Run Is There Value Left?,Simply Wall St.,2026-06-26,0.34,Why the Market Dipped But Marathon Petroleum (MPC) Gained Today,Zacks,2026-06-25,0.527,Marathon Petroleum (MPC) Stock Fair Value Edges Higher After Analyst Target Increases,Simply Wall St.,2026-06-25,0.572,2,strong_buy,0.82,"Marathon Petroleum shows +55.21% YTD and +53% 1-year return, with positive 1M (+2.84%) and 1W (+4.59%) momentum, P/E 16.73, and a buy rating; strong refining cash flows support further upside.",+55.21% YTD; +4.59% 1W momentum; P/E 16.73; buy consensus,,,,,
VLO,Valero Energy,Energy,ep-refining,NYSE,266.32,+2.04%,+9.25%,+5.46%,+62.86%,+93%,59.646,0.553,19.45,3.21,2515633,21057333,66094233,185.0,4.31,buy,2.42,2.04,102.04,2.04,1020.4,20.4,10204.0,204.0,9.25,109.25,9.25,1092.5,92.5,10925.0,925.0,5.46,105.46,5.46,1054.6,54.6,10546.0,546.0,62.86,162.86,62.86,1628.6,628.6,16286.0,6286.0,93.0,193.0,93.0,1930.0,930.0,19300.0,9300.0,Energy ETFs to Buy as Oil Price Slides to Pre-Iran War Level,Zacks,2026-06-29,-0.421,"Why HF Sinclair Is a Cash Flow Story, Not Merely a Valuation Play",Zacks,2026-06-29,0.34,Will Refining Flexibility Drive HF Sinclair's Summer Performance?,Zacks,2026-06-29,0.34,1,strong_buy,0.85,"Valero leads the universe with +58.61% YTD and +93% 1-year return, strong 1W momentum of +9.76%, P/E 18.95, and a buy analyst consensus; refining margins remain robust despite broader oil volatility.",+58.61% YTD; +9.76% 1W momentum; P/E 18.95; buy consensus,,,,,
SLB,SLB (Schlumberger),Energy,oilfield-services,NYSE,46.38,-1.92%,-3.27%,-14.84%,+16.66%,+39%,52.301,0.708,20.43,15.17,8059310,103299110,336874110,251.0,3.99,buy,1.62,-1.92,98.08,-1.92,980.8,-19.2,9808.0,-192.0,-3.27,96.73,-3.27,967.3,-32.7,9673.0,-327.0,-14.84,85.16,-14.84,851.6,-148.4,8516.0,-1484.0,16.66,116.66,16.66,1166.6,166.6,11666.0,1666.0,39.0,139.0,39.0,1390.0,390.0,13900.0,3900.0,SLB N.V. (SLB) Launches SLB Digital Marketplace,Insider Monkey,2026-06-28,0.0,NOV vs. SLB N.V.: Which Energy Stock Is a Better Buy in 2026?,Motley Fool,2026-06-28,0.612,Is SLB N.V. (SLB) One of the Best Low Volatility Stocks to Buy Under $50?,Insider Monkey,2026-06-27,0.477,,,,,,,,,,
HAL,Halliburton,Energy,oilfield-services,NYSE,34.09,-0.90%,-3.07%,-13.00%,+16.22%,+68%,21.48,0.704,18.83,12.92,8069946,69254746,251927546,199.0,5.38,buy,1.81,-0.9,99.1,-0.9,991.0,-9.0,9910.0,-90.0,-3.07,96.93,-3.07,969.3,-30.7,9693.0,-307.0,-13.0,87.0,-13.0,870.0,-130.0,8700.0,-1300.0,16.22,116.22,16.22,1162.2,162.2,11622.0,1622.0,68.0,168.0,68.0,1680.0,680.0,16800.0,6800.0,"Halliburton, Valero and 3 More Stocks Set Up for a Fragile Hormuz Truce",Oilprice.com,2026-06-29,0.0,Halliburton's Q2 2026 Earnings: What to Expect,Barchart,2026-06-29,0.0,Halliburton (HAL) Ascends While Market Falls: Some Facts to Note,Zacks,2026-06-25,0.0,,,,,,,,,,
BKR,Baker Hughes,Energy,oilfield-services,NASDAQ,56.31,-0.45%,-4.80%,-10.58%,+20.30%,+48%,42.136,0.938,17.99,8.18,5642317,44299617,153551217,163.0,2.93,buy,1.77,-0.45,99.55,-0.45,995.5,-4.5,9955.0,-45.0,-4.8,95.2,-4.8,952.0,-48.0,9520.0,-480.0,-10.58,89.42,-10.58,894.2,-105.8,8942.0,-1058.0,20.3,120.3,20.3,1203.0,203.0,12030.0,2030.0,48.0,148.0,48.0,1480.0,480.0,14800.0,4800.0,BKR Wins Angola Contract for Azule Energy's Greater PAJ Development,Zacks,2026-06-29,0.735,US rig count up 10 as prices drop,"Odessa American, Texas",2026-06-27,-0.382,"Correction: Exchange-Traded Funds, Equity Futures Decline Pre-Bell Friday as Investors Shift Focus From Middle East to Technology Stocks",MT Newswires,2026-06-26,0.0,,,,,,,,,,
NEE,NextEra Energy,Energy,utilities,NYSE,88.66,+0.17%,+3.00%,+6.75%,+11.11%,+28%,139.47,0.671,22.5,11.0,10542222,66634622,236362122,281.0,0.01,buy,1.95,0.17,100.17,0.17,1001.7,1.7,10017.0,17.0,3.0,103.0,3.0,1030.0,30.0,10300.0,300.0,6.75,106.75,6.75,1067.5,67.5,10675.0,675.0,11.11,111.11,11.11,1111.1,111.1,11111.0,1111.0,28.0,128.0,28.0,1280.0,280.0,12800.0,2800.0,Can Duke Energy's Investment Plan Deliver Years of Earnings Growth?,Zacks,2026-06-29,0.382,Why Big Tech’s Demand for Uninterrupted AI Power Is a Major Reality Check for NextEra Energy Investors,24/7 Wall St.,2026-06-29,0.153,"Your Portfolio Pays $60,000 A Year. So Why Can You Only Spend $45,000?",24/7 Wall St.,2026-06-29,0.0,4,buy,0.72,"NextEra Energy has +10.98% YTD and +28% 1-year return, positive 1M (+1.78%) and 1W (+2.09%) momentum, P/E 22.48, and a buy rating; AI-driven power demand supports regulated utility growth.",+10.98% YTD; +2.09% 1W momentum; P/E 22.48; buy consensus,,,,,
SSE.L,SSE plc,Energy,utilities,LSE,2459.0,+1.57%,+4.77%,+5.49%,+10.22%,+32%,0.297,0.596,23.42,4.23,4967083,23264350,94325971,284.0,,buy,2.07,1.57,101.57,1.57,1015.7,15.7,10157.0,157.0,4.77,104.77,4.77,1047.7,47.7,10477.0,477.0,5.49,105.49,5.49,1054.9,54.9,10549.0,549.0,10.22,110.22,10.22,1102.2,102.2,11022.0,1022.0,32.0,132.0,32.0,1320.0,320.0,13200.0,3200.0,SSE (LSE:SSE) Stock Fair Value Edges Lower After Mixed Analyst Target Changes,Simply Wall St.,2026-06-24,0.361,"UK, Japan to deepen ties with £18 billion investment agreement",Investing.com,2026-06-14,0.494,"Bears are Losing Control Over SSE (SSEZY), Here's Why It's a 'Buy' Now",Zacks,2026-06-10,-0.382,5,buy,0.68,"SSE has +8.52% YTD and +32% 1-year return, strong 1W momentum of +4.13%, P/E 23.06, and a buy rating; UK utility with regulated earnings and renewable expansion.",+32% 1-year return; +4.13% 1W momentum; P/E 23.06; buy consensus,,,,,
ENPH,Enphase Energy,Energy,clean-energy,NASDAQ,48.34,+2.09%,-7.77%,-24.16%,+43.23%,+20%,4.805,1.572,47.86,7.95,5095387,31970687,142943087,,22.12,hold,2.52,2.09,102.09,2.09,1020.9,20.9,10209.0,209.0,-7.77,92.23,-7.77,922.3,-77.7,9223.0,-777.0,-24.16,75.84,-24.16,758.4,-241.6,7584.0,-2416.0,43.23,143.23,43.23,1432.3,432.3,14323.0,4323.0,20.0,120.0,20.0,1200.0,200.0,12000.0,2000.0,Enphase Just Found A New Story To Tell,Trefis,2026-06-27,0.0,This Solar Power Stock Still Has a Bright Future,Barrons.com,2026-06-26,0.44,Here's Why Enphase Energy (ENPH) Fell More Than Broader Market,Zacks,2026-06-25,0.273,,,,,,,,,,
FSLR,First Solar,Energy,clean-energy,NASDAQ,232.8,-2.80%,-11.52%,-23.17%,-15.14%,+44%,18.868,1.692,15.03,2.49,1819605,8157205,47264105,,10.39,buy,2.14,-2.8,97.2,-2.8,972.0,-28.0,9720.0,-280.0,-11.52,88.48,-11.52,884.8,-115.2,8848.0,-1152.0,-23.17,76.83,-23.17,768.3,-231.7,7683.0,-2317.0,-15.14,84.86,-15.14,848.6,-151.4,8486.0,-1514.0,44.0,144.0,44.0,1440.0,440.0,14400.0,4400.0,First Solar (FSLR) Dips More Than Broader Market: What You Should Know,Zacks,2026-06-26,0.0,T1 Energy (TE) Draws Bernstein Coverage As Patent Risk Meets US Factory Push,Simply Wall St.,2026-06-25,0.0,First Solar Accelerates Growth Through Capacity Expansion & Innovation,Zacks,2026-06-24,0.637,,,,,,,,,,
BEPC,Brookfield Renewable Corp,Energy,clean-energy,NYSE,37.23,-1.25%,-1.87%,+0.00%,-4.89%,+15%,5.121,1.15,,1.53,1061861,7864061,31251361,416.0,,none,,-1.25,98.75,-1.25,987.5,-12.5,9875.0,-125.0,-1.87,98.13,-1.87,981.3,-18.7,9813.0,-187.0,0.0,100.0,0.0,1000.0,0.0,10000.0,0.0,-4.89,95.11,-4.89,951.1,-48.9,9511.0,-489.0,15.0,115.0,15.0,1150.0,150.0,11500.0,1500.0,Here's Why Buying Brookfield Renewable Today Could Be the Best Financial Decision You Ever Make,Motley Fool,2026-06-27,0.637,This is My Favorite Nuclear Energy Stock to Capitalize on the AI Power Boom,Motley Fool,2026-06-20,0.625,Brookfield Is Launching Another Renewable Energy Company. Here's What Investors Need to Know.,Motley Fool,2026-06-18,0.273,9,buy,0.55,"Brookfield Renewable has +0.77% 1W momentum, dividend yield 4.16%, and the highest news sentiment in the universe at 0.561; renewable tailwinds and yield appeal offset YTD decline.",dividend yield 4.16%; news sentiment 0.561; renewable tailwinds; positive 1W momentum,,,,,
DNNGY,Ørsted,Energy,clean-energy,NASDAQ,7.37,+0.96%,-4.04%,-14.40%,+10.58%,-49%,22.031,0.634,,0.13,12387,640687,2228587,,,none,,0.96,100.96,0.96,1009.6,9.6,10096.0,96.0,-4.04,95.96,-4.04,959.6,-40.4,9596.0,-404.0,-14.4,85.6,-14.4,856.0,-144.0,8560.0,-1440.0,10.58,110.58,10.58,1105.8,105.8,11058.0,1058.0,-49.0,51.0,-49.0,510.0,-490.0,5100.0,-4900.0,Energy & Utilities Roundup: Market Talk,The Wall Street Journal,2026-06-05,0.273,Ørsted Advances Flagship Offshore Wind Projects With Earnings And Risk In Focus,Simply Wall St.,2026-05-17,-0.178,Ørsted and PGE kick off offshore installation of Baltica 2 project,Energy Global,2026-05-14,0.0,,,,,,,,,,
AAPL,Apple,Tech,mega-cap,NASDAQ,281.74,-0.27%,-5.14%,-8.02%,+4.15%,+38%,3121.222,1.086,34.11,52.38,63825743,537625843,1333386743,38.0,0.98,buy,2.02,-0.27,99.73,-0.27,997.3,-2.7,9973.0,-27.0,-5.14,94.86,-5.14,948.6,-51.4,9486.0,-514.0,-8.02,91.98,-8.02,919.8,-80.2,9198.0,-802.0,4.15,104.15,4.15,1041.5,41.5,10415.0,415.0,38.0,138.0,38.0,1380.0,380.0,13800.0,3800.0,Why Samsung & SK Hynix are investing so much in South Korea's AI build-out,Yahoo Finance Video,2026-06-29,0.0,'Magnificent 7' stocks are having a dreadful year,Yahoo Finance,2026-06-29,0.25,Amazon Stock Climbs During Strong Day For Magnificent Seven,Investor's Business Daily,2026-06-29,0.836,,,,,,,,,,
MSFT,Microsoft,Tech,mega-cap,NASDAQ,368.57,-1.13%,+0.33%,-19.97%,-21.72%,-25%,2065.142,1.103,21.96,39.15,50623520,388072220,972172820,98.0,1.28,strong_buy,1.34,-1.13,98.87,-1.13,988.7,-11.3,9887.0,-113.0,0.33,100.33,0.33,1003.3,3.3,10033.0,33.0,-19.97,80.03,-19.97,800.3,-199.7,8003.0,-1997.0,-21.72,78.28,-21.72,782.8,-217.2,7828.0,-2172.0,-25.0,75.0,-25.0,750.0,-250.0,7500.0,-2500.0,"Tech giants are not going to slash their AI spending plans, bullish tech analyst says",Yahoo Finance,2026-06-29,0.206,Microsoft stock is headed for its worst month since 2000,Yahoo Finance,2026-06-29,-0.625,"Nvidia, Micron, and Broadcom hold the stock market's fate in the palm of their hands",Yahoo Finance,2026-06-29,0.0,,,,,,,,,,
GOOGL,Alphabet (Google),Tech,mega-cap,NASDAQ,353.65,+4.59%,+1.14%,-5.98%,+12.36%,+91%,3255.05,1.237,26.96,31.76,32451932,270590932,811153232,26.0,1.53,strong_buy,1.44,4.59,104.59,4.59,1045.9,45.9,10459.0,459.0,1.14,101.14,1.14,1011.4,11.4,10114.0,114.0,-5.98,94.02,-5.98,940.2,-59.8,9402.0,-598.0,12.36,112.36,12.36,1123.6,123.6,11236.0,1236.0,91.0,191.0,91.0,1910.0,910.0,19100.0,9100.0,"Stock market today: Dow closes above 52,000 for first time, S&P 500 and Nasdaq rally as tech gains",Yahoo Finance,2026-06-28,0.34,"Tech giants are not going to slash their AI spending plans, bullish tech analyst says",Yahoo Finance,2026-06-29,0.206,'Magnificent 7' stocks are having a dreadful year,Yahoo Finance,2026-06-29,0.25,,,,,,,,,,
AMZN,Amazon,Tech,mega-cap,NASDAQ,240.14,+3.51%,+3.16%,-8.08%,+6.02%,+6%,1948.465,1.444,32.67,49.9,74685016,531425616,1244582616,,1.01,strong_buy,1.34,3.51,103.51,3.51,1035.1,35.1,10351.0,351.0,3.16,103.16,3.16,1031.6,31.6,10316.0,316.0,-8.08,91.92,-8.08,919.2,-80.8,9192.0,-808.0,6.02,106.02,6.02,1060.2,60.2,10602.0,602.0,6.0,106.0,6.0,1060.0,60.0,10600.0,600.0,Retail 'FOMO' drives record SpaceX Options volume following blockbuster IPO,Yahoo Finance Video,2026-06-29,0.599,The next investing opportunity may be outside Big Tech,Yahoo Finance Video,2026-06-29,0.421,'Magnificent 7' stocks are having a dreadful year,Yahoo Finance,2026-06-29,0.25,,,,,,,,,,
META,Meta Platforms,Tech,mega-cap,NASDAQ,562.6,+2.06%,-0.22%,-6.22%,-13.35%,-25%,1077.2,1.229,20.45,17.09,14265970,77146670,378332670,38.0,1.37,strong_buy,1.31,2.06,102.06,2.06,1020.6,20.6,10206.0,206.0,-0.22,99.78,-0.22,997.8,-2.2,9978.0,-22.0,-6.22,93.78,-6.22,937.8,-62.2,9378.0,-622.0,-13.35,86.65,-13.35,866.5,-133.5,8665.0,-1335.0,-25.0,75.0,-25.0,750.0,-250.0,7500.0,-2500.0,Retail 'FOMO' drives record SpaceX Options volume following blockbuster IPO,Yahoo Finance Video,2026-06-29,0.599,'Magnificent 7' stocks are having a dreadful year,Yahoo Finance,2026-06-29,0.25,Amazon Stock Climbs During Strong Day For Magnificent Seven,Investor's Business Daily,2026-06-29,0.836,,,,,,,,,,
NVDA,NVIDIA,Tech,semiconductors,NASDAQ,194.97,+1.13%,-6.56%,-13.00%,+3.37%,+22%,3561.988,2.202,29.86,160.88,146600013,780363213,3255196113,52.0,1.29,strong_buy,1.3,1.13,101.13,1.13,1011.3,11.3,10113.0,113.0,-6.56,93.44,-6.56,934.4,-65.6,9344.0,-656.0,-13.0,87.0,-13.0,870.0,-130.0,8700.0,-1300.0,3.37,103.37,3.37,1033.7,33.7,10337.0,337.0,22.0,122.0,22.0,1220.0,220.0,12200.0,2200.0,"Stock market today: Dow closes above 52,000 for first time, S&P 500 and Nasdaq rally as tech gains",Yahoo Finance,2026-06-28,0.34,Why Samsung & SK Hynix are investing so much in South Korea's AI build-out,Yahoo Finance Video,2026-06-29,0.0,'Magnificent 7' stocks are having a dreadful year,Yahoo Finance,2026-06-29,0.25,,,,,,,,,,
AMD,Advanced Micro Devices,Tech,semiconductors,NASDAQ,539.49,+4.01%,-2.20%,+5.76%,+141.41%,+268%,663.535,2.492,178.05,37.58,26361008,162799208,637343708,,2.88,strong_buy,1.45,4.01,104.01,4.01,1040.1,40.1,10401.0,401.0,-2.2,97.8,-2.2,978.0,-22.0,9780.0,-220.0,5.76,105.76,5.76,1057.6,57.6,10576.0,576.0,141.41,241.41,141.41,2414.1,1414.1,24141.0,14141.0,268.0,368.0,268.0,3680.0,2680.0,36800.0,26800.0,Why Samsung & SK Hynix are investing so much in South Korea's AI build-out,Yahoo Finance Video,2026-06-29,0.0,"Tech rebound lifts Dow to record, yen hits 40-year low against dollar",AFP,2026-06-29,-0.273,The Margin Squeeze Threatening Intel Stock,Trefis,2026-06-29,-0.527,,,,,,,,,,
