ticker,company_name,sector,category,exchange,price_usd,change_1d,change_1w,change_1m,change_ytd,return_1yr,market_cap_gbp_b,beta,pe_ratio,avg_volume_m,vol_1d,vol_1w,vol_1m,div_yield_pct,short_pct,analyst,analyst_score,pct_1d,val_100_1d,profit_100_1d,val_1000_1d,profit_1000_1d,val_10000_1d,profit_10000_1d,pct_1w,val_100_1w,profit_100_1w,val_1000_1w,profit_1000_1w,val_10000_1w,profit_10000_1w,pct_1m,val_100_1m,profit_100_1m,val_1000_1m,profit_1000_1m,val_10000_1m,profit_10000_1m,pct_ytd,val_100_ytd,profit_100_ytd,val_1000_ytd,profit_1000_ytd,val_10000_ytd,profit_10000_ytd,pct_1y,val_100_1y,profit_100_1y,val_1000_1y,profit_1000_1y,val_10000_1y,profit_10000_1y,news1_title,news1_publisher,news1_date,news1_sentiment,news2_title,news2_publisher,news2_date,news2_sentiment,news3_title,news3_publisher,news3_date,news3_sentiment,signal_rank,signal,signal_confidence,signal_rationale,signal_drivers,portfolio_held,portfolio_quantity,portfolio_avg_price,portfolio_ppl,portfolio_total_value
HEI,HEICO Corporation,Defence,weapons,NYSE,342.45,+1.64%,+1.52%,+10.88%,+4.03%,+4%,36.324,1.035,61.15,0.69,379364,2323064,14245364,7.0,1.55,none,,1.64,101.64,1.64,1016.4,16.4,10164.0,164.0,1.52,101.52,1.52,1015.2,15.2,10152.0,152.0,10.88,110.88,10.88,1108.8,108.8,11088.0,1088.0,4.03,104.03,4.03,1040.3,40.3,10403.0,403.0,4.0,104.0,4.0,1040.0,40.0,10400.0,400.0,Here's Why You Should Add NOC Stock to Your Portfolio Right Now,Zacks,2026-06-25,0.0,"Should HEICO’s Record Q2, Dividend Hike, and Bigger Credit Line Require Action From HEI Investors?",Simply Wall St.,2026-06-25,0.382,Heico (HEI) Stock Weighs Lofty Valuation After Strong Multi‑Year Run,Simply Wall St.,2026-06-24,0.511,6,buy,0.7,"YTD +1.51%, +8.19% one-month momentum, analyst consensus buy (1.83), positive news sentiment 0.22, and a quality aerospace/defence franchise.",Solid one-month momentum (+8.19%); Analyst buy consensus; Positive news sentiment (0.22); High quality defence electronics business,,,,,
AXON,Axon Enterprise,Defence,weapons,NASDAQ,444.73,-2.23%,+5.13%,+15.42%,-21.07%,-43%,27.225,1.422,180.05,1.18,809338,6164838,25625038,,4.85,buy,1.6,-2.23,97.77,-2.23,977.7,-22.3,9777.0,-223.0,5.13,105.13,5.13,1051.3,51.3,10513.0,513.0,15.42,115.42,15.42,1154.2,154.2,11542.0,1542.0,-21.07,78.93,-21.07,789.3,-210.7,7893.0,-2107.0,-43.0,57.0,-43.0,570.0,-430.0,5700.0,-4300.0,AXON's Dedrone Expands in CUAS Capability: Can It Deliver Growth?,Zacks,2026-06-25,0.459,Citizens Sees 53% Upside in Axon,GuruFocus.com,2026-06-25,0.0,"Here is What to Know Beyond Why Axon Enterprise, Inc (AXON) is a Trending Stock",Zacks,2026-06-25,0.0,7,buy,0.65,"Despite a -48% one-year return, AXON has strong short-term momentum (+12.39% 1M), analyst buy consensus (1.60), positive news sentiment (0.161), and an upgraded outlook on AI push.",Strong one-month rebound (+12.39%); Analyst buy consensus (score 1.60); Positive news sentiment (0.161); AI and upgraded outlook catalysts,,,,,
OLN,Olin Corporation,Defence,weapons,NYSE,21.39,+3.28%,-7.00%,-18.14%,+0.75%,+4%,1.852,1.171,,2.53,3787017,20765917,64286817,373.0,13.77,hold,2.64,3.28,103.28,3.28,1032.8,32.8,10328.0,328.0,-7.0,93.0,-7.0,930.0,-70.0,9300.0,-700.0,-18.14,81.86,-18.14,818.6,-181.4,8186.0,-1814.0,0.75,100.75,0.75,1007.5,7.5,10075.0,75.0,4.0,104.0,4.0,1040.0,40.0,10400.0,400.0,Olin (OLN) Stock Could Be 16.3% Undervalued On Cost Cutting Narrative,Simply Wall St.,2026-06-21,-0.128,Olin (OLN) Agrees Huntsman Merger As Deal Fairness Probe Begins,Simply Wall St.,2026-06-21,0.202,"Lyft upgraded, Leidos downgraded: Wall Street's top analyst calls",The Fly,2026-06-17,0.202,,,,,,,,,,
MRCY,Mercury Systems,Defence,weapons,NASDAQ,105.57,+0.34%,-8.60%,+6.29%,+38.85%,+104%,4.814,0.949,,0.62,562420,3960220,16876520,,9.15,none,,0.34,100.34,0.34,1003.4,3.4,10034.0,34.0,-8.6,91.4,-8.6,914.0,-86.0,9140.0,-860.0,6.29,106.29,6.29,1062.9,62.9,10629.0,629.0,38.85,138.85,38.85,1388.5,388.5,13885.0,3885.0,104.0,204.0,104.0,2040.0,1040.0,20400.0,10400.0,3 Unpopular Stocks with Warning Signs,StockStory,2026-06-23,-0.34,Mercury Systems (MRCY) Stock Valuation After Strong Multi‑Period Gains And Backlog Expectations,Simply Wall St.,2026-06-15,0.691,Axon (AXON) Up 20.2% Since Last Earnings Report: Can It Continue?,Zacks,2026-06-05,0.0,2,strong_buy,0.8,"Exceptional +123% one-year return and +45.82% YTD, with strong 1-month momentum +11.63% and positive news sentiment 0.07.",Very strong YTD (+45.82%) and 1Y (+123%) performance; Strong 1-month +11.63% move; Innovation in defence electronics; Contract wins and backlog growth potential,,,,,
DRS,Leonardo DRS,Defence,weapons,NYSE,44.36,-2.68%,-4.77%,-3.14%,+28.06%,+0%,8.988,0.121,41.46,0.99,876246,4499146,20697846,81.0,1.31,none,,-2.68,97.32,-2.68,973.2,-26.8,9732.0,-268.0,-4.77,95.23,-4.77,952.3,-47.7,9523.0,-477.0,-3.14,96.86,-3.14,968.6,-31.4,9686.0,-314.0,28.06,128.06,28.06,1280.6,280.6,12806.0,2806.0,0.0,100.0,0.0,1000.0,0.0,10000.0,0.0,Winners And Losers Of Q1: Leonardo DRS (NASDAQ:DRS) Vs The Rest Of The Defense Contractors Stocks,StockStory,2026-06-22,0.052,Leonardo DRS (DRS) Stock Valuation Check After Strong Multi Year Returns,Simply Wall St.,2026-06-12,0.511,Leonardo DRS (DRS) Gained from the E-Drive and Golden Dome Initiative,Insider Monkey,2026-06-12,0.382,5,strong_buy,0.7,"Excellent YTD return of +32.04%, positive news sentiment 0.277, and low beta of 0.121 indicating relative stability.",Impressive YTD gain (+32.04%); Positive news sentiment (0.277); Low beta (0.121) for lower volatility; Defence electronics niche growth,,,,,
XOM,ExxonMobil,Energy,oil-majors,NYSE,137.55,+0.87%,-2.27%,-8.18%,+13.66%,+24%,432.084,0.149,23.16,19.16,8808983,102567983,384639983,301.0,1.14,buy,2.29,0.87,100.87,0.87,1008.7,8.7,10087.0,87.0,-2.27,97.73,-2.27,977.3,-22.7,9773.0,-227.0,-8.18,91.82,-8.18,918.2,-81.8,9182.0,-818.0,13.66,113.66,13.66,1136.6,136.6,11366.0,1366.0,24.0,124.0,24.0,1240.0,240.0,12400.0,2400.0,Prediction: You Won't Recognize ExxonMobil in 2040,Motley Fool,2026-06-25,0.0,"Exxon, Chevron investors cautious after oil news",TheStreet,2026-06-25,-0.103,"Stock Market News for Jun 25, 2026",Zacks,2026-06-25,0.0,6,buy,0.7,"YTD +15.46%, 1-year +28%, P/E 23.52, dividend yield 2.95%, positive short-term reversal (+0.85% 1D) and strong news sentiment (+0.251); integrated model buffers against oil price swings, with high dividend appeal.",1-year +28%; YTD +15.46%; dividend yield 2.95%; news sentiment +0.251,,,,,
CVX,Chevron,Energy,oil-majors,NYSE,172.24,+0.57%,-3.01%,-6.75%,+12.58%,+19%,259.971,0.472,30.01,10.42,7871410,55316310,204374310,415.0,1.16,buy,1.79,0.57,100.57,0.57,1005.7,5.7,10057.0,57.0,-3.01,96.99,-3.01,969.9,-30.1,9699.0,-301.0,-6.75,93.25,-6.75,932.5,-67.5,9325.0,-675.0,12.58,112.58,12.58,1125.8,125.8,11258.0,1258.0,19.0,119.0,19.0,1190.0,190.0,11900.0,1900.0,"Chevron, Microsoft deal fuels West Texas data center expansion",USA TODAY,2026-06-25,0.0,Sector Update: Energy Stocks Higher Late Afternoon,MT Newswires,2026-06-25,0.273,Sector Update: Energy Stocks Rise Thursday Afternoon,MT Newswires,2026-06-25,0.273,7,buy,0.7,"YTD +15.03%, 1-year +22%, dividend yield 4.05%, analyst score 1.79 'buy' with 10 buy ratings; premium integrated major with high dividend yield and low short interest (1.16%), though near-term oil price headwinds persist.",dividend yield 4.05%; analyst score 1.79; YTD +15.03%; low short interest 1.16%,,,,,
SHEL,Shell,Energy,oil-majors,NYSE,77.33,-0.49%,-3.79%,-9.06%,+4.40%,+9%,162.454,-0.248,12.05,7.7,5904648,34177108,152993381,402.0,1.89,buy,2.07,-0.49,99.51,-0.49,995.1,-4.9,9951.0,-49.0,-3.79,96.21,-3.79,962.1,-37.9,9621.0,-379.0,-9.06,90.94,-9.06,909.4,-90.6,9094.0,-906.0,4.4,104.4,4.4,1044.0,44.0,10440.0,440.0,9.0,109.0,9.0,1090.0,90.0,10900.0,900.0,European Equities Traded in US as ADRs Rise in Thursday Trading,MT Newswires,2026-06-25,0.0,Chevron CFO pushes back on Trump gas price-gouging probe,Quartz,2026-06-25,0.0,"The Zacks Analyst Blog Highlights Shell, Novo, SAP, Rave and Vaso",Zacks,2026-06-25,0.0,8,buy,0.65,"P/E 12.38, dividend yield 3.93%, 1-year +15%, YTD +7.34%, analyst 'buy'; attractive valuation and high yield, but recent -6.49% 1M reflects falling crude prices and a DOJ probe into gasoline pricing.",P/E 12.38; dividend yield 3.93%; analyst buy consensus; valuation support,,,,,
BP,BP p.l.c.,Energy,oil-majors,NYSE,37.72,-0.36%,-6.03%,-11.56%,+7.86%,+25%,73.612,-0.239,30.67,11.04,9362293,55558693,216552193,527.0,0.4,hold,2.53,-0.36,99.64,-0.36,996.4,-3.6,9964.0,-36.0,-6.03,93.97,-6.03,939.7,-60.3,9397.0,-603.0,-11.56,88.44,-11.56,884.4,-115.6,8844.0,-1156.0,7.86,107.86,7.86,1078.6,78.6,10786.0,786.0,25.0,125.0,25.0,1250.0,250.0,12500.0,2500.0,BP Inks New Deal With ADNOC to Develop UAE's Bab Gas Cap Project,Zacks,2026-06-25,0.0,Sector Update: Energy Stocks Lower Pre-Bell Thursday,MT Newswires,2026-06-25,-0.026,BP Deepens Its Middle East Gas Bet,GuruFocus.com,2026-06-25,0.0,,,,,,,,,,
TTE,TotalEnergies,Energy,oil-majors,NYSE,78.28,-0.97%,-4.68%,-13.06%,+18.96%,+28%,131.888,0.045,11.61,1.67,1275611,10470011,34233811,536.0,0.2,buy,2.0,-0.97,99.03,-0.97,990.3,-9.7,9903.0,-97.0,-4.68,95.32,-4.68,953.2,-46.8,9532.0,-468.0,-13.06,86.94,-13.06,869.4,-130.6,8694.0,-1306.0,18.96,118.96,18.96,1189.6,189.6,11896.0,1896.0,28.0,128.0,28.0,1280.0,280.0,12800.0,2800.0,Sector Update: Energy Stocks Higher Late Afternoon,MT Newswires,2026-06-25,0.273,Sector Update: Energy Stocks Rise Thursday Afternoon,MT Newswires,2026-06-25,0.273,Sector Update: Energy Stocks Lower Pre-Bell Thursday,MT Newswires,2026-06-25,-0.026,,,,,,,,,,
EQNR,Equinor,Energy,oil-majors,NYSE,31.56,-0.44%,-6.52%,-16.38%,+31.60%,+25%,59.548,-0.752,14.28,5.01,4216597,20489997,85671297,481.0,2.85,hold,3.33,-0.44,99.56,-0.44,995.6,-4.4,9956.0,-44.0,-6.52,93.48,-6.52,934.8,-65.2,9348.0,-652.0,-16.38,83.62,-16.38,836.2,-163.8,8362.0,-1638.0,31.6,131.6,31.6,1316.0,316.0,13160.0,3160.0,25.0,125.0,25.0,1250.0,250.0,12500.0,2500.0,Energy Transition Today - Romania's Wind Energy Milestone Secures Major Investment,Simply Wall St.,2026-06-25,0.67,European Equities Traded in the US as American Depositary Receipts Decline in Wednesday Trading,MT Newswires,2026-06-24,0.0,Are Options Traders Betting on a Big Move in Equinor Stock?,Zacks,2026-06-23,0.0,,,,,,,,,,
COP,ConocoPhillips,Energy,ep-refining,NYSE,106.41,+0.86%,-4.32%,-8.72%,+11.72%,+18%,98.248,0.106,18.04,8.2,5952783,50260983,172270183,314.0,1.83,buy,1.73,0.86,100.86,0.86,1008.6,8.6,10086.0,86.0,-4.32,95.68,-4.32,956.8,-43.2,9568.0,-432.0,-8.72,91.28,-8.72,912.8,-87.2,9128.0,-872.0,11.72,111.72,11.72,1117.2,117.2,11172.0,1172.0,18.0,118.0,18.0,1180.0,180.0,11800.0,1800.0,ConocoPhillips (COP) Named to RBC Capital’s June Global Energy Best Ideas List,Insider Monkey,2026-06-25,0.743,"Chord Energy and Atlas Energy Solutions Shares Are Falling, What You Need To Know",StockStory,2026-06-24,0.67,"Nabors Industries and ProPetro Shares Are Falling, What You Need To Know",StockStory,2026-06-24,0.153,5,buy,0.75,"YTD +15.46%, 1-year +23%, P/E 18.61, dividend yield 3.06%, analyst consensus 'buy' with best-in-class an_score of 1.78; diversified E&P with strong balance sheet and LNG growth optionality.",YTD +15.46%; P/E 18.61; dividend yield 3.06%; analyst score 1.78,,,,,
OXY,Occidental Petroleum,Energy,ep-refining,NYSE,51.21,+0.47%,-3.45%,-10.47%,+21.97%,+18%,38.602,0.124,69.2,13.26,7341346,48171246,222855846,204.0,0.02,hold,2.54,0.47,100.47,0.47,1004.7,4.7,10047.0,47.0,-3.45,96.55,-3.45,965.5,-34.5,9655.0,-345.0,-10.47,89.53,-10.47,895.3,-104.7,8953.0,-1047.0,21.97,121.97,21.97,1219.7,219.7,12197.0,2197.0,18.0,118.0,18.0,1180.0,180.0,11800.0,1800.0,The Energy Sector Is on Fire. Is Occidental Petroleum the Best Way to Play It?,Motley Fool,2026-06-25,0.743,"Chord Energy and Atlas Energy Solutions Shares Are Falling, What You Need To Know",StockStory,2026-06-24,0.67,"Nabors Industries and ProPetro Shares Are Falling, What You Need To Know",StockStory,2026-06-24,0.153,,,,,,,,,,
EOG,EOG Resources,Energy,ep-refining,NYSE,133.59,+1.17%,+0.26%,-1.92%,+26.70%,+11%,53.925,0.256,13.15,4.0,3634189,29622889,91177789,303.0,4.11,buy,2.17,1.17,101.17,1.17,1011.7,11.7,10117.0,117.0,0.26,100.26,0.26,1002.6,2.6,10026.0,26.0,-1.92,98.08,-1.92,980.8,-19.2,9808.0,-192.0,26.7,126.7,26.7,1267.0,267.0,12670.0,2670.0,11.0,111.0,11.0,1110.0,110.0,11100.0,1100.0,Can Devon's Multi-Basin Assets Sustain Growth for Years to Come?,Zacks,2026-06-18,0.511,"The Zacks Analyst Blog Highlights Exxon Mobil, ConocoPhillips and EOG Resources",Zacks,2026-06-18,0.0,Oil Prices Slide on US-Iran Deal: 3 Energy Stocks Worth Watching,Zacks,2026-06-17,0.459,3,buy,0.8,"YTD +27.94%, P/E 13.26, dividend yield 3.02%, 1-day +1.56% and 1-week +2.21%; low-cost producer with strong free cash flow generation, insulated from oil price volatility.",YTD +27.94%; P/E 13.26; 1-week +2.21%; dividend yield 3.02%,,,,,
MPC,Marathon Petroleum,Energy,ep-refining,NYSE,253.56,+3.48%,+3.66%,+2.22%,+54.90%,+47%,56.099,0.522,16.69,2.33,1795758,11821358,52761058,159.0,2.5,buy,2.33,3.48,103.48,3.48,1034.8,34.8,10348.0,348.0,3.66,103.66,3.66,1036.6,36.6,10366.0,366.0,2.22,102.22,2.22,1022.2,22.2,10222.0,222.0,54.9,154.9,54.9,1549.0,549.0,15490.0,5490.0,47.0,147.0,47.0,1470.0,470.0,14700.0,4700.0,Marathon Petroleum (MPC) Stock Fair Value Edges Higher After Analyst Target Increases,Simply Wall St.,2026-06-25,0.572,"Chord Energy and Atlas Energy Solutions Shares Are Falling, What You Need To Know",StockStory,2026-06-24,0.67,"Nabors Industries and ProPetro Shares Are Falling, What You Need To Know",StockStory,2026-06-24,0.153,1,strong_buy,0.85,"YTD +51.82%, 1-year +49%, P/E 16.37, dividend yield 1.57%, analyst consensus 'buy' with recent upward momentum (+0.19% 1M) bucking the sector downtrend; refining margins remain elevated as geopolitical tensions ease.",YTD +51.82%; P/E 16.37; analyst buy consensus; positive short-term momentum,,,,,
VLO,Valero Energy,Energy,ep-refining,NYSE,255.06,+6.07%,+6.38%,+5.64%,+55.97%,+77%,57.397,0.553,18.62,3.16,2517081,18207681,65946181,198.0,3.6,buy,2.42,6.07,106.07,6.07,1060.7,60.7,10607.0,607.0,6.38,106.38,6.38,1063.8,63.8,10638.0,638.0,5.64,105.64,5.64,1056.4,56.4,10564.0,564.0,55.97,155.97,55.97,1559.7,559.7,15597.0,5597.0,77.0,177.0,77.0,1770.0,770.0,17700.0,7700.0,Cenovus vs. Valero Energy: Which Energy Stock Is the Better Buy?,Zacks,2026-06-25,0.727,Do Elevated Cash Returns and Insider Sales Reveal a Tension in Valero’s Strategy (VLO)?,Simply Wall St.,2026-06-25,-0.318,Valero Energy (VLO) Stock Is Tied To A Cash Return Story Right Now,Simply Wall St.,2026-06-25,0.273,2,strong_buy,0.85,"YTD +49.01%, 1-year +80%, P/E 17.8, dividend yield 1.97%, plus +2.48% on the day and +0.92% over 1M; strong refining performance benefits from sustained crack spreads as global supply rebalances.",1-year +80%; YTD +49.01%; daily +2.48%; P/E 17.8,,,,,
SLB,SLB (Schlumberger),Energy,oilfield-services,NYSE,47.42,+1.67%,-5.78%,-17.78%,+19.28%,+38%,53.729,0.708,20.89,15.18,10375158,132269058,375678258,253.0,4.24,buy,1.62,1.67,101.67,1.67,1016.7,16.7,10167.0,167.0,-5.78,94.22,-5.78,942.2,-57.8,9422.0,-578.0,-17.78,82.22,-17.78,822.2,-177.8,8222.0,-1778.0,19.28,119.28,19.28,1192.8,192.8,11928.0,1928.0,38.0,138.0,38.0,1380.0,380.0,13800.0,3800.0,"Nabors Industries and ProPetro Shares Are Falling, What You Need To Know",StockStory,2026-06-24,0.153,"SM Energy, Kosmos Energy, and Tenaris Stocks Trade Down, What You Need To Know",StockStory,2026-06-24,0.494,"TechnipFMC and Valaris Shares Plummet, What You Need To Know",StockStory,2026-06-24,0.296,,,,,,,,,,
HAL,Halliburton,Energy,oilfield-services,NYSE,34.67,+2.39%,-4.31%,-15.24%,+18.20%,+64%,21.95,0.704,19.15,13.1,11241804,84481404,290888504,201.0,5.22,buy,1.81,2.39,102.39,2.39,1023.9,23.9,10239.0,239.0,-4.31,95.69,-4.31,956.9,-43.1,9569.0,-431.0,-15.24,84.76,-15.24,847.6,-152.4,8476.0,-1524.0,18.2,118.2,18.2,1182.0,182.0,11820.0,1820.0,64.0,164.0,64.0,1640.0,640.0,16400.0,6400.0,"Chord Energy and Atlas Energy Solutions Shares Are Falling, What You Need To Know",StockStory,2026-06-24,0.67,"Nabors Industries and ProPetro Shares Are Falling, What You Need To Know",StockStory,2026-06-24,0.153,"SM Energy, Kosmos Energy, and Tenaris Stocks Trade Down, What You Need To Know",StockStory,2026-06-24,0.494,,,,,,,,,,
BKR,Baker Hughes,Energy,oilfield-services,NASDAQ,56.94,+1.37%,-5.21%,-14.67%,+21.65%,+47%,42.81,0.938,18.19,8.12,9939116,55339916,178768416,163.0,2.91,buy,1.77,1.37,101.37,1.37,1013.7,13.7,10137.0,137.0,-5.21,94.79,-5.21,947.9,-52.1,9479.0,-521.0,-14.67,85.33,-14.67,853.3,-146.7,8533.0,-1467.0,21.65,121.65,21.65,1216.5,216.5,12165.0,2165.0,47.0,147.0,47.0,1470.0,470.0,14700.0,4700.0,Baker Hughes Unlocks Geothermal Opportunity in North America,Zacks,2026-06-25,0.421,Baker Hughes (BKR) Stock After Recent Pullback Is The Current Valuation Attractive?,Simply Wall St.,2026-06-25,0.44,Why Baker Hughes (BKR) Stock Is Down Today,StockStory,2026-06-24,0.0,,,,,,,,,,
NEE,NextEra Energy,Energy,utilities,NYSE,87.7,+0.57%,+2.30%,+0.79%,+9.90%,+23%,138.618,0.671,22.26,10.76,12403492,70210992,270023892,285.0,0.01,buy,1.95,0.57,100.57,0.57,1005.7,5.7,10057.0,57.0,2.3,102.3,2.3,1023.0,23.0,10230.0,230.0,0.79,100.79,0.79,1007.9,7.9,10079.0,79.0,9.9,109.9,9.9,1099.0,99.0,10990.0,990.0,23.0,123.0,23.0,1230.0,230.0,12300.0,2300.0,The Portfolio That Quietly Pays For Your Midlife Crisis Car,24/7 Wall St.,2026-06-25,-0.625,Customer Growth and Strategic Investments Drive OGS' Performance,Zacks,2026-06-25,0.382,"The Dividend Growth Path That Turns A $50,000 Income Stream Into More Than $100,000",24/7 Wall St.,2026-06-25,0.382,4,buy,0.75,"YTD +8.31%, P/E 21.94, dividend yield 2.88%, analyst 'buy' with near-flat 1M (-0.67%) and positive news sentiment (+0.224); stable regulated utility with growing renewables exposure benefits from falling rates and data centre demand.",P/E 21.94; dividend yield 2.88%; low short interest 0.01%; data centre demand tailwind,,,,,
SSE.L,SSE plc,Energy,utilities,LSE,2419.0,+3.02%,+4.63%,-1.63%,+8.43%,+28%,0.292,0.596,23.04,4.22,4914878,24819762,95718614,293.0,,buy,2.0,3.02,103.02,3.02,1030.2,30.2,10302.0,302.0,4.63,104.63,4.63,1046.3,46.3,10463.0,463.0,-1.63,98.37,-1.63,983.7,-16.3,9837.0,-163.0,8.43,108.43,8.43,1084.3,84.3,10843.0,843.0,28.0,128.0,28.0,1280.0,280.0,12800.0,2800.0,SSE (LSE:SSE) Stock Fair Value Edges Lower After Mixed Analyst Target Changes,Simply Wall St.,2026-06-24,0.361,"UK, Japan to deepen ties with £18 billion investment agreement",Investing.com,2026-06-14,0.494,"Bears are Losing Control Over SSE (SSEZY), Here's Why It's a 'Buy' Now",Zacks,2026-06-10,-0.382,9,buy,0.6,"1-year +27%, P/E 22.27, dividend yield 2.94%, analyst 'buy'; UK utility with renewable generation assets benefits from stable regulatory framework and lower interest rate outlook, though YTD only +4.80%.",1-year +27%; dividend yield 2.94%; analyst buy; regulation tailwind,,,,,
ENPH,Enphase Energy,Energy,clean-energy,NASDAQ,47.21,-3.79%,-1.19%,-29.43%,+39.88%,+11%,4.716,1.572,46.74,7.88,6628334,38623334,168443334,,24.43,hold,2.52,-3.79,96.21,-3.79,962.1,-37.9,9621.0,-379.0,-1.19,98.81,-1.19,988.1,-11.9,9881.0,-119.0,-29.43,70.57,-29.43,705.7,-294.3,7057.0,-2943.0,39.88,139.88,39.88,1398.8,398.8,13988.0,3988.0,11.0,111.0,11.0,1110.0,110.0,11100.0,1100.0,Sunrun (RUN) Soars 12.6%: Is Further Upside Left in the Stock?,Zacks,2026-06-25,0.0,"Stock Market Today, June 24: Sunrun Jumps After Announcing Deal With Tesla and Renew Home for 16 Gigawatts of Flexible Power",Motley Fool,2026-06-24,0.226,Enphase Energy (ENPH) Gains Upgrade as Solid-State Transformers Open AI Data Center Opportunity,Insider Monkey,2026-06-24,0.743,,,,,,,,,,
FSLR,First Solar,Energy,clean-energy,NASDAQ,248.64,-0.74%,-2.42%,-7.89%,-9.37%,+60%,20.248,1.692,16.07,2.5,1119115,10180315,61160715,,10.39,buy,2.14,-0.74,99.26,-0.74,992.6,-7.4,9926.0,-74.0,-2.42,97.58,-2.42,975.8,-24.2,9758.0,-242.0,-7.89,92.11,-7.89,921.1,-78.9,9211.0,-789.0,-9.37,90.63,-9.37,906.3,-93.7,9063.0,-937.0,60.0,160.0,60.0,1600.0,600.0,16000.0,6000.0,T1 Energy (TE) Draws Bernstein Coverage As Patent Risk Meets US Factory Push,Simply Wall St.,2026-06-25,0.0,First Solar Accelerates Growth Through Capacity Expansion & Innovation,Zacks,2026-06-24,0.637,"TAN’s 82% Rally Masks a Quiet $3,350 Tax on $50,000 Over a Decade",24/7 Wall St.,2026-06-23,0.0,,,,,,,,,,
BEPC,Brookfield Renewable Corp,Energy,clean-energy,NYSE,37.62,-1.23%,+4.56%,-2.73%,-3.90%,+15%,5.2,1.15,,1.54,1577050,8815450,34307350,414.0,,none,,-1.23,98.77,-1.23,987.7,-12.3,9877.0,-123.0,4.56,104.56,4.56,1045.6,45.6,10456.0,456.0,-2.73,97.27,-2.73,972.7,-27.3,9727.0,-273.0,-3.9,96.1,-3.9,961.0,-39.0,9610.0,-390.0,15.0,115.0,15.0,1150.0,150.0,11500.0,1500.0,This is My Favorite Nuclear Energy Stock to Capitalize on the AI Power Boom,Motley Fool,2026-06-20,0.625,Brookfield Is Launching Another Renewable Energy Company. Here's What Investors Need to Know.,Motley Fool,2026-06-18,0.273,3 High-Yield Energy Stocks Worth Buying for the Income -- and Holding for the Gains,Motley Fool,2026-06-17,0.66,10,buy,0.55,"1-week +3.47%, YTD -3.18%, dividend yield 4.14%, news sentiment +0.506 (highest in universe); clean energy developer with strong cash flow from long-term PPAs and AI data centre power demand catalyst, but P/E null and low visibility.",news sentiment +0.506; dividend yield 4.14%; 1-week +3.47%; AI power demand catalyst,,,,,
DNNGY,Ørsted,Energy,clean-energy,NASDAQ,7.47,+1.22%,-0.53%,-14.82%,+12.08%,-51%,22.437,0.634,,0.13,6184,662584,2422784,,,none,,1.22,101.22,1.22,1012.2,12.2,10122.0,122.0,-0.53,99.47,-0.53,994.7,-5.3,9947.0,-53.0,-14.82,85.18,-14.82,851.8,-148.2,8518.0,-1482.0,12.08,112.08,12.08,1120.8,120.8,11208.0,1208.0,-51.0,49.0,-51.0,490.0,-510.0,4900.0,-5100.0,Energy & Utilities Roundup: Market Talk,The Wall Street Journal,2026-06-05,0.273,Ørsted Advances Flagship Offshore Wind Projects With Earnings And Risk In Focus,Simply Wall St.,2026-05-17,-0.178,Ørsted and PGE kick off offshore installation of Baltica 2 project,Energy Global,2026-05-14,0.0,,,,,,,,,,
AAPL,Apple,Tech,mega-cap,NASDAQ,275.15,-5.38%,-7.03%,-10.76%,+1.72%,+46%,3069.311,1.086,33.31,47.87,102383867,338318767,1219916167,37.0,1.06,buy,2.06,-5.38,94.62,-5.38,946.2,-53.8,9462.0,-538.0,-7.03,92.97,-7.03,929.7,-70.3,9297.0,-703.0,-10.76,89.24,-10.76,892.4,-107.6,8924.0,-1076.0,1.72,101.72,1.72,1017.2,17.2,10172.0,172.0,46.0,146.0,46.0,1460.0,460.0,14600.0,4600.0,"Apple stock plunges after raising prices on MacBooks, iPads amid global memory crisis",Yahoo Finance,2026-06-25,-0.625,Big Tech stocks tumble while Micron continues to gain on Q3 earnings,Yahoo Finance Video,2026-06-25,0.527,May PCE: Inflation ticks up to highest level since 2023,Yahoo Finance Video,2026-06-25,0.0,,,,,,,,,,
MSFT,Microsoft,Tech,mega-cap,NASDAQ,352.83,-3.44%,-6.88%,-15.19%,-25.06%,-27%,1990.63,1.103,21.04,36.28,62728991,252771791,918191491,100.0,1.19,strong_buy,1.34,-3.44,96.56,-3.44,965.6,-34.4,9656.0,-344.0,-6.88,93.12,-6.88,931.2,-68.8,9312.0,-688.0,-15.19,84.81,-15.19,848.1,-151.9,8481.0,-1519.0,-25.06,74.94,-25.06,749.4,-250.6,7494.0,-2506.0,-27.0,73.0,-27.0,730.0,-270.0,7300.0,-2700.0,Micron earnings beat fuels hopes for Tech rally rebound,Yahoo Finance Video,2026-06-25,0.421,Alphabet makes the Dow look more like the Nasdaq,Yahoo Finance,2026-06-24,0.42,Dow Jones Futures: Mixed Market Signals As Micron's Gain Is Apple's Pain,Investor's Business Daily,2026-06-25,0.026,,,,,,,,,,
GOOGL,Alphabet (Google),Tech,mega-cap,NASDAQ,343.71,+0.46%,-5.52%,-11.56%,+9.20%,+99%,3185.454,1.237,26.2,30.4,42597335,218887235,781772635,25.0,1.42,strong_buy,1.44,0.46,100.46,0.46,1004.6,4.6,10046.0,46.0,-5.52,94.48,-5.52,944.8,-55.2,9448.0,-552.0,-11.56,88.44,-11.56,884.4,-115.6,8844.0,-1156.0,9.2,109.2,9.2,1092.0,92.0,10920.0,920.0,99.0,199.0,99.0,1990.0,990.0,19900.0,9900.0,Micron earnings beat fuels hopes for Tech rally rebound,Yahoo Finance Video,2026-06-25,0.421,Alphabet makes the Dow look more like the Nasdaq,Yahoo Finance,2026-06-24,0.42,Investors Are Getting Another Great Opportunity to Buy This Incredible Artificial Intelligence (AI) Stock Right Now,Motley Fool,2026-06-25,0.883,,,,,,,,,,
AMZN,Amazon,Tech,mega-cap,NASDAQ,227.01,-2.59%,-4.42%,-14.43%,+0.23%,+8%,1854.677,1.444,30.68,46.29,76001063,350789163,1093403263,,0.94,strong_buy,1.34,-2.59,97.41,-2.59,974.1,-25.9,9741.0,-259.0,-4.42,95.58,-4.42,955.8,-44.2,9558.0,-442.0,-14.43,85.57,-14.43,855.7,-144.3,8557.0,-1443.0,0.23,100.23,0.23,1002.3,2.3,10023.0,23.0,8.0,108.0,8.0,1080.0,80.0,10800.0,800.0,Qualcomm raises data center outlook on AI demand,Yahoo Finance Video,2026-06-25,-0.128,Alphabet makes the Dow look more like the Nasdaq,Yahoo Finance,2026-06-24,0.42,Amazon Stock Slips Below Key Level. Why It's A Rough Day For Cloud Hyperscaler Stocks.,Investor's Business Daily,2026-06-25,0.178,,,,,,,,,,
META,Meta Platforms,Tech,mega-cap,NASDAQ,542.87,-2.83%,-4.35%,-11.26%,-16.39%,-23%,1046.617,1.229,19.75,17.57,16443852,87740852,416653452,38.0,1.47,strong_buy,1.31,-2.83,97.17,-2.83,971.7,-28.3,9717.0,-283.0,-4.35,95.65,-4.35,956.5,-43.5,9565.0,-435.0,-11.26,88.74,-11.26,887.4,-112.6,8874.0,-1126.0,-16.39,83.61,-16.39,836.1,-163.9,8361.0,-1639.0,-23.0,77.0,-23.0,770.0,-230.0,7700.0,-2300.0,Qualcomm's 'next phase' is AI rack infrastructure: CFO,Yahoo Finance Video,2026-06-25,0.0,Meta Stock: 'Bulls Are Frustrated' But Analyst Sees Big Potential For AI Business Push,Investor's Business Daily,2026-06-25,-0.296,Amazon Stock Slips Below Key Level. Why It's A Rough Day For Cloud Hyperscaler Stocks.,Investor's Business Daily,2026-06-25,0.178,,,,,,,,,,
