ticker,company_name,sector,category,exchange,price_usd,change_1d,change_1w,change_1m,change_ytd,return_1yr,market_cap_gbp_b,beta,pe_ratio,avg_volume_m,vol_1d,vol_1w,vol_1m,div_yield_pct,short_pct,analyst,analyst_score,pct_1d,val_100_1d,profit_100_1d,val_1000_1d,profit_1000_1d,val_10000_1d,profit_10000_1d,pct_1w,val_100_1w,profit_100_1w,val_1000_1w,profit_1000_1w,val_10000_1w,profit_10000_1w,pct_1m,val_100_1m,profit_100_1m,val_1000_1m,profit_1000_1m,val_10000_1m,profit_10000_1m,pct_ytd,val_100_ytd,profit_100_ytd,val_1000_ytd,profit_1000_ytd,val_10000_ytd,profit_10000_ytd,pct_1y,val_100_1y,profit_100_1y,val_1000_1y,profit_1000_1y,val_10000_1y,profit_10000_1y,news1_title,news1_publisher,news1_date,news1_sentiment,news2_title,news2_publisher,news2_date,news2_sentiment,news3_title,news3_publisher,news3_date,news3_sentiment,signal_rank,signal,signal_confidence,signal_rationale,signal_drivers,portfolio_held,portfolio_quantity,portfolio_avg_price,portfolio_ppl,portfolio_total_value
INCY,Incyte,Biotech,oncology,NASDAQ,107.53,-1.22%,+8.63%,+10.74%,+6.02%,+53%,16.278,0.79,15.19,1.61,1810500,11708900,46180800,,9.83,buy,2.33,-1.22,98.78,-1.22,987.8,-12.2,9878.0,-122.0,8.63,108.63,8.63,1086.3,86.3,10863.0,863.0,10.74,110.74,10.74,1107.4,107.4,11074.0,1074.0,6.02,106.02,6.02,1060.2,60.2,10602.0,602.0,53.0,153.0,53.0,1530.0,530.0,15300.0,5300.0,2 Growth Stocks to Add to Your Roster and 1 We Avoid,StockStory,2026-06-22,0.103,"Here Are Monday’s Best Wall Street Analyst Research Calls: Accenture, Apple, Boyd Gaming, BWX Technologies, Conoco-Phillips, Estee Lauder, Hut 8, Incyte, SpaceX, and More",24/7 Wall St.,2026-06-22,0.637,Incyte Stock: Is INCY Outperforming the Healthcare Sector?,Barchart,2026-06-22,0.0,8,buy,0.6,"+53% 1Y, +7.52% 1M, P/E 14.75 is compelling for an oncology biotech; news sentiment high at 0.371 with low beta 0.79. Analyst score 2.33 (buy) supports continued upside.",+53% 1Y; P/E 14.75; News sentiment 0.371; Beta 0.79,,,,,
EXEL,Exelixis,Biotech,oncology,NASDAQ,53.23,-0.32%,+1.51%,+6.50%,+22.14%,+23%,10.138,0.435,17.63,2.57,2145680,17701080,57722380,,16.07,buy,2.16,-0.32,99.68,-0.32,996.8,-3.2,9968.0,-32.0,1.51,101.51,1.51,1015.1,15.1,10151.0,151.0,6.5,106.5,6.5,1065.0,65.0,10650.0,650.0,22.14,122.14,22.14,1221.4,221.4,12214.0,2214.0,23.0,123.0,23.0,1230.0,230.0,12300.0,2300.0,"Qualcomm upgrade, Intel initiation among today's top calls on Wall Street",The Fly,2026-06-25,0.202,"Here Are Thursday’s Best Wall Street Analyst Research Calls: Brown-Forman, CoreWeave, Intel, JFrog, Keurig Dr. Pepper, Klarna Group, Qualcomm, Shift 4 Payments, and More",24/7 Wall St.,2026-06-25,0.637,EXEL Down on Colorectal Cancer Study Data on Zanzalintinib,Zacks,2026-06-23,-0.66,,,,,,,,,,
ALNY,Alnylam Pharmaceuticals,Biotech,oncology,NASDAQ,293.17,+1.18%,+3.70%,-0.79%,-26.74%,-8%,29.659,0.267,73.85,1.12,1107523,7119723,26974723,,5.29,buy,1.79,1.18,101.18,1.18,1011.8,11.8,10118.0,118.0,3.7,103.7,3.7,1037.0,37.0,10370.0,370.0,-0.79,99.21,-0.79,992.1,-7.9,9921.0,-79.0,-26.74,73.26,-26.74,732.6,-267.4,7326.0,-2674.0,-8.0,92.0,-8.0,920.0,-80.0,9200.0,-800.0,"Alnylam Pharmaceuticals, Inc. (ALNY) and GENESIS Pharma Expand Commercial Partnership",Insider Monkey,2026-06-23,0.318,"Alnylam Pharmaceuticals (ALNY), Inceptive Form $2B Partnership to Advance RNAi Drug Discovery",Insider Monkey,2026-06-23,0.0,Alnylam (ALNY) Expands Its RNAi Therapeutics Reach Into Four More Nordic Countries,Insider Monkey,2026-06-22,0.128,,,,,,,,,,
RCUS,Arcus Biosciences,Biotech,oncology,NYSE,30.25,+1.33%,+25.41%,+25.36%,+29.88%,+239%*,2.883,0.837,,1.22,2282643,12303543,32110343,,15.32,none,,1.33,101.33,1.33,1013.3,13.3,10133.0,133.0,25.41,125.41,25.41,1254.1,254.1,12541.0,2541.0,25.36,125.36,25.36,1253.6,253.6,12536.0,2536.0,29.88,129.88,29.88,1298.8,298.8,12988.0,2988.0,239.0,339.0,239.0,3390.0,2390.0,33900.0,23900.0,Bristol Myers Squibb’s AI Overhaul And Oncology Trials Shape Value Story,Simply Wall St.,2026-06-12,0.34,"Arcus, Bristol Myers Team Up to Advance Kidney Cancer Study",Zacks,2026-06-04,-0.66,How Eisai (TSE:4523) Is Reframing Its Story With A Tweaked Fair Value Outlook,Simply Wall St.,2026-05-21,0.572,6,strong_buy,0.55,"+216% 1Y, +21.00% YTD, +16.78% 1M, +16.54% 1W; strong buy analyst rating (score 1.46) with no earnings (P/E null) but strong momentum in oncology pipeline.",+216% 1Y; +16.78% 1M; Analyst score 1.46 (strong_buy); Momentum across all timeframes,,,,,
MRNA,Moderna,Biotech,mrna,NASDAQ,59.75,-1.43%,-3.32%,+27.05%,+93.62%,+119%,17.964,1.03,,7.07,6162508,57123008,163755508,,17.82,hold,3.0,-1.43,98.57,-1.43,985.7,-14.3,9857.0,-143.0,-3.32,96.68,-3.32,966.8,-33.2,9668.0,-332.0,27.05,127.05,27.05,1270.5,270.5,12705.0,2705.0,93.62,193.62,93.62,1936.2,936.2,19362.0,9362.0,119.0,219.0,119.0,2190.0,1190.0,21900.0,11900.0,How Unanimous FDA Panel Support For mRNA Flu Shot At Moderna (MRNA) Has Changed Its Investment Story,Simply Wall St.,2026-06-24,0.026,Moderna (MRNA) Rises As Market Takes a Dip: Key Facts,Zacks,2026-06-23,0.0,Should You Buy Moderna Before Aug. 5?,Motley Fool,2026-06-22,0.0,1,buy,0.975,"+97.67% YTD, +29.70% 1M, strong momentum driven by unanimous FDA panel backing for mFlusiva (mRNA flu vaccine) [simplywall.st](https://simplywall.st/stocks/us/pharmaceuticals-biotech/nasdaq-mrna/moderna/news/moderna-mrna-is-up-101-after-unanimous-fda-panel-backing-for). High short interest of 17.82% and negative news sentiment (-0.182) temper conviction, but tidal regulatory catalyst supports sustained upside.",+97.67% YTD; +29.70% 1M momentum; Unanimous FDA panel endorsement for mFlusiva; Short interest 17.82%,,,,,
BNTX,BioNTech,Biotech,mrna,NASDAQ,90.0,-3.23%,-2.41%,-2.44%,-6.92%,-15%,17.246,1.324,,0.95,699274,4519974,23850774,,3.3,buy,1.55,-3.23,96.77,-3.23,967.7,-32.3,9677.0,-323.0,-2.41,97.59,-2.41,975.9,-24.1,9759.0,-241.0,-2.44,97.56,-2.44,975.6,-24.4,9756.0,-244.0,-6.92,93.08,-6.92,930.8,-69.2,9308.0,-692.0,-15.0,85.0,-15.0,850.0,-150.0,8500.0,-1500.0,"VERAXA Unveils Cancer Therapy Platform, Sparks Partnering Talks at BIO 2026",Exec Edge,2026-06-18,-0.66,PTC Therapeutics (PTCT) Moves 7.2% Higher: Will This Strength Last?,Zacks,2026-06-18,0.579,"US Equity Markets End Lower After Government Bond Yields Rise, Fed's Policy Statement",MT Newswires,2026-06-17,-0.296,,,,,,,,,,
NVAX,Novavax,Biotech,mrna,NASDAQ,8.56,-4.80%,-9.89%,-18.16%,+20.06%,+37%*,1.067,2.414,,4.66,4352612,25260412,112600112,,28.13,buy,2.33,-4.8,95.2,-4.8,952.0,-48.0,9520.0,-480.0,-9.89,90.11,-9.89,901.1,-98.9,9011.0,-989.0,-18.16,81.84,-18.16,818.4,-181.6,8184.0,-1816.0,20.06,120.06,20.06,1200.6,200.6,12006.0,2006.0,37.0,137.0,37.0,1370.0,370.0,13700.0,3700.0,Novavax (NVAX) Suffers a Larger Drop Than the General Market: Key Insights,Zacks,2026-06-24,-0.637,"Investors Heavily Search Novavax, Inc. (NVAX): Here is What You Need to Know",Zacks,2026-06-23,0.0,Novavax (NVAX) Stock Falls Amid Market Uptick: What Investors Need to Know,Zacks,2026-06-18,0.0,,,,,,,,,,
BMRN,BioMarin Pharmaceutical,Biotech,rare-disease,NASDAQ,57.35,-0.24%,+4.23%,+8.45%,-3.53%,+6%,8.399,0.24,41.26,2.01,1428486,11551986,49372486,,6.02,buy,1.69,-0.24,99.76,-0.24,997.6,-2.4,9976.0,-24.0,4.23,104.23,4.23,1042.3,42.3,10423.0,423.0,8.45,108.45,8.45,1084.5,84.5,10845.0,845.0,-3.53,96.47,-3.53,964.7,-35.3,9647.0,-353.0,6.0,106.0,6.0,1060.0,60.0,10600.0,600.0,Therapeutics Stocks Q1 Teardown: BioMarin Pharmaceutical (NASDAQ:BMRN) Vs The Rest,StockStory,2026-06-25,0.0,ABCELLERA BIOLG (ABCL) Surges 7.1%: Is This an Indication of Further Gains?,Zacks,2026-06-25,0.34,BioMarin (BMRN) Presents Positive Phase 2 Data for VOXZOGO in Hypochondroplasia Treatment,Insider Monkey,2026-06-23,0.557,10,buy,0.55,"+6.85% 1M, +1.53% 1W; positive Phase 2 data for VOXZOGO in hypochondroplasia treatment. News sentiment 0.353, analyst score 1.69 (buy), P/E 40.65 reflects orphan drug premium.",+6.85% 1M; Positive Phase 2 VOXZOGO data; News sentiment 0.353; Analyst score 1.69 (buy),,,,,
SRPT,Sarepta Therapeutics,Biotech,rare-disease,NASDAQ,16.02,-4.70%,-5.54%,-3.90%,-24.82%,-3%,1.282,0.205,45.77,2.94,2468059,15551959,64990259,,28.53,hold,2.83,-4.7,95.3,-4.7,953.0,-47.0,9530.0,-470.0,-5.54,94.46,-5.54,944.6,-55.4,9446.0,-554.0,-3.9,96.1,-3.9,961.0,-39.0,9610.0,-390.0,-24.82,75.18,-24.82,751.8,-248.2,7518.0,-2482.0,-3.0,97.0,-3.0,970.0,-30.0,9700.0,-300.0,"Sarepta's Elevidys Showing Signs of Stabilization as siRNA Pipeline Gains Importance, RBC Says",MT Newswires,2026-06-18,0.599,Is Sarepta (SRPT) Using New Equity Plans To Quietly Redefine Its Post‑Profitability Playbook?,Simply Wall St.,2026-06-08,0.0,All You Need to Know About Sarepta Therapeutics (SRPT) Rating Upgrade to Buy,Zacks,2026-06-08,0.0,,,,,,,,,,
COAG,Hemab Therapeutics,Biotech,rare-disease,NASDAQ,27.72,-3.60%,+4.80%,-0.43%,-18.47%,-15%,0.981,,,0.37,124949,2511749,5935049,,,strong_buy,1.0,-3.6,96.4,-3.6,964.0,-36.0,9640.0,-360.0,4.8,104.8,4.8,1048.0,48.0,10480.0,480.0,-0.43,99.57,-0.43,995.7,-4.3,9957.0,-43.0,-18.47,81.53,-18.47,815.3,-184.7,8153.0,-1847.0,-15.0,85.0,-15.0,850.0,-150.0,8500.0,-1500.0,"Hemab Therapeutics Details Post-IPO Pipeline Push, Sutacimig Phase III Plans",MarketBeat,2026-06-09,0.0,Hemab Therapeutics IPO Debut Puts COAG And Pipeline Risks In Focus,Simply Wall St.,2026-05-03,-0.273,,,,,,,,,,,,,,
NVO,Novo Nordisk,Biotech,metabolic,NYSE,47.64,+0.83%,+9.47%,+7.81%,-5.73%,-30%,159.804,0.349,11.37,15.46,9331828,68222328,290017828,380.0,0.71,buy,2.36,0.83,100.83,0.83,1008.3,8.3,10083.0,83.0,9.47,109.47,9.47,1094.7,94.7,10947.0,947.0,7.81,107.81,7.81,1078.1,78.1,10781.0,781.0,-5.73,94.27,-5.73,942.7,-57.3,9427.0,-573.0,-30.0,70.0,-30.0,700.0,-300.0,7000.0,-3000.0,Novo Nordisk (CPSE:NOVO B) Wins UK Approval For Oral Wegovy With Wider Consumer Ripple Effects,Simply Wall St.,2026-06-25,0.778,"An Analyst Just Declared Eli Lilly the ""Clear Winner"" of an American Diabetes Association Conference Focused on Weight-Loss Drugs. Novo's Chief Scientist Disagrees. Who's Right?",Motley Fool,2026-06-25,0.772,VKTX Stock Jumps on Phase I Study Initiation for New Obesity Drug,Zacks,2026-06-25,0.0,4,buy,0.8,"+7.97% 1W, +3.92% 1D after UK MHRA approved Wegovy oral pill for weight management, making UK the first European country to clear the formulation [tikr.com](https://www.tikr.com/blog/novo-nordisk-stock-jumped-6-on-uk-pill-approval-heres-where-shares-could-go-in-2026). P/E 11.29, dividend yield 3.80%, news sentiment 0.209.","+7.97% 1W; UK MHRA approved oral Wegovy pill; P/E 11.29, dividend 3.80%; News sentiment 0.209",,,,,
LLY,Eli Lilly,Biotech,metabolic,NYSE,1127.69,+1.37%,+1.41%,+5.91%,+4.74%,+41%,761.989,0.517,40.06,3.2,2188774,15898774,70636174,62.0,1.1,buy,1.74,1.37,101.37,1.37,1013.7,13.7,10137.0,137.0,1.41,101.41,1.41,1014.1,14.1,10141.0,141.0,5.91,105.91,5.91,1059.1,59.1,10591.0,591.0,4.74,104.74,4.74,1047.4,47.4,10474.0,474.0,41.0,141.0,41.0,1410.0,410.0,14100.0,4100.0,"Employers, governments join forces to address AI job loss concerns",Yahoo Finance Video,2026-06-25,-0.026,Sector Update: Healthcare Stocks Gain Late Afternoon,MT Newswires,2026-06-25,0.527,"An Analyst Just Declared Eli Lilly the ""Clear Winner"" of an American Diabetes Association Conference Focused on Weight-Loss Drugs. Novo's Chief Scientist Disagrees. Who's Right?",Motley Fool,2026-06-25,0.772,,,,,,,,,,
LEGN,Legend Biotech,Biotech,neuroscience,NASDAQ,28.43,-5.33%,-15.18%,-3.73%,+32.17%,-12%,4.167,0.352,,2.71,1842378,23280478,73710778,,17.1,buy,1.6,-5.33,94.67,-5.33,946.7,-53.3,9467.0,-533.0,-15.18,84.82,-15.18,848.2,-151.8,8482.0,-1518.0,-3.73,96.27,-3.73,962.7,-37.3,9627.0,-373.0,32.17,132.17,32.17,1321.7,321.7,13217.0,3217.0,-12.0,88.0,-12.0,880.0,-120.0,8800.0,-1200.0,Legend Biotech Corporation (LEGN) Price Target Raised to $49 on LB5006 Clinical Progress,Insider Monkey,2026-06-25,0.421,"After Apogee, 3 More Biotech Buyout Targets Wall Street Can’t Stop Watching",24/7 Wall St.,2026-06-24,-0.296,Legend Biotech (LEGN) Reports a Complete Response in Five of Six Patients at Its Highest Dose,Insider Monkey,2026-06-22,0.0,,,,,,,,,,
IONS,Ionis Pharmaceuticals,Biotech,neuroscience,NASDAQ,78.34,+0.44%,+5.42%,+2.98%,-1.67%,+92%,9.81,0.37,,1.8,2556621,11388221,39448221,,13.64,buy,1.62,0.44,100.44,0.44,1004.4,4.4,10044.0,44.0,5.42,105.42,5.42,1054.2,54.2,10542.0,542.0,2.98,102.98,2.98,1029.8,29.8,10298.0,298.0,-1.67,98.33,-1.67,983.3,-16.7,9833.0,-167.0,92.0,192.0,92.0,1920.0,920.0,19200.0,9200.0,FDA Expands IONS' Tryngolza Label to Treat Severe Hypertriglyceridemia,Zacks,2026-06-25,0.128,IONS Stock Jumps 4% After-Hours — Goldman Sachs Lifts Price Target On Tryngolza Approval,Stocktwits,2026-06-24,0.477,"Ionis, with new FDA nod, hits a ‘commercial inflection point’",BioPharma Dive,2026-06-24,0.0,,,,,,,,,,
BTC,Bitcoin,Crypto,bitcoin,Crypto,60135.137431,-1.44%,-4.40%,-20.66%,-31.29%,-31%,915.648,,,26825.09,43197491544,187775639640,1040760878760,,,,,-1.44,98.56,-1.44,985.6,-14.4,9856.0,-144.0,-4.4,95.6,-4.4,956.0,-44.0,9560.0,-440.0,-20.66,79.34,-20.66,793.4,-206.6,7934.0,-2066.0,-31.29,68.71,-31.29,687.1,-312.9,6871.0,-3129.0,-31.0,69.0,-31.0,690.0,-310.0,6900.0,-3100.0,"As bitcoin slides, Scott Melker revisits the many times BTC was called “dead”",Yahoo Finance Video,2026-06-25,0.0,"Bitcoin and ethereum prices today, Thursday, June 25, 2026: Bitcoin tumbles further below $60,000",Yahoo Personal Finance,2026-06-25,0.0,Strive CEO says digital credit could become a $3 trillion market,TheStreet,2026-06-25,0.382,9,buy,0.55,BTC is the reference asset and is showing signs of holding a fragile floor near £47.5K amid extreme fear (Fear & Greed 23); the £953B market cap and ETF outflows of $6B over 30 days suggest it's deeply oversold and poised for a mean-reversion bounce.,extreme fear zone (23/100); largest market cap — ultimate safety; $6B ETF outflows in 30 days = oversold; potential mean reversion setup,,,,,
ETH,Ethereum,Crypto,layer1,Crypto,1579.015305,-2.45%,-7.45%,-23.72%,-46.78%,-47%,144.731,,,10711.22,14568298985,74978551009,436502289250,,,,,-2.45,97.55,-2.45,975.5,-24.5,9755.0,-245.0,-7.45,92.55,-7.45,925.5,-74.5,9255.0,-745.0,-23.72,76.28,-23.72,762.8,-237.2,7628.0,-2372.0,-46.78,53.22,-46.78,532.2,-467.8,5322.0,-4678.0,-47.0,53.0,-47.0,530.0,-470.0,5300.0,-4700.0,Iranian entities moved $3.8B through crypto exchange CoinEx: What to know,Yahoo Finance Video,2026-06-25,0.0,Inside Machi Big Brother's high-stakes ETH trade,Yahoo Finance Video,2026-06-24,0.0,Kraken To Buy 15% Stake In DeFi Lender Aave,CryptoProwl,2026-06-25,0.0,,,,,,,,,,
SOL,Solana,Crypto,layer1,Crypto,67.041397,-1.20%,-3.52%,-19.80%,-46.16%,-46%,29.559,,,2391.64,3225670575,16741463306,86487355547,,,,,-1.2,98.8,-1.2,988.0,-12.0,9880.0,-120.0,-3.52,96.48,-3.52,964.8,-35.2,9648.0,-352.0,-19.8,80.2,-19.8,802.0,-198.0,8020.0,-1980.0,-46.16,53.84,-46.16,538.4,-461.6,5384.0,-4616.0,-46.0,54.0,-46.0,540.0,-460.0,5400.0,-4600.0,Solana Just Had Its Biggest Week Ever in This 1 Key Segment. Is It Worth Buying?,Motley Fool,2026-06-25,0.226,SOL Price is Down 20% But Solana Network Activity is Climbing on Meme Coins,BeInCrypto,2026-06-25,0.0,"Top Cryptocurrencies Mixed; Bitcoin Holds Above $59,000 Level",MT Newswires,2026-06-25,0.202,,,,,,,,,,
BNB,BNB,Crypto,layer1,Crypto,559.604766,-0.59%,-3.33%,-14.65%,-35.17%,-35%,57.285,,,663.03,879354015,4641243413,32956797396,,,,,-0.59,99.41,-0.59,994.1,-5.9,9941.0,-59.0,-3.33,96.67,-3.33,966.7,-33.3,9667.0,-333.0,-14.65,85.35,-14.65,853.5,-146.5,8535.0,-1465.0,-35.17,64.83,-35.17,648.3,-351.7,6483.0,-3517.0,-35.0,65.0,-35.0,650.0,-350.0,6500.0,-3500.0,"Top Cryptocurrencies Mixed; Bitcoin Holds Above $59,000 Level",MT Newswires,2026-06-25,0.202,"ZachXBT Calls Out MemeCore After M Token Crashes 75%, Demands Answers From Binance and Bybit",CCN,2026-06-25,0.0,$600M Wiped Out in Hours: Crypto’s Leverage Bloodbath Just Hit BTC and ETH Hardest,BeInCrypto,2026-06-24,0.0,3,buy,0.6,"BNB lost only -0.39% on the day and -4.60% on the week, the second-best among majors after TRX, with a 1M decline of -12.47% far less severe than ETH or SOL; its £59B market cap and BNB Chain ecosystem give it defensive strength.",resilient intraday and weekly price action; outperforming other large-cap L1s; low 1M drawdown vs peers; large market cap base,,,,,
ADA,Cardano,Crypto,layer1,Crypto,0.14347,-2.18%,-11.97%,-40.11%,-56.87%,-57%,3.965,,,363.25,597438088,2542734231,14858283818,,,,,-2.18,97.82,-2.18,978.2,-21.8,9782.0,-218.0,-11.97,88.03,-11.97,880.3,-119.7,8803.0,-1197.0,-40.11,59.89,-40.11,598.9,-401.1,5989.0,-4011.0,-56.87,43.13,-56.87,431.3,-568.7,4313.0,-5687.0,-57.0,43.0,-57.0,430.0,-570.0,4300.0,-5700.0,"Top Cryptocurrencies Mixed; Bitcoin Holds Above $59,000 Level",MT Newswires,2026-06-25,0.202,"Top Cryptocurrencies Lower; Bitcoin Falls Below $60,000 Level",MT Newswires,2026-06-24,-0.103,"After Warning of a Potential Collapse, Cardano's Founder Now Says Cardano Can Beat Bitcoin. Is He Right?",Motley Fool,2026-06-24,-0.681,,,,,,,,,,
AVAX,Avalanche,Crypto,layer1,Crypto,6.227598,-2.16%,-0.86%,-31.91%,-49.40%,-49%,2.042,,,278.02,261098482,1946155211,6900668054,,,,,-2.16,97.84,-2.16,978.4,-21.6,9784.0,-216.0,-0.86,99.14,-0.86,991.4,-8.6,9914.0,-86.0,-31.91,68.09,-31.91,680.9,-319.1,6809.0,-3191.0,-49.4,50.6,-49.4,506.0,-494.0,5060.0,-4940.0,-49.0,51.0,-49.0,510.0,-490.0,5100.0,-4900.0,MXNB Lands on Ripple XRPL Permissioned DEX to Power USD/MXN Settlement Rail,Coinspeaker,2026-06-24,0.0,,,,,,,,,,,,,,,,,,
XRP,XRP,Crypto,payments,Crypto,1.039951,-3.21%,-9.04%,-21.81%,-43.46%,-43%,49.013,,,1461.25,2115175161,10228741274,58523364219,,,,,-3.21,96.79,-3.21,967.9,-32.1,9679.0,-321.0,-9.04,90.96,-9.04,909.6,-90.4,9096.0,-904.0,-21.81,78.19,-21.81,781.9,-218.1,7819.0,-2181.0,-43.46,56.54,-43.46,565.4,-434.6,5654.0,-4346.0,-43.0,57.0,-43.0,570.0,-430.0,5700.0,-4300.0,"Top Cryptocurrencies Mixed; Bitcoin Holds Above $59,000 Level",MT Newswires,2026-06-25,0.202,Project Pangea Targets $150B Trade Corridor: Can Chainlink Challenge XRP and XLM in Cross-Border Payments?,CCN,2026-06-25,0.077,"XRP's 'Hard Money' Case Strengthens if Ripple Speeds Up Escrow Releases, Says Lawyer Bill Morgan",CCN,2026-06-25,0.382,,,,,,,,,,
XLM,Stellar,Crypto,payments,Crypto,0.177735,-4.75%,-23.79%,+20.84%,-11.41%,-11%,4.58,,,309.66,208253934,2167624844,19796523648,,,,,-4.75,95.25,-4.75,952.5,-47.5,9525.0,-475.0,-23.79,76.21,-23.79,762.1,-237.9,7621.0,-2379.0,20.84,120.84,20.84,1208.4,208.4,12084.0,2084.0,-11.41,88.59,-11.41,885.9,-114.1,8859.0,-1141.0,-11.0,89.0,-11.0,890.0,-110.0,8900.0,-1100.0,,,,,,,,,,,,,2,strong_buy,0.65,XLM boasts exceptional 1-month momentum of +27.67% YTD and a YTD of -4.06% that massively outperforms the broader market; its 1Y return of -4% is the second-best in the snapshot despite a weekly pullback.,+27.67% one-month momentum; nearly flat YTD vs -28% for BTC; strong 1Y relative outperformance; low market cap £5B offers upside,,,,,
TRX,TRON,Crypto,payments,Crypto,0.323682,-0.94%,+1.12%,-13.64%,+13.83%,+14%,23.316,,,547.81,699011268,3834660898,17810975621,,,,,-0.94,99.06,-0.94,990.6,-9.4,9906.0,-94.0,1.12,101.12,1.12,1011.2,11.2,10112.0,112.0,-13.64,86.36,-13.64,863.6,-136.4,8636.0,-1364.0,13.83,113.83,13.83,1138.3,138.3,11383.0,1383.0,14.0,114.0,14.0,1140.0,140.0,11400.0,1400.0,"Tron (TRX) Looks Incredibly Healthy, But Nobody Is Talking About It",BeInCrypto,2026-06-24,0.249,,,,,,,,,1,strong_buy,0.7,"TRX is the only asset with positive YTD (+15.53%) and 1Y (+16%) returns in a market where nearly everything is down; it held up best during the chip selloff, down only -0.90% on the day and up +3.33% on the week [analyticsinsight.net](https://www.analyticsinsight.net/price-analysis/crypto-prices-today-bitcoin-holds-near-62557-as-nasdaq-tech-selloff-triggers-717m-in-liquidations-eth-slips-below-1800).",positive YTD and 1Y returns; best weekly performer in risk-off; low-fee network absorbs transfer volume; strong relative strength vs peers,,,,,
SUI,Sui,Crypto,emerging,Crypto,0.679423,-1.01%,-5.91%,-32.03%,-51.56%,-52%,2.079,,,335.57,396554083,2349018177,14773494848,,,,,-1.01,98.99,-1.01,989.9,-10.1,9899.0,-101.0,-5.91,94.09,-5.91,940.9,-59.1,9409.0,-591.0,-32.03,67.97,-32.03,679.7,-320.3,6797.0,-3203.0,-51.56,48.44,-51.56,484.4,-515.6,4844.0,-5156.0,-52.0,48.0,-52.0,480.0,-520.0,4800.0,-5200.0,SUI Group Deepens Bluefin Partnership With an Additional 4M SUI Loan,CryptoProwl,2026-06-25,0.0,,,,,,,,,,,,,,,,,,
HBAR,Hedera,Crypto,emerging,Crypto,0.073622,-2.56%,-8.12%,-14.87%,-30.67%,-31%,2.431,,,57.95,81419417,405626869,3132740267,,,,,-2.56,97.44,-2.56,974.4,-25.6,9744.0,-256.0,-8.12,91.88,-8.12,918.8,-81.2,9188.0,-812.0,-14.87,85.13,-14.87,851.3,-148.7,8513.0,-1487.0,-30.67,69.33,-30.67,693.3,-306.7,6933.0,-3067.0,-31.0,69.0,-31.0,690.0,-310.0,6900.0,-3100.0,,,,,,,,,,,,,5,buy,0.55,"HBAR's -0.07% one-day change and -3.92% weekly drop are among the mildest in the universe, while its 1Y return of -27% is far better than most altcoins; the £2.56B market cap and enterprise Hashgraph narrative provide a floor.",near flat daily price action; better 1Y return than most peers; resilient during broad sell-off; enterprise adoption catalyst,,,,,
ALGO,Algorand,Crypto,emerging,Crypto,0.084837,-5.78%,-13.91%,-22.02%,-23.00%,-23%,0.576,,,37.64,46736005,263457599,1378695255,,,,,-5.78,94.22,-5.78,942.2,-57.8,9422.0,-578.0,-13.91,86.09,-13.91,860.9,-139.1,8609.0,-1391.0,-22.02,77.98,-22.02,779.8,-220.2,7798.0,-2202.0,-23.0,77.0,-23.0,770.0,-230.0,7700.0,-2300.0,-23.0,77.0,-23.0,770.0,-230.0,7700.0,-2300.0,,,,,,,,,,,,,,,,,,,,,,
MINA,Mina,Crypto,emerging,Crypto,0.03891,-1.49%,-6.91%,-29.91%,-48.50%,-48%,0.038,,,4.09,6212876,28653807,321863607,,,,,-1.49,98.51,-1.49,985.1,-14.9,9851.0,-149.0,-6.91,93.09,-6.91,930.9,-69.1,9309.0,-691.0,-29.91,70.09,-29.91,700.9,-299.1,7009.0,-2991.0,-48.5,51.5,-48.5,515.0,-485.0,5150.0,-4850.0,-48.0,52.0,-48.0,520.0,-480.0,5200.0,-4800.0,,,,,,,,,,,,,,,,,,,,,,
POL,Polygon (MATIC),Crypto,infra,Crypto,0.071638,-2.48%,-7.77%,-21.98%,-28.68%,-29%,0.58,,,43.59,50920887,305110773,1366234220,,,,,-2.48,97.52,-2.48,975.2,-24.8,9752.0,-248.0,-7.77,92.23,-7.77,922.3,-77.7,9223.0,-777.0,-21.98,78.02,-21.98,780.2,-219.8,7802.0,-2198.0,-28.68,71.32,-28.68,713.2,-286.8,7132.0,-2868.0,-29.0,71.0,-29.0,710.0,-290.0,7100.0,-2900.0,,,,,,,,,,,,,,,,,,,,,,
DOT,Polkadot,Crypto,infra,Crypto,0.849388,-4.08%,-12.25%,-31.85%,-52.54%,-53%,1.09,,,86.92,103130237,608429477,4044182110,,,,,-4.08,95.92,-4.08,959.2,-40.8,9592.0,-408.0,-12.25,87.75,-12.25,877.5,-122.5,8775.0,-1225.0,-31.85,68.15,-31.85,681.5,-318.5,6815.0,-3185.0,-52.54,47.46,-52.54,474.6,-525.4,4746.0,-5254.0,-53.0,47.0,-53.0,470.0,-530.0,4700.0,-5300.0,DOT Is Repeating XRP’s June Sentiment Crash — Except for One Crucial Catch,BeInCrypto,2026-06-19,-0.402,,,,,,,,,,,,,,,,,,
LINK,Chainlink,Crypto,infra,Crypto,7.256675,-2.36%,-9.09%,-22.51%,-40.49%,-40%,4.007,,,212.28,309967992,1485968973,8390717494,,,,,-2.36,97.64,-2.36,976.4,-23.6,9764.0,-236.0,-9.09,90.91,-9.09,909.1,-90.9,9091.0,-909.0,-22.51,77.49,-22.51,774.9,-225.1,7749.0,-2251.0,-40.49,59.51,-40.49,595.1,-404.9,5951.0,-4049.0,-40.0,60.0,-40.0,600.0,-400.0,6000.0,-4000.0,Project Pangea Targets $150B Trade Corridor: Can Chainlink Challenge XRP and XLM in Cross-Border Payments?,CCN,2026-06-25,0.077,"Crypto News Today (June 24): BTC Struggling to Reclaim $63K, THORChain Resumes Trading, and Chainlink Joins Bank Stablecoin Push",99bitcoins,2026-06-24,-0.421,Better Buy: XRP vs. Chainlink (LINK),Motley Fool,2026-06-22,0.44,,,,,,,,,,
DOGE,Dogecoin,Crypto,meme,Crypto,0.074582,-1.76%,-10.45%,-25.95%,-36.41%,-36%,8.769,,,532.2,878517734,3725401818,24021632328,,,,,-1.76,98.24,-1.76,982.4,-17.6,9824.0,-176.0,-10.45,89.55,-10.45,895.5,-104.5,8955.0,-1045.0,-25.95,74.05,-25.95,740.5,-259.5,7405.0,-2595.0,-36.41,63.59,-36.41,635.9,-364.1,6359.0,-3641.0,-36.0,64.0,-36.0,640.0,-360.0,6400.0,-3600.0,"Top Cryptocurrencies Mixed; Bitcoin Holds Above $59,000 Level",MT Newswires,2026-06-25,0.202,Better Buy for This Crypto Bear Market: XRP or Dogecoin?,Motley Fool,2026-06-25,0.44,"Bitcoin Hits 20-Month Low, Ethereum, Dogecoin, XRP Also Decline: Analyst Identifies 'Genuine Battleground' For Beleaguered BTC Amid 'Extreme Fear'",Benzinga,2026-06-25,-0.807,,,,,,,,,,
PEPE,Pepe,Crypto,meme,Crypto,2e-06,-6.65%,-16.90%,-32.67%,-41.60%,-42%,0.74,,,126.57,189552812,885981997,5585128983,,,,,-6.65,93.35,-6.65,933.5,-66.5,9335.0,-665.0,-16.9,83.1,-16.9,831.0,-169.0,8310.0,-1690.0,-32.67,67.33,-32.67,673.3,-326.7,6733.0,-3267.0,-41.6,58.4,-41.6,584.0,-416.0,5840.0,-4160.0,-42.0,58.0,-42.0,580.0,-420.0,5800.0,-4200.0,,,,,,,,,,,,,,,,,,,,,,
TAO,Bittensor,Crypto,ai,Crypto,212.230445,-2.77%,-9.61%,-23.96%,-2.94%,-3%,1.782,,,339.81,176351179,2378682994,7894683425,,,,,-2.77,97.23,-2.77,972.3,-27.7,9723.0,-277.0,-9.61,90.39,-9.61,903.9,-96.1,9039.0,-961.0,-23.96,76.04,-23.96,760.4,-239.6,7604.0,-2396.0,-2.94,97.06,-2.94,970.6,-29.4,9706.0,-294.0,-3.0,97.0,-3.0,970.0,-30.0,9700.0,-300.0,,,,,,,,,,,,,7,buy,0.5,"TAO has positive YTD (+1.52%) and 1Y (+2%) returns, making it one of only three assets with gains over both periods; its £1.86B market cap and leading AI subnet protocol position it well if the AI narrative recovers.",positive YTD and 1Y returns; top-3 performer by long-term metrics; leading AI narrative exposure; decent market cap liquidity,,,,,
FET,ASI Alliance,Crypto,ai,Crypto,0.166852,-2.74%,-14.64%,-32.46%,-16.03%,-16%,0.286,,,56.44,56803160,395114734,3846431841,,,,,-2.74,97.26,-2.74,972.6,-27.4,9726.0,-274.0,-14.64,85.36,-14.64,853.6,-146.4,8536.0,-1464.0,-32.46,67.54,-32.46,675.4,-324.6,6754.0,-3246.0,-16.03,83.97,-16.03,839.7,-160.3,8397.0,-1603.0,-16.0,84.0,-16.0,840.0,-160.0,8400.0,-1600.0,,,,,,,,,,,,,,,,,,,,,,
