ticker,company_name,sector,category,exchange,price_usd,change_1d,change_1w,change_1m,change_ytd,return_1yr,market_cap_usd_b,beta,pe_ratio,avg_volume_m,vol_1d,vol_1w,vol_1m,div_yield_pct,short_pct,analyst,analyst_score,pct_1d,val_100_1d,profit_100_1d,val_1000_1d,profit_1000_1d,val_10000_1d,profit_10000_1d,pct_1w,val_100_1w,profit_100_1w,val_1000_1w,profit_1000_1w,val_10000_1w,profit_10000_1w,pct_1m,val_100_1m,profit_100_1m,val_1000_1m,profit_1000_1m,val_10000_1m,profit_10000_1m,pct_ytd,val_100_ytd,profit_100_ytd,val_1000_ytd,profit_1000_ytd,val_10000_ytd,profit_10000_ytd,pct_1y,val_100_1y,profit_100_1y,val_1000_1y,profit_1000_1y,val_10000_1y,profit_10000_1y,news1_title,news1_publisher,news1_date,news1_sentiment,news2_title,news2_publisher,news2_date,news2_sentiment,news3_title,news3_publisher,news3_date,news3_sentiment,signal_rank,signal,signal_confidence,signal_rationale,signal_drivers,portfolio_held,portfolio_quantity,portfolio_avg_price,portfolio_ppl,portfolio_total_value
EXEL,Exelixis,Biotech,oncology,NASDAQ,55.53,-0.57%,-0.91%,+8.14%,+27.42%,+26%,13.958,0.424,18.39,2.74,2353863,10635763,55064763,,15.44,buy,2.26,-0.57,99.43,-0.57,994.3,-5.7,9943.0,-57.0,-0.91,99.09,-0.91,990.9,-9.1,9909.0,-91.0,8.14,108.14,8.14,1081.4,81.4,10814.0,814.0,27.42,127.42,27.42,1274.2,274.2,12742.0,2742.0,26.0,126.0,26.0,1260.0,260.0,12600.0,2600.0,Exelixis (EXEL) Earnings Expected to Grow: Should You Buy?,Zacks,2026-07-20,0.0,Will Exelixis (EXEL) Beat Estimates Again in Its Next Earnings Report?,Zacks,2026-07-16,0.0,Is Exelixis (EXEL) Expensive After Its Recent Rally Or Still Undervalued?,Simply Wall St.,2026-07-11,0.0,,,,,,,,,,
ALNY,Alnylam Pharmaceuticals,Biotech,oncology,NASDAQ,272.67,+1.55%,-5.34%,-4.80%,-31.86%,-17%,36.405,0.269,68.34,1.28,1334352,6526652,31751152,,5.79,buy,1.78,1.55,101.55,1.55,1015.5,15.5,10155.0,155.0,-5.34,94.66,-5.34,946.6,-53.4,9466.0,-534.0,-4.8,95.2,-4.8,952.0,-48.0,9520.0,-480.0,-31.86,68.14,-31.86,681.4,-318.6,6814.0,-3186.0,-17.0,83.0,-17.0,830.0,-170.0,8300.0,-1700.0,"Collect 9.8% On VRTX Stock Now, And Still Keep 15% Of Upside",Trefis,2026-07-16,0.0,Morgan Stanley Raises its Price Target on Alnylam (ALNY),Insider Monkey,2026-07-14,0.0,"Alnylam Pharmaceuticals' Q2 Results to Determine 2026 Revenue Outlook, BofA Securities Says",MT Newswires,2026-07-14,0.296,,,,,,,,,,
RCUS,Arcus Biosciences,Biotech,oncology,NYSE,28.17,+2.44%,+0.36%,+3.45%,+20.95%,+196%*,3.543,0.799,,1.32,940649,4546049,30231949,,16.54,none,,2.44,102.44,2.44,1024.4,24.4,10244.0,244.0,0.36,100.36,0.36,1003.6,3.6,10036.0,36.0,3.45,103.45,3.45,1034.5,34.5,10345.0,345.0,20.95,120.95,20.95,1209.5,209.5,12095.0,2095.0,196.0,296.0,196.0,2960.0,1960.0,29600.0,19600.0,"An Arcus Insider Sold 68,569 Shares but Kept 1.2 Million After a 200% Run",Motley Fool,2026-07-13,0.153,Bristol-Myers Squibb (BMY) Joins Arcus Biosciences to Test a New Two-Drug Kidney Cancer Combination,Insider Monkey,2026-07-01,-0.66,Bristol Myers Squibb’s AI Overhaul And Oncology Trials Shape Value Story,Simply Wall St.,2026-06-12,0.34,,,,,,,,,,
MRNA,Moderna,Biotech,mrna,NASDAQ,59.49,-3.71%,-11.22%,+0.24%,+92.77%,+100%,23.604,0.942,,7.8,4571142,23952442,170015342,,16.4,hold,2.96,-3.71,96.29,-3.71,962.9,-37.1,9629.0,-371.0,-11.22,88.78,-11.22,887.8,-112.2,8878.0,-1122.0,0.24,100.24,0.24,1002.4,2.4,10024.0,24.0,92.77,192.77,92.77,1927.7,927.7,19277.0,9277.0,100.0,200.0,100.0,2000.0,1000.0,20000.0,10000.0,"Moderna (MRNA): Buy, Sell, or Hold Post Q1 Earnings?",StockStory,2026-07-17,0.0,MRNA Advances Cancer Pipeline With New Immunotherapy Study,Zacks,2026-07-17,-0.66,Neglected Quant Safety Trade Makes a Comeback as AI Risks Rise,Bloomberg,2026-07-17,-0.402,,,,,,,,,,
BNTX,BioNTech,Biotech,mrna,NASDAQ,92.16,+4.97%,+2.32%,+2.18%,-4.69%,-16%,23.306,1.324,,0.96,685137,4171737,16478437,,3.4,buy,1.55,4.97,104.97,4.97,1049.7,49.7,10497.0,497.0,2.32,102.32,2.32,1023.2,23.2,10232.0,232.0,2.18,102.18,2.18,1021.8,21.8,10218.0,218.0,-4.69,95.31,-4.69,953.1,-46.9,9531.0,-469.0,-16.0,84.0,-16.0,840.0,-160.0,8400.0,-1600.0,Is BioNTech (BNTX) Undervalued As It Exits German Manufacturing Sites?,Simply Wall St.,2026-07-10,0.0,BioNTech (BNTX) Stock Could Be Overvalued After a 58% Five Year Slump,Simply Wall St.,2026-07-10,0.0,"Biopharma Sector Seen Shifting to Fundamentals From Macro in H2, Morgan Stanley Says",MT Newswires,2026-07-08,0.0,,,,,,,,,,
NVAX,Novavax,Biotech,mrna,NASDAQ,7.88,-3.31%,-11.56%,-12.44%,+10.52%,+15%*,1.296,2.427,,4.87,3002161,14005061,78598861,,28.04,buy,2.33,-3.31,96.69,-3.31,966.9,-33.1,9669.0,-331.0,-11.56,88.44,-11.56,884.4,-115.6,8844.0,-1156.0,-12.44,87.56,-12.44,875.6,-124.4,8756.0,-1244.0,10.52,110.52,10.52,1105.2,105.2,11052.0,1052.0,15.0,115.0,15.0,1150.0,150.0,11500.0,1500.0,3 Small-Cap Stocks Walking a Fine Line,StockStory,2026-07-20,0.202,"HRMY Posts Preliminary Q2 Revenues, Announces CFO Transition",Zacks,2026-07-17,0.0,Novavax (NVAX) Stock Sinks As Market Gains: Here's Why,Zacks,2026-07-14,0.34,,,,,,,,,,
BMRN,BioMarin Pharmaceutical,Biotech,rare-disease,NASDAQ,59.11,-0.81%,-0.15%,+5.74%,-0.57%,+5%,11.425,0.239,42.53,2.05,1082770,6292570,34806870,,7.22,buy,1.72,-0.81,99.19,-0.81,991.9,-8.1,9919.0,-81.0,-0.15,99.85,-0.15,998.5,-1.5,9985.0,-15.0,5.74,105.74,5.74,1057.4,57.4,10574.0,574.0,-0.57,99.43,-0.57,994.3,-5.7,9943.0,-57.0,5.0,105.0,5.0,1050.0,50.0,10500.0,500.0,2 Reasons to Avoid BMRN and 1 Stock to Buy Instead,StockStory,2026-07-17,-0.296,"Collect 9.8% On VRTX Stock Now, And Still Keep 15% Of Upside",Trefis,2026-07-16,0.0,FDA Accepts BMRN's sNDA Seeking Full Approval for Voxzogo,Zacks,2026-07-14,0.66,8,buy,0.7,"Positive news sentiment of 0.195, 1M momentum of +8.96%, a buy analyst consensus (score 1.72), and a low beta of 0.239, though P/E of 42.87 is elevated.",news sentiment 0.195; +8.96% 1M; buy consensus; beta 0.239,,,,,
SRPT,Sarepta Therapeutics,Biotech,rare-disease,NASDAQ,16.83,-2.86%,-10.57%,-4.65%,-21.02%,+29%,1.778,0.202,48.09,3.36,1770839,16819739,79749639,,32.62,hold,2.74,-2.86,97.14,-2.86,971.4,-28.6,9714.0,-286.0,-10.57,89.43,-10.57,894.3,-105.7,8943.0,-1057.0,-4.65,95.35,-4.65,953.5,-46.5,9535.0,-465.0,-21.02,78.98,-21.02,789.8,-210.2,7898.0,-2102.0,29.0,129.0,29.0,1290.0,290.0,12900.0,2900.0,Sarepta Skids After A Rival Clears A Key Hurdle In The Duchenne Space,Investor's Business Daily,2026-07-20,0.077,uniQure Trends to Watch as Gene Therapy Bets Shift Beyond Hemgenix,Zacks,2026-07-17,0.0,Following FDA sNDA Acceptance Is Sarepta Therapeutics (SRPT) Still Undervalued?,Simply Wall St.,2026-07-14,0.459,,,,,,,,,,
COAG,Hemab Therapeutics,Biotech,rare-disease,NASDAQ,49.39,-0.20%,+25.01%,+55.61%,+45.26%,+45%,2.306,,,0.35,567774,1912974,6392374,,,strong_buy,1.0,-0.2,99.8,-0.2,998.0,-2.0,9980.0,-20.0,25.01,125.01,25.01,1250.1,250.1,12501.0,2501.0,55.61,155.61,55.61,1556.1,556.1,15561.0,5561.0,45.26,145.26,45.26,1452.6,452.6,14526.0,4526.0,45.0,145.0,45.0,1450.0,450.0,14500.0,4500.0,Sector Update: Healthcare Stocks Advance Late Afternoon,MT Newswires,2026-07-13,0.0,"Hemab Therapeutics Details Post-IPO Pipeline Push, Sutacimig Phase III Plans",MarketBeat,2026-06-09,0.0,Hemab Therapeutics IPO Debut Puts COAG And Pipeline Risks In Focus,Simply Wall St.,2026-05-03,-0.273,1,strong_buy,0.7,"Explosive momentum with +44.97% YTD, +68.57% 1M, and +29.61% 1W, backed by a strong_buy analyst consensus (score 1.0) despite a neutral news sentiment of -0.091.",+44.97% YTD; +68.57% 1M; strong_buy consensus; low market cap $2.3B,,,,,
NVO,Novo Nordisk,Biotech,metabolic,NYSE,49.61,-1.33%,+0.67%,+8.13%,-1.83%,-22%,219.467,0.36,11.9,14.05,6714301,42984701,219597501,358.0,0.88,buy,2.43,-1.33,98.67,-1.33,986.7,-13.3,9867.0,-133.0,0.67,100.67,0.67,1006.7,6.7,10067.0,67.0,8.13,108.13,8.13,1081.3,81.3,10813.0,813.0,-1.83,98.17,-1.83,981.7,-18.3,9817.0,-183.0,-22.0,78.0,-22.0,780.0,-220.0,7800.0,-2200.0,Novo Nordisk (CPSE:NOVO B) Launches Kyinsu In China Through Fangzhou Internet Hospital,Simply Wall St.,2026-07-20,0.0,Does EU Approval of Wegovy Pill Change NVO's Competitive Story?,Zacks,2026-07-20,0.586,Citi lifts Novo Nordisk target on strong GLP-1 pill launch,Proactive,2026-07-20,0.511,5,buy,0.8,"Cheap P/E of 12.07, 3.58% dividend yield, strong 1M momentum of +16.51%, and a positive catalyst from the first European approval of oral Wegovy, with low short interest of 0.88%.",P/E 12.07; dividend yield 3.58%; +16.51% 1M; oral Wegovy EU approval,,,,,
LLY,Eli Lilly,Biotech,metabolic,NYSE,1146.9,-2.52%,-2.96%,+4.07%,+6.52%,+55%,1022.739,0.506,40.7,3.27,1796278,12538878,59748378,59.0,1.05,buy,1.76,-2.52,97.48,-2.52,974.8,-25.2,9748.0,-252.0,-2.96,97.04,-2.96,970.4,-29.6,9704.0,-296.0,4.07,104.07,4.07,1040.7,40.7,10407.0,407.0,6.52,106.52,6.52,1065.2,65.2,10652.0,652.0,55.0,155.0,55.0,1550.0,550.0,15500.0,5500.0,Scribe Therapeutics Files $107.2 Million IPO as Sanofi Backs Share Purchase,GuruFocus.com,2026-07-20,0.25,Sector Update: Healthcare Stocks Fall Late Afternoon,MT Newswires,2026-07-20,0.0,Reading Between The Lines Of JNJ Stock's Latest Call,Trefis,2026-07-20,0.0,,,,,,,,,,
LEGN,Legend Biotech,Biotech,neuroscience,NASDAQ,23.21,+2.25%,-9.86%,-20.89%,+7.90%,-47%,4.489,0.341,,2.68,2347890,14042190,42260890,,16.15,buy,1.73,2.25,102.25,2.25,1022.5,22.5,10225.0,225.0,-9.86,90.14,-9.86,901.4,-98.6,9014.0,-986.0,-20.89,79.11,-20.89,791.1,-208.9,7911.0,-2089.0,7.9,107.9,7.9,1079.0,79.0,10790.0,790.0,-47.0,53.0,-47.0,530.0,-470.0,5300.0,-4700.0,Legend Biotech Corporation (LEGN) Price Target Raised to $49 on LB5006 Clinical Progress,Insider Monkey,2026-06-25,0.421,"After Apogee, 3 More Biotech Buyout Targets Wall Street Can’t Stop Watching",24/7 Wall St.,2026-06-24,-0.296,Legend Biotech (LEGN) Reports a Complete Response in Five of Six Patients at Its Highest Dose,Insider Monkey,2026-06-22,0.0,,,,,,,,,,
IONS,Ionis Pharmaceuticals,Biotech,neuroscience,NASDAQ,52.95,-3.09%,-6.70%,-30.23%,-33.54%,+31%,8.751,0.365,,2.56,2166897,16820697,81774797,,13.99,buy,1.68,-3.09,96.91,-3.09,969.1,-30.9,9691.0,-309.0,-6.7,93.3,-6.7,933.0,-67.0,9330.0,-670.0,-30.23,69.77,-30.23,697.7,-302.3,6977.0,-3023.0,-33.54,66.46,-33.54,664.6,-335.4,6646.0,-3354.0,31.0,131.0,31.0,1310.0,310.0,13100.0,3100.0,Cathie Wood Just Bet Big on This Biotech Stock,Motley Fool,2026-07-18,0.0,Biogen Slumps As Alzheimer's Study Leaves 'More Questions Than Answers',Investor's Business Daily,2026-07-14,0.0,Morgan Stanley Raises its Price Target on Alnylam (ALNY),Insider Monkey,2026-07-14,0.0,,,,,,,,,,
BTC,Bitcoin,Crypto,bitcoin,Crypto,65347.324191,+1.50%,+5.65%,+2.29%,-25.33%,-25%,1310.812,,,25038.77,16067920756,175271374437,811081551045,,,,,1.5,101.5,1.5,1015.0,15.0,10150.0,150.0,5.65,105.65,5.65,1056.5,56.5,10565.0,565.0,2.29,102.29,2.29,1022.9,22.9,10229.0,229.0,-25.33,74.67,-25.33,746.7,-253.3,7467.0,-2533.0,-25.0,75.0,-25.0,750.0,-250.0,7500.0,-2500.0,Morgan Stanley's E*TRADE embraces crypto trading,Yahoo Finance Video,2026-07-20,0.0,"Bitcoin and ethereum prices today, Monday, July 20, 2026: Crypto prices mixed as second half 2026 outlooks conflict",Yahoo Personal Finance,2026-07-20,-0.318,Strategy stock rises after the company raises $263 million without selling bitcoin,Yahoo Finance,2026-07-20,0.0,,,,,,,,,,
ETH,Ethereum,Crypto,layer1,Crypto,1903.847552,+2.37%,+8.65%,+9.93%,-35.83%,-36%,229.762,,,9484.58,7002880346,66392058500,299006900957,,,,,2.37,102.37,2.37,1023.7,23.7,10237.0,237.0,8.65,108.65,8.65,1086.5,86.5,10865.0,865.0,9.93,109.93,9.93,1099.3,99.3,10993.0,993.0,-35.83,64.17,-35.83,641.7,-358.3,6417.0,-3583.0,-36.0,64.0,-36.0,640.0,-360.0,6400.0,-3600.0,Morgan Stanley's E*TRADE embraces crypto trading,Yahoo Finance Video,2026-07-20,0.0,"AI shock spares Bitcoin, Wall Street moves on-chain, and leveraged crypto ETFs explained",CoinDesk,2026-07-20,-0.382,Ethereum News: BlackRock’s ETHA Drives ETH ETF Reversal With Back-to-Back Inflow Weeks,Cryptonews,2026-07-20,0.0,5,buy,0.65,"Leading large-cap L1 with +7.48% 1M and +4.31% 1W, resilient amid Iran tensions; positive sentiment 0.061 and headline noting flat trading.",+7.48% 1-month gain; +4.31% 1-week gain; market cap $223.8B; resilient to macro news,,,,,
SOL,Solana,Crypto,layer1,Crypto,77.898707,+2.73%,+5.03%,+7.85%,-37.44%,-37%,45.395,,,1585.0,1235387144,11094994300,68160948149,,,,,2.73,102.73,2.73,1027.3,27.3,10273.0,273.0,5.03,105.03,5.03,1050.3,50.3,10503.0,503.0,7.85,107.85,7.85,1078.5,78.5,10785.0,785.0,-37.44,62.56,-37.44,625.6,-374.4,6256.0,-3744.0,-37.0,63.0,-37.0,630.0,-370.0,6300.0,-3700.0,Morgan Stanley's E*TRADE embraces crypto trading,Yahoo Finance Video,2026-07-20,0.0,MicroStrategy holds 843K bitcoin as cash reserves reach $3.2B,Yahoo Finance Video,2026-07-20,0.026,"ADA Underperforms Bitcoin Despite Activating ‘Historic’ Van Rossem Hard Fork, Its First Community-Governed Upgrade",Stocktwits,2026-07-20,-0.103,7,buy,0.58,"Largest alt-L1 by market cap at $44.2B with +5.42% 1M, but negative sentiment -0.223 and slight weekly decline -0.70%.",+5.42% 1-month return; market cap $44.2B; negative sentiment -0.223; 1W -0.70%,,,,,
BNB,BNB,Crypto,layer1,Crypto,571.458996,+0.49%,+1.40%,-2.35%,-33.79%,-34%,76.099,,,549.82,397716991,3848773479,18589651604,,,,,0.49,100.49,0.49,1004.9,4.9,10049.0,49.0,1.4,101.4,1.4,1014.0,14.0,10140.0,140.0,-2.35,97.65,-2.35,976.5,-23.5,9765.0,-235.0,-33.79,66.21,-33.79,662.1,-337.9,6621.0,-3379.0,-34.0,66.0,-34.0,660.0,-340.0,6600.0,-3400.0,"Top Cryptocurrencies Lower; Bitcoin Holds Above $64,000",MT Newswires,2026-07-17,-0.103,Binance’s BNB Coin May Drop Toward $500 Next: Here’s Why,FX Empire,2026-07-17,-0.273,"Top Cryptocurrencies Fall; Bitcoin Holds Above $64,000",MT Newswires,2026-07-16,0.202,,,,,,,,,,
ADA,Cardano,Crypto,layer1,Crypto,0.1713,+3.55%,+9.80%,+5.72%,-48.51%,-49%,6.25,,,262.24,163248058,1835707639,10793819395,,,,,3.55,103.55,3.55,1035.5,35.5,10355.0,355.0,9.8,109.8,9.8,1098.0,98.0,10980.0,980.0,5.72,105.72,5.72,1057.2,57.2,10572.0,572.0,-48.51,51.49,-48.51,514.9,-485.1,5149.0,-4851.0,-49.0,51.0,-49.0,510.0,-490.0,5100.0,-4900.0,Cardano Triggers Hard Fork With First Community-Voted Upgrade,decrypt,2026-07-20,-0.103,"ADA Underperforms Bitcoin Despite Activating ‘Historic’ Van Rossem Hard Fork, Its First Community-Governed Upgrade",Stocktwits,2026-07-20,-0.103,Cardano Activates the Van Rossem Hard Fork: Will It Boost ADA Price?,BeInCrypto,2026-07-19,0.318,,,,,,,,,,
AVAX,Avalanche,Crypto,layer1,Crypto,6.605885,+2.88%,+3.85%,+7.00%,-46.33%,-46%,2.852,,,150.81,178431183,1055660956,5569775000,,,,,2.88,102.88,2.88,1028.8,28.8,10288.0,288.0,3.85,103.85,3.85,1038.5,38.5,10385.0,385.0,7.0,107.0,7.0,1070.0,70.0,10700.0,700.0,-46.33,53.67,-46.33,536.7,-463.3,5367.0,-4633.0,-46.0,54.0,-46.0,540.0,-460.0,5400.0,-4600.0,,,,,,,,,,,,,6,buy,0.62,"Best 1M return among major L1s at +7.84% and highest news sentiment 0.18 in layer1, with tokenized stocks narrative as a $3T market.",+7.84% 1-month return; news sentiment +0.18; tokenized stocks $3T market theme; market cap $2.8B,,,,,
XRP,XRP,Crypto,payments,Crypto,1.116881,+2.23%,+5.82%,-2.58%,-39.28%,-39%,69.768,,,979.26,659774400,6854836514,39901559315,,,,,2.23,102.23,2.23,1022.3,22.3,10223.0,223.0,5.82,105.82,5.82,1058.2,58.2,10582.0,582.0,-2.58,97.42,-2.58,974.2,-25.8,9742.0,-258.0,-39.28,60.72,-39.28,607.2,-392.8,6072.0,-3928.0,-39.0,61.0,-39.0,610.0,-390.0,6100.0,-3900.0,Why Is XRP (Ripple) Underperforming the Crypto Market?,24/7 Wall St.,2026-07-20,0.0,Validators Are About to Vote on the XRP Ledger’s Biggest Upgrade in Years,24/7 Wall St.,2026-07-20,0.0,"HYPE ETFs Post First Outflow Since May, Ending a 9-Week Streak",BeInCrypto,2026-07-20,0.0,,,,,,,,,,
XLM,Stellar,Crypto,payments,Crypto,0.189736,-0.67%,+5.94%,-11.06%,-5.43%,-5%,6.481,,,152.58,118636487,1068053148,7599744864,,,,,-0.67,99.33,-0.67,993.3,-6.7,9933.0,-67.0,5.94,105.94,5.94,1059.4,59.4,10594.0,594.0,-11.06,88.94,-11.06,889.4,-110.6,8894.0,-1106.0,-5.43,94.57,-5.43,945.7,-54.3,9457.0,-543.0,-5.0,95.0,-5.0,950.0,-50.0,9500.0,-500.0,,,,,,,,,,,,,,,,,,,,,,
TRX,TRON,Crypto,payments,Crypto,0.326762,-0.05%,+0.53%,+0.42%,+14.91%,+15%,31.001,,,349.89,267447224,2449239064,13023901679,,,,,-0.05,99.95,-0.05,999.5,-0.5,9995.0,-5.0,0.53,100.53,0.53,1005.3,5.3,10053.0,53.0,0.42,100.42,0.42,1004.2,4.2,10042.0,42.0,14.91,114.91,14.91,1149.1,149.1,11491.0,1491.0,15.0,115.0,15.0,1150.0,150.0,11500.0,1500.0,Wall Street explores tokenization of assets,Yahoo Finance Video,2026-07-16,0.178,The US sanctioned 4 of Iran's central bank crypto wallets. Here's why.,Yahoo Finance Video,2026-07-16,0.0,US Treasury Freezes $131 Million in Iran-Linked Crypto Wallets,decrypt,2026-07-15,0.178,3,buy,0.7,"Only major asset with positive YTD at +14.79% and positive 1D at +0.30%, supported by tokenization narrative and sentiment 0.119.",+14.79% YTD return; positive news sentiment 0.119; tokenization theme; stable 1D momentum,,,,,
SUI,Sui,Crypto,emerging,Crypto,0.768206,+2.74%,+8.25%,+8.78%,-45.23%,-45%,3.113,,,181.76,130616573,1272328012,7350193776,,,,,2.74,102.74,2.74,1027.4,27.4,10274.0,274.0,8.25,108.25,8.25,1082.5,82.5,10825.0,825.0,8.78,108.78,8.78,1087.8,87.8,10878.0,878.0,-45.23,54.77,-45.23,547.7,-452.3,5477.0,-4523.0,-45.0,55.0,-45.0,550.0,-450.0,5500.0,-4500.0,Sui Price Forecast: Depressed On-Chain Data Favors 33% Drop for SUI,FX Empire,2026-07-16,-0.527,,,,,,,,,10,buy,0.48,"Slight daily gain +0.03% and 1M +3.10% but depressed on-chain data and very negative sentiment -0.527, forecasting a 33% drop.",+3.10% 1-month return; news sentiment -0.527; depressed on-chain activity; micro-cap $3.0B,,,,,
HBAR,Hedera,Crypto,emerging,Crypto,0.066696,+0.36%,+1.29%,-16.76%,-37.19%,-37%,2.921,,,46.46,38498185,325232815,1713789602,,,,,0.36,100.36,0.36,1003.6,3.6,10036.0,36.0,1.29,101.29,1.29,1012.9,12.9,10129.0,129.0,-16.76,83.24,-16.76,832.4,-167.6,8324.0,-1676.0,-37.19,62.81,-37.19,628.1,-371.9,6281.0,-3719.0,-37.0,63.0,-37.0,630.0,-370.0,6300.0,-3700.0,,,,,,,,,,,,,,,,,,,,,,
ALGO,Algorand,Crypto,emerging,Crypto,0.083507,+1.04%,+0.86%,-10.51%,-24.21%,-24%,0.749,,,19.45,14624569,136180959,770160842,,,,,1.04,101.04,1.04,1010.4,10.4,10104.0,104.0,0.86,100.86,0.86,1008.6,8.6,10086.0,86.0,-10.51,89.49,-10.51,894.9,-105.1,8949.0,-1051.0,-24.21,75.79,-24.21,757.9,-242.1,7579.0,-2421.0,-24.0,76.0,-24.0,760.0,-240.0,7600.0,-2400.0,,,,,,,,,,,,,,,,,,,,,,
MINA,Mina,Crypto,emerging,Crypto,0.045247,+3.71%,+6.66%,+6.98%,-40.11%,-40%,0.058,,,3.76,2570270,26331537,148888467,,,,,3.71,103.71,3.71,1037.1,37.1,10371.0,371.0,6.66,106.66,6.66,1066.6,66.6,10666.0,666.0,6.98,106.98,6.98,1069.8,69.8,10698.0,698.0,-40.11,59.89,-40.11,598.9,-401.1,5989.0,-4011.0,-40.0,60.0,-40.0,600.0,-400.0,6000.0,-4000.0,,,,,,,,,,,,,8,buy,0.55,"Decent short-term momentum with +3.15% 1W and +3.91% 1M, though negative YTD -41.73% and tiny $0.057B market cap.",+3.15% 1-week gain; +3.91% 1-month gain; micro-cap $0.057B; YTD -41.73%,,,,,
POL,Polygon (MATIC),Crypto,infra,Crypto,0.080305,-0.34%,-1.88%,+0.17%,-20.05%,-20%,0.858,,,37.78,23274177,264445049,1102220711,,,,,-0.34,99.66,-0.34,996.6,-3.4,9966.0,-34.0,-1.88,98.12,-1.88,981.2,-18.8,9812.0,-188.0,0.17,100.17,0.17,1001.7,1.7,10017.0,17.0,-20.05,79.95,-20.05,799.5,-200.5,7995.0,-2005.0,-20.0,80.0,-20.0,800.0,-200.0,8000.0,-2000.0,,,,,,,,,,,,,,,,,,,,,,
DOT,Polkadot,Crypto,infra,Crypto,0.830215,+1.80%,+0.14%,-13.97%,-53.62%,-54%,1.407,,,90.86,78894474,636011454,2546914653,,,,,1.8,101.8,1.8,1018.0,18.0,10180.0,180.0,0.14,100.14,0.14,1001.4,1.4,10014.0,14.0,-13.97,86.03,-13.97,860.3,-139.7,8603.0,-1397.0,-53.62,46.38,-53.62,463.8,-536.2,4638.0,-5362.0,-54.0,46.0,-54.0,460.0,-540.0,4600.0,-5400.0,,,,,,,,,,,,,,,,,,,,,,
LINK,Chainlink,Crypto,infra,Crypto,8.601173,+2.99%,+10.11%,+8.64%,-29.46%,-29%,6.435,,,189.27,119584339,1324905380,5629981622,,,,,2.99,102.99,2.99,1029.9,29.9,10299.0,299.0,10.11,110.11,10.11,1101.1,101.1,11011.0,1011.0,8.64,108.64,8.64,1086.4,86.4,10864.0,864.0,-29.46,70.54,-29.46,705.4,-294.6,7054.0,-2946.0,-29.0,71.0,-29.0,710.0,-290.0,7100.0,-2900.0,"BlackRock, Vanguard and JPMorgan Join DTCC's Tokenization Pilot: Which Crypto Could Benefit?",CCN,2026-07-16,0.637,"Chainlink Hits Record 900,000 Wallets as CCIP Adoption Expands",BeInCrypto,2026-07-14,0.103,US Government Sends $297 Million in Seized Crypto to Coinbase in One Day,BeInCrypto,2026-07-14,0.0,2,buy,0.75,"Strong institutional catalyst via DTCC tokenization pilot involving BlackRock, Vanguard, and JPMorgan; positive news sentiment 0.247 and +5.12% 1W.",news sentiment +0.247; +5.12% 1-week return; DTCC tokenization pilot with major banks; market cap $6.2B,,,,,
DOGE,Dogecoin,Crypto,meme,Crypto,0.072241,+0.23%,+1.41%,-13.44%,-38.41%,-38%,12.343,,,423.43,291643562,2964014784,16046434135,,,,,0.23,100.23,0.23,1002.3,2.3,10023.0,23.0,1.41,101.41,1.41,1014.1,14.1,10141.0,141.0,-13.44,86.56,-13.44,865.6,-134.4,8656.0,-1344.0,-38.41,61.59,-38.41,615.9,-384.1,6159.0,-3841.0,-38.0,62.0,-38.0,620.0,-380.0,6200.0,-3800.0,74% of Americans with an advisor feel ready to retire — here's the boring 3-step plan that starts there,Moneywise,2026-07-20,0.052,"Bitcoin, Ethereum, XRP, Dogecoin Stay Flat Amid Iran Tensions—Analyst Says This BTC Level Could Ignite 'Sustained Bull Trend'",Benzinga,2026-07-20,0.0,"Top Cryptocurrencies Lower; Bitcoin Holds Above $64,000",MT Newswires,2026-07-17,-0.103,,,,,,,,,,
PEPE,Pepe,Crypto,meme,Crypto,3e-06,+4.19%,+10.41%,+4.12%,-27.08%,-27%,1.217,,,145.04,147804491,1015294085,4329646731,,,,,4.19,104.19,4.19,1041.9,41.9,10419.0,419.0,10.41,110.41,10.41,1104.1,104.1,11041.0,1041.0,4.12,104.12,4.12,1041.2,41.2,10412.0,412.0,-27.08,72.92,-27.08,729.2,-270.8,7292.0,-2708.0,-27.0,73.0,-27.0,730.0,-270.0,7300.0,-2700.0,,,,,,,,,,,,,,,,,,,,,,
TAO,Bittensor,Crypto,ai,Crypto,195.713687,-0.72%,-1.66%,-15.30%,-10.50%,-10%,2.181,,,110.57,71419393,773978564,5268053351,,,,,-0.72,99.28,-0.72,992.8,-7.2,9928.0,-72.0,-1.66,98.34,-1.66,983.4,-16.6,9834.0,-166.0,-15.3,84.7,-15.3,847.0,-153.0,8470.0,-1530.0,-10.5,89.5,-10.5,895.0,-105.0,8950.0,-1050.0,-10.0,90.0,-10.0,900.0,-100.0,9000.0,-1000.0,,,,,,,,,,,,,,,,,,,,,,
FET,ASI Alliance,Crypto,ai,Crypto,0.153908,-2.01%,-1.21%,-17.76%,-22.55%,-23%,0.345,,,33.68,23309973,235742195,1444970624,,,,,-2.01,97.99,-2.01,979.9,-20.1,9799.0,-201.0,-1.21,98.79,-1.21,987.9,-12.1,9879.0,-121.0,-17.76,82.24,-17.76,822.4,-177.6,8224.0,-1776.0,-22.55,77.45,-22.55,774.5,-225.5,7745.0,-2255.0,-23.0,77.0,-23.0,770.0,-230.0,7700.0,-2300.0,,,,,,,,,,,,,,,,,,,,,,
RNDR,Render,Crypto,ai,Crypto,1.515018,+2.45%,+2.86%,-11.23%,+17.98%,+18%,0.786,,,21.99,16370088,153928301,986124333,,,,,2.45,102.45,2.45,1024.5,24.5,10245.0,245.0,2.86,102.86,2.86,1028.6,28.6,10286.0,286.0,-11.23,88.77,-11.23,887.7,-112.3,8877.0,-1123.0,17.98,117.98,17.98,1179.8,179.8,11798.0,1798.0,18.0,118.0,18.0,1180.0,180.0,11800.0,1800.0,,,,,,,,,,,,,,,,,,,,,,
OCEAN,Ocean Protocol,Crypto,ai,Crypto,0.107744,+0.16%,-1.75%,+5.08%,-28.45%,-28%,,,,0.03,9022,218445,2772440,,,,,0.16,100.16,0.16,1001.6,1.6,10016.0,16.0,-1.75,98.25,-1.75,982.5,-17.5,9825.0,-175.0,5.08,105.08,5.08,1050.8,50.8,10508.0,508.0,-28.45,71.55,-28.45,715.5,-284.5,7155.0,-2845.0,-28.0,72.0,-28.0,720.0,-280.0,7200.0,-2800.0,,,,,,,,,,,,,9,buy,0.52,Moderate 1M momentum at +4.02% but with weekly decline -4.76% and no news sentiment; YTD -28.57%.,+4.02% 1-month return; 1W -4.76%; YTD -28.57%; no sentiment data,,,,,
GRT,The Graph,Crypto,ai,Crypto,0.016685,+1.76%,-1.71%,-14.86%,-49.81%,-50%,0.182,,,11.23,7062789,78629375,406693131,,,,,1.76,101.76,1.76,1017.6,17.6,10176.0,176.0,-1.71,98.29,-1.71,982.9,-17.1,9829.0,-171.0,-14.86,85.14,-14.86,851.4,-148.6,8514.0,-1486.0,-49.81,50.19,-49.81,501.9,-498.1,5019.0,-4981.0,-50.0,50.0,-50.0,500.0,-500.0,5000.0,-5000.0,,,,,,,,,,,,,,,,,,,,,,
AGIX,SingularityNET,Crypto,ai,Crypto,0.066981,-1.91%,-1.80%,-17.88%,-21.89%,-22%,,,,0.0,1216,23404,208275,,,,,-1.91,98.09,-1.91,980.9,-19.1,9809.0,-191.0,-1.8,98.2,-1.8,982.0,-18.0,9820.0,-180.0,-17.88,82.12,-17.88,821.2,-178.8,8212.0,-1788.0,-21.89,78.11,-21.89,781.1,-218.9,7811.0,-2189.0,-22.0,78.0,-22.0,780.0,-220.0,7800.0,-2200.0,,,,,,,,,,,,,,,,,,,,,,
NMR,Numeraire,Crypto,ai,Crypto,9.537971,-3.65%,-1.52%,+6.96%,-0.17%,-0%,0.071,,,5.4,4956264,37783570,183127470,,,,,-3.65,96.35,-3.65,963.5,-36.5,9635.0,-365.0,-1.52,98.48,-1.52,984.8,-15.2,9848.0,-152.0,6.96,106.96,6.96,1069.6,69.6,10696.0,696.0,-0.17,99.83,-0.17,998.3,-1.7,9983.0,-17.0,-0.0,100.0,0.0,1000.0,0.0,10000.0,0.0,Numerai Buys Back Another $1.2M in NMR as Hedge Fund Assets Reach $700M,CryptoProwl,2026-07-18,0.202,U.S. government moves Shiba Inu related to major bankruptcy case,TheStreet,2026-07-15,0.0,,,,,4,buy,0.68,Buyback catalyst with $1.2M in NMR repurchased as hedge fund assets reach $700M; positive sentiment 0.101 and +6.79% 1M.,$1.2M buyback announced; positive news sentiment 0.101; +6.79% 1-month return; YTD +0.69%,,,,,
ALT,AltLayer,Crypto,ai,Crypto,0.006357,+0.91%,+1.54%,-0.97%,-44.48%,-44%,0.042,,,3.39,1845257,23759608,130308817,,,,,0.91,100.91,0.91,1009.1,9.1,10091.0,91.0,1.54,101.54,1.54,1015.4,15.4,10154.0,154.0,-0.97,99.03,-0.97,990.3,-9.7,9903.0,-97.0,-44.48,55.52,-44.48,555.2,-444.8,5552.0,-4448.0,-44.0,56.0,-44.0,560.0,-440.0,5600.0,-4400.0,,,,,,,,,,,,,,,,,,,,,,
AIOZ,AIOZ Network,Crypto,ai,Crypto,0.04996,-0.98%,-0.10%,-14.26%,-42.34%,-42%,0.063,,,3.42,4416448,23973806,115260259,,,,,-0.98,99.02,-0.98,990.2,-9.8,9902.0,-98.0,-0.1,99.9,-0.1,999.0,-1.0,9990.0,-10.0,-14.26,85.74,-14.26,857.4,-142.6,8574.0,-1426.0,-42.34,57.66,-42.34,576.6,-423.4,5766.0,-4234.0,-42.0,58.0,-42.0,580.0,-420.0,5800.0,-4200.0,,,,,,,,,,,,,,,,,,,,,,
ARKM,Arkham,Crypto,ai,Crypto,0.10546,-0.59%,-1.56%,-19.02%,-40.23%,-40%,0.024,,,4.83,3785129,33798807,184687273,,,,,-0.59,99.41,-0.59,994.1,-5.9,9941.0,-59.0,-1.56,98.44,-1.56,984.4,-15.6,9844.0,-156.0,-19.02,80.98,-19.02,809.8,-190.2,8098.0,-1902.0,-40.23,59.77,-40.23,597.7,-402.3,5977.0,-4023.0,-40.0,60.0,-40.0,600.0,-400.0,6000.0,-4000.0,,,,,,,,,,,,,,,,,,,,,,
