ticker,company_name,sector,category,exchange,price_usd,change_1d,change_1w,change_1m,change_ytd,return_1yr,market_cap_gbp_b,beta,pe_ratio,avg_volume_m,vol_1d,vol_1w,vol_1m,div_yield_pct,short_pct,analyst,analyst_score,pct_1d,val_100_1d,profit_100_1d,val_1000_1d,profit_1000_1d,val_10000_1d,profit_10000_1d,pct_1w,val_100_1w,profit_100_1w,val_1000_1w,profit_1000_1w,val_10000_1w,profit_10000_1w,pct_1m,val_100_1m,profit_100_1m,val_1000_1m,profit_1000_1m,val_10000_1m,profit_10000_1m,pct_ytd,val_100_ytd,profit_100_ytd,val_1000_ytd,profit_1000_ytd,val_10000_ytd,profit_10000_ytd,pct_1y,val_100_1y,profit_100_1y,val_1000_1y,profit_1000_1y,val_10000_1y,profit_10000_1y,news1_title,news1_publisher,news1_date,news1_sentiment,news2_title,news2_publisher,news2_date,news2_sentiment,news3_title,news3_publisher,news3_date,news3_sentiment,signal_rank,signal,signal_confidence,signal_rationale,signal_drivers,portfolio_held,portfolio_quantity,portfolio_avg_price,portfolio_ppl,portfolio_total_value
RXRX,Recursion Pharmaceuticals,Biotech,genomics,NASDAQ,3.23,+2.22%,+2.54%,+13.33%,-23.10%,-38%*,1.298,1.004,,15.72,22636057,90484457,472472757,,32.82,none,,2.22,102.22,2.22,1022.2,22.2,10222.0,222.0,2.54,102.54,2.54,1025.4,25.4,10254.0,254.0,13.33,113.33,13.33,1133.3,133.3,11333.0,1333.0,-23.1,76.9,-23.1,769.0,-231.0,7690.0,-2310.0,-38.0,62.0,-38.0,620.0,-380.0,6200.0,-3800.0,Why Recursion Pharmaceuticals (RXRX) Dipped More Than Broader Market Today,Zacks,2026-06-16,0.0,X-Energy (XE) Powers 13.5% as Cathie Wood Gobbles More Stake,Insider Monkey,2026-06-16,0.0,"Cathie Wood Buys $444 Million in SpaceX, Dumps Tesla and AMD",GuruFocus.com,2026-06-15,-0.402,9,buy,0.4,"RXRX has +10.4% 1M momentum despite -24% YTD, with low beta (1.004) and 32.8% short interest that could fuel a squeeze if AI drug discovery platform catalysts emerge. No official analyst score but technical setup is interesting.",+10.4% 1M momentum; low beta 1.004; 32.8% short interest squeeze potential; AI drug discovery platform,,,,,
INCY,Incyte,Biotech,oncology,NASDAQ,98.22,-0.73%,-8.91%,+2.74%,-3.16%,+45%,14.86,0.79,13.87,1.58,3645085,11221185,41995285,,9.83,buy,2.41,-0.73,99.27,-0.73,992.7,-7.3,9927.0,-73.0,-8.91,91.09,-8.91,910.9,-89.1,9109.0,-891.0,2.74,102.74,2.74,1027.4,27.4,10274.0,274.0,-3.16,96.84,-3.16,968.4,-31.6,9684.0,-316.0,45.0,145.0,45.0,1450.0,450.0,14500.0,4500.0,"MIRM, INCY Report Positive Rare Disease Data as FDA Begins NDA Review (Revised)",Zacks,2026-06-17,0.557,"MIRM, INCY Report Positive Rare Disease Data as FDA Begins NDA Review",Zacks,2026-06-15,0.557,Incyte Buys Vega To Add Late Stage Von Willebrand Disease Opportunity,Simply Wall St.,2026-06-12,0.421,,,,,,,,,,
EXEL,Exelixis,Biotech,oncology,NASDAQ,51.91,-0.94%,-2.97%,+6.66%,+19.11%,+30%,9.881,0.435,17.19,2.53,5280714,12583214,53591514,,16.07,buy,2.16,-0.94,99.06,-0.94,990.6,-9.4,9906.0,-94.0,-2.97,97.03,-2.97,970.3,-29.7,9703.0,-297.0,6.66,106.66,6.66,1066.6,66.6,10666.0,666.0,19.11,119.11,19.11,1191.1,191.1,11911.0,1911.0,30.0,130.0,30.0,1300.0,300.0,13000.0,3000.0,Exelixis CABINET Win Extends CABOMETYX Reach And Raises Valuation Questions,Simply Wall St.,2026-06-13,0.66,Halozyme Therapeutics (HALO) Up 0.8% Since Last Earnings Report: Can It Continue?,Zacks,2026-06-10,0.0,"Exelixis Hits High on Growing Sales, Institutional Inflows",FX Empire,2026-06-10,0.178,,,,,,,,,,
ALNY,Alnylam Pharmaceuticals,Biotech,oncology,NASDAQ,278.09,-1.16%,-3.90%,-5.51%,-30.51%,-9%,28.116,0.267,70.05,1.11,1772889,6846889,24528489,,5.29,buy,1.79,-1.16,98.84,-1.16,988.4,-11.6,9884.0,-116.0,-3.9,96.1,-3.9,961.0,-39.0,9610.0,-390.0,-5.51,94.49,-5.51,944.9,-55.1,9449.0,-551.0,-30.51,69.49,-30.51,694.9,-305.1,6949.0,-3051.0,-9.0,91.0,-9.0,910.0,-90.0,9100.0,-900.0,Alnylam Taps Generative AI And Nordic Expansion As Market Lags Targets,Simply Wall St.,2026-06-14,-0.361,Can Alnylam Rely on Amvuttra to Sustain Its Rapid Sales Momentum?,Zacks,2026-06-12,0.0,"Alnylam Pharmaceuticals Unveils 2030 Targets, Betting on AMVUTTRA and Pipeline Readouts",MarketBeat,2026-06-09,0.0,,,,,,,,,,
RCUS,Arcus Biosciences,Biotech,oncology,NYSE,24.31,-1.26%,+4.33%,+6.86%,+4.38%,+180%*,2.315,0.837,,1.17,1118626,5400126,23399526,,15.32,strong_buy,1.46,-1.26,98.74,-1.26,987.4,-12.6,9874.0,-126.0,4.33,104.33,4.33,1043.3,43.3,10433.0,433.0,6.86,106.86,6.86,1068.6,68.6,10686.0,686.0,4.38,104.38,4.38,1043.8,43.8,10438.0,438.0,180.0,280.0,180.0,2800.0,1800.0,28000.0,18000.0,Bristol Myers Squibb’s AI Overhaul And Oncology Trials Shape Value Story,Simply Wall St.,2026-06-12,0.34,"Arcus, Bristol Myers Team Up to Advance Kidney Cancer Study",Zacks,2026-06-04,-0.66,How Eisai (TSE:4523) Is Reframing Its Story With A Tweaked Fair Value Outlook,Simply Wall St.,2026-05-21,0.572,,,,,,,,,,
MRNA,Moderna,Biotech,mrna,NASDAQ,63.96,+3.04%,+28.85%,+39.90%,+107.26%,+139%,19.218,1.03,,6.71,21594865,58515565,147469365,,17.82,hold,3.09,3.04,103.04,3.04,1030.4,30.4,10304.0,304.0,28.85,128.85,28.85,1288.5,288.5,12885.0,2885.0,39.9,139.9,39.9,1399.0,399.0,13990.0,3990.0,107.26,207.26,107.26,2072.6,1072.6,20726.0,10726.0,139.0,239.0,139.0,2390.0,1390.0,23900.0,13900.0,MRNA Stock Clocks Best Week In Over 4 Years On FDA Advisory Committee Endorsement For Flu Vaccine,Stocktwits,2026-06-18,0.599,🔎 Under the Radar: Moderna Stock Rises on Flu-Shot Recommendation,The Wall Street Journal,2026-06-18,0.0,"Stock Market Today: Nasdaq, Russell 2000 Pace Rebound; SpaceX Slumps 24% Off Its Peak",Investor's Business Daily,2026-06-18,0.0,2,strong_buy,0.8,"MRNA has exploded +108% YTD, +33% 1M, driven by restructuring into three commercial franchises and positive FDA briefing docs for mRNA flu vaccine mFlusiva ahead of the June 18 VRBPAC meeting, with a PDUFA on Aug 5, 2026; strong cancer vaccine data (KEYNOTE-942) further supports platform. News sentiment is negative (-0.338) but the web search reveals substantial positive catalyst flow.",+108% YTD momentum; positive FDA VRBPAC briefing for mFlusiva; restructuring toward 3 commercial franchises; KEYNOTE-942 cancer vaccine data,,,,,
BNTX,BioNTech,Biotech,mrna,NASDAQ,90.89,-1.74%,+1.51%,+3.53%,-6.00%,-13%,17.406,1.324,,0.97,877986,4555286,23458686,,3.3,buy,1.55,-1.74,98.26,-1.74,982.6,-17.4,9826.0,-174.0,1.51,101.51,1.51,1015.1,15.1,10151.0,151.0,3.53,103.53,3.53,1035.3,35.3,10353.0,353.0,-6.0,94.0,-6.0,940.0,-60.0,9400.0,-600.0,-13.0,87.0,-13.0,870.0,-130.0,8700.0,-1300.0,"VERAXA Unveils Cancer Therapy Platform, Sparks Partnering Talks at BIO 2026",Exec Edge,2026-06-18,-0.66,PTC Therapeutics (PTCT) Moves 7.2% Higher: Will This Strength Last?,Zacks,2026-06-18,0.579,"US Equity Markets End Lower After Government Bond Yields Rise, Fed's Policy Statement",MT Newswires,2026-06-17,-0.296,,,,,,,,,,
NVAX,Novavax,Biotech,mrna,NASDAQ,9.13,-4.80%,+1.11%,+2.58%,+28.05%,+48%*,1.137,2.414,,4.58,7547222,21781922,110843022,,28.13,buy,2.33,-4.8,95.2,-4.8,952.0,-48.0,9520.0,-480.0,1.11,101.11,1.11,1011.1,11.1,10111.0,111.0,2.58,102.58,2.58,1025.8,25.8,10258.0,258.0,28.05,128.05,28.05,1280.5,280.5,12805.0,2805.0,48.0,148.0,48.0,1480.0,480.0,14800.0,4800.0,Moderna Is Up 94% This Year: Is It Outperforming Other Vaccine Stocks Like Pfizer and Novavax?,24/7 Wall St.,2026-06-16,0.361,A Look Back at Therapeutics Stocks’ Q1 Earnings: Novavax (NASDAQ:NVAX) Vs The Rest Of The Pack,StockStory,2026-06-16,0.0,Novavax (NVAX) Stock Slides as Market Rises: Facts to Know Before You Trade,Zacks,2026-06-12,0.0,,,,,,,,,,
BMRN,BioMarin Pharmaceutical,Biotech,rare-disease,NASDAQ,54.69,-0.60%,-1.53%,+9.80%,-8.01%,+0%,8.005,0.24,39.35,2.01,2949546,8752246,52568246,,6.02,buy,1.69,-0.6,99.4,-0.6,994.0,-6.0,9940.0,-60.0,-1.53,98.47,-1.53,984.7,-15.3,9847.0,-153.0,9.8,109.8,9.8,1098.0,98.0,10980.0,980.0,-8.01,91.99,-8.01,919.9,-80.1,9199.0,-801.0,0.0,100.0,0.0,1000.0,0.0,10000.0,0.0,2 Profitable Stocks Worth Your Attention and 1 We Find Risky,StockStory,2026-06-11,0.459,Biomarin Pharmaceutical (BMRN): Most Undervalued Stocks to Buy and Hold for 2 Years,Insider Monkey,2026-06-08,0.0,BioMarin’s VOXZOGO Win In Hypochondroplasia Shapes Rare Disease Growth Story,Simply Wall St.,2026-06-05,0.751,8,buy,0.55,"BMRN is up +10.3% 1M, with a buy consensus (score 1.69) and positive news sentiment (+0.242). P/E of 39.41 is elevated but reflects rare-disease pricing power, and low beta (0.24) provides downside protection.",+10.3% 1M rebound; buy analyst consensus (1.69); positive news sentiment +0.242; low beta 0.24 defensive,,,,,
SRPT,Sarepta Therapeutics,Biotech,rare-disease,NASDAQ,17.53,+3.73%,+16.87%,+5.35%,-17.74%,-16%,1.402,0.205,50.09,3.13,4704609,15995309,62710009,,28.53,none,,3.73,103.73,3.73,1037.3,37.3,10373.0,373.0,16.87,116.87,16.87,1168.7,168.7,11687.0,1687.0,5.35,105.35,5.35,1053.5,53.5,10535.0,535.0,-17.74,82.26,-17.74,822.6,-177.4,8226.0,-1774.0,-16.0,84.0,-16.0,840.0,-160.0,8400.0,-1600.0,"Sarepta's Elevidys Showing Signs of Stabilization as siRNA Pipeline Gains Importance, RBC Says",MT Newswires,2026-06-18,0.599,Is Sarepta (SRPT) Using New Equity Plans To Quietly Redefine Its Post‑Profitability Playbook?,Simply Wall St.,2026-06-08,0.0,All You Need to Know About Sarepta Therapeutics (SRPT) Rating Upgrade to Buy,Zacks,2026-06-08,0.0,,,,,,,,,,
COAG,Hemab Therapeutics,Biotech,rare-disease,NASDAQ,29.24,+10.55%,+8.54%,+14.94%,-14.00%,-22%,1.034,,,0.34,1547886,2664386,5594186,,,strong_buy,1.0,10.55,110.55,10.55,1105.5,105.5,11055.0,1055.0,8.54,108.54,8.54,1085.4,85.4,10854.0,854.0,14.94,114.94,14.94,1149.4,149.4,11494.0,1494.0,-14.0,86.0,-14.0,860.0,-140.0,8600.0,-1400.0,-22.0,78.0,-22.0,780.0,-220.0,7800.0,-2200.0,"Hemab Therapeutics Details Post-IPO Pipeline Push, Sutacimig Phase III Plans",MarketBeat,2026-06-09,0.0,Hemab Therapeutics IPO Debut Puts COAG And Pipeline Risks In Focus,Simply Wall St.,2026-05-03,-0.273,,,,,,,,,,,,,,
NVO,Novo Nordisk,Biotech,metabolic,NYSE,43.19,-0.94%,-1.75%,-2.46%,-14.54%,-41%,144.822,0.349,10.16,15.79,7981639,50013539,272662739,414.0,0.71,buy,2.36,-0.94,99.06,-0.94,990.6,-9.4,9906.0,-94.0,-1.75,98.25,-1.75,982.5,-17.5,9825.0,-175.0,-2.46,97.54,-2.46,975.4,-24.6,9754.0,-246.0,-14.54,85.46,-14.54,854.6,-145.4,8546.0,-1454.0,-41.0,59.0,-41.0,590.0,-410.0,5900.0,-4100.0,Hims & Hers Rallies With a July FDA Decision Looming,GuruFocus.com,2026-06-18,-0.128,FDA Accepts Roche's Filing for Lunsumio VELO-Polivy in LBCL,Zacks,2026-06-18,0.318,Can Pfizer Take Share From Lilly & Novo Nordisk in the Obesity Space?,Zacks,2026-06-18,0.296,,,,,,,,,,
LLY,Eli Lilly,Biotech,metabolic,NYSE,1098.57,-1.28%,-5.37%,+7.55%,+2.03%,+46%,741.852,0.517,39.0,3.17,4441204,14690804,72149204,,1.1,buy,1.74,-1.28,98.72,-1.28,987.2,-12.8,9872.0,-128.0,-5.37,94.63,-5.37,946.3,-53.7,9463.0,-537.0,7.55,107.55,7.55,1075.5,75.5,10755.0,755.0,2.03,102.03,2.03,1020.3,20.3,10203.0,203.0,46.0,146.0,46.0,1460.0,460.0,14600.0,4600.0,Eli Lilly and Company (LLY) is one of the Best Growth Stocks to Buy According Ray Dalio,Insider Monkey,2026-06-18,0.778,Taking Advantage Of Short-Term Rotation With Eli Lilly Stock,Investor's Business Daily,2026-06-18,0.25,Eli Lilly (LLY) Stock Could Be 24.7% Undervalued on Its Growth Narrative,Simply Wall St.,2026-06-18,0.382,7,buy,0.65,"LLY is up +11.1% 1M, +46% 1Y, with a P/E of 38.98 (reasonable for growth), positive news sentiment (+0.26), buy rating, and a massive £741.8B market cap signaling stability; obesity franchise momentum remains a key driver.",+11.1% 1M momentum; +46% 1Y return; P/E 39 reasonable for growth; positive news sentiment +0.26,,,,,
LEGN,Legend Biotech,Biotech,neuroscience,NASDAQ,27.93,-11.33%,-23.02%,+3.67%,+29.85%,-1%,3.928,0.352,,2.42,13601339,19815239,70152339,,17.1,buy,1.6,-11.33,88.67,-11.33,886.7,-113.3,8867.0,-1133.0,-23.02,76.98,-23.02,769.8,-230.2,7698.0,-2302.0,3.67,103.67,3.67,1036.7,36.7,10367.0,367.0,29.85,129.85,29.85,1298.5,298.5,12985.0,2985.0,-1.0,99.0,-1.0,990.0,-10.0,9900.0,-100.0,"Exchange-Traded Funds, Equity Futures Higher Pre-Bell Thursday as Interim US-Iran Deal Lifts Risk Sentiment",MT Newswires,2026-06-18,-0.273,Imviva Unveils Leukemia Data at EHA 2026 With 86% Response Rates,Exec Edge,2026-06-11,0.0,Legend Biotech (LEGN) Is Up 26.2% After Early In Vivo CAR-T Success in B-Cell Lymphoma,Simply Wall St.,2026-06-04,0.572,,,,,,,,,,
IONS,Ionis Pharmaceuticals,Biotech,neuroscience,NASDAQ,74.12,-2.20%,+0.41%,+0.38%,-6.97%,+99%,9.276,0.37,,1.82,2399737,9460537,37858937,,13.64,buy,1.62,-2.2,97.8,-2.2,978.0,-22.0,9780.0,-220.0,0.41,100.41,0.41,1004.1,4.1,10041.0,41.0,0.38,100.38,0.38,1003.8,3.8,10038.0,38.0,-6.97,93.03,-6.97,930.3,-69.7,9303.0,-697.0,99.0,199.0,99.0,1990.0,990.0,19900.0,9900.0,"Is lonis Pharmaceuticals, Inc. (IONS) Among the Best Genomics Stocks to Buy According to Analysts?",Insider Monkey,2026-06-16,0.637,Intellia Surges; Can Its Gene-Editing Drug Solve The Chronic Treatment Problem?,Investor's Business Daily,2026-06-15,-0.226,Assessing Ionis Pharmaceuticals (IONS) Valuation After New Olezarsen Data Plans And Bullish Pipeline Updates,Simply Wall St.,2026-06-06,0.0,,,,,,,,,,
BTC,Bitcoin,Crypto,bitcoin,Crypto,62777.13568,-2.36%,-1.20%,-18.06%,-28.27%,-28%,952.948,,,27207.83,32345181753,190454798684,1047856019360,,,,,-2.36,97.64,-2.36,976.4,-23.6,9764.0,-236.0,-1.2,98.8,-1.2,988.0,-12.0,9880.0,-120.0,-18.06,81.94,-18.06,819.4,-180.6,8194.0,-1806.0,-28.27,71.73,-28.27,717.3,-282.7,7173.0,-2827.0,-28.0,72.0,-28.0,720.0,-280.0,7200.0,-2800.0,Fed rates hold: Stocks and bitcoin drop after Kevin Warsh FOMC debut,Yahoo Finance Video,2026-06-18,-0.273,"Coinbase CEO on bitcoin bottom, AI agents, and his war of words with JPMorgan CEO",Yahoo Finance,2026-06-18,-0.599,Roundtable 100: Frank Holmes Makes the Case for HIVE Digital Technologies,TheStreet,2026-06-18,0.0,,,,,,,,,,
ETH,Ethereum,Crypto,layer1,Crypto,1701.793925,-2.31%,+1.52%,-19.06%,-42.64%,-43%,155.534,,,11628.11,13878521094,81396739712,445897013330,,,,,-2.31,97.69,-2.31,976.9,-23.1,9769.0,-231.0,1.52,101.52,1.52,1015.2,15.2,10152.0,152.0,-19.06,80.94,-19.06,809.4,-190.6,8094.0,-1906.0,-42.64,57.36,-42.64,573.6,-426.4,5736.0,-4264.0,-43.0,57.0,-43.0,570.0,-430.0,5700.0,-4300.0,Why Coinbase CEO Brian Armstrong believes bitcoin has bottomed,Yahoo Finance Video,2026-06-18,0.0,"Bitcoin and ethereum prices today, Thursday, June 18, 2026: Prices sliding despite Iran peace deal",Yahoo Personal Finance,2026-06-18,-0.431,"Tech, Media & Telecom Roundup: Market Talk",The Wall Street Journal,2026-06-18,0.0,,,,,,,,,,
SOL,Solana,Crypto,layer1,Crypto,69.427014,-3.17%,+3.72%,-17.36%,-44.24%,-44%,30.504,,,2453.92,2763627181,17177443754,87909836373,,,,,-3.17,96.83,-3.17,968.3,-31.7,9683.0,-317.0,3.72,103.72,3.72,1037.2,37.2,10372.0,372.0,-17.36,82.64,-17.36,826.4,-173.6,8264.0,-1736.0,-44.24,55.76,-44.24,557.6,-442.4,5576.0,-4424.0,-44.0,56.0,-44.0,560.0,-440.0,5600.0,-4400.0,Fed rates hold: Stocks and bitcoin drop after Kevin Warsh FOMC debut,Yahoo Finance Video,2026-06-18,-0.273,Why Coinbase CEO Brian Armstrong believes bitcoin has bottomed,Yahoo Finance Video,2026-06-18,0.0,"Tech, Media & Telecom Roundup: Market Talk",The Wall Street Journal,2026-06-18,0.0,,,,,,,,,,
BNB,BNB,Crypto,layer1,Crypto,578.438935,-3.50%,-4.16%,-9.31%,-32.99%,-33%,59.042,,,769.76,853748437,5388298829,33158684234,,,,,-3.5,96.5,-3.5,965.0,-35.0,9650.0,-350.0,-4.16,95.84,-4.16,958.4,-41.6,9584.0,-416.0,-9.31,90.69,-9.31,906.9,-93.1,9069.0,-931.0,-32.99,67.01,-32.99,670.1,-329.9,6701.0,-3299.0,-33.0,67.0,-33.0,670.0,-330.0,6700.0,-3300.0,"Top Cryptocurrencies Drop; Bitcoin Falls Below $63,000",MT Newswires,2026-06-18,-0.077,BNB Chain’s LAB Token Keeps Exploding in a Parabolic Rally: What’s Next?,BeInCrypto,2026-06-18,0.0,"Top Cryptocurrencies Fall; Bitcoin Drops Below $65,000 Level",MT Newswires,2026-06-17,0.202,,,,,,,,,,
ADA,Cardano,Crypto,layer1,Crypto,0.16266,-2.30%,-4.63%,-34.29%,-51.10%,-51%,4.481,,,487.49,542818019,3412419639,14655063136,,,,,-2.3,97.7,-2.3,977.0,-23.0,9770.0,-230.0,-4.63,95.37,-4.63,953.7,-46.3,9537.0,-463.0,-34.29,65.71,-34.29,657.1,-342.9,6571.0,-3429.0,-51.1,48.9,-51.1,489.0,-511.0,4890.0,-5110.0,-51.0,49.0,-51.0,490.0,-510.0,4900.0,-5100.0,"Top Cryptocurrencies Drop; Bitcoin Falls Below $63,000",MT Newswires,2026-06-18,-0.077,"Hoskinson Has a Plan to Save Cardano, But ADA Holders aren’t Buying It",BeInCrypto,2026-06-18,0.273,"Top Cryptocurrencies Fall; Bitcoin Drops Below $65,000 Level",MT Newswires,2026-06-17,0.202,,,,,,,,,,
AVAX,Avalanche,Crypto,layer1,Crypto,6.293873,-6.55%,-5.36%,-30.64%,-48.86%,-49%,2.058,,,183.33,234588218,1283309890,6186044049,,,,,-6.55,93.45,-6.55,934.5,-65.5,9345.0,-655.0,-5.36,94.64,-5.36,946.4,-53.6,9464.0,-536.0,-30.64,69.36,-30.64,693.6,-306.4,6936.0,-3064.0,-48.86,51.14,-48.86,511.4,-488.6,5114.0,-4886.0,-49.0,51.0,-49.0,510.0,-490.0,5100.0,-4900.0,Why Is The Crypto Market Down Today?,BeInCrypto,2026-06-16,0.0,FIFA World Cup Push Lifts Avalanche Adoption: Will AVAX Price Rally?,BeInCrypto,2026-06-15,0.0,Is Avalanche About to Have Its Biggest Year Yet?,Motley Fool,2026-06-15,0.0,,,,,,,,,,
XRP,XRP,Crypto,payments,Crypto,1.145612,-3.35%,+0.24%,-15.44%,-37.72%,-38%,53.836,,,1827.13,2011874255,12789931418,59160198483,,,,,-3.35,96.65,-3.35,966.5,-33.5,9665.0,-335.0,0.24,100.24,0.24,1002.4,2.4,10024.0,24.0,-15.44,84.56,-15.44,845.6,-154.4,8456.0,-1544.0,-37.72,62.28,-37.72,622.8,-377.2,6228.0,-3772.0,-38.0,62.0,-38.0,620.0,-380.0,6200.0,-3800.0,"Tech, Media & Telecom Roundup: Market Talk",The Wall Street Journal,2026-06-18,0.0,"Top Cryptocurrencies Drop; Bitcoin Falls Below $63,000",MT Newswires,2026-06-18,-0.077,"Ripple Drops 6%, Bitcoin Falls 5% in Crypto Pullback Defying Stock Rally",24/7 Wall St.,2026-06-18,0.0,,,,,,,,,,
XLM,Stellar,Crypto,payments,Crypto,0.235402,+3.98%,+22.36%,+64.38%,+17.33%,+17%,6.026,,,389.32,466127344,2725214750,18282690834,,,,,3.98,103.98,3.98,1039.8,39.8,10398.0,398.0,22.36,122.36,22.36,1223.6,223.6,12236.0,2236.0,64.38,164.38,64.38,1643.8,643.8,16438.0,6438.0,17.33,117.33,17.33,1173.3,173.3,11733.0,1733.0,17.0,117.0,17.0,1170.0,170.0,11700.0,1700.0,,,,,,,,,,,,,2,strong_buy,0.8,"XLM is up +62.74% in 1 month and +22.20% in 1 week, with positive funding rates and rising open interest (+10% in 24h), holding above key moving averages at $0.18-$0.20.",+62.74% 1M momentum; positive funding rate 0.0065%; rising open interest +10%; holding above $0.18-$0.20 MA cluster,,,,,
TRX,TRON,Crypto,payments,Crypto,0.320227,-0.09%,+2.11%,-10.00%,+12.62%,+13%,22.998,,,552.88,593755821,3870154726,17679865929,,,,,-0.09,99.91,-0.09,999.1,-0.9,9991.0,-9.0,2.11,102.11,2.11,1021.1,21.1,10211.0,211.0,-10.0,90.0,-10.0,900.0,-100.0,9000.0,-1000.0,12.62,112.62,12.62,1126.2,126.2,11262.0,1262.0,13.0,113.0,13.0,1130.0,130.0,11300.0,1300.0,Tron Shows 3 Bullish Signals While Topping Weekly Loser List,BeInCrypto,2026-06-13,-0.527,Monero Jumps 27% in a Suspected $120 Million Laundering Run: Too Loud to Hide?,BeInCrypto,2026-06-12,-0.382,,,,,,,,,,,,,,
SUI,Sui,Crypto,emerging,Crypto,0.721985,-6.21%,-5.34%,-31.26%,-48.52%,-49%,2.203,,,366.86,393421513,2568002981,17204269636,,,,,-6.21,93.79,-6.21,937.9,-62.1,9379.0,-621.0,-5.34,94.66,-5.34,946.6,-53.4,9466.0,-534.0,-31.26,68.74,-31.26,687.4,-312.6,6874.0,-3126.0,-48.52,51.48,-48.52,514.8,-485.2,5148.0,-4852.0,-49.0,51.0,-49.0,510.0,-490.0,5100.0,-4900.0,4 AI Models Reveal SOL Price Predictions for 2026 — One Calls for a Massive Surge,CCN,2026-06-14,0.0,,,,,,,,,,,,,,,,,,
HBAR,Hedera,Crypto,emerging,Crypto,0.080173,-0.42%,+0.53%,-9.01%,-24.50%,-24%,2.639,,,72.16,83279336,505134775,3077632986,,,,,-0.42,99.58,-0.42,995.8,-4.2,9958.0,-42.0,0.53,100.53,0.53,1005.3,5.3,10053.0,53.0,-9.01,90.99,-9.01,909.9,-90.1,9099.0,-901.0,-24.5,75.5,-24.5,755.0,-245.0,7550.0,-2450.0,-24.0,76.0,-24.0,760.0,-240.0,7600.0,-2400.0,,,,,,,,,,,,,9,buy,0.45,"HBAR is up +0.50% in 1W and -0.48% in 1D, with a market cap of £2.628B and YTD of -24.87%, showing a slight positive short-term bias in a downtrend.",+0.50% 1W; market cap £2.628B; emerging category,,,,,
ALGO,Algorand,Crypto,emerging,Crypto,0.098023,+1.03%,+9.66%,-11.97%,-11.04%,-11%,0.663,,,41.32,48625384,289273641,1359315289,,,,,1.03,101.03,1.03,1010.3,10.3,10103.0,103.0,9.66,109.66,9.66,1096.6,96.6,10966.0,966.0,-11.97,88.03,-11.97,880.3,-119.7,8803.0,-1197.0,-11.04,88.96,-11.04,889.6,-110.4,8896.0,-1104.0,-11.0,89.0,-11.0,890.0,-110.0,8900.0,-1100.0,,,,,,,,,,,,,6,buy,0.6,"ALGO gained +14.28% in 1 week and +2.67% in 1 day, showing a strong short-term reversal despite a -9.21% YTD and -10.33% 1M decline, with a small market cap of £0.677B.",+14.28% 1W momentum; short-term reversal; low market cap £0.677B,,,,,
MINA,Mina,Crypto,emerging,Crypto,0.041783,-4.34%,-2.26%,-25.95%,-44.69%,-45%,0.041,,,4.46,5959529,31193298,316815255,,,,,-4.34,95.66,-4.34,956.6,-43.4,9566.0,-434.0,-2.26,97.74,-2.26,977.4,-22.6,9774.0,-226.0,-25.95,74.05,-25.95,740.5,-259.5,7405.0,-2595.0,-44.69,55.31,-44.69,553.1,-446.9,5531.0,-4469.0,-45.0,55.0,-45.0,550.0,-450.0,5500.0,-4500.0,,,,,,,,,,,,,,,,,,,,,,
POL,Polygon (MATIC),Crypto,infra,Crypto,0.077588,+1.33%,+4.43%,-12.77%,-22.75%,-23%,0.627,,,31.96,35862174,223753500,1314989220,,,,,1.33,101.33,1.33,1013.3,13.3,10133.0,133.0,4.43,104.43,4.43,1044.3,44.3,10443.0,443.0,-12.77,87.23,-12.77,872.3,-127.7,8723.0,-1277.0,-22.75,77.25,-22.75,772.5,-227.5,7725.0,-2275.0,-23.0,77.0,-23.0,770.0,-230.0,7700.0,-2300.0,,,,,,,,,,,,,,,,,,,,,,
DOT,Polkadot,Crypto,infra,Crypto,0.968706,-3.19%,+0.95%,-20.87%,-45.88%,-46%,1.239,,,101.61,114803932,711255257,4292349004,,,,,-3.19,96.81,-3.19,968.1,-31.9,9681.0,-319.0,0.95,100.95,0.95,1009.5,9.5,10095.0,95.0,-20.87,79.13,-20.87,791.3,-208.7,7913.0,-2087.0,-45.88,54.12,-45.88,541.2,-458.8,5412.0,-4588.0,-46.0,54.0,-46.0,540.0,-460.0,5400.0,-4600.0,,,,,,,,,,,,,,,,,,,,,,
LINK,Chainlink,Crypto,infra,Crypto,7.963826,-0.91%,+0.43%,-15.63%,-34.69%,-35%,4.385,,,220.03,230115423,1540234287,8997205231,,,,,-0.91,99.09,-0.91,990.9,-9.1,9909.0,-91.0,0.43,100.43,0.43,1004.3,4.3,10043.0,43.0,-15.63,84.37,-15.63,843.7,-156.3,8437.0,-1563.0,-34.69,65.31,-34.69,653.1,-346.9,6531.0,-3469.0,-35.0,65.0,-35.0,650.0,-350.0,6500.0,-3500.0,What Crypto Whales Are Buying and Selling Ahead of the June FOMC Meeting,BeInCrypto,2026-06-17,0.0,Chainlink Bets Big on Prediction Markets with New Oracle Strategy,CoinGape,2026-06-15,0.0,Best Altcoins to Buy in 2026,Motley Fool,2026-06-14,0.637,,,,,,,,,,
DOGE,Dogecoin,Crypto,meme,Crypto,0.083181,-2.87%,-3.78%,-19.05%,-29.08%,-29%,9.746,,,796.44,594997438,5575079893,25235318986,,,,,-2.87,97.13,-2.87,971.3,-28.7,9713.0,-287.0,-3.78,96.22,-3.78,962.2,-37.8,9622.0,-378.0,-19.05,80.95,-19.05,809.5,-190.5,8095.0,-1905.0,-29.08,70.92,-29.08,709.2,-290.8,7092.0,-2908.0,-29.0,71.0,-29.0,710.0,-290.0,7100.0,-2900.0,"Top Cryptocurrencies Drop; Bitcoin Falls Below $63,000",MT Newswires,2026-06-18,-0.077,"Elon Musk, The World's First Trillionaire, Holds Bitcoin And 'Some' Dogecoin — 'Let That Sink In,' Says Popular Analyst",Benzinga,2026-06-18,0.421,"Bitcoin, Ethereum, XRP, Dogecoin In Red Even As Trump Signs Iran Peace Deal: Analyst Says BTC In 'Fragile Recovery Phase'",Benzinga,2026-06-18,0.542,,,,,,,,,,
PEPE,Pepe,Crypto,meme,Crypto,3e-06,-3.38%,+1.26%,-21.85%,-29.78%,-30%,0.888,,,186.5,185626753,1305504589,5757446201,,,,,-3.38,96.62,-3.38,966.2,-33.8,9662.0,-338.0,1.26,101.26,1.26,1012.6,12.6,10126.0,126.0,-21.85,78.15,-21.85,781.5,-218.5,7815.0,-2185.0,-29.78,70.22,-29.78,702.2,-297.8,7022.0,-2978.0,-30.0,70.0,-30.0,700.0,-300.0,7000.0,-3000.0,,,,,,,,,,,,,,,,,,,,,,
TAO,Bittensor,Crypto,ai,Crypto,235.222315,-4.54%,+8.50%,-8.46%,+7.57%,+8%,1.965,,,302.7,263792860,2118920763,6888188044,,,,,-4.54,95.46,-4.54,954.6,-45.4,9546.0,-454.0,8.5,108.5,8.5,1085.0,85.0,10850.0,850.0,-8.46,91.54,-8.46,915.4,-84.6,9154.0,-846.0,7.57,107.57,7.57,1075.7,75.7,10757.0,757.0,8.0,108.0,8.0,1080.0,80.0,10800.0,800.0,,,,,,,,,,,,,,,,,,,,,,
FET,ASI Alliance,Crypto,ai,Crypto,0.195175,-2.27%,+0.67%,+3.76%,-1.78%,-2%,0.334,,,92.83,80847667,649776330,4031893439,,,,,-2.27,97.73,-2.27,977.3,-22.7,9773.0,-227.0,0.67,100.67,0.67,1006.7,6.7,10067.0,67.0,3.76,103.76,3.76,1037.6,37.6,10376.0,376.0,-1.78,98.22,-1.78,982.2,-17.8,9822.0,-178.0,-2.0,98.0,-2.0,980.0,-20.0,9800.0,-200.0,,,,,,,,,,,,,10,buy,0.4,"FET is up +0.47% in 1M and -0.67% in 1W, with a market cap of £0.328B and YTD of -3.63%, showing very weak momentum but a relatively stable YTD.",+0.47% 1M; market cap £0.328B; AI sector,,,,,
RNDR,Render,Crypto,ai,Crypto,1.662176,-1.70%,+0.06%,-8.17%,+29.44%,+29%,0.653,,,59.09,56396625,413607930,2996575039,,,,,-1.7,98.3,-1.7,983.0,-17.0,9830.0,-170.0,0.06,100.06,0.06,1000.6,0.6,10006.0,6.0,-8.17,91.83,-8.17,918.3,-81.7,9183.0,-817.0,29.44,129.44,29.44,1294.4,294.4,12944.0,2944.0,29.0,129.0,29.0,1290.0,290.0,12900.0,2900.0,,,,,,,,,,,,,,,,,,,,,,
OCEAN,Ocean Protocol,Crypto,ai,Crypto,0.10228,+1.54%,-1.91%,-14.59%,-32.08%,-32%,,,,0.04,33588,257484,2022515,,,,,1.54,101.54,1.54,1015.4,15.4,10154.0,154.0,-1.91,98.09,-1.91,980.9,-19.1,9809.0,-191.0,-14.59,85.41,-14.59,854.1,-145.9,8541.0,-1459.0,-32.08,67.92,-32.08,679.2,-320.8,6792.0,-3208.0,-32.0,68.0,-32.0,680.0,-320.0,6800.0,-3200.0,,,,,,,,,,,,,,,,,,,,,,
GRT,The Graph,Crypto,ai,Crypto,0.019292,-0.97%,-1.86%,-21.60%,-41.97%,-42%,0.159,,,12.26,12471269,85852761,539649739,,,,,-0.97,99.03,-0.97,990.3,-9.7,9903.0,-97.0,-1.86,98.14,-1.86,981.4,-18.6,9814.0,-186.0,-21.6,78.4,-21.6,784.0,-216.0,7840.0,-2160.0,-41.97,58.03,-41.97,580.3,-419.7,5803.0,-4197.0,-42.0,58.0,-42.0,580.0,-420.0,5800.0,-4200.0,,,,,,,,,,,,,,,,,,,,,,
AGIX,SingularityNET,Crypto,ai,Crypto,0.082904,-4.98%,-2.16%,+0.95%,-3.32%,-3%,,,,0.01,8204,81052,834798,,,,,-4.98,95.02,-4.98,950.2,-49.8,9502.0,-498.0,-2.16,97.84,-2.16,978.4,-21.6,9784.0,-216.0,0.95,100.95,0.95,1009.5,9.5,10095.0,95.0,-3.32,96.68,-3.32,966.8,-33.2,9668.0,-332.0,-3.0,97.0,-3.0,970.0,-30.0,9700.0,-300.0,,,,,,,,,,,,,,,,,,,,,,
