ticker,company_name,sector,category,exchange,price_usd,change_1d,change_1w,change_1m,change_ytd,return_1yr,market_cap_gbp_b,beta,pe_ratio,avg_volume_m,vol_1d,vol_1w,vol_1m,div_yield_pct,short_pct,analyst,analyst_score,pct_1d,val_100_1d,profit_100_1d,val_1000_1d,profit_1000_1d,val_10000_1d,profit_10000_1d,pct_1w,val_100_1w,profit_100_1w,val_1000_1w,profit_1000_1w,val_10000_1w,profit_10000_1w,pct_1m,val_100_1m,profit_100_1m,val_1000_1m,profit_1000_1m,val_10000_1m,profit_10000_1m,pct_ytd,val_100_ytd,profit_100_ytd,val_1000_ytd,profit_1000_ytd,val_10000_ytd,profit_10000_ytd,pct_1y,val_100_1y,profit_100_1y,val_1000_1y,profit_1000_1y,val_10000_1y,profit_10000_1y,news1_title,news1_publisher,news1_date,news1_sentiment,news2_title,news2_publisher,news2_date,news2_sentiment,news3_title,news3_publisher,news3_date,news3_sentiment,signal_rank,signal,signal_confidence,signal_rationale,signal_drivers,portfolio_held,portfolio_quantity,portfolio_avg_price,portfolio_ppl,portfolio_total_value
SNDK,SanDisk Corporation,AI,memory,NASDAQ,2335.0,+8.60%,+19.21%,+46.90%,+748.35%,+3936%,262.019,,79.72,14.19,14790307,60235807,243157907,,9.71,buy,1.59,8.6,108.6,8.6,1086.0,86.0,10860.0,860.0,19.21,119.21,19.21,1192.1,192.1,11921.0,1921.0,46.9,146.9,46.9,1469.0,469.0,14690.0,4690.0,748.35,848.35,748.35,8483.5,7483.5,84835.0,74835.0,3936.0,4036.0,3936.0,40360.0,39360.0,403600.0,393600.0,"Sandisk, Western Digital, and others soar as Micron results  'justify elevated valuations'",Yahoo Finance,2026-06-25,0.0,"Microsoft stock tumbles, Micron sparks memory chip rally, Qualcomm's data center venture",Yahoo Finance Video,2026-06-25,0.0,Dow Jones Futures: Mixed Market Signals As Micron's Gain Is Apple's Pain,Investor's Business Daily,2026-06-25,0.026,8,strong_buy,1.0,"YTD of +613.41% and 1M of +23.53% with a buy analyst consensus; the -13.31% 1D crash on Korean contagion is severe, but the underlying Q3 beat (revenue $5.95B vs $4.73B consensus) and 645% datacenter YoY growth suggest fundamentals remain intact ([247wallst.com](https://247wallst.com/investing/2026/06/23/sandisk-plunges-11-micron-and-western-digital-slide-10-as-korean-market-crash-hits-memory-chips/)).",YTD +613.41%; 1M +23.53%; Q3 revenue beat; datacenter growth 645% YoY,,,,,
WDC,Western Digital,AI,memory,NASDAQ,675.39,-6.70%,-5.16%,+28.77%,+260.09%,+914%,176.398,2.2,40.35,8.09,11690257,66433057,200303857,9.0,10.43,buy,1.56,-6.7,93.3,-6.7,933.0,-67.0,9330.0,-670.0,-5.16,94.84,-5.16,948.4,-51.6,9484.0,-516.0,28.77,128.77,28.77,1287.7,287.7,12877.0,2877.0,260.09,360.09,260.09,3600.9,2600.9,36009.0,26009.0,914.0,1014.0,914.0,10140.0,9140.0,101400.0,91400.0,"Sandisk, Western Digital, and others soar as Micron results  'justify elevated valuations'",Yahoo Finance,2026-06-25,0.0,"Microsoft stock tumbles, Micron sparks memory chip rally, Qualcomm's data center venture",Yahoo Finance Video,2026-06-25,0.0,"AI boom keeps memory chip makers in sweet spot, says expert",Reuters Videos,2026-06-25,0.459,7,strong_buy,1.0,Up +257.62% YTD and +27.88% in the last month with a buy analyst consensus and neutral news sentiment; the -8.53% 1D drop follows sector-wide Korea-led selling but the 1W gain of +2.63% shows relative strength.,YTD +257.62%; 1M +27.88%; 1W +2.63%; buy consensus,,,,,
285A,Kioxia Holdings,AI,memory,TSE,103850.0,+10.88%,+7.17%,+58.67%,+814.98%,+3556%,266.291,,103.09,36.24,29128700,181844200,912899100,,,buy,1.62,10.88,110.88,10.88,1108.8,108.8,11088.0,1088.0,7.17,107.17,7.17,1071.7,71.7,10717.0,717.0,58.67,158.67,58.67,1586.7,586.7,15867.0,5867.0,814.98,914.98,814.98,9149.8,8149.8,91498.0,81498.0,3556.0,3656.0,3556.0,36560.0,35560.0,365600.0,355600.0,Micron Jumps 267% as It Sees Memory Shortages Beyond 2027,GuruFocus.com,2026-06-25,-0.153,Japan's Nikkei Hits Record High After Micron's Blockbuster Results Soothe Investor Concerns,Barrons.com,2026-06-25,0.751,Kioxia Stock Surges 700% as AI Chip Demand Drives Profit Growth,GuruFocus.com,2026-06-24,0.612,5,strong_buy,1.0,"YTD surge of +714.98% and a 1-month return of +41.33% despite a high P/E of 91.95; the 1D move of +0.42% avoided the worst of Tuesday's memory selloff, supported by positive news sentiment of 0.164.",YTD +714.98%; 1M +41.33%; news sentiment +0.164; avoided major selloff,,,,,
MU,Micron Technology,AI,memory,NASDAQ,1213.56,-0.03%,+16.33%,+35.46%,+284.91%,+732%,1037.023,2.173,27.43,51.1,79552392,326514692,1272270192,6.0,3.34,strong_buy,1.49,-0.03,99.97,-0.03,999.7,-0.3,9997.0,-3.0,16.33,116.33,16.33,1163.3,163.3,11633.0,1633.0,35.46,135.46,35.46,1354.6,354.6,13546.0,3546.0,284.91,384.91,284.91,3849.1,2849.1,38491.0,28491.0,732.0,832.0,732.0,8320.0,7320.0,83200.0,73200.0,"Sandisk, Western Digital, and others soar as Micron results  'justify elevated valuations'",Yahoo Finance,2026-06-25,0.0,Big Tech stocks tumble while Micron continues to gain on Q3 earnings,Yahoo Finance Video,2026-06-25,0.527,Micron stock soars after blowout earnings expose AI's memory bottleneck,Yahoo Finance,2026-06-24,-0.153,6,strong_buy,1.0,"Up +852% over 1 year and +233.59% YTD, with a strong_buy analyst consensus (score 1.49) and a reasonable P/E of 49.75; the -14.52% 1D drop is a sharp pullback but driven by Korea leveraged ETF contagion, not fundamentals, and Dan Ives calls it a 'gut check moment' with Micron earnings the next catalyst ([fool.com](https://www.fool.com/investing/2026/06/23/why-micron-stock-suddenly-crashed/), [benzinga.com](https://www.benzinga.com/markets/equities/26/06/60062350/dan-ives-says-ai-revolution-is-in-the-third-inning-calls-chip-sell-off-a-gut-check-moment)).",1Y +852%; strong_buy consensus; P/E 49.75; earnings catalyst ahead,,,,,
STX,Seagate Technology,AI,memory,NASDAQ,1025.36,-5.99%,-3.75%,+21.32%,+257.47%,+606%,175.788,2.083,97.38,4.12,5494424,30265824,91170424,30.0,4.58,buy,1.54,-5.99,94.01,-5.99,940.1,-59.9,9401.0,-599.0,-3.75,96.25,-3.75,962.5,-37.5,9625.0,-375.0,21.32,121.32,21.32,1213.2,213.2,12132.0,2132.0,257.47,357.47,257.47,3574.7,2574.7,35747.0,25747.0,606.0,706.0,606.0,7060.0,6060.0,70600.0,60600.0,Western Digital Stock And Seagate Get Boost From Big Micron Earnings Beat,Investor's Business Daily,2026-06-25,0.402,"Nvidia, Qualcomm, Apple, Wendy’s, and More Stocks That Explain Today’s Market",Barrons.com,2026-06-25,0.0,Micron's 19% Rally Sends AI Chip Stocks Surging,GuruFocus.com,2026-06-25,0.0,9,strong_buy,1.0,"YTD return of +261.83% and a 1-month gain of +22.80% with strong news sentiment (+0.141) and a buy consensus; the -5.04% 1D dip is modest relative to peers, and the 1W gain of +1.94% shows relative resilience.",YTD +261.83%; 1M +22.80%; news sentiment +0.141; 1W +1.94%,,,,,
MRVL,Marvell Technology,AI,memory,NASDAQ,281.26,-3.35%,-2.86%,+35.05%,+215.03%,+246%,186.439,2.277,96.65,42.18,38774186,421097186,1544078386,9.0,4.71,strong_buy,1.45,-3.35,96.65,-3.35,966.5,-33.5,9665.0,-335.0,-2.86,97.14,-2.86,971.4,-28.6,9714.0,-286.0,35.05,135.05,35.05,1350.5,350.5,13505.0,3505.0,215.03,315.03,215.03,3150.3,2150.3,31503.0,21503.0,246.0,346.0,246.0,3460.0,2460.0,34600.0,24600.0,"Sandisk, Western Digital, and others soar as Micron results  'justify elevated valuations'",Yahoo Finance,2026-06-25,0.0,"Battle of the Artificial Intelligence (AI) Computing Companies: Is AMD, Broadcom, Nvidia, or Marvell the Best Stock to Buy Now?",Motley Fool,2026-06-25,0.691,Marvell Technology Has Trillion-Dollar Potential. Here Is How Soon It Could Arrive.,Motley Fool,2026-06-25,0.0,10,strong_buy,1.0,"1-year return of +305% and YTD +212.54% with a strong_buy consensus (score 1.45); the -8.08% 1D drop reflects broad AI spending fears, but the 1M gain of +33.99% underscores strong underlying demand for data infrastructure.",1Y +305%; YTD +212.54%; 1M +33.99%; strong_buy consensus,,,,,
P,Everpure,AI,memory,NYSE,71.69,-4.31%,-1.35%,-18.86%,+3.88%,+31%,18.057,1.445,108.62,3.31,1802471,17677571,92089271,,4.16,buy,1.9,-4.31,95.69,-4.31,956.9,-43.1,9569.0,-431.0,-1.35,98.65,-1.35,986.5,-13.5,9865.0,-135.0,-18.86,81.14,-18.86,811.4,-188.6,8114.0,-1886.0,3.88,103.88,3.88,1038.8,38.8,10388.0,388.0,31.0,131.0,31.0,1310.0,310.0,13100.0,3100.0,"Is Corpay, Inc. (CPAY) Outperforming Other Business Services Stocks This Year?",Zacks,2026-06-23,0.0,Everpure (P) Stock After Recent Pullback Is The Rally Running Out Of Steam,Simply Wall St.,2026-06-22,0.0,Everpure (P) Launches AI Data Platforms To Recast Its Enterprise Role,Simply Wall St.,2026-06-22,0.0,,,,,,,,,,
RR.,Rolls-Royce Holdings,AI,nuclear-ops,LSE,1432.0,+0.90%,+1.59%,+13.54%,+19.64%,+52%,1.187,1.22,20.75,34.42,35669489,220293733,758515445,67.0,,buy,1.6,0.9,100.9,0.9,1009.0,9.0,10090.0,90.0,1.59,101.59,1.59,1015.9,15.9,10159.0,159.0,13.54,113.54,13.54,1135.4,135.4,11354.0,1354.0,19.64,119.64,19.64,1196.4,196.4,11964.0,1964.0,52.0,152.0,52.0,1520.0,520.0,15200.0,5200.0,AirAsia Shares Drop 30% as Carrier Seeks Payment Deferrals,GuruFocus.com,2026-06-24,0.026,Is Heico (HEI) Stock Outpacing Its Aerospace Peers This Year?,Zacks,2026-06-24,0.0,The hidden reality behind Britain’s homegrown nuclear age,The Telegraph,2026-06-21,0.0,,,,,,,,,,
CEG,Constellation Energy,AI,nuclear-ops,NASDAQ,268.69,-0.24%,+0.57%,-10.90%,-26.43%,-17%,72.705,1.091,23.32,3.52,2858183,18657783,92454583,64.0,3.6,buy,1.52,-0.24,99.76,-0.24,997.6,-2.4,9976.0,-24.0,0.57,100.57,0.57,1005.7,5.7,10057.0,57.0,-10.9,89.1,-10.9,891.0,-109.0,8910.0,-1090.0,-26.43,73.57,-26.43,735.7,-264.3,7357.0,-2643.0,-17.0,83.0,-17.0,830.0,-170.0,8300.0,-1700.0,Why New CEOs Aren’t Quick Fixes for Sluggish Stocks,Barrons.com,2026-06-25,-0.402,Constellation Energy Corporation (CEG) Among Stocks Expected to Bounce Back According to Analysts,Insider Monkey,2026-06-25,0.273,Annual Global Renewable Energy Investment Could Reach $2.9 Trillion in the Next 5 Years. Here's 1 Top Renewable Energy Stock to Buy.,Motley Fool,2026-06-24,0.625,,,,,,,,,,
VST,Vistra Corp,AI,nuclear-ops,NYSE,167.77,+1.81%,+5.78%,+2.09%,+1.82%,-14%,42.865,1.405,28.06,4.66,3572919,24098419,100452719,56.0,5.39,strong_buy,1.4,1.81,101.81,1.81,1018.1,18.1,10181.0,181.0,5.78,105.78,5.78,1057.8,57.8,10578.0,578.0,2.09,102.09,2.09,1020.9,20.9,10209.0,209.0,1.82,101.82,1.82,1018.2,18.2,10182.0,182.0,-14.0,86.0,-14.0,860.0,-140.0,8600.0,-1400.0,Vistra Corp. (VST) Is a Trending Stock: Facts to Know Before Betting on It,Zacks,2026-06-24,0.0,Vistra Corp. (VST) Advances While Market Declines: Some Information for Investors,Zacks,2026-06-22,0.0,Here is Why Vistra (VST) is Among the Best Electrical Infrastructure Stocks to Buy in 2026,Insider Monkey,2026-06-22,0.637,,,,,,,,,,
TLN,Talen Energy,AI,nuclear-ops,NASDAQ,416.8,+1.18%,+1.71%,+7.15%,+5.06%,+39%,15.095,1.604,,0.76,948430,6427730,20297930,,5.58,buy,1.59,1.18,101.18,1.18,1011.8,11.8,10118.0,118.0,1.71,101.71,1.71,1017.1,17.1,10171.0,171.0,7.15,107.15,7.15,1071.5,71.5,10715.0,715.0,5.06,105.06,5.06,1050.6,50.6,10506.0,506.0,39.0,139.0,39.0,1390.0,390.0,13900.0,3900.0,"IBM upgrade, SpaceX initiation among today's top calls on Wall Street",The Fly,2026-06-23,0.202,"Nuclear Stocks Oklo, Centrus Jump After Signing Uranium Deal",Investor's Business Daily,2026-06-18,0.0,Stocks Supported as Geopolitical Risks Recede,Barchart,2026-06-18,0.052,,,,,,,,,,
BEP,Brookfield Renewable,AI,nuclear-ops,NYSE,35.23,-1.59%,+2.89%,-3.62%,+29.04%,+38%,17.173,0.989,,0.89,780914,4678814,18768514,444.0,0.66,buy,2.31,-1.59,98.41,-1.59,984.1,-15.9,9841.0,-159.0,2.89,102.89,2.89,1028.9,28.9,10289.0,289.0,-3.62,96.38,-3.62,963.8,-36.2,9638.0,-362.0,29.04,129.04,29.04,1290.4,290.4,12904.0,2904.0,38.0,138.0,38.0,1380.0,380.0,13800.0,3800.0,The U.S. Government is Supercharging the Nuclear Energy Resurgence With $17.5 Billion in Loans. Here's What it Means for Utility Stocks.,Motley Fool,2026-06-24,0.273,Is Cameco Set to Benefit From DOE-Backed Nuclear Expansion?,Zacks,2026-06-24,0.459,"HA Sustainable Stock Outlook Turns on Yield, Liquidity, Policy Risks",Zacks,2026-06-19,0.258,,,,,,,,,,
BEPC,Brookfield Renewable Corp,AI,nuclear-ops,NYSE,37.62,-1.23%,+4.56%,-2.73%,-3.90%,+15%,5.199,1.15,,1.54,1577050,8815450,34307350,414.0,,none,,-1.23,98.77,-1.23,987.7,-12.3,9877.0,-123.0,4.56,104.56,4.56,1045.6,45.6,10456.0,456.0,-2.73,97.27,-2.73,972.7,-27.3,9727.0,-273.0,-3.9,96.1,-3.9,961.0,-39.0,9610.0,-390.0,15.0,115.0,15.0,1150.0,150.0,11500.0,1500.0,This is My Favorite Nuclear Energy Stock to Capitalize on the AI Power Boom,Motley Fool,2026-06-20,0.625,Brookfield Is Launching Another Renewable Energy Company. Here's What Investors Need to Know.,Motley Fool,2026-06-18,0.273,3 High-Yield Energy Stocks Worth Buying for the Income -- and Holding for the Gains,Motley Fool,2026-06-17,0.66,,,,,,,,,,
GEV,GE Vernova,AI,smr,NYSE,1085.47,+0.50%,+3.49%,+1.45%,+60.03%,+109%,221.023,1.045,31.67,2.7,2323109,17451409,70340109,19.0,3.42,buy,1.58,0.5,100.5,0.5,1005.0,5.0,10050.0,50.0,3.49,103.49,3.49,1034.9,34.9,10349.0,349.0,1.45,101.45,1.45,1014.5,14.5,10145.0,145.0,60.03,160.03,60.03,1600.3,600.3,16003.0,6003.0,109.0,209.0,109.0,2090.0,1090.0,20900.0,10900.0,Forget XLU. The Grid Fund Actually Powering the AI Boom Is Up 23% in 2026,24/7 Wall St.,2026-06-25,-0.226,GEV vs. PEG: Which Grid Modernization Leader Is the Smarter Buy Now?,Zacks,2026-06-25,0.459,Energy Transition Today - Romania's Wind Energy Milestone Secures Major Investment,Simply Wall St.,2026-06-25,0.67,,,,,,,,,,
BWXT,BWX Technologies,AI,smr,NYSE,204.77,-1.46%,+0.84%,+0.19%,+12.91%,+45%,14.215,0.734,54.75,1.01,662226,5972426,22582626,51.0,3.71,buy,1.8,-1.46,98.54,-1.46,985.4,-14.6,9854.0,-146.0,0.84,100.84,0.84,1008.4,8.4,10084.0,84.0,0.19,100.19,0.19,1001.9,1.9,10019.0,19.0,12.91,112.91,12.91,1129.1,129.1,11291.0,1291.0,45.0,145.0,45.0,1450.0,450.0,14500.0,4500.0,"Micron’s Blowout Sparked a Chip Rally, but the Smart Money Is Already Rotating Into Defense and Space",24/7 Wall St.,2026-06-25,0.649,"Boeing, Lockheed Land Big Contracts; Senate Passes War Powers Resolution",Investor's Business Daily,2026-06-24,-0.599,BWX Technologies (BWXT) Licenses Mpower Reactor To Applied Atomics For New Markets,Simply Wall St.,2026-06-23,0.0,,,,,,,,,,
SMR,NuScale Power,AI,smr,NYSE,10.07,-3.91%,-2.61%,-17.59%,-38.26%,-73%*,2.641,2.219,,35.22,19948794,187390894,839856394,,19.97,hold,2.53,-3.91,96.09,-3.91,960.9,-39.1,9609.0,-391.0,-2.61,97.39,-2.61,973.9,-26.1,9739.0,-261.0,-17.59,82.41,-17.59,824.1,-175.9,8241.0,-1759.0,-38.26,61.74,-38.26,617.4,-382.6,6174.0,-3826.0,-73.0,27.0,-73.0,270.0,-730.0,2700.0,-7300.0,NuScale Power Stock Is Plunging: What's Causing the Decline,Motley Fool,2026-06-25,0.0,Nano Nuclear Energy vs. NuScale Power: Which Nuclear Energy Stock Is a Better Buy in 2026?,Motley Fool,2026-06-25,0.727,OKLO's Licensing Strategy Aims to Support Reactor Rollout,Zacks,2026-06-24,0.402,,,,,,,,,,
OKLO,Oklo Inc,AI,smr,NYSE,51.01,-7.64%,-13.28%,-25.75%,-34.43%,-3%*,6.725,1.113,,13.46,9633737,51123637,294297737,,18.02,buy,1.96,-7.64,92.36,-7.64,923.6,-76.4,9236.0,-764.0,-13.28,86.72,-13.28,867.2,-132.8,8672.0,-1328.0,-25.75,74.25,-25.75,742.5,-257.5,7425.0,-2575.0,-34.43,65.57,-34.43,655.7,-344.3,6557.0,-3443.0,-3.0,97.0,-3.0,970.0,-30.0,9700.0,-300.0,"Top Stock Reports for JPMorgan, Novartis & Qualcomm",Zacks,2026-06-25,0.202,Why Oklo Stock Keeps Going Down,Motley Fool,2026-06-24,0.0,Agility Robotics goes public with Churchill Capital SPAC merger,Quartz,2026-06-24,0.0,,,,,,,,,,
NNE,NANO Nuclear Energy,AI,smr,NASDAQ,20.65,-13.02%,-18.41%,-28.96%,-25.21%,-35%*,0.816,5.044,,2.63,3788188,17791588,75668088,,23.75,strong_buy,1.4,-13.02,86.98,-13.02,869.8,-130.2,8698.0,-1302.0,-18.41,81.59,-18.41,815.9,-184.1,8159.0,-1841.0,-28.96,71.04,-28.96,710.4,-289.6,7104.0,-2896.0,-25.21,74.79,-25.21,747.9,-252.1,7479.0,-2521.0,-35.0,65.0,-35.0,650.0,-350.0,6500.0,-3500.0,Nano Nuclear Energy vs. NuScale Power: Which Nuclear Energy Stock Is a Better Buy in 2026?,Motley Fool,2026-06-25,0.727,"NNE Stock Gains Premarket Amid Leadership Reshuffle, Global Nuclear Push",Stocktwits,2026-06-25,0.34,"Zacks Investment Ideas feature highlights: Nano Nuclear Energy, X-Energy and Amazon",Zacks,2026-06-25,0.421,,,,,,,,,,
CCJ,Cameco Corporation,AI,uranium,NYSE,103.58,-3.47%,-1.98%,-4.24%,+5.09%,+43%,34.184,0.983,97.72,3.15,2965229,15422829,73284529,16.0,,buy,1.79,-3.47,96.53,-3.47,965.3,-34.7,9653.0,-347.0,-1.98,98.02,-1.98,980.2,-19.8,9802.0,-198.0,-4.24,95.76,-4.24,957.6,-42.4,9576.0,-424.0,5.09,105.09,5.09,1050.9,50.9,10509.0,509.0,43.0,143.0,43.0,1430.0,430.0,14300.0,4300.0,Canada's nuclear push: Can it move fast enough?,Financial Post,2026-06-25,0.0,The U.S. Government is Supercharging the Nuclear Energy Resurgence With $17.5 Billion in Loans. Here's What it Means for Utility Stocks.,Motley Fool,2026-06-24,0.273,Strathmore Plus Uranium Planning a Drill Program on Beaver Rim Project,MT Newswires,2026-06-24,0.0,,,,,,,,,,
UEC,Uranium Energy Corp,AI,uranium,NYSE,10.59,-4.93%,-7.27%,-21.61%,-19.22%,+55%,3.971,1.145,,10.0,6858736,60166336,270925136,,12.92,strong_buy,1.44,-4.93,95.07,-4.93,950.7,-49.3,9507.0,-493.0,-7.27,92.73,-7.27,927.3,-72.7,9273.0,-727.0,-21.61,78.39,-21.61,783.9,-216.1,7839.0,-2161.0,-19.22,80.78,-19.22,807.8,-192.2,8078.0,-1922.0,55.0,155.0,55.0,1550.0,550.0,15500.0,5500.0,Brokers Suggest Investing in Uranium Energy (UEC): Read This Before Placing a Bet,Zacks,2026-06-19,0.273,Cameco vs. Centrus Energy: Which Uranium Stock is the Better Buy Now?,Zacks,2026-06-18,0.612,Optimism Surrounds Uranium Energy (UEC) Following an Impressive Quarter,Insider Monkey,2026-06-17,0.836,,,,,,,,,,
LEU,Centrus Energy,AI,uranium,NYSE,170.38,-2.41%,+0.04%,-7.08%,-37.48%,-2%,2.54,1.339,61.73,0.9,855421,5552721,20600721,,22.09,buy,1.75,-2.41,97.59,-2.41,975.9,-24.1,9759.0,-241.0,0.04,100.04,0.04,1000.4,0.4,10004.0,4.0,-7.08,92.92,-7.08,929.2,-70.8,9292.0,-708.0,-37.48,62.52,-37.48,625.2,-374.8,6252.0,-3748.0,-2.0,98.0,-2.0,980.0,-20.0,9800.0,-200.0,Centrus Energy (LEU) Stock After 37% YTD Drop Is The Discount Real?,Simply Wall St.,2026-06-25,0.0,"Centrus Energy and Helix Energy Solutions Shares Plummet, What You Need To Know",StockStory,2026-06-24,0.727,"As Centrus Order Backlog Swells, Growth Acceleration Can Trigger Stock Upside",Barchart,2026-06-23,0.382,,,,,,,,,,
VRT,Vertiv Holdings,AI,power-infra,NYSE,325.57,-2.14%,+2.52%,+0.53%,+85.48%,+156%,94.759,2.037,81.6,5.87,6168679,37099379,139380479,8.0,3.73,strong_buy,1.48,-2.14,97.86,-2.14,978.6,-21.4,9786.0,-214.0,2.52,102.52,2.52,1025.2,25.2,10252.0,252.0,0.53,100.53,0.53,1005.3,5.3,10053.0,53.0,85.48,185.48,85.48,1854.8,854.8,18548.0,8548.0,156.0,256.0,156.0,2560.0,1560.0,25600.0,15600.0,Can AI Infrastructure Demand Fuel CDW's Growth in 2026?,Zacks,2026-06-25,0.273,Can AI-Driven Liquid Cooling Demand Boost NVT's Long-Term Growth?,Zacks,2026-06-24,0.586,"Unlocking an AI Boom in Small Business: Pax8 VP of AI Adoption Chance Weaver, Live from Pax8 Beyond 2026",Exec Edge,2026-06-24,0.25,,,,,,,,,,
ETN,Eaton Corporation,AI,power-infra,NYSE,419.87,+2.16%,+2.50%,+4.15%,+29.03%,+16%,123.539,1.192,41.0,2.54,1816809,12959909,54468809,109.0,2.52,buy,1.72,2.16,102.16,2.16,1021.6,21.6,10216.0,216.0,2.5,102.5,2.5,1025.0,25.0,10250.0,250.0,4.15,104.15,4.15,1041.5,41.5,10415.0,415.0,29.03,129.03,29.03,1290.3,290.3,12903.0,2903.0,16.0,116.0,16.0,1160.0,160.0,11600.0,1600.0,"Top Analyst Reports for Micron Technology, Coca-Cola & Arista Networks",Zacks,2026-06-23,0.202,"Cummins Stock Adds Horsepower, Not Ballast",Trefis,2026-06-23,0.0,Eaton Corporation to Merge Mobility Business with Dana,Insider Monkey,2026-06-22,0.0,,,,,,,,,,
POWL,Powell Industries,AI,power-infra,NASDAQ,309.2,+4.11%,+5.16%,+5.90%,+163.35%,+343%,8.536,1.128,60.39,0.66,764540,4237940,13707340,12.0,11.45,none,,4.11,104.11,4.11,1041.1,41.1,10411.0,411.0,5.16,105.16,5.16,1051.6,51.6,10516.0,516.0,5.9,105.9,5.9,1059.0,59.0,10590.0,590.0,163.35,263.35,163.35,2633.5,1633.5,26335.0,16335.0,343.0,443.0,343.0,4430.0,3430.0,44300.0,34300.0,What Makes Powell Industries (POWL) a Strong Investment?,Insider Monkey,2026-06-25,0.511,3 Reasons We’re Fans of Powell (POWL),StockStory,2026-06-24,0.0,Powell Industries (POWL) Dips More Than Broader Market: What You Should Know,Zacks,2026-06-23,0.0,,,,,,,,,,
EQIX,Equinix,AI,dc-operators,NASDAQ,1087.61,-1.13%,-0.08%,+0.93%,+43.82%,+47%,81.279,0.97,75.27,0.56,621838,3832938,13946338,180.0,2.26,buy,1.58,-1.13,98.87,-1.13,988.7,-11.3,9887.0,-113.0,-0.08,99.92,-0.08,999.2,-0.8,9992.0,-8.0,0.93,100.93,0.93,1009.3,9.3,10093.0,93.0,43.82,143.82,43.82,1438.2,438.2,14382.0,4382.0,47.0,147.0,47.0,1470.0,470.0,14700.0,4700.0,AI Data Center Boom Could Drive Fuel Cell Market to $30 Billion by 2030,Oilprice.com,2026-06-25,0.0,How Cisco’s Secure AI Factory and Quantum Networking Bets Could Reshape the Cisco Systems (CSCO) Narrative,Simply Wall St.,2026-06-23,0.34,Why Cisco (CSCO) Is Turning AI Infrastructure Into a Hybrid Data Center Security Opportunity,Insider Monkey,2026-06-22,0.637,,,,,,,,,,
DLR,Digital Realty,AI,dc-operators,NYSE,192.44,-1.41%,+2.87%,+0.03%,+25.81%,+14%,52.159,1.046,51.18,2.23,2877576,16501176,57518276,253.0,0.01,buy,1.72,-1.41,98.59,-1.41,985.9,-14.1,9859.0,-141.0,2.87,102.87,2.87,1028.7,28.7,10287.0,287.0,0.03,100.03,0.03,1000.3,0.3,10003.0,3.0,25.81,125.81,25.81,1258.1,258.1,12581.0,2581.0,14.0,114.0,14.0,1140.0,140.0,11400.0,1400.0,Digital Realty Bets on AI Growth With Major Expansion Moves,Zacks,2026-06-23,0.382,"Company News for Jun 23, 2026",Zacks,2026-06-23,0.0,APLD's Customer Concentration Remains Elevated: Is Growth at Risk?,Zacks,2026-06-17,0.128,,,,,,,,,,
AMT,American Tower,AI,dc-operators,NYSE,168.72,-2.63%,-6.83%,-7.90%,-1.58%,-20%,59.563,0.891,27.26,3.1,3297521,18926821,71573321,400.0,2.24,buy,1.68,-2.63,97.37,-2.63,973.7,-26.3,9737.0,-263.0,-6.83,93.17,-6.83,931.7,-68.3,9317.0,-683.0,-7.9,92.1,-7.9,921.0,-79.0,9210.0,-790.0,-1.58,98.42,-1.58,984.2,-15.8,9842.0,-158.0,-20.0,80.0,-20.0,800.0,-200.0,8000.0,-2000.0,Is it Wise to Retain American Tower Stock in Your Portfolio Now?,Zacks,2026-06-23,0.477,Is American Tower Corporation (AMT) among the 7 Best “Land Owner” Stocks to Buy for Hard Asset Value,Insider Monkey,2026-06-19,0.827,Why American Tower (AMT) Dipped More Than Broader Market Today,Zacks,2026-06-17,0.0,,,,,,,,,,
GOOGL,Alphabet (Google),AI,hyperscalers,NASDAQ,343.71,+0.46%,-5.52%,-11.56%,+9.20%,+99%,3178.072,1.237,26.2,30.4,42597335,218887235,781772635,25.0,1.42,strong_buy,1.44,0.46,100.46,0.46,1004.6,4.6,10046.0,46.0,-5.52,94.48,-5.52,944.8,-55.2,9448.0,-552.0,-11.56,88.44,-11.56,884.4,-115.6,8844.0,-1156.0,9.2,109.2,9.2,1092.0,92.0,10920.0,920.0,99.0,199.0,99.0,1990.0,990.0,19900.0,9900.0,Micron earnings beat fuels hopes for Tech rally rebound,Yahoo Finance Video,2026-06-25,0.421,Alphabet makes the Dow look more like the Nasdaq,Yahoo Finance,2026-06-24,0.42,Amazon Stock Slips Below Key Level. Why It's A Rough Day For Cloud Hyperscaler Stocks.,Investor's Business Daily,2026-06-25,0.178,,,,,,,,,,
MSFT,Microsoft,AI,hyperscalers,NASDAQ,352.83,-3.44%,-6.88%,-15.19%,-25.06%,-27%,1986.017,1.103,21.04,36.28,62728991,252771791,918191491,100.0,1.19,strong_buy,1.34,-3.44,96.56,-3.44,965.6,-34.4,9656.0,-344.0,-6.88,93.12,-6.88,931.2,-68.8,9312.0,-688.0,-15.19,84.81,-15.19,848.1,-151.9,8481.0,-1519.0,-25.06,74.94,-25.06,749.4,-250.6,7494.0,-2506.0,-27.0,73.0,-27.0,730.0,-270.0,7300.0,-2700.0,Micron earnings beat fuels hopes for Tech rally rebound,Yahoo Finance Video,2026-06-25,0.421,Alphabet makes the Dow look more like the Nasdaq,Yahoo Finance,2026-06-24,0.42,Dow Jones Futures: Mixed Market Signals As Micron's Gain Is Apple's Pain,Investor's Business Daily,2026-06-25,0.026,,,,,,,,,,
AMZN,Amazon,AI,hyperscalers,NASDAQ,227.01,-2.59%,-4.42%,-14.43%,+0.23%,+8%,1850.38,1.444,30.68,46.29,76001063,350789163,1093403263,,0.94,strong_buy,1.34,-2.59,97.41,-2.59,974.1,-25.9,9741.0,-259.0,-4.42,95.58,-4.42,955.8,-44.2,9558.0,-442.0,-14.43,85.57,-14.43,855.7,-144.3,8557.0,-1443.0,0.23,100.23,0.23,1002.3,2.3,10023.0,23.0,8.0,108.0,8.0,1080.0,80.0,10800.0,800.0,Qualcomm raises data center outlook on AI demand,Yahoo Finance Video,2026-06-25,-0.128,Alphabet makes the Dow look more like the Nasdaq,Yahoo Finance,2026-06-24,0.42,Amazon Stock Slips Below Key Level. Why It's A Rough Day For Cloud Hyperscaler Stocks.,Investor's Business Daily,2026-06-25,0.178,,,,,,,,,,
META,Meta Platforms,AI,hyperscalers,NASDAQ,542.87,-2.83%,-4.35%,-11.26%,-16.39%,-23%,1044.191,1.229,19.75,17.57,16443852,87740852,416653452,38.0,1.47,strong_buy,1.31,-2.83,97.17,-2.83,971.7,-28.3,9717.0,-283.0,-4.35,95.65,-4.35,956.5,-43.5,9565.0,-435.0,-11.26,88.74,-11.26,887.4,-112.6,8874.0,-1126.0,-16.39,83.61,-16.39,836.1,-163.9,8361.0,-1639.0,-23.0,77.0,-23.0,770.0,-230.0,7700.0,-2300.0,Qualcomm's 'next phase' is AI rack infrastructure: CFO,Yahoo Finance Video,2026-06-25,0.0,Meta Stock: 'Bulls Are Frustrated' But Analyst Sees Big Potential For AI Business Push,Investor's Business Daily,2026-06-25,-0.296,Amazon Stock Slips Below Key Level. Why It's A Rough Day For Cloud Hyperscaler Stocks.,Investor's Business Daily,2026-06-25,0.178,,,,,,,,,,
IREN,Iris Energy,AI,ai-compute,NASDAQ,47.74,-9.06%,-17.85%,-20.14%,+11.80%,+284%*,12.928,4.232,62.0,44.71,35792738,181407538,1019400738,,16.05,buy,1.81,-9.06,90.94,-9.06,909.4,-90.6,9094.0,-906.0,-17.85,82.15,-17.85,821.5,-178.5,8215.0,-1785.0,-20.14,79.86,-20.14,798.6,-201.4,7986.0,-2014.0,11.8,111.8,11.8,1118.0,118.0,11180.0,1180.0,284.0,384.0,284.0,3840.0,2840.0,38400.0,28400.0,"Bitcoin Crashes Below $60,000 as Crypto Stocks Enter Free Fall",GuruFocus.com,2026-06-25,0.511,Leopold Aschenbrenner’s Situational Awareness Likes This Crypto Stock Despite Bitcoin Declines,Insider Monkey,2026-06-25,0.421,"NBIS, CRWV, APLD, IREN: Why Are Neocloud Stocks Jumping Premarket?",Stocktwits,2026-06-25,0.0,,,,,,,,,,
